Japanese,English,Note
あ！　なんだったら あたし、歌いましょうか？,"Oh, I have an idea! Maybe I could sing a song?",gs3_018.txt
《倉院音頭》とか《霊媒おけさ》 とか《マヨイ節》とか。,"""The Master of Kurain"" or ""The Spirit Song"" or perhaps ""Maya's Theme""?",gs3_018.txt
え！　そんな持ち歌が あるんですか？,That sounds wonderful! I had no idea such songs actually existed.,gs3_018.txt
ありませんけど。 なるほどくんに作らせますから。,Well they don't... yet. I was going to make Nick write them.,gs3_018.txt
‥‥ムリ言うなよ。,...Be serious.,gs3_018.txt
かわいらしい子ですよね。 半年前、お世話になりました。,She's such a cute little girl. I'm deeply in her debt for what she did 7 months ago.,gs3_018.txt
はみちゃん、ていうんですよ。 霊媒師をめざして修行中です！,Her name is Pearl. She's training to be a spirit medium!,gs3_018.txt
手に職をつけようなんて、 とてもエラいですね。,Training at such a young age... That's very impressive.,gs3_018.txt
キャリア・ウーマンどうし、 がんばりましょう！,"Well, as a fellow career woman, I salute her!",gs3_018.txt
きゃりあ・うーまん‥‥,"Career woman, huh...?",gs3_018.txt
（いちおう、そういうコトに なるのかな‥‥霊媒師も）,(I guess that's one way to look at spirit mediums... since they're all women...),gs3_018.txt
やはり‥‥警察に 知らせればよかったんですよね。,Now I realize I should have called the police.,gs3_018.txt
仮面マスクの予告状‥‥。,"As soon as I got that calling card from Mask☆DeMasque, I mean.",gs3_018.txt
そうするべきだったかも しれませんね。,"Yeah, I guess you should have.",gs3_018.txt
ま。イトノコさんのユカイな失敗談 が１つ、増えるだけですけど。,"Well, now Detective Gumshoe has one more failure to add to his list.",gs3_018.txt
あら。ダメ刑事さんなんですか？,Oh? You mean he's not a very good detective?,gs3_018.txt
（この場にイトノコ刑事が いなくてよかったな‥‥）,(It's a good thing he's not here to hear us talking about him...),gs3_018.txt
まさか‥‥探偵さんが 仮面マスクだった、なんて‥‥。,So Detective Atmey was actually Mask☆DeMasque...,gs3_018.txt
そうとう落ちこんでるよ。,She really seems depressed.,gs3_018.txt
しかたないだろうね。,I can't say I blame her.,gs3_018.txt
‥‥わざわざ、怪人に警備を 依頼しちゃったんだから。,She's the one who hired the fox to guard the henhouse.,gs3_018.txt
‥‥ホント、私って 人を見る目がないですよね。,"...I'm really terrible at judging people, I guess.",gs3_018.txt
半年前の事件で、それを 思い知らされたのに‥‥,I should have learned my lesson after what happened 7 months ago...,gs3_018.txt
また今回も！　こんな 探偵さんに引っかかって‥‥,But I didn't! I got taken in by this... this... flimflam detective!,gs3_018.txt
まあまあ。あたしたちが いるじゃないですか！,"Don't feel so bad. After all, we're here to help!",gs3_018.txt
ええ！　成歩堂さんは リッパな方ですよね！,"Yes! Mr. Wright is a really wonderful man, isn't he?",gs3_018.txt
（人を見る目がない霧緒さんに いわれてもなあ‥‥）,"That should've made me happy, but she just admitted she's terrible at judging people...",gs3_018.txt
またまた。‥‥ウレシイくせに！,"Oh, come on... I can tell you're happy anyway.",gs3_018.txt
すみません‥‥ムカシほど カオが広くないものですから。,"I'm sorry, I don't know as many people as I used to.",gs3_018.txt
特に参考になりそうなコトは お話しできませんわ。,So there really isn't anything I can tell you about that person.,gs3_018.txt
同日　某時刻 高菱屋　地下倉庫,October 13 Lordly Tailor Basement Warehouse,gs3_018.txt
あら。いらっしゃい、 おじょうちゃん。,"Oh, Pearl. How nice to see you.",gs3_018.txt
こっ、こんにちは！,H-Hello there!,gs3_018.txt
しばらく見なかったけど‥‥ どこへ行ってたのかしら？,I haven't seen you around lately. What have you been up to?,gs3_018.txt
あの、わたくし。 このツボを調べていました！,"Well, actually... I was having this urn examined!",gs3_018.txt
！　あ、あら。 そうだったの‥‥,O-Oh... I see.,gs3_018.txt
（あらためて、このツボを よーく見てみると‥‥）,(Maybe if we take another good look at this urn...),gs3_018.txt
（この部屋に、そのナゾを解く 手がかりがありそうだな‥‥）,(...we can figure out the mystery of what actually happened here...),gs3_018.txt
なるほどくん！　もう一度、 よーく調べてみようよ！,Nick! Let's look around one more time!,gs3_018.txt
見た感じ、乾いてから 数日はたっているみたいだ。,It looks to me like it's been dry for several days.,gs3_018.txt
このペンキの跡も、 何かとナゾが多いよねー。,There's something suspicious about this paint mark.,gs3_018.txt
シミの左下が欠けてるし、 なぜかピンクだし。,The bottom left part of it is shaped oddly and it's shocking pink.,gs3_018.txt
この色‥‥ツボについている ペンキと同じです！,This is the same color as the paint splotches on the urn!,gs3_018.txt
（‥‥となると、 気になるのは‥‥）,(So then the question is...),gs3_018.txt
（このシミが欠けている “原因”だな‥‥）,(What's the cause of the odd shape...?),gs3_018.txt
よーく、探してみましょうよ、 なるほどくん！,"Let's look around here carefully, Mr. Nick!",gs3_018.txt
見た感じ、乾いてから 数日はたっているみたいだ。,It looks to me like it's been dry for several days.,gs3_018.txt
このペンキの跡も、 何かとナゾが多いよねー。,There's something suspicious about this paint mark.,gs3_018.txt
シミの左下が欠けてるし、 なぜかピンクだし。,The bottom left part of it is shaped oddly and it's shocking pink.,gs3_018.txt
なるほどくん！　もしかして、 この欠けている部分は‥‥！,Mr. Nick! Could it be that this odd shape is...!?,gs3_018.txt
‥‥うん。 きっと、コイツだね。,Yeah... I'm pretty sure this is it.,gs3_018.txt
あ、それ！ ツボをしまっておいたハコ‥‥,Ah! That's the box the Sacred Urn was in...!,gs3_018.txt
このハコにも、少し ペンキがついてるだろ？,"If you look here, there's a little bit of paint on the box as well!",gs3_018.txt
きゃあ、ホントだ！ ほらほら。合わせる合わせる！,"Wow, you're right! Look! It matches!",gs3_018.txt
‥‥いかがですか？ なるほどくん。,"What is it, Mr. Nick?",gs3_018.txt
思ったとおりだよ‥‥。 ピッタリだ！,This is all turning out exactly as I thought it would...!,gs3_018.txt
《ペンキの跡》のデータを 法廷記録にファイルした。,Paint Marks added to the Court Record.,gs3_018.txt
（どうやら‥‥）,(I think it's all starting to become clear...),gs3_018.txt
（そろそろ見えてきたな。 ツボのナゾのコタエが‥‥）,(We're that much closer to solving the mystery of what happened to the urn...),gs3_018.txt
‥‥このハコ‥‥ちょっと 気になるんだよな。,"This box, there's something about it that's bothering me.",gs3_018.txt
それ、倉院のツボを しまっておいたハコだよ！,That's the box that the Sacred Urn was in!,gs3_018.txt
これにも、ピンクの ペンキがついていますね‥‥。,"It looks like there's some pink paint on it, too...",gs3_018.txt
やっぱり、倉院のツボに ついてるのと、同じ色だよ！,And it's definitely the same color as the stuff on the urn!,gs3_018.txt
（このペンキがどこでついたか‥‥ わかるような気がするな）,I think I know how the paint got on it now...,gs3_018.txt
じゃあ、そこをもう一度 調べてみようよ、なるほどくん！,"Alright! Let's investigate again, Nick!",gs3_018.txt
《ツボが入っていたハコ》の データを法廷記録にファイルした。,Urn Box added to the Court Record.,gs3_018.txt
ごめんなさい‥‥。ツボを 割ってしまったのは、私です。,I'm so sorry... I was the one... The one who broke the urn.,gs3_018.txt
（‥‥なんか、小学校の先生にでも なった気分だな）,(...Boy does this make me feel like some sort of evil school teacher.),gs3_018.txt
私‥‥サイテイの女ですね。 自分のシッパイをかくそうなんて。,"I'm a terrible person! Not only did I break it, but I tried to hide what I did!",gs3_018.txt
そ、そんなコト‥‥ね、ねえ。 はみちゃん。,"Well... That's not so hard to understand. Is it, Pearly?",gs3_018.txt
え、ええ！　もうそれは。 わたくし‥‥わかりますとも！,"N-No, not at all! I... know just how she feels!",gs3_018.txt
あれは、２週間ほど前のことです。,It happened about 2 weeks ago.,gs3_018.txt
ポスター用の撮影が終わって、 ツボがこちらへ着いた日のこと‥‥,"Just after the poster photo was taken, on the same day the urn arrived here...",gs3_018.txt
倉庫にしまうつもりで、ハコを 持って、ここへ下りてきたとき‥‥,...I thought I'd put it away down here for safe-keeping. I was carrying it in the box...,gs3_018.txt
私‥‥ペンキのカンにつまずいて、 ハデにひっくり返してしまって。,...when I tripped on a paint can and lost my balance!,gs3_018.txt
そのひょうしに、持っていた ハコを落としちゃったんです。,The box I was carrying crashed to the ground!,gs3_018.txt
‥‥ガシャッ‥‥,...*CRASH*...,gs3_018.txt
‥‥とてもイヤな音がして‥‥ 私、血の気が引きました。,I heard a terrible noise and I thought my heart was going to stop...,gs3_018.txt
そして‥‥おそるおそる、 フタを開けた、その瞬間！,"Fearing the worst, I opened the lid of the box and that's when it happened!",gs3_018.txt
ハコのスキ間から、ツボのカケラが ザラザラと‥‥ペンキの上に！,The broken pieces of the urn fell out of the box and landed right in the paint!,gs3_018.txt
私‥‥私、もう‥‥,I... I... I was in shock...,gs3_018.txt
絶叫しちゃいましたーーーっ！,And let out a huge scream!,gs3_018.txt
‥‥うーん。 ありそうなハナシですよねー。,...Hmm. I can totally see how that could've happened.,gs3_018.txt
（たしかに、真宵ちゃんなら やりそうだ‥‥）,"(Yeah, as clumsy as she is, I'm sure Maya understands...)",gs3_018.txt
倉院の里の、一番ダイジな 秘宝と聞いていたものですから‥‥,"Well, I knew it was the most important treasure in all of Kurain Village...",gs3_018.txt
私、必死になって修理しました。 さいわい、カケラは大きかったし。,"...so I tried as hard as I could to fix it. Fortunately, the shards were pretty big.",gs3_018.txt
そこで、どうして“子供”が “供子”になっちゃったんですか？,"And that's when the ""I AM"" got changed to ""AMI""?",gs3_018.txt
私、もとの文字を 知らなかったんです。,I-I didn't know how it was originally written.,gs3_018.txt
ごくふつうに修理したら、 “供子”になったのですけど‥‥,"But any sane person fixing it would have assumed it said, ""AMI""...",gs3_018.txt
そ、そうなのですか。 ごくふつうに‥‥,A-Any sane person...? Really?,gs3_018.txt
（春美ちゃん‥‥）,"(Oh, Pearls...)",gs3_018.txt
（‥‥図画工作は ニガテって言ってたからな‥‥）,(She said she wasn't very good at spelling...),gs3_018.txt
ツボはコッソリ倉庫にしまって、 それからは、だれも見ていません。,"Anyway, I put the urn into the storeroom and no one had seen it since then.",gs3_018.txt
証拠品《倉院のツボ》の データを書きなおした。,Sacred Urn updated in the Court Record.,gs3_018.txt
でも‥‥あたしたちが最初に ここへ来たとき、,But... There's something I don't get...,gs3_018.txt
あのペンキの跡は、 ありませんでしたよね？,"When we first came here, I didn't see any paint stains.",gs3_018.txt
‥‥ええ。あまりに 見苦しかったものですから。,"Well, that's because it was so ugly and embarrassing.",gs3_018.txt
あの黄金像を使って、 かくしておいたのです。,I used the golden statue to cover it.,gs3_018.txt
（“綾里　供子の像”‥‥か！）,(The Ami Fey statue... Aha!),gs3_018.txt
ぼくたちが、初めてここへ 来たのは‥‥,The first time that we came down here...,gs3_018.txt
倉院のツボが盗まれた夜だった。,It was on the night that the Sacred Urn was stolen.,gs3_018.txt
あのとき‥‥,But Mr. Nick...,gs3_018.txt
‥‥倉庫のカベや床に、 ペンキの跡はありませんでした。,There were no paint marks on the walls or floor of the warehouse when we were here.,gs3_018.txt
‥‥ちょうど、あの日の お昼ごろのコトだったんです。,"Well, there's a good reason for that. On the day of the crime, around noon...",gs3_018.txt
山奥の霊場から、あの黄金像が 倉庫に届いたのは‥‥。,...that golden statue just happened to arrive from the mountain training hall.,gs3_018.txt
そ、それで‥‥？,A-And?,gs3_018.txt
あの黄金像‥‥ペンキの跡をかくす のに、ちょうどいい大きさでした。,I realized that the statue would be the perfect size for covering up the paint stains.,gs3_018.txt
だから‥‥私、あの場所へ 置いておいたんです。,That's why... I put it where you first saw it.,gs3_018.txt
なるほど‥‥ そりゃ、置きますよねえ。,I see... Now it makes perfect sense.,gs3_018.txt
‥‥でも。わたくし、 少しおかしいと思います‥‥,"Um, but there's still one thing I find strange...",gs3_018.txt
？　何かしら、おじょうちゃん。,"What is it, Pearl?",gs3_018.txt
ツボが盗まれた次の日、 また、ここへ来たのですけれど‥‥,"The day after the urn was stolen, we came here again...",gs3_018.txt
そのときは、像は動いていて‥‥ ペンキの跡が見えました。,"At that time, the statue had been moved and the paint was clearly visible.",gs3_018.txt
（たしかに‥‥そうだった）,(She's right about that...),gs3_018.txt
‥‥いかがですか？　霧緒さん。,"Well, Ms. Andrews?",gs3_018.txt
え。わ、私ですか！ ‥‥そんな、知りません！,"Huh! What? I, err... I don't know anything about that!",gs3_018.txt
ペンキをかくすために置いたのに、 動かすわけ、ないじゃないですか。,"I placed it there to cover the paint, so why would I move it again?",gs3_018.txt
じゃ、じゃあ‥‥いったい、 だれがそんなことを‥‥？,Well then who was it? Who would have done it and why...?,gs3_018.txt
（事件の前日‥‥像はたしかに 扉の近くにあった。しかし！）,"(On the day before the theft, the statue was definitely closer to the door!)",gs3_018.txt
（その翌日。像は動かされていた。 いったい、なぜ‥‥？）,"(Then the next day, it was moved. But why...?)",gs3_018.txt
《綾里　供子の黄金像》の データを書きなおした。,Ami Fey's Golden Statue updated in the Court Record.,gs3_018.txt
どうやら‥‥,It looks like...,gs3_018.txt
倉院のツボと、例の殺人事件‥‥ 何か関係があるみたいだな。,...there's some connection between the Sacred Urn and the murder case.,gs3_018.txt
ど‥‥どうして？　なるほどくん！,"Wh-Why? Why do you think so, Nick?",gs3_018.txt
あの晩‥‥ホンモノの怪人、 天杉　優作はＫＢ警備にいた。,"Because that night... the real thief, Ron DeLite, was at KB Security.",gs3_018.txt
‥‥それなら、なぜここに もう１人の仮面マスクが現れたか？,...So then why did another Mask☆DeMasque show up here?,gs3_018.txt
いろいろなコトが‥‥ ある事実を指し示している。,A lot of different things are pointing to one undeniable fact.,gs3_018.txt
‥‥ある事実‥‥？,One undeniable fact...?,gs3_018.txt
（‥‥明日。殺人事件の裁判‥‥）,(The murder trial is starting tomorrow...),gs3_018.txt
（もう一度、あの怪人に登場して もらうことになりそうだな‥‥）,(It looks like that thief is going to be making another appearance...),gs3_018.txt
つづく,To be continued.,gs3_018.txt
ほら！　ちゃんと 見つかりましたよ、倉院のツボ。,See? We got our Sacred Urn back.,gs3_018.txt
ホント、よかったですね！,That's really wonderful.,gs3_018.txt
ただ‥‥,But...,gs3_018.txt
このツボには、まだ ナットクできない点があります。,We're not entirely convinced it's the same urn.,gs3_018.txt
‥‥霧緒さん。 協力してもらいますよ。,"Ms. Andrews, we want you to cooperate with us.",gs3_018.txt
ううう‥‥,Nnngh...,gs3_018.txt
霧緒さん。あそこのカベに ぶちまけられたペンキですけど‥‥,"Ms. Andrews, about the paint that's all over the wall...",gs3_018.txt
ま、まあっ！ あんなところに、ペンキがッ！,Oh! Look at that! It looks like paint alright!,gs3_018.txt
わ、私‥‥今まで ゼンゼン気づきませんでしたわ！,Is-Isn't that funny!? I never noticed that before!,gs3_018.txt
ここまでシラジラしいムード、 あたしも初体験だよ。,That has to be the most pathetic acting I have ever seen in my life.,gs3_018.txt
わたくし、いたたまれない キモチでいっぱいです。,I'm beginning to get very frustrated.,gs3_018.txt
（早くラクにしてあげないとな）,"(Uh oh. I'd better do something to calm them down, and fast!)",gs3_018.txt
‥‥リッパなハコですよね！,What a magnificent box!,gs3_018.txt
ハコをホメても しょうがないでしょう。,You're not going to throw us off the trail with flattery.,gs3_018.txt
それより、このハコに ついているペンキですけど‥‥,I want to know about the paint on this box...,gs3_018.txt
さ、さ、さ、さあ。 私には、なんのことだかサッパリ。,Well I... I'm sure I don't know anything about that!,gs3_018.txt
（シラを切るのは ニガテみたいだな‥‥）,(Some people just have a natural gift for lying... Adrian's not one of them.),gs3_018.txt
～倉院のツボ～,-- The Sacred Urn --,gs3_018.txt
霧緒さん。倉院のツボについて、 何か知ってるんですね？,"Ms. Andrews, do you know anything about the Sacred Urn?",gs3_018.txt
な‥‥“何か”って、なんですか！ 私、セキニンシャとして‥‥,"D-Do I know ""anything""!? I'm in charge of the entire Treasure Exhibit!",gs3_018.txt
今日、法廷で提出された 倉院のツボは‥‥,The urn that was submitted before the court today...,gs3_018.txt
‥‥以前のものと アキラカにちがうんですよ。,...It's obviously not the same urn as before!,gs3_018.txt
そ、それは！　ええと‥‥そうよ！,"W-Well, that's... That's um... ...True!",gs3_018.txt
もしかしたら、そのツボ。 に、ニセモノじゃないかしら！,Maybe it isn't the same! It could be... It could be a fake!,gs3_018.txt
‥‥ニセモノ‥‥？,...A fake?,gs3_018.txt
だって、そう考えるほうが 自然でしょう！　それとも‥‥,You're the one who said it wasn't the same! So that's the most obvious explanation!,gs3_018.txt
法廷で提出されたツボが ホンモノだ、という証拠でも‥‥？,Do you have any evidence the urn that was submitted at the trial was genuine?,gs3_018.txt
いかがですか？　霧緒さん。,"Well, Ms. Andrews?",gs3_018.txt
ほ、ホラ！　やっぱり、 ニセモノだったんですよ！,"See, look! It was a fake after all!",gs3_018.txt
え‥‥,Huh?,gs3_018.txt
だって‥‥成歩堂さんの 証拠も、ニセモノじゃないですか！,"I mean, your evidence is fake too, as I expected!",gs3_018.txt
（どうやら、この証拠‥‥ イミがなかったみたいだな）,"(Oops, I guess this isn't going to help me much...)",gs3_018.txt
ナットクしてもらえましたか？ ‥‥それとも‥‥,So have I convinced you? Or...,gs3_018.txt
ザンネンながら‥‥ このツボはホンモノです。,"Sorry to break it to you, but the urn is the genuine article.",gs3_018.txt
春美ちゃんが倉院の里に 持ち帰って、調べてくれました。,Pearls went back to Kurain Village and had it examined.,gs3_018.txt
そ、そうなんですか。 それならいいんですけど‥‥。,"Is-Is that right? That's nice, but I don't see how...",gs3_018.txt
どうやら、このツボ‥‥ また、割れたみたいですね。,What she discovered was that the vase was broken... again.,gs3_018.txt
ま、“また”‥‥？,"D-Did you say... ""again""?",gs3_018.txt
１年前に、割れたことが あったんですよ。,Yes. It was broken once a year ago.,gs3_018.txt
そして、どうやら‥‥ 同じコトが起こった。,And now it looks like the same thing has happened.,gs3_018.txt
‥‥しかも、最近。,"And quite recently, too...",gs3_018.txt
さ‥‥最近！　そのツボが 割れた、と言うんですか？,R-Recently!? Are you saying that this urn was broken recently!?,gs3_018.txt
はい。,Yes. That's exactly what I'm saying.,gs3_018.txt
どうして‥‥わかるんですか？ このツボが最近割れた、なんて！,Why do you think it was broken recently? How do you know?,gs3_018.txt
それで？　成歩堂さん。,"So, Mr. Wright?",gs3_018.txt
は、はい？,Huh?,gs3_018.txt
どうして、このツボが最近割れた ってわかるんですか？,Why do you think it was broken recently again?,gs3_018.txt
いや、だから、それは‥‥その。,"Uh, well... B-Because... ...Umm, I just think so.",gs3_018.txt
うつむいていては、 わかりませんよ？,"Sorry, but that's not a valid explanation.",gs3_018.txt
（追いつめるつもりが‥‥ 追いつめられちまった！）,(Grrr... The hunter has become the hunted!),gs3_018.txt
と、とにかく！　割れたんですよ！ パリンと！　最近！,W-Well it was! It was broken recently! Come on! You know it!,gs3_018.txt
‥‥それだけは、ゆずれません！,I'm not willing to yield to you on this point!,gs3_018.txt
や、ヤケにならないでください。 ‥‥もう一度、聞きましょうか？,"G-Get a grip, please! ...Now, I'll ask you one more time, Mr. Wright.",gs3_018.txt
このポスター‥‥最近 作ったんですよね？,"This poster... It was made recently, right?",gs3_018.txt
ポスター‥‥？ あっ！　こ、これは‥‥！,Poster...? Ah! The poster for the exhibit!,gs3_018.txt
ここに運ばれてくるまで、 ツボには“子供”と書かれていた。,"At the time when this photo was taken, the urn said, ""I AM"" on it.",gs3_018.txt
しかし！　今はなぜか、 “供子”と書かれている！,"But now, for some mysterious reason, it says, ""AMI""!",gs3_018.txt
‥‥ツボが割れて、修理するとき、 とりちがえてしまったからです！,"When the urn was fixed, the letters were transposed!",gs3_018.txt
きゃあああっ！,AAAAAAH!,gs3_018.txt
こ、“子供”‥‥なんて。 私、知りませんでした‥‥,"""I AM""...? What does that even mean? I don't know anything about that...!",gs3_018.txt
このポスターの撮影には 立ち会わなかったものですから。,I wasn't even there when the photo for this poster was taken.,gs3_018.txt
それは、シッパイでしたね。 じゃあ‥‥話してください。,That was a mistake. Now... Tell the truth.,gs3_018.txt
あ。ま、待ってください！,Ah! W-Wait!,gs3_018.txt
な、なんですか‥‥？,For?,gs3_018.txt
つ、ツボが割れたからと言って ‥‥私にはカンケイありません！,"Ev-Even if the urn was broken, I had nothing to do with it!",gs3_018.txt
‥‥え！,...Huh?,gs3_018.txt
そ、そうです！　きっと、写真を 撮影したスタッフのだれかが！,"Y-Yes, that's it! It must have been one of the people at the photo shoot!",gs3_018.txt
つるっと落としちゃったんです！ ‥‥そうに決まってますッ！,They probably dropped it! I'm sure that's what happened!,gs3_018.txt
（やれやれ‥‥まだ、 ロックは残っているからな‥‥）,(Hmm... It looks like I still haven't broken the entire Psyche-Lock...),gs3_018.txt
ツボが‥‥この高菱屋で割れた、 っていう証拠はあるんですか！,Do you have any proof the urn was broken here at Lordly Tailor?,gs3_018.txt
どうですか？　霧緒さん！,"Well, Ms. Andrews?",gs3_018.txt
成歩堂さん‥‥やっぱり、 思ったとおりの方でした。,"I knew I was right about you, Mr. Wright...",gs3_018.txt
‥‥は？,Excuse me?,gs3_018.txt
最後のさいごで、 やさしいところを見せてくれる‥‥,"You're a softie at heart, aren't you...?",gs3_018.txt
そういうところがあるんですよね。 ‥‥ホッとしました。,I knew you'd never hurt me on purpose. What a relief...,gs3_018.txt
（‥‥まちがえたらしいな、 どうも‥‥）,"(Grrr, I guess that wasn't the right piece of evidence.)",gs3_018.txt
