Japanese,English,Note
事件当夜‥‥だれかが、この 指示どおりのコトをしたんだ。,We both know someone carried out these instructions on the night of the murder.,gs3_070.txt
たしかに、それが春美ちゃんだった という証拠は、ない。,But you're right. There's no evidence that proves it was you.,gs3_070.txt
や‥‥‥‥やっぱり！ そ‥‥‥‥そうですよねっ！,I-I-I knew it!,gs3_070.txt
‥‥でも‥‥,However...,gs3_070.txt
この指示に従ったのは、 “子ども”だったんだよ。,I do know that whoever did it was a child.,gs3_070.txt
ど‥‥どうして、そんな！,Huh? H-How do you know that!?,gs3_070.txt
‥‥もし、オトナだったのならば。,It couldn't have been an adult...,gs3_070.txt
こんな思いちがいは しなかったはずなんだよ。,No adult would've made a simple mistake like that.,gs3_070.txt
お‥‥“思いちがい”‥‥？,A... simple mistake? What do you mean by that?,gs3_070.txt
必死で、書いてあることに 従おうとしたんだろうけど‥‥,I'm sure you thought you were carefully following the instructions you'd been given.,gs3_070.txt
指示書のイミをとりちがえたんだ。 ‥‥それを示す証拠があるはずだ！,"But you misunderstood some of the words, and this is the evidence that proves it!",gs3_070.txt
これが‥‥“思いちがい”だよ！,This shows the mistake you made!,gs3_070.txt
あの‥‥,Umm...,gs3_070.txt
もう言わなくても わかると思うのですが‥‥,"I guess you know what I'm about to say, huh?",gs3_070.txt
思いちがいをしているのは、 なるほどくんのほうだと思います。,"I don't think it's me who made a mistake, Mr. Nick. It's you.",gs3_070.txt
（‥‥指示書に従った人物は、 まだ子どもだった‥‥）,(But the person who read these instructions must have been a child.),gs3_070.txt
（だから‥‥あれが ちゃんと、読めなかった）,(That's why they misunderstood the meaning of that word...),gs3_070.txt
（そして‥‥“思いちがい”を したんだ‥‥！）,(It's the only explanation for how such a simple mistake could've been made!),gs3_070.txt
もう一度だ、春美ちゃん！ この指示書に従ったのが‥‥,"OK, Pearls. I'll go over it again. The person who read these instructions...",gs3_070.txt
この掛け軸‥‥ 春美ちゃんがやったんだね？,"It was you who splattered gravy on this hanging scroll, wasn't it?",gs3_070.txt
ええええっ！,Ah!,gs3_070.txt
あああの。わわ、わたくしが、 いいい、いったいナニを‥‥っ！,Wh-What!? Wh-Why would I d-do something like...?,gs3_070.txt
《指示書》に、こう書かれている。,Do you remember what was written in that letter?,gs3_070.txt
『家元に、華麗に引導を たたきつけてやりなさい』,"""Gravely roast the Master in the fires of Hades and bring our vengeance to fruition.""",gs3_070.txt
《華麗》‥‥《引導》‥‥ この漢字が、読めなかったんだ。,"But you didn't know how to read the words ""gravely"" and ""roast"" among others, right?",gs3_070.txt
ど‥‥ どうして、それを‥‥！,H-How do you know that!?,gs3_070.txt
‥‥思い出したんだよ。 事件があった、あの晩‥‥,Remember the conversation you had with Ms. Deauxnim on the night of the murder...?,gs3_070.txt
いっしょに、 ご本を読んであげましょう。,Perhaps we can read some books together.,gs3_070.txt
えっ！　よ、よ、 よろしいのですか？,R-Really!? I'd love to!,gs3_070.txt
あ。あの、わたくし。 読めない漢字があるのですけれど。,"I, umm... I'm not very good at reading.",gs3_070.txt
ふふふ。いっしょに お勉強しましょうか。,"Ha ha ha. Well then, would you like to practice reading with me?",gs3_070.txt
あ、あの。先生！　たとえば、 これは、なんと読むのですか？,"Um, Ms. Elise? So, for example, how do you read this?",gs3_070.txt
“華麗”‥‥ムズカシイ字。 これは、《かれい》ね。,"It says, ""gravely""... That's kind of a tough word.",gs3_070.txt
《カレイ》《インドウ》 ‥‥読み方は、わかった。,"Sure, Ms. Deauxnim taught you how to read ""gravely"" and ""roast"".",gs3_070.txt
でも‥‥,But what she didn't teach you...,gs3_070.txt
今度は、そのコトバの イミがわからなかったんだ。,...is what they meant!,gs3_070.txt
《カレー》といえば《インド》 ‥‥わたくし、そう思ったのです。,"""Gravely"" sounded like ""gravy"" to me, and the only ""roast"" I could think of was the food...",gs3_070.txt
だから‥‥,And that's why you did it...,gs3_070.txt
たたきつけたわけだね？ インドのカレーを‥‥“家元”に。,That's why you covered the picture of the Master in gravy from that night's pot roast.,gs3_070.txt
正直なところ‥‥,To be honest...,gs3_070.txt
自分でも、ちょっとヘンだな、 とは思っておりました。,I did think it was a bit strange.,gs3_070.txt
‥‥やっぱり‥‥ ちがった、のですね。,I guess I really did get the wrong idea...,gs3_070.txt
ちょっと、ね。,Just a tiny bit.,gs3_070.txt
わたくし‥‥本当に、 役に立たないのですね。,I... I really am useless!,gs3_070.txt
おかあさまの指示も守れず‥‥,I didn't even manage to burn the letter properly as my mother had asked of me...,gs3_070.txt
お手紙を焼くことすら、 マンゾクにできないなんて‥‥,Such a simple thing... And I couldn't even do it right...,gs3_070.txt
同日　某時刻 葉桜院　山門,February 9 Hazakura Temple Main Gate,gs3_070.txt
‥‥そういえば、ビキニさんは もう本堂に戻っているかな。,I wonder if Sister Bikini has gone back to the Main Hall already.,gs3_070.txt
それに、さっきからイトノコ刑事の 姿が見あたらないけど‥‥,"I haven't seen Gumshoe around for a while, either.",gs3_070.txt
なかよく、お茶でも 飲んでいるかもしれないな。,Maybe they're having a cup of tea together somewhere.,gs3_070.txt
イトノコ刑事、オバサンに 好かれるタイプみたいだから。,I bet Gumshoe is Sister Bikini's type.,gs3_070.txt
それにしても、でっかい 山門だなあ。,This is one impressive gate.,gs3_070.txt
分家の霊場とはいえ、 リッパなものだ。,It's pretty grand for something that belongs to a branch family of the clan.,gs3_070.txt
‥‥意外に、もうかっているの かもしれないな。,I bet they make an exorbitant amount of money here.,gs3_070.txt
修行に《スペシャル・コース》 なんて、商売上手だし。,"I mean, that whole Special Course thing has got to be good business!",gs3_070.txt
発想が、真宵ちゃんみたいに なってきちまった。,Ack! Noooo!! I'm starting to think like Maya!,gs3_070.txt
‥‥事件当夜、コイツは 何のために使用されたんだろう。,I wonder what this thing was used for on the night of the murder...,gs3_070.txt
１本しかないキーを持っていた のは、あやめさんだから‥‥,"There is only one key to this snowmobile, and Iris is the one who had it.",gs3_070.txt
使ったのは、彼女‥‥かな。 でも、あやめさん自身は‥‥,So I have to wonder if it was her...,gs3_070.txt
葉桜院からは出ていない、 って言ってるんだよな‥‥。,...But she says she never left Hazakura Temple that night.,gs3_070.txt
かわいらしい鐘つき堂だ。,"It's a quaint, little bell tower.",gs3_070.txt
あやめさんが《消灯の鐘》を 鳴らしたときは‥‥,I never would've thought that something this horrible was about to happen...,gs3_070.txt
まさか、こんな大変なコトに なるなんて、思わなかったのに。,...when Iris rang the lights out bell that night.,gs3_070.txt
ここから、 葉桜院の本堂が見える。,You can see the Main Hall from here.,gs3_070.txt
ビキニさんも、そろそろ 帰っているだろう。,Sister Bikini should be back by now.,gs3_070.txt
地震が起きたとき、 話を中断されちまったけど‥‥,We were interrupted earlier by the earthquake.,gs3_070.txt
しっかり、聞き出しておいた ほうがよさそうだな。,I think I should go pick up our conversation where we left off.,gs3_070.txt
同日　某時刻 葉桜院　本堂,February 9 Hazakura Temple Main Hall,gs3_070.txt
ビキニさん‥‥ いないみたいだ。,Looks like Sister Bikini is not here.,gs3_070.txt
地震のあと始末だろうか。 コシを痛めてるのに、大変だな‥‥,She must be sorting things out after the quake. Must be hard on her with her bad back.,gs3_070.txt
‥‥ビキニさんには、どうしても、 聞いておくべきことがある。,There are a few things I really need to discuss with her.,gs3_070.txt
あとで、また来てみよう。,Guess I'll drop by again later and see if she's around.,gs3_070.txt
笑ってしまうほど巨大な勾玉が うっそり、まつられている。,There's a laughably large Magatama on the altar.,gs3_070.txt
こんなちっぽけなシロモノでも サイコ・ロックが見えるんだから、,If I can see Psyche-Locks with the tiny Magatama I've got...,gs3_070.txt
これだけ大きかったら、 何が見えてもフシギじゃないな。,...I can only imagine what kind of power this bad boy has under his hood!,gs3_070.txt
祭壇だ。古びているが、 キレイに手入れされている。,"It's an altar. It looks a bit old, but someone does a good job taking care of it.",gs3_070.txt
‥‥そういえば去年、 倉院の里でも見かけたな。,"Speaking of altars, I remember seeing one like this in Kurain Village last year.",gs3_070.txt
やっぱり、霊力に 関係しているのだろうか。,I guess they really do have something to do with spiritual power after all.,gs3_070.txt
読めないけど、まがまがしい 呪文がびっしり書かれている。,I bet the writing on these sliding doors are instructions for spirit channeling...,gs3_070.txt
数学の公式をトイレに張って おぼえる、みたいなコトなのか、,Kinda like how we scribbled math formulas on the bathroom walls to remember them.,gs3_070.txt
それとも、一種のカンニング ペーパーみたいなものなのか‥‥,Except we couldn't go to the bathroom during tests... And I can't read these walls.,gs3_070.txt
火鉢なんて、テレビの時代劇で しか見たことがなかったけど、,I've only seen a layout like this when I saw this really old Japanese movie on TV.,gs3_070.txt
意外にあたたかいものだ。,Wow! This hibachi brazier really puts out a lot of heat!,gs3_070.txt
あの夜は、みんなでコレを囲んで、 汗だくでカレーをかきこんだのに。,"Just thinking about how happy we were, sitting here eating pot roast and gravy... *sigh*",gs3_070.txt
ワラで編んだ 円座がつまれている。,It's a stack of straw zabuton cushions.,gs3_070.txt
‥‥きっと、ここに来なかったら 一生、知らなかっただろうな。,"Maya told me this type of zabuton is called ""enza""...",gs3_070.txt
《円座》なんてコトバ。,"I suppose if I'd never come here, I'd have missed out on all these new things.",gs3_070.txt
同日　某時刻 葉桜院　本堂,February 9 Hazakura Temple Main Hall,gs3_070.txt
‥‥で？　どうだったんだい、 修験洞は！,Well!? What's the damage!? How is the Sacred Cavern!?,gs3_070.txt
なんとか、ブジでした。 ‥‥でも、大きなモンダイが‥‥,It looks like it survived. But we have a bigger problem now.,gs3_070.txt
（ぼくは、ビキニさんに話した）,(I told Sister Bikini all about it...),gs3_070.txt
（修験洞への進入を拒む、 ５つの《錠》のこと‥‥）,(About the five locks that were stopping us from getting inside the Sacred Cavern.),gs3_070.txt
い‥‥いったい、だれが そんなことを‥‥,But who... who could've done that...?,gs3_070.txt
からくり錠を使えるのは、 倉院の人間だけなのに‥‥,The only people who know how to set those trick locks are those of the Kurain Tradition.,gs3_070.txt
《錠》のことは、あやめさんに おねがいしました。,"We have Iris at the Sacred Cavern, trying her best to open them for us right now.",gs3_070.txt
ビキニさんには‥‥ お話をうかがいたいんです。,"Actually, there's something I've been meaning to talk with you about, Sister Bikini.",gs3_070.txt
ああ‥‥。さっきは 途中だったっけねえ。,"Oh, yes. We were in the middle of a chat, weren't we?",gs3_070.txt
１７年間、姿を消していた 倉院流霊媒道の家元‥‥,Yes. You were telling me how the Master of Kurain disappeared 17 years ago.,gs3_070.txt
綾里　舞子がなぜ、 この葉桜院に姿を見せたか？,I want to know why Misty Fey suddenly appeared at this temple.,gs3_070.txt
１週間前‥‥エリスさま、いえ。 ‥‥舞子さまが、いらっしゃった。,"It was about a week ago when Mystic Elise... No, I mean Mystic Misty, arrived.",gs3_070.txt
家元のアカシを示してから‥‥ あの方は、こうおっしゃったの。,"After she showed me the talisman that proved she was the Master, she said...",gs3_070.txt
《倉院流霊媒道・本家の血が 絶やされようとしている》,"""Someone is trying to destroy the Kurain Tradition's main family line.""",gs3_070.txt
《私は、それを阻むために ここへ来た》‥‥って。,"""I am here to put a stop to them.""",gs3_070.txt
本家の‥‥血‥‥？,Someone was trying to destroy the main family line?,gs3_070.txt
倉院流の真の後継者は、一子相伝 ‥‥たったひとりきり、なの。,"There is only one heir to the title of ""Master"" at any time, and it's usually the eldest.",gs3_070.txt
その血を継ぐ霊媒師‥‥ 家元と、その娘が《本家》よ。,"That child becomes the new Master of Kurain, and her daughters, the main family.",gs3_070.txt
それ以外の霊媒師は《分家》と 呼ばれ、決して頂点には立てない。,"All other mediums become branch family members, with no hope of controlling the clan.",gs3_070.txt
だから‥‥倉院流の歴史では、 何度もくりかえされてきたわ。,That's why nothing has changed throughout the history of the clan...,gs3_070.txt
《分家》が《本家》を根絶やしに しようとする、暗殺計画が‥‥,Branch families always have and always will plot to erase those of the main family line.,gs3_070.txt
‥‥‥！,,gs3_070.txt
（そ、そんな重たいものなのか ‥‥《家元》って‥‥）,(Is the power of the Master worth this much bloodshed...?),gs3_070.txt
ありがとうございました。,Thank you very much.,gs3_070.txt
おかげで、いろいろなことが わかってきました。,You've helped clear up a lot of details.,gs3_070.txt
‥‥春美ちゃんに‥‥ ２人も、お姉さんがいたなんて。,"Pearls had two older sisters, huh...",gs3_070.txt
きっと、それは‥‥,"Yes, that's right...",gs3_070.txt
キミ子さまの《本家》に 対する、執念なんだねえ‥‥,No doubt it was all because of Mystic Morgan's anger towards the main family...,gs3_070.txt
しゅうねん‥‥？,Anger? What do you mean?,gs3_070.txt
双子の娘たちを、宝石商の だんなさまに奪われて‥‥,Her twin daughters were taken from her by her jeweler husband.,gs3_070.txt
それでも、娘を《家元》にする 夢を、あきらめきれなかった‥‥,But even that couldn't destroy her dream that a child of hers would one day lead the clan.,gs3_070.txt
（だから‥‥春美ちゃんが 生まれたのか‥‥）,(That's why she had Pearls?),gs3_070.txt
今度の事件も‥‥,It seems that the incident here was a result of Mystic Morgan's anger.,gs3_070.txt
独房にいるキミ子さまの執念が 引き起こしたのかもしれないね‥‥,It was able to break free of the bars that confine her.,gs3_070.txt
（‥‥あやめさんの 双子のお姉さん‥‥か）,(So Iris has a twin sister...),gs3_070.txt
（とにかく‥‥）,(The plot thickens...),gs3_070.txt
（こんなアイマイな姿のままでは、 なんの武器にもならない！）,(But this information will be useless unless I can flesh it out a bit.),gs3_070.txt
（‥‥なんとかして、もっと 《情報》を集めるんだ‥‥！）,"(I need to ask more questions, and get some more info!)",gs3_070.txt
アンタも、知ってるんでしょ？ 倉院流が“本物”だ、って‥‥,"You believe in the Technique, don't you Mr. Wright? You know its power is real...",gs3_070.txt
え‥‥ええ。,Yes... I do...,gs3_070.txt
（真宵ちゃんと会ってから、 この３年間‥‥）,(It's been three years since I first met Maya.),gs3_070.txt
（ぼくは、何度も見てきた。 彼女に、死者が宿るのを‥‥）,"(In that time, I've seen her channel the spirits of the dead plenty of times.)",gs3_070.txt
（仮面マスクの事件でも‥‥ マコちゃんの事件でも‥‥）,"(During the Mask☆DeMasque case, and during Maggey Byrde's trial, too.)",gs3_070.txt
（千尋さんは、いつでも ぼくを助けてくれた）,"(Thanks to Maya, Mia's always on hand to help me out when I need her the most.)",gs3_070.txt
倉院流は、この世界に対して、 大きな影響力を持ってきたわ。,"The Kurain Technique has made a huge difference to the world, you know.",gs3_070.txt
当然よね。死者と語らう、 本当の霊能力なんだから。,"I mean, the ability to commune with the dead... That's true psychic power, you know.",gs3_070.txt
その時代の権力者たちの影に、 かならず倉院流が存在した。,"Members of the Tradition have always been there, behind every important leader.",gs3_070.txt
その権威は、ゼッタイで‥‥ だれもが敬意を払っていたの。,Who wouldn't respect such a tremendous skill?,gs3_070.txt
‥‥でも‥‥,"I suppose so, but...",gs3_070.txt
そのわりには、あまり‥‥その。 生活が豊かであるようには‥‥,"With all that power and influence, I kind of expected you'd be really rich by now...",gs3_070.txt
ビンボーくさい、って？ わはは。ハッキリ言うわね。,"Are you saying we're poor, Mr. Wright? Ho ho ho! You're very direct, aren't you?",gs3_070.txt
‥‥信用を失ったのよ。 たった一度の《失敗》で‥‥,"People don't believe in it anymore, you see. All because of one little mistake...",gs3_070.txt
《失敗》‥‥？,A mistake? What mistake?,gs3_070.txt
今から、１７年前のことよ。 倉院流の権威が、地に落ちたわ。,It was 17 years ago. That's when everything came crashing down.,gs3_070.txt
ある事件によって、ね。,All because of that incident.,gs3_070.txt
（その《事件》って‥‥ も、もしかして‥‥？）,"(""That incident""? Is she talking about what I think she is...?)",gs3_070.txt
今でも、記録が残っているはずよ。 ‥‥もちろん、封印されてるけど。,"I'm sure the records still exist if you're interested. Locked up, of course.",gs3_070.txt
《ＤＬ６号事件》‥‥ それが、記録に与えられた名前よ。,"It was called the ""DL-6 Incident"". That's the name of the file.",gs3_070.txt
《ＤＬ６号事件》‥‥ （やっぱり‥‥そうだったか！）,"The DL-6 Incident, huh?",gs3_070.txt
ＤＬ６号事件‥‥,The DL-6 Incident...,gs3_070.txt
その事件なら‥‥ よく、知っています。,...I know it well.,gs3_070.txt
今から、３年前‥‥ ぼくが扱った事件、ですから。,I handled a related case just three years ago.,gs3_070.txt
‥‥‥！,,gs3_070.txt
そう‥‥。あの弁護士‥‥ アンタ、だったのかい‥‥,Ah! That's right... So it was you who was the defense attorney on that case...,gs3_070.txt
（１７年前に起こった、 ある殺人事件‥‥）,(A murder that took place 17 years ago...),gs3_070.txt
‥‥この国の警察の歴史で初めて、 霊媒師に協力が求められたの。,It was the first time in the country's history the police ever used a spirit medium.,gs3_070.txt
被害者の霊を呼び出して、 犯人の名を聞く‥‥という試みね。,The idea was to channel the victim's spirit to learn the identity of the murderer.,gs3_070.txt
（その霊媒師が、綾里　舞子‥‥ 真宵ちゃんのおかあさんだった）,"(And the medium who performed the channeling was Misty Fey, Maya's mother.)",gs3_070.txt
‥‥舞子さまの霊媒によって、 １人の男の名が浮かび上がったわ。,"Through Mystic Misty's channeling, the name of a certain man surfaced.",gs3_070.txt
捜査陣は、色めきたった。 犯人の名が、わかったのだから‥‥,"Armed with that as evidence, the investigators were spurred into action...",gs3_070.txt
‥‥ええ。 でも、その《男》は‥‥,But that man...,gs3_070.txt
裁判の結果‥‥‥無罪判決が 下されてしまった。,"He was found not guilty, wasn't he?",gs3_070.txt
‥‥そのとおりよ。,...That's right. He was.,gs3_070.txt
そして‥‥、事件はそのまま 迷宮入りしてしまったわ。,And the case remained a mystery...,gs3_070.txt
私たちは、失敗したの。,"In other words, we failed.",gs3_070.txt
倉院流霊媒道が、初めて 一般世間に姿を見せた事件で‥‥,It was the first case the world had ever seen the Kurain Tradition openly involved in.,gs3_070.txt
マスコミ、司法当局、世論、 そして‥‥倉院の里の霊媒師たち。,"It was all over the media. The public, the judiciary, the people of Kurain Village...",gs3_070.txt
あらゆるメディアが、舞子さまの チカラを“インチキ”だ、と‥‥。,Everyone judged her. Everyone said Mystic Misty's powers were a sham.,gs3_070.txt
そして‥‥あの方は失意のまま、 姿を消してしまった。,"And then she just disappeared; vanished, while everyone still thought of her as a fraud.",gs3_070.txt
でも！　ぼくは、 その真相を知っています！,But I know the truth!,gs3_070.txt
綾里　舞子さんの霊媒は‥‥ インチキではなかった！,Misty Fey's spirit channeling wasn't a sham at all!,gs3_070.txt
‥‥もちろん、そうよ。,Of course it wasn't...,gs3_070.txt
あなたのおかげで、 事件の真相がわかってから‥‥,"And since you managed to reveal the truth, we're finally making a comeback.",gs3_070.txt
倉院は、やっと‥‥ふたたび、 チカラを取り戻そうとしているの。,The Kurain Tradition is starting to recover at last.,gs3_070.txt
その《チカラ》を背負って立つのが ‥‥新しい家元さま、なのよ。,But with a new Master wielding the power of the clan...,gs3_070.txt
（それが‥‥‥ 真宵ちゃん‥‥なのか！）,(Does she mean Maya!?),gs3_070.txt
倉院流の霊力は、 その血に宿っているわ。,The spiritual power of the Kurain Channeling Technique is in the blood.,gs3_070.txt
（真宵ちゃんも‥‥ そう言っていたっけ）,(Maya's told me the exact same thing before...),gs3_070.txt
あたしたち綾里家の女は、代々 霊媒師として生きてきたの。,"We, the women of the Fey family, have always been spirit mediums.",gs3_070.txt
綾里の血は、強い霊力を 宿しているから‥‥。,It's because the power to communicate with spirits flows strongly through us.,gs3_070.txt
（霊力は‥‥綾里家の女性の 血にのみ、受け継がれるらしい）,"(According to Maya, only the women in the family can inherit that power.)",gs3_070.txt
綾里　供子さまの血を受けた 《家元》の娘たちの中から‥‥,The main family's bloodline stems directly from Mystic Ami.,gs3_070.txt
代々、たったひとり‥‥ 次の《家元》が決められるの。,"But with each new generation, only one daughter becomes the new Master.",gs3_070.txt
選ばれなかった娘さんは、 《分家》になるわけですね。,"And the ones who don't become branch families, right?",gs3_070.txt
‥‥そうよ。それが、 いくつもの悲劇を生んできたわ。,That's right. And it's always the cause of tragedy.,gs3_070.txt
真宵ちゃんには、お姉さんが いたんです。千尋さん、という‥‥,"You know, Maya had a sister, too. An older sister named Mia...",gs3_070.txt
聞いたこと、あるわ‥‥ お姉さまのこと。,Oh yes. I've heard of her.,gs3_070.txt
‥‥‥！　知ってるんですか？,What!? You know about Mia!?,gs3_070.txt
おかあさま‥‥舞子さまの事件を 調べるため、弁護士になったとか。,Of course. She became a lawyer in the hopes of discovering what happened to her mother.,gs3_070.txt
（そして‥‥その事件を追ううちに 命を落としてしまった‥‥）,(And lost her life as a result...),gs3_070.txt
‥‥千尋さまは、 おっしゃっていたそうよ。,Do you know what Mystic Mia is rumored to have said?,gs3_070.txt
自分が弁護士になったのは、 おかあさまのためだけじゃない‥‥,She said it wasn't only because of her mother that she became a lawyer...,gs3_070.txt
姉妹で、家元の座をめぐって 争いたくないからだ、って。,She also didn't want to fight with her sister over the leadership of the Tradition.,gs3_070.txt
そ‥‥そうなんですか‥‥！,Really...!?,gs3_070.txt
