Japanese,English,Note
いやあ、カンドーしたなあ。 あのときは。,"A truly moving moment, if I do say so myself.",gs3_014.txt
‥‥さぞ、ソーゼツな光景 だったんでしょうねえ‥‥。,...That must've been one heck of a beautiful scene.,gs3_014.txt
“もらい泣き”のイミが よくわからないけどな。,"(If beauty is in the eye of the beholder, I'm convinced that these two are blind.)",gs3_014.txt
怪人になろうと決めて、ボク、 いろいろ勉強したんですよ。,"Once I decided to become a thief, I started studying like crazy.",gs3_014.txt
‥‥怪人について？,Studying!? Like what? Petty Larceny 101? The History of Pilfering?,gs3_014.txt
はい。小説や映画を見て、 大センパイたちのカツヤクを。,"Ha. No, but I watched a lot of movies and read a lot of novels about great thieves.",gs3_014.txt
へええ。ネッシンなんですねー。,"Oh yeah? I admire you for doing your homework, if for nothing else.",gs3_014.txt
みなさん、とても はずかしいカッコウをなさって、,"All the great ones had their own trademarks. Flashy costumes, calling cards...",gs3_014.txt
予告状に高笑い。そして、 キメぜりふは“サラバだ諸君”。,"...unique laughs, and catchy slogans, like, ""Farewell, my friends!""",gs3_014.txt
‥‥このへんは、やはりキッチリ 押さえないと、って思って。,I figured I needed to do a good job with that if I was going to make a splash.,gs3_014.txt
ホント、怪人にならないと、 なかなか言えないよねー。,"Yeah, I guess you really can't say goofy stuff like that unless you're a master thief.",gs3_014.txt
“サラバ”も“ショクン”も。,"""Farewell"" or ""We shall meet again""... You know, hokey stuff like that.",gs3_014.txt
さすが、名探偵さんですよね。,"He's an Ace Detective, alright.",gs3_014.txt
１回目の事件から毎回、ボクを いい感じに追いつめますからねえ。,He's been hot on my trail ever since the first heist.,gs3_014.txt
でも‥‥今日の法廷で、 ショーゲキの告白をしましたよね。,"Yes, but... He made a pretty stunning confession in court today.",gs3_014.txt
“この自分こそ、仮面マスクだ！” ‥‥って。,"""It was me all along! I am Mask☆DeMasque!""...",gs3_014.txt
ううん‥‥思いこみがハゲしいん でしょうね、たぶん。,I don't know what to say... I guess he's just delusional.,gs3_014.txt
（まれかさんみたいなコト 言ってるぞ‥‥）,(That's exactly what your wife said about you...),gs3_014.txt
じつは‥‥ときどき、思うんです。,I'm ashamed to admit it...,gs3_014.txt
もしかして‥‥ボク、怪人には 向いてないんじゃないか、って。,...but sometimes I wonder if I'm really cut out to be a thief.,gs3_014.txt
そりゃそうでしょう！,"Well, isn't that obvious?",gs3_014.txt
ゼンゼン似合いませんよ！,It doesn't suit you at all!,gs3_014.txt
うううう‥‥。やっぱり、 気のせいじゃなかったのか‥‥,Uuugh... I knew it... I guess I'm not the only one who came to that conclusion.,gs3_014.txt
まれかちゃん‥‥犯罪者だけは ユルせないらしいんですよ。,Dessie... She really has a thing against criminals.,gs3_014.txt
その理由‥‥優作さん、 ご存じなんですか？,"Do you have any idea why that is, Mr. DeLite?",gs3_014.txt
さあ‥‥。詳しいハナシは、 彼女に聞いてもらえますか。,"Well... If you want to know the details, you'll have to ask her.",gs3_014.txt
とにかくボク、ＫＢ警備を クビになっちゃって‥‥,"But the thing is, after I lost my job at KB Security...",gs3_014.txt
まれかちゃんのために、 おカネがほしかったんです。,I needed to earn money to keep Dessie satisfied... Lots of money.,gs3_014.txt
でも‥‥なかなかシゴトが 決まらなくて。,But... I just couldn't seem to find a good job.,gs3_014.txt
ケッキョク、まれかちゃんが イチバンきらいな、怪人に‥‥,That's why I wound up becoming the thing that Dessie hates most... A thief.,gs3_014.txt
あ、シャチョー‥‥ おキノドクです。,Mr. Bullard... my old boss. It's so sad...,gs3_014.txt
何か、思い当たるコトは ありますか？,Do you have any idea what might have happened?,gs3_014.txt
‥‥毒島さんが 殺害されたコトについて。,Was there anyone that might have wanted him dead?,gs3_014.txt
そうですね‥‥なにかと 敵の多いヒトでしたから。,"Oh yeah, sure... Mr. Bullard was the type of guy who made lots of enemies.",gs3_014.txt
脅迫まがいのコトをしてみたり。,He did lots of threatening things to people...,gs3_014.txt
いやいや。“まがい”じゃなくて、 脅迫そのものじゃないですか。,"Wait, wait, do you mean he scared people, or that he threaten them with blackmail?",gs3_014.txt
まあ‥‥、そういうヒト でしたねえ。,"Well, I guess they're kind of the same, right?",gs3_014.txt
カッコイイですよねー、 あこがれちゃうなー。,Isn't he great! I wish I could be half as cool as him!,gs3_014.txt
ボクが怪人だって信じて くれたの、このヒトだけだったし。,"Besides, he's the only one that really believed me when I said I was the thief!",gs3_014.txt
いやいや。それは、きみを殺人罪で 再タイホするためだったんだよ。,"Hey, hang on a second! This is the guy that had you arrested for murder!",gs3_014.txt
‥‥そんなワルいヒトには 見えなかったけどなあ‥‥,"Well, I still don't think that makes him a bad person...",gs3_014.txt
（どんなふうに見えたんだよ、 いったい‥‥）,(What in the world do you see in that coffee-crazed prosecutor!?),gs3_014.txt
どうですか？　これなんですけど。,What do you think about this?,gs3_014.txt
そういうのはボク、ちょっと。 ‥‥‥‥いや。,"Hmm... I don't really think I can help you with that. Err, no, that's not it...",gs3_014.txt
ちょっとちがうか。 “そういうの”って、どういうのか,It's just that the thing is I don't really know if I can say one way or the other,gs3_014.txt
よく聞こえないね。,I didn't really catch that.,gs3_014.txt
聞くイミもなさそうだよ。,"Don't worry, you didn't miss anything.",gs3_014.txt
いやー、フシギですよねー。,That's kind of strange...,gs3_014.txt
なにがですか？,What is?,gs3_014.txt
仮面マスクのエモノ‥‥今までは 有名な美術品ばかりだったのに。,"Up until now, Mask☆DeMasque has gone after famous works of art or treasures.",gs3_014.txt
いきなり、こんなシブくてジミな マニア向けのツボですから。,Why did he suddenly decide to steal this plain-looking urn that nobody would want?,gs3_014.txt
‥‥他人ゴトみたいに 言わないでほしいな‥‥,You make it sound like you had nothing to do with the theft.,gs3_014.txt
だって‥‥このツボをエモノに 選んだの、ボクじゃないですから。,Well... It wasn't me that chose to steal this urn.,gs3_014.txt
へえ。ボク、こういうの、 けっこう好きなんですよ。,"Wow, this is cool! I'm really into this kind of stuff.",gs3_014.txt
ホントですか！　あたしたちの お宝なんですよ！,Oh yeah? It's one of our most valuable treasures!,gs3_014.txt
もし無罪になったら、ゼッタイ 見に行きますから。,"If I ever get out of here, me and Dessie will go to Lordly Tailor...",gs3_014.txt
まれかちゃんといっしょに、 真宵さんたちの秘宝展。,...to check out the whole Treasures of Kurain Exhibit!,gs3_014.txt
‥‥あの、盗まないでくださいね。 あたしたちの、お宝‥‥。,"Um, OK, I guess... Just promise me you won't steal anything, OK?",gs3_014.txt
やだなあ。シゴト抜きで 行くに決まってるじゃないですか！,Oh don't worry! We'd be going when I'm not on the job as Mask☆DeMasque.,gs3_014.txt
（ビミョーな会話だな‥‥）,"(Well, that's reassuring...)",gs3_014.txt
この予告状‥‥ 優作くんが作ったの？,This calling card... Did you send this?,gs3_014.txt
いえ‥‥それが。ボク、 知らないんですよねー。それ。,"No...! Err, that is... I don't know anything about that.",gs3_014.txt
だって、あの晩は それどころじゃなかったし。,"I mean, I had other plans for that night already...",gs3_014.txt
（脅迫状が届いていた わけだからな‥‥）,"(That's true... He did get that blackmail letter, after all...)",gs3_014.txt
やっぱり‥‥アイガ探偵なのかな。 予告状を書いたの。,What about Detective Atmey...? Could he be the one that sent it?,gs3_014.txt
そうみたいだね。 他に考えられないし。,It looks that way. I can't think of anyone else.,gs3_014.txt
あの夜は、しかたなくＫＢ警備に 行ったんです。,"Yeah... That night, because of the letter, I had no choice but to go to KB Security.",gs3_014.txt
これ‥‥どう見ても、ホンモノの 仮面マスクですよね。,This photo... This has got to be the real Mask☆DeMasque!,gs3_014.txt
ええ。このボクもタイコ判を 押しますよ！,I'm sure it is. I know Mask☆DeMasque when I see him.,gs3_014.txt
でも‥‥優作くんじゃ ないんだよね。,"Yes, but... This isn't you, right Mr. DeLite?",gs3_014.txt
はあ、そうですねえ。 ボク、ＫＢ警備にいましたから。,"Well, err... No... I was at KB Security then.",gs3_014.txt
じゃあ、やっぱり‥‥ アイガ探偵なのかな‥‥。,"So then... I guess it really is Detective Atmey, after all.",gs3_014.txt
この脅迫状‥‥やっぱり、 ブスジマ社長さんが？,"So was this blackmail letter written by KB Security's CEO, Kane Bullard?",gs3_014.txt
たぶん、そうだと思います。,I-I think so... Probably.,gs3_014.txt
あの社長室、キーカードがないと 入れませんしね。,You can only get into the CEO's office if you have a key card.,gs3_014.txt
（脅迫状で、取り引きの場所が ＫＢ警備に指定されている‥‥）,(The blackmail letter said to meet at KB Security...),gs3_014.txt
やっぱり、ブスジマさんしか 考えられないよね‥‥。,Then no one else other than Mr. Bullard could've have written the letter...,gs3_014.txt
‥‥あの晩、午前１時‥‥ ボク、ＫＢ警備に行ったんです。,I was at KB Security at around 1 o'clock that night...,gs3_014.txt
サイフに入れておいたキーカードを 使って、ドアを開けたから‥‥,I took out my wallet to open the door with the key card...,gs3_014.txt
コイツは、そのとき 落としたワケですね？,So is that when you dropped it?,gs3_014.txt
スミマセン‥‥。今まで かくしていて。,I-I'm sorry... I should have told you the truth earlier.,gs3_014.txt
どうして、このカードを 優作くんが持っていたのかな？,What are you still doing with this key card anyway?,gs3_014.txt
ＫＢ警備をやめたときに、 会社に返さなかったの？,Didn't you return it when you left your job at KB Security?,gs3_014.txt
か、返しましたよ、もちろん！,Of course I returned it! Don't be silly!,gs3_014.txt
あの。このカードは、脅迫状と いっしょに送られてきたんです。,Umm... But it got sent back to me along with the blackmail letter.,gs3_014.txt
脅迫状と‥‥？,With the blackmail letter...?,gs3_014.txt
“これを使って社長室に入れ” ‥‥って。,"Yes, it said... ""Use this to enter the CEO's office"".",gs3_014.txt
いやー、ここまで人気者に なるとは思いませんでしたよ！,Oh! I didn't know Mask☆DeMasque had become so famous!,gs3_014.txt
このブロマイド、 あたしが買ったんですよ！,"Yeah, I actually bought this publicity photo!",gs3_014.txt
あ。よかったら、サインしますよ！ 『怪人参上！』って。,"Really? Well, I'd be happy to sign it if you like! I'll even add, ""Behind Bars!""",gs3_014.txt
え！　ホントですか！,Yes! Please! Please!,gs3_014.txt
（優作くん‥‥すっかり 忘れてるみたいだな‥‥）,(It looks like Ron has totally forgotten about what happened at the trial today...),gs3_014.txt
（今日の裁判で、無罪判決を もらったコト‥‥）,"(That he was declared ""not guilty"" of being Mask☆DeMasque...)",gs3_014.txt
社長室の非常ブザーですね。,That's the emergency buzzer from the CEO's office.,gs3_014.txt
鳴らしちゃダメですよ。 ものスゴい音がするから。,Don't press it! It makes a terrible racket!,gs3_014.txt
へへ。あたし、思いっきり 鳴らしちゃいました。,Hee hee. Sorry. I just love making a lot of noise.,gs3_014.txt
‥‥あの。そのブザー、 事件にカンケイあるんですか？,"Err, umm... Does this buzzer have something to do with this case?",gs3_014.txt
今のところ、なんとも 言えないですね。,"Well, at this point, I don't really know yet.",gs3_014.txt
（ボタンに指紋は なかったわけだし‥‥）,"(After all, there were no prints on it, or anything else for that matter.)",gs3_014.txt
ブスジマさんが殺害された時間‥‥ 一度だけ、鳴らされているんです。,The buzzer went off just once around the time that Bullard was killed.,gs3_014.txt
えええッ！　コワいですねー‥‥,Oooh! Th-That's scary!,gs3_014.txt
優作くん、何か知らないかな？,"Do you know anything about that, Mr. DeLite?",gs3_014.txt
‥‥ううん。 特に思い当たるコトはないです。,"...Sorry, I'm afraid I don't.",gs3_014.txt
（‥‥たよりにならないな‥‥）,(Why am I not surprised by how clueless he is anymore...),gs3_014.txt
このリスト‥‥ 社長室で見つけたんですけど。,"This list... We found it in the office of the CEO, Mr. Bullard.",gs3_014.txt
これ、仮面マスクが盗んだ エモノのリストじゃないですか！,Hey! This is a list of all the things Mask☆DeMasque stole!,gs3_014.txt
盗まれたモノの横に、 値段が書いてありますよね。,And that's the value of each item listed next to them.,gs3_014.txt
《１０００万円》とか 《１５００万円》とか‥‥,"""100,000 dollars""... ""150,000 dollars""...",gs3_014.txt
これって、秘宝のお値段‥‥ なんですか？,Are you sure that's the value of the stolen items?,gs3_014.txt
ううん‥‥それにしては ヤスい気がしますねー。,Hmm... The numbers seem a little low to me.,gs3_014.txt
闇ルートで取り引きしても、 ３倍以上の値がつくと思いますよ。,"Even on the black market, the prices should be at least three times higher than that.",gs3_014.txt
（さすが、元警備員。そのへんの 情報には詳しいみたいだな‥‥）,(I guess he knows about that stuff because he used to be a security guard...),gs3_014.txt
優作くん。この証言、 まちがいないね？,"Mr. DeLite, are you absolutely sure about this testimony?",gs3_014.txt
脅迫状で指示されたとおりに、 美術品を盗んだ‥‥,That you stole the treasures as you were directed by a series of blackmail letters...,gs3_014.txt
ええ。おカネももらえるし、 “これもアリかな”って。,"Yes, and I got money for them in return. It seemed like a good deal.",gs3_014.txt
（ウソをついてるようには 見えないな‥‥）,(He doesn't look like he's lying...),gs3_014.txt
じゃあ‥‥アイガ探偵の 告白は、なんだったのかな‥‥,So then how do you explain Detective Atmey's crazy confession...?,gs3_014.txt
あ、これ！　ボクのデビュー戦の 記事じゃないですか！,Hey! This is an article about my debut heist!,gs3_014.txt
いやー、タイヘンでしたよ。 いきなり追いつめられちゃって。,"Boy, that was a tough one. Before I knew it, they were hot on my trail.",gs3_014.txt
でも‥‥仮面マスク、ちゃんと 逃げられたんですよね？,"But Mask☆DeMasque... He must have gotten away, right?",gs3_014.txt
記事にも《消えた》って 書いてあるし‥‥。,"It says in the article that he ""disappeared""...",gs3_014.txt
そうなんです！ とっさにヒラめいたんですよ！,That's right! I got a sudden burst of inspiration!,gs3_014.txt
そこにあるポリバケツの中に 怪人の衣装をかくして‥‥,I hid my Mask☆DeMasque costume in a nearby plastic bucket...,gs3_014.txt
警備員に早変わりしたんです。 ‥‥ミゴトでしょう？,"Then I quickly changed into my security guard uniform. ...Pretty clever, eh?",gs3_014.txt
へええ‥‥って、 ちょっと待ってください！,"Wow... Awesome! ...Hey, hold the phone!",gs3_014.txt
この写真の警備員‥‥ 優作さん、なんですか！,"The guard in this photo... Is this you, Mr. DeLite?",gs3_014.txt
そうですよ。 意外なトリックでしょう！,Hee hee. That's right. Nice trick if I do say so myself!,gs3_014.txt
（なんというか‥‥タンジュン すぎて、あきれちまうな）,(Nice and easy to figure out! Even Pearls could see through that in a heartbeat.),gs3_014.txt
証拠品《新聞記事》の データを書きなおした。,Newspaper Clipping updated in the Court Record.,gs3_014.txt
‥‥でも、 さすがは名探偵ですよね。,"But as you might expect, Detective Atmey found the disguise...",gs3_014.txt
ボクがバケツに捨てた怪人の衣装、 見つけちゃいましたから。,"He truly deserves the title of ""Ace Detective"".",gs3_014.txt
アイガ探偵が‥‥怪人の衣装を？ （聞いたことなかったな‥‥）,"Detective Atmey found the Mask☆DeMasque disguise? (Hmm, that's interesting...)",gs3_014.txt
ウチに持って帰っちゃった みたいですね、探偵さん。,"Yes, and I heard that he brought it home with him.",gs3_014.txt
（哀牙探偵‥‥そのとき、 コイツを手にいれたワケか‥‥）,(So that's it... That's when Atmey got his hands on this.),gs3_014.txt
おかげでボク、新しい衣装を 作り直したんですよ。,"Thanks to that, I got the chance to remake my costume.",gs3_014.txt
それはタイヘンでしたねー‥‥,"That must have been really time-consuming, huh?",gs3_014.txt
‥‥その数日後でしたね。,"Yes, it took quite a while to complete. Anyway, a few days after that...",gs3_014.txt
ボクのウチに、最初の脅迫状が 届いたのは‥‥。,I received the first of the blackmail letters...,gs3_014.txt
きょ‥‥キョーハクジョー！,B-Blackmail letters!?,gs3_014.txt
どど、どういうコトですか！ 優作くん！　話して！　ホラ早く！,Wh-What are you talking about? Hurry! Tell me what you mean!,gs3_014.txt
そそ、そんなに 身を乗り出さないでください‥‥,"H-Hey, calm down...! Don't get so worked up...!",gs3_014.txt
同日　某時刻 怪人☆仮面マスク　アジト,October 13 Mask☆DeMasque's Hideout,gs3_014.txt
あ！　リューイチくん！ マヨイちゃん！,Oh! Nicky boy! Maya!,gs3_014.txt
まれかさん‥‥,Ms. DeLite...,gs3_014.txt
アタシ‥‥ユーサクくんを 助けるつもりだったのに！,All I wanted to do was help my dear Ronnie...!,gs3_014.txt
‥‥完全に逆効果でしたね。,Yeah... but I guess it ended up hurting his case...,gs3_014.txt
そういうコト言わない、 なるほどくん。,"Don't say that, Nick! She doesn't need your help beating herself up.",gs3_014.txt
ねえ、リューイチくん。 助けてくれるでしょ？,"Hey, Nicky boy! Please! Please help Ronnie!",gs3_014.txt
ユーサクくん‥‥殺人なんて、 ゼッタイ‥‥！,"He's not a killer, I swear! My Ronnie wouldn't hurt a fly!",gs3_014.txt
‥‥とにかく、調べてみます。,...Alright. I'll poke around and see what I can find out.,gs3_014.txt
ホントに！ ウレシイっ！,"Really! Are you serious!? Oh, I'm so happy!",gs3_014.txt
‥‥リューイチくんたちが いてくれて、よかったな。,I knew asking for your help was the right thing to do.,gs3_014.txt
アタシ‥‥もう、 どうしていいかわからなくて。,I... I don't know what I can do to help anymore...,gs3_014.txt
（‥‥意外にモロいところが あったんだな。まれかさん）,(I had no idea Ms. DeLite had such a vulnerable side.),gs3_014.txt
これ‥‥仮面マスクだよ！,It's Mask☆DeMasque!,gs3_014.txt
ムネに、テープレコーダーが ブラさがっているな。,There's a tape recorder hanging from his neck.,gs3_014.txt
どれどれ。いじってみよう！,Let me see that!,gs3_014.txt
‥‥カチ‥‥,...click...,gs3_014.txt
わははははははははははははは‥‥,Aha ha ha ha ha ha ha...,gs3_014.txt
‥‥ゴクロウだったねえ、諸君。 宝冠はいただいて行くよ‥‥,"I'll be taking this crown now! Better luck next time, gentlemen!",gs3_014.txt
わーははははははははははは‥‥,Aha ha ha ha ha ha ha...,gs3_014.txt
ユーサクくん、『ほがらかな笑い声 こそ、怪人のイノチだ』‥‥って。,"Ronnie used to say that ""a happy laugh is the lifeblood of a thief"".",gs3_014.txt
たしかに、ココロが 洗われるような笑い声ですね。,"Well, that certainly is a happy-sounding laugh alright.",gs3_014.txt
けっこう、笑うのって ムズカシイんだよ。,"Yes, and laughing isn't as easy as it sounds.",gs3_014.txt
なんかこう、しらじらしく なっちゃってねー。,"The harder you try, the more fake it sounds.",gs3_014.txt
うーん。優作さん、 ドリョク家なんだねえ‥‥。,"Yeah. Mr. DeLite really works hard at his craft, huh?",gs3_014.txt
きゃあ、カワイイ！ これ、気球っていうんだよ！,"Oh, that's so cute! It's called a hot air balloon, you know!",gs3_014.txt
‥‥さすがに知ってるよ。,...Wow! There's no fooling you!,gs3_014.txt
あたしも 作ってみようかなー、気球。,I want to make my own balloon now!,gs3_014.txt
なるほどくんも 乗せてあげるからね！,"I'll even let you ride in it, Nick!",gs3_014.txt
（気球には、ゴクヒのはずの エンブレムがプリントされてる）,(That emblem on the balloon is supposed to be top-secret.),gs3_014.txt
（‥‥天杉　優作が仮面マスクで あるという証拠だ）,(This could convince the courts that Ron DeLite is Mask☆DeMasque...),gs3_014.txt
（真宵ちゃんにはダマっておこう。 ‥‥コワいから）,"(I'd better not tell Maya. She gets kinda... scary when it comes to ""celebrities""...)",gs3_014.txt
天杉　優作は‥‥脅迫状を 受け取っていたんだ。,"So Ron received a blackmail letter, huh?",gs3_014.txt
まれかさんは知ってるのかな？ このコト‥‥,Do you think Ms. DeLite knows about this?,gs3_014.txt
知ってたら、ニコニコ笑ってる ワケにも行かないだろ。,"Well if she did, I don't think she would've been smiling like that.",gs3_014.txt
教えてあげたほうが いいのかな‥‥,I wonder if we should tell her about it...,gs3_014.txt
よけいなコトは しないほうがいいと思うよ。,I think it'd be smarter if we didn't.,gs3_014.txt
中途ハンパなヘンソウ道具が ガクに入ってかざられている。,It's a bunch of cheap costume pieces arranged inside a nice frame.,gs3_014.txt
つ、つけヒゲだよ なるほどくん！,"L-Look, Nick! It's a fake beard!",gs3_014.txt
厚紙を切りぬいた 仮面もあるぞ‥‥,There's also a mask made out of cardboard...,gs3_014.txt
ほらほら、なるほどくん。 つけヒゲつけヒゲ！,"Here, Nick! Try on this fake beard! Come on! Try it on!",gs3_014.txt
う、うわ！ ナニするんだよ‥‥,H-Hey! Cut it out...,gs3_014.txt
ついでにマスクも かぶるかぶる！,Now put on the mask!,gs3_014.txt
あはははははははは！ 怪人なるほどくんだ！,Aha ha ha ha ha ha! It's Phoenix☆DeMasque!,gs3_014.txt
気に入ったら 持っていっていいよ。,"If you like it, feel free to take it home with you.",gs3_014.txt
いいです！,"Thanks, but no thanks!",gs3_014.txt
（‥‥なんか、どこかで 見たことがあるような気がする）,(Hmmm... This thing looks vaguely familiar.),gs3_014.txt
あ！　金魚ばちがあるよ。 逆さまだけど。,"Oh, I know! It's a fishbowl! Well, an upside-down one, anyway...",gs3_014.txt
ヘルメットかもしれないよ。 ‥‥宇宙人の。,I think it's a helmet. ...An alien helmet.,gs3_014.txt
となりにあるのは、 テープレコーダーかな。,And that looks like a tape recorder or something next to it.,gs3_014.txt
通信機かもしれないよ。 ‥‥宇宙人の。,I think it's a transceiver. ...An alien transceiver.,gs3_014.txt
あー、それ。優作くんが 持って帰ってきたんだよねー。,"Oh, that. Ronnie brought that home one day.",gs3_014.txt
会社のトモダチにムリ言って、 もらったんだって。,He asked one of his friends from work if he could have it.,gs3_014.txt
宇宙レンジャーの制服。 優作くん、うれしそうだったなー。,It's a Space Ranger uniform. I've never seen Ronnie happier in his whole life.,gs3_014.txt
はあああ‥‥。 あたしもほしくなってきたよ。,"Oh, man... Now I want one, too!",gs3_014.txt
（あの事件の警備会社‥‥ ＫＢ警備だったのか）,(I wonder if KB Security was in charge of security at the event from that old case?),gs3_014.txt
