Japanese,English,Note
５年前、おぼろ橋から転落して‥‥ 吾童川の急流に飲みこまれて。,...when she fell off of Dusky Bridge and was lost in the Eagle River.,gs3_050.txt
しかし！　カンジンの死体は 発見されていないのです！,However! Her corpse was never found!,gs3_050.txt
死亡認定の手つづきは、 すでに５年前に済んでいる！,She was declared legally dead 5 years ago!,gs3_050.txt
法律的には、美柳　ちなみは すでに、死者なのだ‥‥,"As far as the law is concerned, Dahlia Hawthorne is officially dead.",gs3_050.txt
しかし、死体が見つかって いないのは、ジジツです！,But the fact remains that her body was never recovered!,gs3_050.txt
５年前‥‥。美柳　ちなみさんは、 １４才だったそうです。,"Dahlia Hawthorne was 14 years old, 5 years ago.",gs3_050.txt
生きていれば‥‥今年、１９才。,"If she were still alive, she would be 19 now.",gs3_050.txt
‥‥無久井　里子さん。,...Melissa Foster.,gs3_050.txt
ちょうど、あなたぐらいの 年ごろですね‥‥。,I believe that's the same age you are!,gs3_050.txt
え‥‥っ！,Ah...!,gs3_050.txt
まさか‥‥弁護人！ この証人が‥‥？,Even you couldn't...! Ms. Fey...! You're not saying...!,gs3_050.txt
‥‥そのとおり。 弁護側は主張します。,But I am. That's precisely what I'm saying.,gs3_050.txt
その証言台に立っている “証人”は‥‥,"This ""witness"" before us is the girl that was kidnapped and killed 5 years ago!",gs3_050.txt
５年前の誘拐事件の中心人物、 美柳　ちなみである、と！,This girl is in fact Ms. Dahlia Hawthorne!,gs3_050.txt
な‥‥なんですとおおおおおおッ！,WHA...! WHAAAAAAT!,gs3_050.txt
クッ‥‥！　どうやら、火事場に バクダンを放りこんじまったな。,Ha...! Nice work... That was like tossing a grenade into a 3-alarm fire!,gs3_050.txt
このまま終わったら‥‥,But unless you can tie all the loose ends together...,gs3_050.txt
ただのヒトさわがせな お姉さん、だぜ。,...you're nothing but a hit-and-run arsonist.,gs3_050.txt
わ、わかってます！,I... I understand.,gs3_050.txt
（彼女の正体が暴ければ‥‥ かならず、状況は変わるわ！）,"(If I can expose her true nature, I can turn this whole case on its head!)",gs3_050.txt
（今度は、あの検事さんが あわてふためく番よ‥‥！）,(Now is my chance to make Mr. Edgeworth squirm...!),gs3_050.txt
ぬ‥‥ぬううううう‥‥,Hmm... Hmm... Hmmm...,gs3_050.txt
証人！　あなたは‥‥ いったい、ダレなのですかッ！,Witness! Just who are you anyway!?,gs3_050.txt
わたし‥‥わたしは‥‥ I... I... I'm...,,gs3_050.txt
‥‥フッ‥‥,I didn't think it'd come to this.,gs3_050.txt
もう‥‥そのへんで いいだろう、証人。,"That's enough... You don't have to say anymore, witness.",gs3_050.txt
はい。わかりましたわ。,Yes. I understand.,gs3_050.txt
ど、どういうことですか！ 御剣検事くん‥‥,Wh-What! Mr. Edgeworth! Explain yourself!,gs3_050.txt
裁判長。‥‥正直に告白しよう。,Your Honor. I have an admission to make.,gs3_050.txt
弁護側がここまで食い下がるとは ‥‥予想外だった。,I honestly never thought the defense would pursue the matter this far...,gs3_050.txt
御剣検事！ ま、まさか、あなたは‥‥,You don't...! You don't mean...!,gs3_050.txt
‥‥検事局を 見くびってもらっては困る。,"...Yes. The prosecutor's office isn't filled with fools, you know.",gs3_050.txt
身元のハッキリしない証人など、 この私がユルすハズがない。,"Naturally, we conduct full background checks on all of our witnesses.",gs3_050.txt
な、なんですって‥‥？,Wh-What did he say...?,gs3_050.txt
クッ‥‥！　どうやら‥‥ ボウヤは、知ってやがったのさ。,Ha...! It looks like the kid knew.,gs3_050.txt
彼女の正体を‥‥最初っから、な。,He knew her true identity from the get-go.,gs3_050.txt
そんな‥‥！ じゃあ、どうして！,No way...! But then why...!,gs3_050.txt
アンタが暴かなければ、 触れないつもりだったんだろう。,"If you hadn't revealed her secret, he wasn't going to say anything about it.",gs3_050.txt
必要なのは、《証言》だった。 それが、取引ってヤツさ。,"All he wanted was her testimony, so he made a little trade.",gs3_050.txt
‥‥紹介しよう。,Let me introduce you to...,gs3_050.txt
被害者の妹にあたる‥‥ 美柳　ちなみさん、だ。,"...the victim's younger sister, Ms. Dahlia Hawthorne.",gs3_050.txt
し‥‥しかし！　５年前に 亡くなったのでは‥‥？,But... But... I thought she died 5 years ago...?,gs3_050.txt
われわれもそう考えていた。 しかし‥‥そうではなかった。,"We thought so as well... But... Well, as you can see...",gs3_050.txt
いったい、なぜ！　５年間も 身をかくしていたのですか！,Why!? Why did she hide her identity for 5 years!?,gs3_050.txt
‥‥それは、今回の事件とは 関係のないことだ。,That has nothing to do with the current case.,gs3_050.txt
彼女は、たまたま 事件を目撃しただけ‥‥,She was merely an accidental witness to a crime...,gs3_050.txt
“たまたま”‥‥？ そんなはず、ないでしょう！,Accidental...? I don't believe that for a minute!,gs3_050.txt
あなたは、５年間も 《被害者》の仮面をかぶっていた！,"For the last 5 years, she's been playing the role of victim!",gs3_050.txt
そして‥‥今回も！　殺人現場で 疑わしい行動をとっています！,And now we find her acting suspiciously at another murder scene!,gs3_050.txt
‥‥弁護人のウスっぺらい たくらみは、見えている‥‥,"...Really, Ms. Fey! Your strategy is clearly obvious.",gs3_050.txt
おおかた、被告人の無罪を 勝ちとるために‥‥,You're trying to pin your client's crime on an innocent witness in order to win...,gs3_050.txt
この証人に、無実の罪を 着せようというのだろう。,...At any cost.,gs3_050.txt
‥‥なんですって‥‥！,H-How dare you!,gs3_050.txt
しかし‥‥考えていただきたい。 今から５年前、彼女は‥‥,"Please, let us take a moment to think.",gs3_050.txt
誘拐され、殺害されかけた ツラい過去を抱えているのだ。,"Five years ago, this girl was kidnapped and nearly killed.",gs3_050.txt
ぬうううう‥‥,Hmm...,gs3_050.txt
そして、何より‥‥,But even worse than that... 5 years later...,gs3_050.txt
美柳　ちなみは、被害者の たったひとりの妹なのだ。,...Dahlia Hawthorne lost something much more precious. Her big sister.,gs3_050.txt
りっぱな刑事である姉を 殺害する理由など、ないッ！,Ms. Fey must be insane to even suggest that she murdered her.,gs3_050.txt
うううううッ！,Whaaaaat!?,gs3_050.txt
‥‥検察側の主張は、 もっともだと考えます。,...I'm inclined to agree with the prosecutor's logic.,gs3_050.txt
弁護人！　あなたは 立証できると言うのですかッ！,Ms. Fey! Do you have any evidence to back up your assertion!?,gs3_050.txt
この、キノドクな証人が、 お姉さまを殺害した理由をッ！,What possible reason would this witness have for killing her beloved sister!?,gs3_050.txt
そ、それは‥‥‥,W-Well you see...,gs3_050.txt
（追いつめたつもりが‥‥ いつのまにか、逆転されてる！）,"(I thought I was winning, but somehow he's turned it around on me!)",gs3_050.txt
クッ‥‥！,Ha...!,gs3_050.txt
目をさましてやろうか、 コネコちゃん‥‥,"I think you need a little push in the right direction, Kitten...",gs3_050.txt
‥‥弁護側には、証人の動機を 立証する用意がありますっ！,The defense is prepared to present evidence supporting our claim!,gs3_050.txt
あ！　今のは、私じゃなくて、 このコーヒーのヒトが勝手に‥‥,Ah! That wasn't me! It was this guy... This crazy coffee addict...,gs3_050.txt
ヘタなハッタリは やめていただきたいな‥‥キミ。,"I think we've heard enough empty threats from you, old man.",gs3_050.txt
クッ‥‥！　ボウヤ。なぜ ハッタリだとわかる‥‥？,"Ha...! What makes you think they're empty, boy?",gs3_050.txt
そこの弁護士が、イチバン あたふたしているからだッ！,Because your protégé looks like she's sweating bullets!,gs3_050.txt
え‥‥！ （そりゃ、あたふたするわよ！）,Ah...! (I AM sweating bullets!),gs3_050.txt
‥‥アンタは今、この状況を ピンチだと考えている。そうだろ？,"...You think you're in a tough spot, huh?",gs3_050.txt
あたりまえですっ！,Of course! Aren't I?,gs3_050.txt
‥‥ちがう。 今は、ただ《勝負時》なんだ。,"...No. You've just arrived at the moment of truth, that's all.",gs3_050.txt
ピンチか、チャンスか？ 決めるのは、アンタ自身なのさ。,Whether you win or lose... That's up to you.,gs3_050.txt
（私自身が‥‥決める‥‥）,(Up to me...?),gs3_050.txt
‥‥フッ。若さゆえの暴走、か。 ほほえましいな‥‥,*sigh*... The rashness of youth. How charming.,gs3_050.txt
（私より若いくせに）,(This coming from someone younger than me!),gs3_050.txt
それでは、弁護側の考えを うかがいましょう。,"Now then, let's not waste any more time. ...Ms. Fey.",gs3_050.txt
この証人が‥‥実の姉である 美柳　勇希を殺害した“動機”は！,"What motive would this witness have for murdering her own sister, Valerie Hawthorne?",gs3_050.txt
‥‥なんだろうか。 今の、不吉なシロモノは？,...What is this? Is this the defense's idea of a joke?,gs3_050.txt
イミがわかりません。 なんなのですか？　弁護人。,"If so, I certainly don't get the punch line... Well? Ms. Fey?",gs3_050.txt
今のは‥‥、その。 若さゆえの暴走ですっ！,"Oh, that was... The rashness of youth!",gs3_050.txt
じ、自分で 認めてどうするんですかッ！,Th-The rashness of youth!? And what is your point in furthering such a stereotype!?,gs3_050.txt
あの証人は、５年間も 身をひそめてきた。,"That witness stayed hidden for 5 years, Kitten.",gs3_050.txt
かならず、理由があるはずだ。 そして‥‥,There must be a good reason for that.,gs3_050.txt
美柳　勇希が、その“理由”に からんでいるのさ‥‥,And somehow it must involve Valerie Hawthorne...,gs3_050.txt
（もう一度‥‥！　法廷記録の スミズミまで見るの、千尋！）,"(OK, one more time, Mia! You gotta read the Court Record more carefully this time!)",gs3_050.txt
‥‥尾並田さんの脱走が、 すべての始まりでした。,...The story starts after Terry Fawles escaped.,gs3_050.txt
彼に呼び出された勇希さんが 書いた、このメモ‥‥,He called Valerie and told her he wanted to meet. This is the note she left...,gs3_050.txt
こう書かれています。 『ちなみに相談。今度こそ伝える』,"It says, ""Talk to Dahlia. Tell her this time, the whole truth must come out.""",gs3_050.txt
‥‥美柳　ちなみは、勇希さんから 宣告されたのです。,...Valerie Hawthorne gave Dahlia a warning.,gs3_050.txt
《すべて、世間に公表する》 ‥‥と。,She told her she was going to reveal to the world the whole truth.,gs3_050.txt
“公表”‥‥？,The whole truth...?,gs3_050.txt
美柳　ちなみと被害者の間には、 大きなヒミツがあったのです。,There was a dangerously important secret between Valerie and Dahlia.,gs3_050.txt
だから、美柳　ちなみは 姉を殺害しなければならなかった！,That's the reason Dahlia felt she had to kill Valerie...,gs3_050.txt
その口を、永久にふさぐために！,To keep her mouth shut permanently!,gs3_050.txt
‥‥アマいな、弁護士クン。 それでは、だれもナットクしない。,"A terrific story, Ms. Fey! If you like fiction, that is.",gs3_050.txt
その“大きなヒミツ”とやらが、 いったい、なんだったのか‥‥？,"Enlighten the court, Ms. Fey. What was this secret that was so important?",gs3_050.txt
それが立証できないかぎりは！,Where's your evidence!?,gs3_050.txt
美柳　ちなみ、勇希、そして 尾並田　美散‥‥,"Dahlia and Valerie Hawthorne, and Terry Fawles...",gs3_050.txt
３人をつなぐ“大きなヒミツ”。 ‥‥１つしか、ねえぜ。,There's only one important secret that connects them all...,gs3_050.txt
ええ。‥‥わかっています。,"Oh, yes... I know this secret.",gs3_050.txt
‥‥裁判長！　弁護側は、 証言を要求します。,...Your Honor! The defense would like to request further testimony.,gs3_050.txt
い、いったい‥‥なんの 証言ですかな？,Wh-What testimony?,gs3_050.txt
５年前の誘拐事件について。 そこにコタエがあるはずです。,Regarding the kidnapping 5 years ago. We believe it will explain a lot of things.,gs3_050.txt
美柳姉妹の、“大きなヒミツ” ‥‥その正体が！,Such as the nature of the important secret between the Hawthorne sisters!,gs3_050.txt
ぐっ‥‥！,Ugh...!,gs3_050.txt
‥‥わかりました。 証言をおねがいしましょう。,...Very well. I'll grant your request for further testimony.,gs3_050.txt
ツラい記憶でしょうが、 話していただけますね？,"I know it will be painful for you, but can enlighten us once more, my little maple leaf?",gs3_050.txt
え、ええ。 もちろん、かまいませんわ‥‥,"Y-Yes, I-I'll try. Mr. Judge...",gs3_050.txt
（いよいよエガオが キレイね、ちなみさん‥‥）,"(Putting on the old charm one more time, Dahlia?)",gs3_050.txt
（‥‥でも。 それも、これが最後よ！）,(But this will be the last time you hide behind your womanly wiles!),gs3_050.txt
～５年前の事件～,-- 5 Years Ago --,gs3_050.txt
５年前‥‥わたし、尾並田さまに 誘拐されましたの。,"Five years ago, I was kidnapped by Mr. Fawles.",gs3_050.txt
身代金は、ダイヤの原石でした。 おぼろ橋の上で、お姉さまは‥‥,"The ransom price was a raw diamond. My sister, Valerie, brought it to the bridge...",gs3_050.txt
取り引きが終わったとき、 尾並田さまの右腕を撃ちましたの！,"After she made the exchange, she shot Mr. Fawles in the arm!",gs3_050.txt
尾並田さまは、わたしを殺すために 背中を押して、つき落としました！,That's when Mr. Fawles tried to kill me by shoving me off the bridge from behind!,gs3_050.txt
わたし‥‥美柳家のムスメでいる のが、コワくなってしまって‥‥,"I survived, but I was afraid I might be kidnapped again for my family's money...",gs3_050.txt
それ以来、身分をいつわって、 今まで生活してきたんです‥‥。,So I decided to change my identity and start a new life...,gs3_050.txt
ぬうううううう‥‥,Hmmm...,gs3_050.txt
‥‥誘拐事件が、彼女のココロに 大きなキズを残したのだ。,...The kidnapping left her emotionally scarred.,gs3_050.txt
美柳家を去り、姉の協力を得て 第二の人生を歩んでいた。,"With her sister's help, she left the Hawthorne family and started all over again.",gs3_050.txt
それなのに‥‥その姉を、殺害？ ‥‥考えられぬッ！,"And we're to believe after all that, she murdered her sister? Preposterous!",gs3_050.txt
事情は、わかりました。 ‥‥弁護人。,"Thank you, Mr. Edgeworth. ...Ms. Fey?",gs3_050.txt
は、はい。,"Y-Yes, Your Honor.",gs3_050.txt
お聞きのとおり、証人は今もなお、 ココロにキズを負っています。,"As you've heard, the witness is still traumatized from the kidnapping.",gs3_050.txt
‥‥くれぐれも、尋問には 気をつけてもらいたいですね。,...I'll ask you again to be extremely gentle in your cross-examination.,gs3_050.txt
（‥‥また、先手を 打たれてしまった‥‥）,(...Mr. Edgeworth got the jump on me again...),gs3_050.txt
クッ‥‥！　ここまで来たら、 カケヒキなんざ、ねじふせろ。,"Ha...! If we're not allowed to fight, then let's twist some arms.",gs3_050.txt
‥‥いいか。オレたちには１つ、 切り札となる情報があるんだぜ。,...Listen up. We've still got that info... That ace up our sleeve.,gs3_050.txt
‥‥なんですか！,...What info?,gs3_050.txt
決まってるじゃねえか。 オレたちは、知っている。,"Come on, Kitten. Don't say you've forgotten already.",gs3_050.txt
５年前の《誘拐事件》が‥‥ すべて、狂言だったことを！,The fact that the kidnapping 5 years ago was staged!,gs3_050.txt
（《狂言誘拐》‥‥。控え室で、 尾並田さんは言っていた）,"(That's right, it was a fake kidnapping! Terry Fawles told us that in the lobby.)",gs3_050.txt
アイツの言うコト、なんでもやる。 ちなみに言われたコトだったら‥‥,I do anything she says. Anything Dahlia says...,gs3_050.txt
じゃあ‥‥５年前の 誘拐を計画したのは‥‥？,What you're saying is that the kidnapping 5 years ago was planned by...,gs3_050.txt
オレと、ちなみ。 ‥‥勇希も、仲間だった。,"Yeah. Me and Dahlia... ...And Valerie, too.",gs3_050.txt
（そう‥‥この《狂言誘拐》を 立証するの、千尋！）,"(Yes! That's it! The fake kidnapping is your best shot, Mia!)",gs3_050.txt
（それこそが、彼女の “ヒミツ”なんだから‥‥）,(That's her secret!),gs3_050.txt
～５年前の事件～,-- 5 Years Ago --,gs3_050.txt
５年前‥‥わたし、尾並田さまに 誘拐されましたの。,"Five years ago, I was kidnapped by Mr. Fawles.",gs3_050.txt
身代金は、ダイヤの原石でした。 おぼろ橋の上で、お姉さまは‥‥,"The ransom price was a raw diamond. My sister, Valerie, brought it to the bridge...",gs3_050.txt
取り引きが終わったとき、 尾並田さまの右腕を撃ちましたの！,"After she made the exchange, she shot Mr. Fawles in the arm!",gs3_050.txt
尾並田さまは、わたしを殺すために 背中を押して、つき落としました！,That's when Mr. Fawles tried to kill me by shoving me off the bridge from behind!,gs3_050.txt
わたし‥‥美柳家のムスメでいる のが、コワくなってしまって‥‥,"I survived, but I was afraid I might be kidnapped again for my family's money...",gs3_050.txt
それ以来、身分をいつわって、 今まで生活してきたんです‥‥。,So I decided to change my identity and start a new life...,gs3_050.txt
あの証人にとっても、まさに ここが勝負どころさ。,"It's the moment of truth for this witness, too.",gs3_050.txt
５年前の事件が《狂言誘拐》 だったこと‥‥,Once the truth about this staged kidnapping comes out...,gs3_050.txt
ソイツが立証されたとき‥‥ あの子の正体は、すべて暴かれる！,Everyone in the court will know how much of a Jezebel she really is!,gs3_050.txt
（仕組まれた誘拐事件‥‥ かならず立証してみせるわ！）,(I've just got to prove that kidnapping was a hoax!),gs3_050.txt
尾並田さんとあなたは‥‥ 知り合いだったのですか？,Did you and Mr. Fawles have a relationship?,gs3_050.txt
‥‥ええ。 わたし、お勉強を‥‥,...Y-Yes. As a tutor...,gs3_050.txt
教えていたんですか？ 尾並田さんに。,You were tutoring him? Mr. Fawles?,gs3_050.txt
と、とんでもありません！ 教えていただいておりましたの。,"N-No, of course not! Don't be ridiculous!",gs3_050.txt
家庭教師だったんです。 尾並田　美散さまは‥‥,Mr. Fawles came to the house to tutor ME!,gs3_050.txt
（‥‥そりゃそうね。５年前、 彼女は１４才だったんだから）,"(That makes sense... 5 years ago, she was only 14.)",gs3_050.txt
美柳家に出入りしているうちに、 計画を思いついたのだろう。,He probably came up with the kidnapping plan during that time.,gs3_050.txt
資産家の宝石商だ。 いくらでもカネがとれる‥‥,"The Hawthornes are in the jewelry trade and are quite wealthy, you see.",gs3_050.txt
ぬうううううう‥‥ アタマのいいオトコですねえ。,"Hmm... Quite the clever fellow, that Mr. Fawles.",gs3_050.txt
（“アタマのいいオトコ”か‥‥）,(Did I hear him right!? Did he just call Mr. Fawles a clever fellow?),gs3_050.txt
たしか‥‥ダイヤは、 ２億円の価値があった、とか。,I heard the diamond is valued in the neighboorhood of 2 million dollars.,gs3_050.txt
ににに、におくえん！,2 million dollars!?,gs3_050.txt
カットする前のダイヤの原石で、 おトウフぐらいの大きさでしたわ。,"It was still uncut, so it was about the size of a pint of milk.",gs3_050.txt
ぬうううううう‥‥！,HMMMMM!!!,gs3_050.txt
２億円のおトウフですか‥‥。 私はどうかと思いますな！,A 2 million dollar pint of milk... I don't know what to think about that!,gs3_050.txt
犯人の要求によって、取引相手には 姉の勇希さんが指定された。,"The defendant demanded that her sister, Valerie, make the exchange.",gs3_050.txt
もちろん、刑事としてではなく‥‥ あくまでも、個人として。,"Not as a detective, of course, but as an individual.",gs3_050.txt
ところで‥‥,"By the way, I want to ask you, Mr. Edgeworth.",gs3_050.txt
どうして、あんな山の中で 取り引きをしたのでしょうか。,Why do you think he wanted to make the exchange up there on that mountain?,gs3_050.txt
逃げにくそうだし、 犯人に不利に見えますが‥‥,"If he ever got surrounded, it would be hard to escape...",gs3_050.txt
誘拐犯の考えることは、１つ。 警察の介入だ。,"There's one thing a kidnapper wants to prevent, and that's police involvement.",gs3_050.txt
さみしい山の中ならば、 尾行の存在がわかりやすい。,"In a place like that, it would be easy to tell if he was being followed.",gs3_050.txt
犯人は、山の入り口で 安全をたしかめることができる。,"With only one entrance to the mountain, he was ensuring his safety.",gs3_050.txt
かしこいかたでしたのね。 尾並田さま‥‥,What a wickedly clever man that Mr. Fawles is...,gs3_050.txt
（自分で考えたクセに‥‥）,"(Yeah, right. It was all YOUR plan...)",gs3_050.txt
とにかく、おぼろ橋の上で お姉さまは‥‥,"Anyway, Valerie brought the diamond to the mountain and...",gs3_050.txt
あなたが、人質にとられているのに ‥‥キケンなことをしましたね。,That was a dangerous thing to do considering you were being held hostage.,gs3_050.txt
でも‥‥‥おかげでわたし、 助かったのですよ。,"Yes, but... Actually, that saved my life.",gs3_050.txt
どういうことですか？,What do you mean?,gs3_050.txt
尾並田さま、右手にナイフを お持ちになっていて‥‥,"You see, Mr. Fawles was holding a knife in his right hand...",gs3_050.txt
わたし‥‥ハッキリ わかりましたの。,"Somehow, I just KNEW he was going to use it.",gs3_050.txt
このかたは、わたしを お殺しになるつもりだ、って。,I knew he was going to use that knife to kill me!,gs3_050.txt
‥‥‥！,,gs3_050.txt
だから、お姉さまは ピストルをお撃ちになったのです！,That's why my sister shot him! It was to save me!,gs3_050.txt
そのときのこと‥‥もっと 詳しく聞かせてください！,I'd like to hear more about what happened right at that moment!,gs3_050.txt
右腕を撃たれて‥‥尾並田さまは わたしの腕を、おはなしに‥‥,"Well, when Mr. Fawles was shot in the right arm, he let go of me...",gs3_050.txt
ムチュウでした。 逃げようとおもった、そのとき‥‥,"I-I was dazed. I turned to try and run away, but Mr. Fawles turned to grab me as well...",gs3_050.txt
尾並田さまと目が合いました。 殺意にみちた、おそろしい目‥‥,"As I ran past, he and I locked eyes for a second, and he gave me a large, bloodthirsty grin.",gs3_050.txt
さ、殺意ィィ‥‥ッ！,B-Bloodthirsty grin... Oooh...,gs3_050.txt
そして、次の瞬間‥‥,And in the next instant...,gs3_050.txt
‥‥川の水深は６メートルほど。 流れはかなり早い‥‥,I advise the court to remember that the river is 18 feet deep and incredibly swift...,gs3_050.txt
わたし、およぐのはトクイでした。 でも、気を失ってしまって‥‥,"I-I was a strong swimmer, but I was knocked out...",gs3_050.txt
気がついたら、見たこともない 山の中に流れついていたんです。,"When I came to, I had been carried away by the river to a strange place.",gs3_050.txt
わたし‥‥今でも 忘れられません。,I'll never forget that day.,gs3_050.txt
コワれかけた橋の上で‥‥ 逃げ道もなくて。,"The crumbling bridge, nowhere to run...",gs3_050.txt
背中を‥‥ほんの、ひと押し。 それだけでしたわ。,Then just one little shove from behind. That was it.,gs3_050.txt
お姉さまが止める間もなく、 ‥‥川の中へ‥‥,Before my sister could catch me... ...I fell into the river.,gs3_050.txt
