Japanese,English,Note
同日　某時刻 おぼろ橋,February 9 Dusky Bridge,gs3_070.txt
‥‥急に、だれにも 会わなくなっちまったな。,It's weird that there's no one around all of a sudden.,gs3_070.txt
人がいないと、ホントに 静かだな、山の中は。,It sure gets quiet up here in the mountains when you're all on your own.,gs3_070.txt
‥‥そういえば、この先に 山小屋があったけど‥‥,Speaking of alone... I guess I should go check out the shack just down this path...,gs3_070.txt
矢張のヤツ、またあそこで ふてくされてるのだろうか。,Maybe I'll find Larry there sulking again.,gs3_070.txt
《おぼろ橋》というより、本当に 《おんぼろ橋》になっちまった。,"Now it really is more of a ""Dusty Bridge"" than a ""Dusky Bridge"".",gs3_070.txt
１０年ほど前の誘拐事件といい、 呪われた橋、だよな‥‥,"That kidnapping incident happened here 11 years ago, so maybe it's cursed, too.",gs3_070.txt
葉桜院には、電話がないらしい。,Hazakura Temple doesn't have a single private phone line...,gs3_070.txt
このへんに民家はないから、 ビキニさん専用、なのだろうか。,"...and there aren't any houses in the area, so I guess Bikini is the only one who uses this.",gs3_070.txt
‥‥携帯電話ぐらい、 もってくればよかったな。,...I really wish I had brought my cell phone with me.,gs3_070.txt
あいかわらず、危なっかしく かたむいている。,That thing looks like it's ready to collapse... At least more than it did before.,gs3_070.txt
ビキニさんの話では、吾童山は 地震の多い土地柄らしい。,"According to Bikini, Eagle Mountain is very prone to earthquakes.",gs3_070.txt
イヤな予感がしたけど‥‥ 現実になってしまった。,"I had a feeling something bad was going to happen, and sure enough, it did.",gs3_070.txt
御剣のヤツ、このあたりには 住めそうもないな。,Yup. Edgeworth definitely couldn't live up here!,gs3_070.txt
葉桜院に向かう方向とは別に、 １本の細い道がのびている。,There's a narrow path going off in a different direction than that of the Main Hall.,gs3_070.txt
道しるべには《極楽庵へ》と 書かれているようだ。,"Looks like someone's taken the effort to write ""To Heavenly Hall"" on the signpost.",gs3_070.txt
向こう岸まで、２０メートル近く ありそうだ。,It looks like it's about 20 yards to that cliff over there.,gs3_070.txt
こちらから、奥の院は見えない。,But I can't see the Inner Temple from here.,gs3_070.txt
真宵ちゃん、ブジだといいけど‥‥,I really hope Maya's OK...,gs3_070.txt
同日　某時刻 山小屋　極楽庵,February 9 Heavenly Hall,gs3_070.txt
あ！　なるほどくん！,Oh! Mr. Nick!,gs3_070.txt
春美ちゃん！ 何してるの、こんなところで。,Pearls! What are you doing here?,gs3_070.txt
そ、それより‥‥ 真宵さまはっ！　どうですかっ！,N-Nothing... What about Mystic Maya!? Is she alright!?,gs3_070.txt
え。‥‥うん。それが、まだ‥‥,Um... Well... We don't know yet.,gs3_070.txt
そ、そうなのですか‥‥,Oh... I see...,gs3_070.txt
おい、コラ！ ナニしに来たんだよ、成歩堂！,"Hey! What do you think you're doing here, Nick!?",gs3_070.txt
矢張‥‥,Larry...,gs3_070.txt
ここは、負け犬たちがつどう、 負け犬たちの山小屋だぜ！,"This is the losers' shack, where losers get together to lose themselves!",gs3_070.txt
まけいぬ‥‥？,This is the what...?,gs3_070.txt
負け犬たちが身を寄せあって なぐさめあうんだよ！　悪いか！,"Hey, we find comfort in each other's failures, OK? You got a problem with that?",gs3_070.txt
‥‥わたくし、マシスさんに 似顔絵を描いていただきました。,"Look, Mr. Nick. Mr. Laurice did a picture of me!",gs3_070.txt
よ、よかったね。,"That's, um... great, Pearls.",gs3_070.txt
オレたち、これから たき木を集めに行くんだ！,We're going to gather firewood now.,gs3_070.txt
うらぶれたキャンプファイヤーで うす汚れたイモを焼くんだ！,We'll be cooking some half-rotten potatoes over a miserable little camp fire.,gs3_070.txt
ジャマするなよな！,So stay out of our way!,gs3_070.txt
（‥‥まいったな。すっかり 盛り上がってるぞ‥‥逆向きに）,(I don't believe this... Why can't he try getting fired up over becoming a better man?),gs3_070.txt
どうせ、オレの言うことなんて ダレも信じちゃくれねえんだ！,No one believes a word I say anymore.,gs3_070.txt
ハルミちゃん！　ダメだぜ、 こんなヤツを信用しちゃあ！,"Listen to me, Pearl. You don't wanna trust this kind of guy, OK? He'll only let you down!",gs3_070.txt
まよいさま‥‥,"Oh, Mystic Maya...",gs3_070.txt
ワラぶきの屋根に、 雪がふんわりとつもっている。,The snow is really piled up on the straw roof.,gs3_070.txt
おとぎ話の世界みたいだ。 ‥‥屋根だけ見れば。,"It's otherworldly... Like something out of a fairy tale. ...Well, the roof part anyway.",gs3_070.txt
《極楽庵》と書かれた 一枚板が、かかげられている。,"The sign says, ""Heavenly Hall"".",gs3_070.txt
こんなサムいところで 一晩すごしたら‥‥,I guess it's pretty fitting. If you spent a night in this little freezing shack...,gs3_070.txt
たしかに、極楽あたりに 行けそうな気がする。,...you'd probably find yourself at the pearly gates by morning.,gs3_070.txt
‥‥せっかくのいいフンイキが 台なしになっている。,That stuff is really ruining the beautiful atmosphere around here.,gs3_070.txt
この、なんとも イタイタしい感じは‥‥,It's so inappropriate.,gs3_070.txt
あえてたとえるならば、 ビキニをつけたビキニさん、かな。,Like Sister Bikini in a bikini! *shudder* ...I've gotta think of the kittens...,gs3_070.txt
これをのぼっていくと、 おぼろ橋のたもとにつく。,These steps lead up to the foot of Dusky Bridge.,gs3_070.txt
おりて来るのはラクでいいけど‥‥ 帰るのが、めんどくさいな。,"Coming down is a cinch, but going back up doesn't look like a walk in the park.",gs3_070.txt
‥‥川がなぜ下流に向かうのか、 水のキモチがわかる気がする。,"I'm starting to understand why rivers always want to flow downstream, not up.",gs3_070.txt
あれは‥‥おぼろ橋だな。 遠いけど、ハッキリ見える。,That's Dusky Bridge up there. It's amazing how clearly you can see it from so far away.,gs3_070.txt
矢張のヤツ、小屋の窓から あの事件を目撃したのだろう。,Larry supposedly saw everything through the shack's window.,gs3_070.txt
このへんは明かりがないから、 夜はまっ暗だろうけど‥‥,"Not much light gets down here, so it must be pitch black at night...",gs3_070.txt
あの晩にかぎっては、 橋がバリバリ燃えてたからなあ。,But this area was probably illuminated that night because of the burning bridge above.,gs3_070.txt
これが、ウワサの吾童川か。 事件当夜、ぼくも流されてみた。,This is the famous Eagle River. I got to try out its rough rapids the other night.,gs3_070.txt
《かなりの急流だ》とは 聞いていたけど‥‥,They say it has a really strong current.,gs3_070.txt
たしかに、そうとうなパワー、 そしてスピードだったな、アレは。,And they weren't kidding. It's both powerful and fast-flowing.,gs3_070.txt
よく助かったな、ぼく。,I was dead lucky... I mean lucky not to be dead!,gs3_070.txt
小屋のドテっぱらに、 好き勝手にラクガキしてある。,"Look at this graffiti, scrawled right on the front of the shack.",gs3_070.txt
‥‥でも、アイツの似顔絵、 意外と似ているんだよな。,At least he managed to get a pretty good likeness.,gs3_070.txt
考えてみれば、あいつには ゲージュツが合うのかもしれない。,"When I really think about it, I guess art kind of suits him.",gs3_070.txt
存在自体がアートだからな。 ‥‥あるイミ。,"I mean, his very existence is an art... of sorts.",gs3_070.txt
‥‥矢張。この絵について なんか言いたいコト、あるか？,"Larry, is there something you want to tell me about this picture?",gs3_070.txt
ヘン！　もお、オマエに 言うコトなんか、ナニもねえぜ！,"Heh! I've got nothing to say to you, Nick!",gs3_070.txt
オレと春美ちゃんは、負け犬どうし ここでイモ食って暮らすんだ！,"My life's here now, with Pearl. Two losers cooking potatoes together forevermore!",gs3_070.txt
（やれやれ‥‥）,(What am I going to do with him...?),gs3_070.txt
じゃ、春美ちゃん。 この絵なんだけど‥‥どう思う？,"Alright then. What do you think about this picture, Pearls?",gs3_070.txt
まあ‥‥とても、 おじょうずですね！,I... I think it's really well drawn!,gs3_070.txt
わたくし、お絵かきは ニガテなものですから‥‥,"I can't draw at all, so I think it's really amazing.",gs3_070.txt
だろ！　だろ！　この火の色が なかなか出なくてさー。,"See! Someone appreciates it! It's tough getting the flames to look like that, you know.",gs3_070.txt
お空をお飛びになってるのは あやめさま、でしょうか？,"It's supposed to be Sister Iris flying through the air, isn't it?",gs3_070.txt
‥‥ユメいっぱいの、 とてもステキな絵だと思います！,I love it! It's like a dream. A wonderful fantasy.,gs3_070.txt
いやいや、ユメじゃねえの！,"No, no, no! It wasn't a dream!",gs3_070.txt
ホントに飛んだワケよ！ あの晩、あやめちゃんは。,"She really flew! I'm telling you, Iris really flew that night.",gs3_070.txt
まあ！ ‥‥ま、マシスさま‥‥,But Mr. Laurice...,gs3_070.txt
う。,*sigh*,gs3_070.txt
は‥‥ハルミちゃんまで そんな目で‥‥,"Not you too... Please don't look at me like that, Pearl...",gs3_070.txt
カワイソウなヒトを見る目で オレを見ないでくれェェェ！,Don't look at me like I'm some kind of nutcase. I beg of you!,gs3_070.txt
（やっぱり、矢張はホンキで 描いたんだな。この絵‥‥）,(I guess this picture really is a representation of what Larry thinks he saw...),gs3_070.txt
あの晩‥‥たしかにオレ、 ここでウトウトしてたけど‥‥,"OK, so I was half asleep when I was here that night.",gs3_070.txt
カミナリの音で、ビックリして 目がさめたんだ！　そして‥‥,But I was wide awake after the lightning struck!,gs3_070.txt
ホントに、見たんだよ！ この、スゴいシーンを！,And I saw what I saw! It was exactly like I drew in the picture.,gs3_070.txt
（まいったな‥‥ 信じるしかない、のか‥‥？）,(And it looks like I don't have any choice but to take this sketch at face value...),gs3_070.txt
なんだよ、最後の“？”は！,Hey! What's with the look of doubt on your face!?,gs3_070.txt
あの‥‥春美ちゃん。,"Umm, Pearls...",gs3_070.txt
は、はい。なんでしょうか。,"Y-Yes, Mr. Nick?",gs3_070.txt
事件があった夜の ことなんだけど‥‥,I've been meaning to ask you about the night of the murder...,gs3_070.txt
‥‥‥！,,gs3_070.txt
春美ちゃん、どこで何をしてたの？ 事件があったころ。,"Where were you, and what exactly were you doing when it all happened?",gs3_070.txt
あ‥‥あの。ええと‥‥,"I, um... I...",gs3_070.txt
わた、わた、わたくしごときモノの コトなんて‥‥,"I was just... Well... I'm just a kid, you know.",gs3_070.txt
どどどどどどどうでもよろしいじゃ ありませんか！,"I-I'm sure it doesn't really matter wh-what I was doing, d-d-does it, Mr. Nick?",gs3_070.txt
‥‥そういうわけには いかないんだよ。,"Sorry, Pearls... But yes, it does.",gs3_070.txt
事件が起こった晩‥‥,On the night of the murder...,gs3_070.txt
春美ちゃんは、部屋でエリス先生と 絵本を読んでいたはずだった。,"...you were supposed to be in Ms. Deauxnim's room, reading a book together.",gs3_070.txt
でも‥‥,But...,gs3_070.txt
エリス先生は殺害されて、 春美ちゃんも、奥の院にいた。,"Ms. Deauxnim was murdered, and you, Pearls, were at the Inner Temple.",gs3_070.txt
う、ううう‥‥,Nngh...,gs3_070.txt
いったい、あの晩‥‥ 何があったのかな？,"Just what exactly happened that night, Pearls...?",gs3_070.txt
申しわけありません。 ‥‥なるほどくん‥‥,"I'm really sorry, Mr. Nick...",gs3_070.txt
わたくし‥‥わるい子です。 だから、きっと‥‥,I... I've been a bad girl.,gs3_070.txt
バチが当たったのですね。,I know I'll be punished.,gs3_070.txt
‥‥どういうこと？ 春美ちゃん。,"What are you talking about, Pearls?",gs3_070.txt
わたくしの霊力が‥‥ 消えてしまったのです。,My spiritual power... It has disappeared.,gs3_070.txt
（れ‥‥霊力が‥‥？）,(What? Her powers have disappeared...?),gs3_070.txt
‥‥春美ちゃん。 教えてくれないかな。,"Come on, Pearls. You can tell me.",gs3_070.txt
事件があった夜‥‥ いったい、何があったのか？,What happened to you on the night of the murder?,gs3_070.txt
なぜ、春美ちゃんは今日、 奥の院で保護されたか‥‥？,Why were you found taking refuge at the Inner Temple today?,gs3_070.txt
わ‥‥わたくし‥‥ I... I...,,gs3_070.txt
（‥‥よっぽどのヒミツが あるらしいな‥‥）,(Wow. It must be a really big secret she's hiding.),gs3_070.txt
‥‥春美ちゃん。 霊力が消えた、というのは‥‥？,"What do you mean your power has disappeared, Pearls?",gs3_070.txt
わたくし、もう‥‥ おしまいです。,It's... It's all over for me.,gs3_070.txt
霊の呼べない霊媒師なんて‥‥ 絵の描けない画家さまのよう‥‥,A spirit medium who can't channel spirits is... like a painter who can't paint.,gs3_070.txt
なんで、そこでオレを見るんだよ！,Hey! What are you looking at me for!?,gs3_070.txt
もしかして、春美ちゃん‥‥,Pearls.,gs3_070.txt
この葉桜院で、だれかの霊を 呼ぼうとして‥‥,Did you try to channel someone's spirit right here at Hazakura Temple?,gs3_070.txt
‥‥失敗、したのかな？,"Tried but failed, perhaps?",gs3_070.txt
‥‥‥うう‥‥‥,Ah...,gs3_070.txt
うわああああああああああああん！,Waaaaaaaaah!,gs3_070.txt
コラァ、なるほどお！ 女の子を泣かすな！,"Way to go, Nick! You made her cry!",gs3_070.txt
もお、オレも泣いちゃうぞ！ うおおおおおおおおおおおおおん！,That's... That was really c-cruel of you... Waaaaaaaah!,gs3_070.txt
（‥‥やっぱり‥‥）,(Just as I thought...),gs3_070.txt
（サイコ・ロックを解除するしか ないみたいだな‥‥）,(I'm going to have to break her Psyche-Lock to get the truth out of her...),gs3_070.txt
あの、春美ちゃん‥‥？,"Um, Pearls...?",gs3_070.txt
（‥‥ダメだ）,(...It's no good.),gs3_070.txt
（今は、何も目に入らない 状況みたいだ‥‥）,(She's in no condition to look at anything for me right now.),gs3_070.txt
同日　某時刻 山小屋　極楽庵,February 9 Heavenly Hall,gs3_070.txt
‥‥あれ。春美ちゃんと 矢張、いないぞ。,Hmm... I was expecting Larry and Pearls to be here.,gs3_070.txt
たき木を集めに 行っちまったのかな。,I guess they must've gone to collect firewood.,gs3_070.txt
‥‥しかたない。 あとでまた、来てみよう。,I suppose I'll have to check back later.,gs3_070.txt
同日　某時刻 山小屋　極楽庵,February 9 Heavenly Hall,gs3_070.txt
（お。小屋の前で、あのふたりが たき火をしてるぞ‥‥）,"(Look at that! They really did make a fire, right in front of the shack...)",gs3_070.txt
‥‥あ、なるほどくん！,Oh! Mr. Nick!,gs3_070.txt
ハッ！ 一歩おそかったな、成歩堂！,"Hah! You're too late, Nick!",gs3_070.txt
イモならもう、 ゼンブ食っちまったぜ！,"If you came here for one of our potatoes, we've already polished them all off!",gs3_070.txt
（‥‥手がかりは ほぼ、そろった‥‥）,(I think I've pretty much got all the evidence I need.),gs3_070.txt
（そろそろ、春美ちゃんの 話を聞くときがきたかな‥‥）,(Now I just need to find out what Pearls is hiding.),gs3_070.txt
‥‥ありがとう、春美ちゃん。 おかげで、助かったよ。,"Thanks, Pearls. You really helped me out.",gs3_070.txt
どういたしまして！,You're very welcome!,gs3_070.txt
わたくしどもには、 おかあさまがついています！,My mother is watching over us!,gs3_070.txt
きっと‥‥真宵さまも ブジですよね！,So I'm sure Mystic Maya will be alright!,gs3_070.txt
（この、無邪気な笑顔‥‥）,(Look at that innocent smile on her face.),gs3_070.txt
（‥‥ぼくは、なんと言えば いいんだろう‥‥？）,(What am I supposed to say to her?),gs3_070.txt
クッ‥‥！,Ha...!,gs3_070.txt
アンタにも、やっと わかったかい？　まるほどう。,"Finally figured it out, have you, Trite?",gs3_070.txt
‥‥“知らない”ってコトが、 どれほど大きな《罪》なのか‥‥,You've finally realized how terrible of a crime being painfully oblivious is.,gs3_070.txt
ご‥‥、ゴドー検事！,G-Godot!,gs3_070.txt
修験洞の入り口で、パズル遊びを しているみたいだな。,The entrance to the Sacred Cavern looks like a freaking puzzle workshop.,gs3_070.txt
（あやめさんのこと、か‥‥）,(I guess he's talking about Iris and the lock-breaking effort...),gs3_070.txt
‥‥ムダなことさ。,...But it's all a waste of time.,gs3_070.txt
ど、どういうことですか‥‥？,W-Why do you say that?,gs3_070.txt
おそらく‥‥綾里　真宵は もう、帰ってこねえだろうぜ。,Because Maya Fey isn't coming back.,gs3_070.txt
え‥‥‥,What?,gs3_070.txt
な、何を言うんだ！ なぜ、あなたがそんなことを‥‥,You don't know what you're talking about! How can you say something like that?,gs3_070.txt
‥‥アンタが、守ってやる べきだったんだ。,"It was your job to protect her, Trite.",gs3_070.txt
綾里　真宵も‥‥ そして、綾里　千尋も。,Just like it was your job to protect Mia Fey...,gs3_070.txt
‥‥２人は、大変な事件に 巻きこまれていたのさ。,"Two sisters, caught up in the worst circumstances.",gs3_070.txt
そ‥‥それは わかりましたけど‥‥,"I... I realize that, but...",gs3_070.txt
いつも、そばにいたのは‥‥ アンタだけ、だったんだ。,And you were the only one who was by their sides.,gs3_070.txt
助けてやれたのは、 アンタだけだったんだよ！,You were the only one who could have saved them.,gs3_070.txt
で、でも‥‥！ ぼくは、何も知らなかった‥‥,But I didn't know anything about what was going on!,gs3_070.txt
クッ‥‥！ 言っただろう？　まるほどう。,"Ha...! What did I just say, Trite?",gs3_070.txt
“知らない”ってのは、 大きな《罪》なんだ、と‥‥,Being oblivious is a heinous crime in itself.,gs3_070.txt
‥‥‥！,,gs3_070.txt
明日、だ。,Tomorrow...,gs3_070.txt
すべての決着をつけてやるぜ。 ‥‥法廷で、な。,We'll settle everything in court tomorrow. ...Once and for all.,gs3_070.txt
な‥‥なるほどくん‥‥,M-Mr. Nick...,gs3_070.txt
い、今の‥‥検事さんの お話は‥‥まさか！,Is... Is what that man just said true?,gs3_070.txt
‥‥だいじょうぶだよ、 春美ちゃん。,"It'll be alright, Pearls.",gs3_070.txt
真宵ちゃんは、きっと生きている。 ‥‥明日になれば、わかるさ！,I'm sure Maya's alive. You'll see for yourself tomorrow!,gs3_070.txt
‥‥そ‥‥ そうですよね！,I... Yeah! That's right!,gs3_070.txt
わたくし‥‥なるほどくんを 信じていますから！,"I know I can trust you, Mr. Nick!",gs3_070.txt
‥‥春美ちゃん‥‥,...My dear Pearl...,gs3_070.txt
‥‥よくやってくれましたね、 アタクシの春美ちゃん‥‥,"...You've done so well, my child. My Pearl...",gs3_070.txt
‥‥あなたは、何も 知らなくてよいのですよ‥‥,...It's better that you don't know...,gs3_070.txt
‥‥アタクシには、この日が 来るのがわかっていました‥‥,...I knew this day would come for you...,gs3_070.txt
‥‥綾里家・本家の血は‥‥ 絶えたのです。,...The blood of the main family is no more...,gs3_070.txt
‥‥今度こそ‥‥あなたが。 家元の座を手にする‥‥,...Now you... You are to take the place at the head of the Fey clan...,gs3_070.txt
‥‥アタクシの、最後のねがい‥‥ ‥‥間に合ったようですね‥‥,"...My last, great wish... It seems I was just in time...",gs3_070.txt
つづく,To be continued.,gs3_070.txt
わたくし‥‥あの晩、お夕食のあと 奥の院に向かったのです。,"I... After dinner that night, I did go to the Inner Temple.",gs3_070.txt
‥‥あまったカレーの おナベを持って。,With a pot full of the leftover gravy.,gs3_070.txt
カレー‥‥か。,The gravy?,gs3_070.txt
奥の院の掛け軸は 見ておりましたので‥‥,I saw the picture on the hanging scroll near the Sacred Cavern.,gs3_070.txt
お手紙に書いてあった《家元》とは きっと、このことだと思って‥‥,"I was sure it was the Master of Kurain, like it said in the letter.",gs3_070.txt
‥‥なるほどね。それで？,I see. And then?,gs3_070.txt
雪のせいで、奥の院についたら １０時をとっくにすぎていました。,"Well, it was already way past 10 when I got there because of all the snow.",gs3_070.txt
だから‥‥わたくし、奥の院の 《はなれ》へ行ったのです。,So I went to the Inner Temple guest area.,gs3_070.txt
《はなれ》‥‥？,The guest area?,gs3_070.txt
ええ。そこで、修行が終わるのを お待ちしようと思いました。,Yes. I thought I could wait there until the training was over.,gs3_070.txt
‥‥どうして《修験堂》に 行かなかったの？,Why didn't you just go to the Training Hall?,gs3_070.txt
修験者の《本行》が始まったら、 立ち入りはユルされないのです。,"Because Mystic Maya's main training had already started, and I couldn't interrupt it!",gs3_070.txt
そこで、真宵さまのブジを お祈りしていたのですが‥‥,So I just stayed where I was and prayed for her to get through it.,gs3_070.txt
その‥‥わたくし‥‥。,But then... I...,gs3_070.txt
‥‥もしかして‥‥ 眠っちゃった、のかな？,"Pearls, did you fall asleep?",gs3_070.txt
も、申しわけありません！ このような、だらしのない‥‥,I'm sorry! I didn't mean to! I just couldn't help it!,gs3_070.txt
いやいや、ハルミちゃん！ そりゃ、しかたねえって！,"Hey, don't worry about it, Pearl! Who cares if you fell asleep?",gs3_070.txt
オレも、あやめちゃんを待ってて ケッキョク、寝ちまったし。,"I fell asleep waiting for Iris, too. It happens.",gs3_070.txt
それで‥‥閉じこめられちゃった わけだね。奥の院に。,Anyway... Then you found yourself trapped at the Inner Temple?,gs3_070.txt
目がさめたら、朝でした。 わたくし、泣いてしまいました！,"Yes. When I woke up, it was morning. I tried not to cry, but...",gs3_070.txt
‥‥おぼろ橋はなくなっていて、 修験堂には、どなたもいなくて。,...Dusky Bridge wasn't there anymore and there was no one in the Training Hall.,gs3_070.txt
お寝坊したから、置いていかれて しまったのだと思って‥‥,I thought everyone had left me because I overslept!,gs3_070.txt
お手紙を燃やして、いっしょに カレーをあたためて‥‥,"I threw the letter into the incinerator, then I heated up the leftover gravy, and...",gs3_070.txt
（‥‥泣きながら 掛け軸にぶちまけたわけか）,(And let off some steam by chucking the gravy on the scroll while you cried...?),gs3_070.txt
‥‥タイヘンだったなあ、 ハルミちゃん。,"It must've been pretty scary for you, Pearl.",gs3_070.txt
オレも小さいころ、よく寝坊して 成歩堂に置いていかれたよ。学校。,"I know what it's like. Nick used to leave me behind when I fell asleep at school, too.",gs3_070.txt
‥‥いっしょにするなよ。,"Don't equate something so trivial with her experience, Larry.",gs3_070.txt
おかあさまのお手紙に 書いてあったのです。,It was written right in my mother's letter.,gs3_070.txt
『《消灯の鐘》が聞こえたら、 すぐに霊媒をしなさい』‥‥と。,"It said, ""As soon as you hear the lights out bell, you must channel her spirit.""",gs3_070.txt
鐘の音が聞こえたとき、わたくし 奥の院に向かう途中でしたが‥‥,I was on my way over to the Inner Temple when I heard the bell ring.,gs3_070.txt
呼び出したわけだね。 ‥‥《美柳　ちなみ》の霊を。,So you channeled Dahlia Hawthorne's spirit?,gs3_070.txt
でも‥‥,No...,gs3_070.txt
わたくし、できなかったのです！,"I tried, but I couldn't do it!",gs3_070.txt
