Japanese,English,Note
い、いえいえ！　今年の成歩堂は ヒトアジちがいますよ、霧緒さん！,"I-I think you're mixing up the me of a year ago and the me of today, Ms. Andrews!",gs3_018.txt
でも‥‥それなら、 ちゃんと答えてください！,Well then... Prove me wrong by coming up with the right answer!,gs3_018.txt
どうですか？　霧緒さん。,"Well, Ms. Andrews?",gs3_018.txt
あの‥‥どういうことですか？,Umm... What is this supposed to mean?,gs3_018.txt
このツボには‥‥ ピンクのペンキがついてます。,This urn has these pretty little pink paint splotches on it.,gs3_018.txt
ううっ‥‥,Nngh...,gs3_018.txt
そして‥‥ツボが入っていた、 このハコにも。,"And there's some on the box the urn was stored in, too!",gs3_018.txt
‥‥どう見ても、 同じペンキですよね。,"No matter how you look at it, the paint seems to be exactly the same, wouldn't you say?",gs3_018.txt
だ、だから‥‥なんですか？,S-So? What does that prove?,gs3_018.txt
ツボは、ハコごと落とされた‥‥ そして、同時にペンキがついた。,That the urn was dropped along with the box! That's when they both got paint on them.,gs3_018.txt
‥‥ここまでは、いいですか？,...Are you with me so far?,gs3_018.txt
は、はい‥‥,Y-Yes...,gs3_018.txt
それなら、話はカンタンです。,The rest of the story is obvious.,gs3_018.txt
“このハコが落とされたのが、 ここ、高菱屋の地下倉庫である”,"""This box was dropped right here in Lordly Tailor's basement warehouse.""",gs3_018.txt
‥‥それが証明できれば、 ツボもここで割れたことになる。,"...If I can prove that, it means that the urn was broken here, too.",gs3_018.txt
そんな証拠、あるんですか？,So can you prove that?,gs3_018.txt
そのハコが、この倉庫で落とされた っていう証拠が‥‥？,Can you prove that box was dropped here in the basement warehouse?,gs3_018.txt
どうですか！　霧緒さん！,"Well, Ms. Andrews!?",gs3_018.txt
あの‥‥それは、こっちが 聞きたいです。,"Um... Actually, I think I should be the one asking the questions.",gs3_018.txt
え‥‥？,Huh...?,gs3_018.txt
最近どうですか？　成歩堂さん。,"Are you feeling ill, Mr. Wright? Have you been getting enough sleep?",gs3_018.txt
はたらきすぎて、 つかれているのでは‥‥？,Are you sure you haven't been working yourself too hard?,gs3_018.txt
（追いつめるつもりが、 いたわられてしまった‥‥）,"(Uh oh, she's turning this thing around on me now...)",gs3_018.txt
たまには、ゆっくり休んだ ほうがいいですよ。,You really should take some time off and try to relax.,gs3_018.txt
と、とりあえず、このモンダイを ハッキリさせてから休みます！,"I-I can relax later, after I've solved this mystery!",gs3_018.txt
（コタエはハッキリ わかっているのに‥‥！）,(Argh! The answer is right here! I know it!),gs3_018.txt
（もう少し、倉庫を調べてみた ほうがいいのかな‥‥？）,(Maybe I need to investigate the warehouse some more...?),gs3_018.txt
あ‥‥‥,Ah...!,gs3_018.txt
‥‥もう、わかってるんじゃ ないですか？　‥‥霧緒さん。,"I think you already know where I'm going with this, don't you?",gs3_018.txt
‥‥は‥‥、はい。 まあ、ウスウスは。,Y-Yes... More or less...,gs3_018.txt
地下倉庫のカベと床にも、ハデに ペンキがブチまけられていた。,There's pink paint splattered on the floor and walls of this basement warehouse.,gs3_018.txt
あのペンキ‥‥ハジの部分が 少し、欠けていますね？,"But there's an odd shape imprinted into a part of the paint stain, am I right?",gs3_018.txt
ええ‥‥,Y-Yes...,gs3_018.txt
このハコをそこに当てると、 ペンキの跡とピッタリ合いました。,"If you put this box into the impression in the paint, you can see it fits perfectly.",gs3_018.txt
つまり！　このハコは あそこで落とされた！,Which means this box was dropped right there!,gs3_018.txt
そして、そのとき‥‥中に 入っていたツボも、割れたんです！,And that... is when the urn was broken!,gs3_018.txt
さすが‥‥成歩堂さんッ！,"Your name does you justice, Mr. Wright...",gs3_018.txt
どうですか？　霧緒さん。,"Well, Ms. Andrews?",gs3_018.txt
あの‥‥どういうことですか？,Umm... What is this supposed to mean?,gs3_018.txt
このツボには‥‥ ピンクのペンキがついてます。,There is pink paint all over this urn.,gs3_018.txt
ううっ‥‥,Nngh...,gs3_018.txt
地下倉庫のカベと床にも、ハデに ペンキがブチまけられていた。,And there is pink paint all over the floor and walls of this basement warehouse.,gs3_018.txt
つまり‥‥このツボは、 あそこで割れたんです！,In other words... This urn was broken there!,gs3_018.txt
今度こそ‥‥言い逃れは できませんよね。霧緒さん。,"You can't weasel out of this one, Ms. Andrews.",gs3_018.txt
‥‥で、でも！,B-But...!,gs3_018.txt
（うお。まだ 言い逃れるつもりかよ‥‥！）,(Uh-oh. She's trying to make her escape...!),gs3_018.txt
ぴ、ピンクのペンキなんて、 どこにでもあるじゃないですか！,B-But you can get pink paint anywhere!,gs3_018.txt
ぼくの事務所にはありませんよ。,"Well there's none in my office, that's for sure!",gs3_018.txt
わ、私のお部屋にはあります！,W-Well there is in my room!,gs3_018.txt
（ウソつけ！）,(Liar!),gs3_018.txt
と、とにかく！,An-Anyway...!,gs3_018.txt
ツボについているペンキと、 床にこぼれているペンキ‥‥,The paint on the urn and the paint on the floor...,gs3_018.txt
同じものだっていう証拠は あるんですか！,There's no proof that it's the same paint!,gs3_018.txt
（まったく‥‥ ムチャクチャを言うなあ）,(Come on! This is getting ridiculous!),gs3_018.txt
このツボのペンキと、床のペンキを つなぐ証拠は‥‥,The proof linking the paint on the urn to the paint on the floor is...,gs3_018.txt
どうですか！　霧緒さん！,"Well, Ms. Andrews!?",gs3_018.txt
あの‥‥それは、こっちが 聞きたいです。,"Um... Actually, I think I should be the one asking the questions.",gs3_018.txt
え‥‥？,Huh...?,gs3_018.txt
最近どうですか？　成歩堂さん。,"Are you feeling ill, Mr. Wright? Have you been getting enough sleep?",gs3_018.txt
はたらきすぎて、 つかれているのでは‥‥？,Are you sure you haven't been working yourself too hard?,gs3_018.txt
（追いつめるつもりが、 いたわられてしまった‥‥）,"(Uh oh, she's turning this thing around on me now...)",gs3_018.txt
たまには、ゆっくり休んだ ほうがいいですよ。,You really should take some time off and try to relax.,gs3_018.txt
と、とりあえず、このモンダイを ハッキリさせてから休みます！,"I-I can relax later, after I've solved this mystery!",gs3_018.txt
（コタエはハッキリ わかっているのに‥‥！）,(Argh! The answer is right here! I know it!),gs3_018.txt
（もう少し、倉庫を調べてみた ほうがいいのかな‥‥？）,(Maybe I need to investigate the warehouse some more...?),gs3_018.txt
このハコ‥‥ ツボが入っていたものですね？,"This box... The urn was stored in this, right?",gs3_018.txt
ええ‥‥そうですけど。,Y-Yes... That's right.,gs3_018.txt
この箱にも‥‥ピンクの ペンキがついてます。,"Well, there's pink paint on this box as well.",gs3_018.txt
あ‥‥！,Ah...!,gs3_018.txt
どうやら、わかったみたいですね。,"I think you already know where I'm going with this, don't you?",gs3_018.txt
‥‥は‥‥、はい。 まあ、ウスウスは。,Y-Yes... More or less...,gs3_018.txt
床のペンキ‥‥ハジの部分が 少し、欠けていますね？,"The paint on the floor has an odd shape imprinted in it, doesn't it?",gs3_018.txt
ええ‥‥,Y-Yes...,gs3_018.txt
