Japanese,English,Note
やってくれたな‥‥まるほどう‥‥,Well done... Trite.,gs3_044.txt
‥‥１７杯目のコーヒーは、 アンタにおごっておくぜ。,I saved my 17th cup of coffee just for you.,gs3_044.txt
ゆっくり、味わうがいいさ‥‥,Savor it...,gs3_044.txt
‥‥アンタのエモノを ながめながら、な‥‥。,While you watch your caged prey.,gs3_044.txt
‥‥今度こそ‥‥ 終わったのですね。,"Wright, you caught a tiger by his toe, but if this one hollers, he won't be let go.",gs3_044.txt
ゴドー検事。 芝九蔵　虎ノ助は？,"The prosecution will be sure to take care of Mr. Tigre, won't you, Mr. Godot?",gs3_044.txt
‥‥緊急逮捕した。 岡　高夫・殺害容疑、だ‥‥。,"He is being arrested on suspicion of the murder of Glen Elg, Your Honor.",gs3_044.txt
どうやら、ワレワレは‥‥,Fortunately for us...,gs3_044.txt
恐るべきあやまちを、ただすことが できたようですね。,...we managed to rectify a very grave error.,gs3_044.txt
弁護士不在のまま、 判決を下してしまった、という‥‥,Ms. Byrde was found guilty in the absence of a genuine defense attorney.,gs3_044.txt
‥‥そうですね。,"Yes, she was.",gs3_044.txt
証拠は‥‥なかった。,And in the absence of genuine evidence.,gs3_044.txt
ヤツの、たったヒトコトさえ なければ‥‥,But The Tiger made one mistake.,gs3_044.txt
‥‥そのとおり。,Indeed.,gs3_044.txt
芝九蔵　虎ノ助は‥‥ ツミを逃れていたかもしれません。,He very nearly got away with everything if it wasn't for that one slip of the tongue.,gs3_044.txt
恐ろしい‥‥犯人でしたな。,Furio Tigre is a truly frightening criminal.,gs3_044.txt
クッ‥‥！,Ha...!,gs3_044.txt
本当に恐ろしかったのは‥‥,The truly frightening one...,gs3_044.txt
そこの弁護人だった‥‥のかも、 しれねえな‥‥,...is that defense attorney over there.,gs3_044.txt
（‥‥ゴドー検事‥‥）,(Godot...),gs3_044.txt
何はともあれ‥‥ 決着は今、つきました。,Well. I am now in a position to deliver my verdict.,gs3_044.txt
被告人・須々木　マコに、 改めて判決を言いわたします！,"This court finds the defendant, Maggey Byrde...",gs3_044.txt
‥‥では、本日はこれにて閉廷！,That is all. This court is adjourned!,gs3_044.txt
同日　午後　４時１０分 地方裁判所　被告人第１控え室,"January 8, 4:10 PM District Court Defendant Lobby No. 1",gs3_044.txt
な、成歩堂さん！ アタシは‥‥スズキは‥‥‥,Mr. Wright! I-I-I...,gs3_044.txt
もー、なんと言っていいかッ！ ありがとうございましたッ！,"I'm at a loss for words! Thank you, sir!",gs3_044.txt
おめでとう！　マコちゃん！,"Congratulations, Maggey!",gs3_044.txt
１ヶ月前の裁判で、成歩堂さんに こっぴどくハメられたのも‥‥,I was so mad when Mr. Wright landed me in all that trouble a month ago.,gs3_044.txt
今じゃ、ちょっぴり ユルせるキモチになりましたっ！,But now I feel like I can forgive him!,gs3_044.txt
い、いやいや！　だから、アレは 芝九蔵だったんだから‥‥,"Hey! That wasn't me, Maggey! That was The Tiger.",gs3_044.txt
あ‥‥！　なるほどくん！ ‥‥あの、ドアのところ‥‥,"Look, Nick! In the doorway!",gs3_044.txt
（‥‥い、イトノコ刑事‥‥！）,(Detective Gumshoe!),gs3_044.txt
あ‥‥じゃッ！ そういうコトで‥‥！,"Oh. Guess I'll be heading off then. See you 'round, pal.",gs3_044.txt
ま、待ってくださいよ！,W-Wait!,gs3_044.txt
イトノコセンパイ‥‥,Detective Gumshoe...,gs3_044.txt
あー、その。 マコクン、おめでとうッス！,"Uh, oh yeah. Congratulations, Maggey!",gs3_044.txt
‥‥ありがとうございます。,Thanks...,gs3_044.txt
じ、自分は信じていたッス！ マコクンの無実を‥‥,I-I knew you were innocent all along.,gs3_044.txt
そのコトバ、 証言の時に聞きたかったッス。,Why didn't you say that in your testimony then?,gs3_044.txt
むぐぎゅ！,Huh?,gs3_044.txt
あー‥‥と。その‥‥ なんッスねえ‥‥。,Oh... Well... I was...,gs3_044.txt
じゃッ！ そういうコトで‥‥！,"Well, guess I'll be heading off then. See you 'round.",gs3_044.txt
‥‥ちょっと！　イトノコ刑事！ （走っていっちまった‥‥）,"Wait up, Detective! (He just ran off!)",gs3_044.txt
ま、マコちゃん！　いいの‥‥？,Maggey! Why are you being so hard on him?,gs3_044.txt
イトノコさん、マコちゃんのために がんばったんだよ！,He busted his butt for you!,gs3_044.txt
このクスリビンだって、 イトノコさんが‥‥,It's thanks to him that we got the medication bottle...,gs3_044.txt
そんなの、ケッキョク 役に立たなかったッス！,That wasn't even any use!,gs3_044.txt
え‥‥‥,But...,gs3_044.txt
成歩堂さんが、うまく 使ってくれたから‥‥,It's only because Mr. Wright used it so cleverly.,gs3_044.txt
センパイは、ただひたすら、 カラ回りしてただけッス！,Detective Gumshoe was just running around in circles.,gs3_044.txt
（‥‥やれやれ）,(Poor guy...),gs3_044.txt
イトノコ刑事のコト‥‥ まだ、ユルせないみたいだね。,Looks like she still isn't ready to forgive him.,gs3_044.txt
ね。なるほどくん‥‥。 なんとかしてあげられないの？,"Can't you put in a good word for him, Nick?",gs3_044.txt
（そうだなあ‥‥）,"(Yeah, Maya is right. I should help Gumshoe out. It's clear he needs it.)",gs3_044.txt
‥‥ねえ、マコちゃん。,"Uh, Maggey...",gs3_044.txt
イトノコ刑事は、いつもきみの コトをシンパイしてたんだよ。,"You know, Detective Gumshoe's been really worried about you through all of this.",gs3_044.txt
自分も、そう信じて いたかったッス。‥‥でも！,"I wanted to believe that, sir.",gs3_044.txt
１日目の裁判‥‥,But on that first day of the trial...,gs3_044.txt
センパイの証言で、スズキ‥‥ あやうく、死にかけたッス！,...he practically gave the judge a free pass to lock me up!,gs3_044.txt
‥‥それは、しかたないよ。 彼は《刑事》だからね。,"He didn't have any choice, Maggey. He's a detective. He has to report the facts.",gs3_044.txt
自分を‥‥スズキのコトを、 ウタガってたに決まってるッス！,"He doubted me, that's why! He thought I might have done it!",gs3_044.txt
（イトノコ刑事のキモチを、 彼女に伝えてあげよう）,(I've got to prove to her that Gumshoe really cares about her.),gs3_044.txt
（マコちゃんへの、無罪判決の 《お祝い》だな‥‥）,(I know. I'll give her a little present to celebrate her freedom...),gs3_044.txt
‥‥‥？ あ、あの‥‥これ、なんですか？,Um... What's this?,gs3_044.txt
え！　ええと、マコちゃんの 無罪判決のお祝いに、って思って。,"Huh!? Uh, I thought it'd be a good present. You know, to celebrate your freedom.",gs3_044.txt
ちょっと、よく わからないッスけど‥‥,"Oh. Well, I don't really get it, but...",gs3_044.txt
ありがとうございます！ ダイジにするッス！,Thanks! I'll treasure it always!,gs3_044.txt
（どうやら‥‥ 大シッパイみたいだな‥‥）,(That didn't seem to do the trick...),gs3_044.txt
じゃあ‥‥そろそろ、 シツレイしますね！,"Well, I guess I'll be going now, then.",gs3_044.txt
マコちゃん。今度こそ、 いいことが待ってるよね！,"Good things are going to happen to you from now on, Maggey. I'm sure of it.",gs3_044.txt
もちろんッス！ 今度こそ‥‥,Of course! No one can be that unlucky forever!,gs3_044.txt
いいニュースを伝えられるよう、 がんばるッス！,"I'll do my best to have some good news to report to you next time we meet, sir!",gs3_044.txt
うん。待ってるよ。,Good. We'll look forward to it.,gs3_044.txt
‥‥さようなら。 スズキ‥‥一生、忘れないッス！,Goodbye. I won't forget how you helped me.,gs3_044.txt
ニセモノだらけの物語は、 これでおしまいだ。,So the case of phony versus genuine comes to an end.,gs3_044.txt
マコちゃんをとり巻いていた いつわりは姿を消して‥‥,The false allegations surrounding Maggey have all been cleared up.,gs3_044.txt
‥‥本当の物語が、これから 始まるのかもしれない‥‥,And who knows? Maybe a whole new chapter of her life is about to start...?,gs3_044.txt
‥‥はい、これ。 無罪判決の、お祝い。,Here you are. A present to celebrate your freedom!,gs3_044.txt
こここ、これは‥‥！,Th-That's...!,gs3_044.txt
イトノコ刑事、入魂の プレゼントだよ。,"A present from Detective Gumshoe, made with a ton of love.",gs3_044.txt
マコちゃん、ちょっと ヤセたみたいだから、って。,He said you lost weight and he was worried about you.,gs3_044.txt
せ‥‥センパイ‥‥,D-Detective Gumshoe...,gs3_044.txt
アタシ‥‥ I...,,gs3_044.txt
じつは、ウインナー‥‥ そんなにキライじゃないッス。,"I actually really like weenies, you know.",gs3_044.txt
‥ぐぎゅるるぐぐ‥‥ぅぅ‥‥う‥,...Uuuggggrrrrrrrr...ggg...,gs3_044.txt
そういえば‥‥ おなかへったよねえ。,"Did you guys hear that!? I'm pretty hungry myself, you know.",gs3_044.txt
‥‥今日の裁判、ずいぶん 長くかかったからなあ。,"Yeah, the trial dragged on a bit today, didn't it?",gs3_044.txt
‥‥あの‥‥。 食べてもいいッスか？　これ‥‥。,"Um, is it OK if I eat this now?",gs3_044.txt
‥‥どう？　マコちゃん！,"So? How is it, Maggey?",gs3_044.txt
‥‥‥おいしいッス‥‥‥,It's... It's really good!,gs3_044.txt
ニセモノだらけの物語は、 これでおしまいだ。,So the case of phony versus genuine comes to an end.,gs3_044.txt
マコちゃんをとり巻いていた いつわりは姿を消して‥‥,The false allegations surrounding Maggey have all been cleared up.,gs3_044.txt
‥‥本当の物語が、これから 始まるのかもしれない‥‥,And who knows? Maybe a whole new chapter of her life is about to start...?,gs3_044.txt
■第３話　逆転のレシピ おわり,Episode 3: Recipe for Turnabout THE END,gs3_044.txt
