Japanese,English,Note
非道なる弁護人の悪意にみちた 質問に、答える必要はない。,The witness doesn't need to respond to questions that are clearly malicious in intent.,gs3_050.txt
そうです！ あんまりですわ‥‥,Thank you! She's really gone too far...!,gs3_050.txt
ぬうううう‥‥。 弁護人！　ユルしませんぞ！,Hmmmmm! Ms. Fey! You're treading on thin ice here!,gs3_050.txt
（そんなにヒドいコトを 聞いたのかしら、私‥‥）,(I hardly said anything! Talk about sensitive...),gs3_050.txt
でも！　あなたの事件当日の 行動は、かなり疑わしい！,"Perhaps, but your behavior that day was very suspicious!",gs3_050.txt
証言はムジュンしているし、 犯人しか知らない情報‥‥,"Not only have you contradicted yourself here in court, but you know things you shouldn't.",gs3_050.txt
トランクのキズのことも 知っていました。,"For example, the scratches on the trunk of the car.",gs3_050.txt
そ、それは‥‥,Well th-that's...,gs3_050.txt
ザンネンながら、弁護士クン。 それはなんの証拠にもならない。,"Unfortunately Ms. Fey, your last statement proves nothing.",gs3_050.txt
なぜですか！,Oh really!? And why is that?,gs3_050.txt
証人には、被害者の特定のため 一度、検事局に来てもらっている。,The witness came to the police station once to identify the suspect.,gs3_050.txt
そのとき‥‥この写真を、係官が 見せた可能性があるのでね。,"It's entirely possible that, at that time, an officer showed her this photo.",gs3_050.txt
ぬうううう‥‥。 それは、あるまじきミスですな。,Hmm... That seems like a rather serious mistake.,gs3_050.txt
クッ‥‥！　出たぜ。 検察側、お得意の戦法だ。,Ha...! That's the oldest trick in the prosecutor's book.,gs3_050.txt
そ、そんな‥‥！,Th-That's not fair...!,gs3_050.txt
わたし‥‥ユルせないんです。 あの日見た、囚人服のかた‥‥,That wicked inmate... I'll never be able to forget that horrible day...,gs3_050.txt
“さかうらみ”‥‥？,A grudge...?,gs3_050.txt
あの。被害者のカタの証言が キメ手になったのですよね？,"Well, the policewoman's testimony was crucial, wasn't it?",gs3_050.txt
被告人さまの‥‥ 死刑判決の、キメ手に。,...Crucial in getting the defendant sentenced to death.,gs3_050.txt
そのとおり。被告人は、 それをウラんでいたのだ。,"Yes, and that's precisely why he harbored such deep anger against her.",gs3_050.txt
‥‥自分の罪を棚に上げて‥‥,So much anger that he forgot his own guilt...,gs3_050.txt
尾並田さんは、５年前の罪を 認めていません！,My client has always maintained that he's innocent of those charges!,gs3_050.txt
ずいぶん、忘れっぽいのですね。 ‥‥被告人さまは。,"He seems rather forgetful. ...Your client, I mean.",gs3_050.txt
‥‥‥！,,gs3_050.txt
刑事さまのコトはおろか、ご自分の なさったことまでお忘れなんて。,"Not only did he forget about what he did, but he forgot the poor policewoman as well.",gs3_050.txt
どういうことですか？,What do you mean by that?,gs3_050.txt
被告人さま‥‥刑事さまの おカオ、お忘れだったのでしょう？,"Your client... He forgot what the detective looked like, right?",gs3_050.txt
それなら、いっそ‥‥証言のことも 忘れてしまえばよろしかったのに。,It's too bad for her that he didn't forget about her testimony as well.,gs3_050.txt
（たしかに‥‥尾並田さん、 忘れっぽいみたいだけど‥‥）,"(Well, she's right about that. Mr. Fawles is kind of forgetful...)",gs3_050.txt
“被害者のカオを忘れていた” ‥‥というのは？,"You said, ""he forgot what the detective looked like."" What did you mean by that?",gs3_050.txt
だって、目印がなければ、ご本人と わからなかったのですよね？,"Well he couldn't tell who she was without some kind of identification, right?",gs3_050.txt
たしかに‥‥被害者は現場で、 目印のマフラーをしていた。,Quite right... That's why the victim was wearing a scarf as identification.,gs3_050.txt
‥‥もし、あの日。 白いマフラーをしていたら‥‥,"Why, if I had been wearing a white scarf that day...",gs3_050.txt
わたし、あのかたに狙われたかも しれないのですよね‥‥,...then he probably would have tried to kill me...,gs3_050.txt
ぬうううう‥‥たしかに。 ユルしがたいことです！,Hmm... That's true. He's clearly a bitter man!,gs3_050.txt
（マズいわ。尾並田さんの印象が どんどん悪くなっていく‥‥）,(This is bad. Mr. Fawles's reputation just keeps getting worse and worse.),gs3_050.txt
（深追いはキケンだけど、 今の発言‥‥どうかしら？）,(Sometimes it's best not to poke too deep... What should I do with that last statement?),gs3_050.txt
（これ以上、尾並田さんのウッカリ ぶりが強調されちゃったら‥‥）,(Any more damage to my client's image could be a disaster...),gs3_050.txt
（裁判長に、よけい悪い印象を 与えかねないわ‥‥）,(The judge already has a bad enough opinion of him...),gs3_050.txt
忘れっぽい人間は、 信用できませんね。,You just can't trust someone with a bad memory.,gs3_050.txt
１週間前の今日、何を食べたか？,What did you eat for dinner one week ago today?,gs3_050.txt
‥‥最低でも、それぐらいは 押さえておきたいものです。,"...At the very least, a person should remember that much.",gs3_050.txt
ちなみに私は、給料日だったので 家族でスキヤキをいただきました。,"As for me, it was payday, so I had a nice moose steak with some poutine on the side.",gs3_050.txt
（‥‥だから何よ！）,(...And how does this relate to anything!?),gs3_050.txt
スキヤキにしろ、犯罪にしろ、 自らの行いを否定してはいけない。,"Whether it's eating steak or committing murder, a person shouldn't deny their actions.",gs3_050.txt
‥‥そういうことだ。,"I'm in complete agreement, Your Honor.",gs3_050.txt
裁判長！　ただ今の証人の 発言‥‥非常に重要です！,Your Honor! What the witness said just now was tremendously important!,gs3_050.txt
証言に加えていただけますか！,I'd like it added to the official testimony!,gs3_050.txt
検察側にも、異議はない‥‥,The prosecution has no objection...,gs3_050.txt
被告人が、見さかいなく殺意を バラまく、危険人物だったこと‥‥,"After all, the defendant is a killer and a mentally unbalanced one at that...",gs3_050.txt
それを立証する、貴重な証言 だからな‥‥,That testimony only helps to further prove that point...,gs3_050.txt
ぬうおおおお‥‥！,Hmm...!,gs3_050.txt
い、いえ！ そういうつもりでは‥‥,"N-No, that's not why I...",gs3_050.txt
わかりました。 ‥‥証人。おねがいします。,"Enough. ...Witness, if you would?",gs3_050.txt
もちろん、よろこんで。,"My pleasure, Mr. Judge.",gs3_050.txt
この事件のことは 知っていたのですか？,You knew about that incident?,gs3_050.txt
おととしまで、この国には いなかったんですよね？,But weren't you out of the country until the year before last?,gs3_050.txt
脱走なさった死刑囚さまのこと、 ニュースで拝見したものですから。,"Well, I saw a report about the escaped convict on the news.",gs3_050.txt
わたし流に調べてみましたの。 ワイドショーなどを参考に。,They had an in-depth report about his whole history.,gs3_050.txt
５年前、あなたはまだ、 外国にいらっしゃったワケですな？,"So you were still living abroad 5 years ago, is that right?",gs3_050.txt
ええ‥‥。,Yes...,gs3_050.txt
“ふたりを知らない”‥‥ まちがいありませんね？,You didn't know either person? Are you certain of that?,gs3_050.txt
ええ。わたし、 人見知りするほうですから。,Yes. I'm afraid I'm rather shy around people.,gs3_050.txt
ぬうううう‥‥ それは、しかたないですねえ。,"Hmm... Oh well, that can't be helped.",gs3_050.txt
（イミがわからない‥‥）,(Why is he just agreeing with everything that comes out of her mouth...?),gs3_050.txt
吾童山の吊り橋の上で、初めて ふたりを見たわけですか？,"The first time you saw either of them was when they were on the bridge, correct?",gs3_050.txt
ええ‥‥。本当に、 グーゼンだったんです。,Yes... It really was a coincidence.,gs3_050.txt
“ラッキーだった” というのは‥‥？,What do you mean by lucky?,gs3_050.txt
だって‥‥今は２月ですから。 みんなマフラーをしています。,Well... It's February now. Everyone is wearing scarves.,gs3_050.txt
もしグーゼンに、指定どおりの 白いマフラーをしていたら‥‥,If I had accidentally worn a white scarf like he said...,gs3_050.txt
証人自身が、キケンに さらされたかもしれない。,Then you yourself might have been killed.,gs3_050.txt
ぬうううう‥‥ッ！,Hmmmmm... That would've been a terrible loss for this world!,gs3_050.txt
クッ‥‥！　今のゆさぶりは よけいだったぜ‥‥,"Ha...! It looks like you pressed too hard this time, Kitten.",gs3_050.txt
神乃木さん‥‥,Mr. Armando...,gs3_050.txt
ようすを見ているうちは、 ゴールは目に入らねえ。,Keep looking around you and you're going to lose sight of the finish line.,gs3_050.txt
早いトコ、つかまえないと‥‥ 法廷の女神、そっぽ向いちゃうぜ！,"Justice is blind, but she's not deaf. Sometimes you have to know when not to talk.",gs3_050.txt
証人。‥‥あなたが撮影した、 この写真を見てください。,Witness... I want you to look at this photo you took.,gs3_050.txt
この写真では、ハッキリしません。 被害者の目印である、マフラー‥‥,"It's hard to see in the photo, but look at the scarf the victim wore as identification.",gs3_050.txt
マフラーというのは、モチロン。 これのコトでしょうな？,"Ah, you are talking about this scarf right here, eh?",gs3_050.txt
そ、そう！　それですわ！ 刑事さまがしていた、マフラー‥‥,Y-Yes! That's it! The scarf the policewoman was wearing...,gs3_050.txt
（どうやら‥‥つかまえたようね）,"(I've got her now, just don't mess up...)",gs3_050.txt
‥‥それは、ヘンですね。,...But that's strange.,gs3_050.txt
あなたは、たった今、 こう証言したはずよ。,"In your testimony, you stated the following...",gs3_050.txt
《白いマフラーを持っていなくて よかった》、と‥‥,"""I guess I'm lucky I wasn't wearing a white scarf.""",gs3_050.txt
し、“白い”‥‥？,Wh-White?,gs3_050.txt
‥‥これが、あなたも認めた 被害者のマフラーです。,...This is the scarf you identified as belonging to the victim.,gs3_050.txt
どこからどう見ても、 《白》ではありません！,But it certainly doesn't look white to me!,gs3_050.txt
あ‥‥ッ！,Oh...!,gs3_050.txt
事件当日、現場は小雨がふって キリも出ていた！,"Well, it was foggy that day... And it was raining as well!",gs3_050.txt
被告人が見まちがえても、 ムリはない！,It's not surprising that she mistook it for white!,gs3_050.txt
そうは行きません。,"Sorry, but not this time.",gs3_050.txt
証人はたった今、認めたのです。 これが被害者のマフラーだと！,The witness just confirmed that this was the victim's scarf!,gs3_050.txt
しかし‥‥いったい なぜ、そんなカンちがいを‥‥？,"Yes, but... What's the significance...?",gs3_050.txt
たしかに、このマフラーは どう見ても、白ではない‥‥,"It's true that the scarf doesn't look white, but...",gs3_050.txt
その理由は‥‥ １つしか考えられません！,There's only one explanation for this mix-up!,gs3_050.txt
証人がマフラーの色を 《白》だとカンちがいした理由は！,The reason why the witness thought the scarf was white is...!,gs3_050.txt
‥‥これが、それを立証する 致命的な証拠ですっ！,Here's the definitive piece of evidence that proves it!,gs3_050.txt
それが‥‥ 致命的な証拠、なのですか？,That...? That's your definitive piece of evidence?,gs3_050.txt
ええ！ ‥‥私の考えが正しければ。,Yes! ...If my thinking is correct.,gs3_050.txt
フッ‥‥それでナゾは解けた。 コタエはカンタンだ。,Well then. We have one mystery solved! The answer is simple.,gs3_050.txt
弁護人の考えは正しくなかった。 ‥‥それだけのコト。,Ms. Fey's thinking is wrong. ...That's all there is to it.,gs3_050.txt
え‥‥‥,Huh?,gs3_050.txt
たのむ。ソイツを引っこめてくれ。 オレまでミジメになっちまうぜ。,"Please, Kitten. You've got to do something... You're killing me over here.",gs3_050.txt
弁護人には、致命的な ペナルティを与えます。,"Ms. Fey, I've got a definitive penalty to reward you for your definitive piece of evidence.",gs3_050.txt
（し‥‥しまった‥‥！）,"(Well, that wasn't what I was expecting...)",gs3_050.txt
そもそも‥‥立証など できるのですかな？,Well... Do you have evidence or not?,gs3_050.txt
証人が、このマフラーの色を 白だとカンちがいした理由など‥‥,"Perhaps you can tell us about why the witness thought the scarf was white, eh...",gs3_050.txt
‥‥証人。 このメモを見たことは？,...Witness. Have you ever seen this note?,gs3_050.txt
ぞ‥‥存じ上げませんわ‥‥,"N-Note...? I, err... No, never...",gs3_050.txt
ゴクヒ資料ですからな。 知らなくて当然でしょう。,It's top-secret evidence. There's no reason that you would have.,gs3_050.txt
‥‥それはどうでしょうか‥‥,"Hmm, I wonder about that...",gs3_050.txt
な、なんですの‥‥？,Wh-What do you mean...?,gs3_050.txt
このメモの中に、尾並田さんの 指示が書かれているんです。,This note shows Mr. Fawles's instructions to the victim regarding their meeting.,gs3_050.txt
《目印に、白のマフラー》‥‥と。,"It says... ""Wear white scarf for identification.""",gs3_050.txt
白い‥‥マフラー‥‥‥？ ああああああっ！,White... Scarf...? AAAAAAH!!!,gs3_050.txt
証人！　あなたは、このメモの 内容を知っていたのです！,Witness! You KNEW what this note said!,gs3_050.txt
それ以外に、マフラーの色を カンちがいできる方法は、ない！,There's no other possible reason for you to mistake the scarf's color!,gs3_050.txt
‥‥たしかに、尾並田さんは、 美柳　勇希さんに要求しました。,...It's true. Mr. Fawles did give instructions to Valerie Hawthorne about their meeting.,gs3_050.txt
《白いマフラーを用意するように》 被害者のメモに書かれています。,"The note that she left said: ""Wear white scarf for identification.""",gs3_050.txt
それが、何か‥‥？,"Yes, what about it...?",gs3_050.txt
“何か”じゃありません！ あきらかにヘンじゃないですか！,Isn't it obvious!? Doesn't it strike you as odd!?,gs3_050.txt
そのメモの内容を‥‥、どうして この証人が知っているのですか！,That note was a secret piece of evidence! How is it that the witness knows about it!?,gs3_050.txt
あ‥‥ッ！,Ah...!,gs3_050.txt
静粛に！　静粛に！ それは‥‥やや不自然ぎみですな。,"Order! Order! Hmm... It is odd, isn't it?",gs3_050.txt
まさか、御剣検事くん。,"Well, Mr. Edgeworth!?",gs3_050.txt
証人に、みだりにゴクヒ資料を 見せているワケでは‥‥？,Did you show top-secret evidence to the witness...?,gs3_050.txt
そ、それは‥‥さすがに、 そのような許可はしていない。,Y-Your Honor... I certainly never gave anyone permission to do such a thing.,gs3_050.txt
それならば！　この証人が メモの内容を知っているはずが‥‥,"In that case, the only way the witness could know about the note would b--",gs3_050.txt
お、お待ちくださいなっ！,J-Just a moment!,gs3_050.txt
わたし‥‥そんなメモなど、 もちろん知りませんわ！,Of course... Of course I didn't know about the note!,gs3_050.txt
ただ‥‥事件があったとき、 この目で拝見いたしましたの。,It's just... I saw it when it happened. ...With my own eyes.,gs3_050.txt
被害者のかたが、ハンニンと お会いになったとき‥‥,When the victim went to see the killer...,gs3_050.txt
ご自分のマフラーを、あのかたに お示しになったんです。,She used her own scarf to signal him.,gs3_050.txt
だから、わたし‥‥白いマフラーが 目印なんだと思いましたの。,That's why... That's why I assumed that the signal was a white scarf.,gs3_050.txt
ぬうううう‥‥それなら、 スジは通りますかな。,Hmmm... I suppose that makes sense.,gs3_050.txt
（どんなスジも通すワケには 行かないわよ、千尋！）,"(Come on, Mia! You can't let her weasel out of it that easily!)",gs3_050.txt
‥‥証人！　悪いけど、 あなたの主張は通らないわ。,"...Witness! Sorry, but your explanation isn't going to work here.",gs3_050.txt
ど、どうしてですの！ だってわたし、拝見しましたのに！,B-But why!? It-It's true! That's what I saw!,gs3_050.txt
被害者が、現場で白いマフラーを 見せられるハズ、ありません！,Impossible. There's no way you could have seen the victim use a white scarf to signal him!,gs3_050.txt
‥‥これが、それを立証する 致命的な証拠ですっ！,Here's the definitive piece of evidence that proves it!,gs3_050.txt
それが‥‥ 致命的な証拠、なのですか？,That...? That's your definitive piece of evidence?,gs3_050.txt
ええ！ ‥‥私の考えが正しければ。,Yes! ...If my thinking is correct.,gs3_050.txt
フッ‥‥それでナゾは解けた。 コタエはカンタンだ。,Well then. We have one mystery solved! The answer is simple.,gs3_050.txt
弁護人の考えは正しくなかった。 ‥‥それだけのコト。,Ms. Fey's thinking is wrong. ...That's all there is to it.,gs3_050.txt
え‥‥‥,Huh?,gs3_050.txt
たのむ。ソイツを引っこめてくれ。 オレまでミジメになっちまうぜ。,"Please, Kitten. You've got to do something... You're killing me over here.",gs3_050.txt
弁護人には、致命的な ペナルティを与えます。,"Ms. Fey, I've got a definitive penalty to reward you for your definitive piece of evidence.",gs3_050.txt
（し‥‥しまった‥‥！）,"(Well, that wasn't what I was expecting...)",gs3_050.txt
やっと信じていただけましたか？ わたしの申し上げたこと‥‥。,Well? ...Do you finally believe me?,gs3_050.txt
（こんなところで、モタモタ してる場合じゃないわ‥‥！）,"(Come on, Mia! You're running out of time...!)",gs3_050.txt
‥‥あなたは、さっきから 何度も証言していますね。,You've said several times in your testimony that the victim was wearing a scarf...,gs3_050.txt
被害者のマフラーの色は 《白》だった、と。,"...A white scarf, correct?",gs3_050.txt
‥‥ええ。それが どうかいたしまして‥‥？,Yes... Is something wrong...?,gs3_050.txt
それは、こっちが聞きたいわね。 ‥‥無久井　里子さん。,That's what I'd like to know. ...Ms. Foster.,gs3_050.txt
ごらんなさい。 これが、被害者のマフラーです！,Have a look at this. It's the victim's scarf!,gs3_050.txt
あ‥‥‥！,Ah...!,gs3_050.txt
この色を、どう表現するかは 人それぞれでしょう。‥‥しかし！,I'm sure people would disagree about what to call this color. ...However!,gs3_050.txt
決して《白》ではない！,It certainly is not white!,gs3_050.txt
あなたは、このメモの内容を 知っていたのです！,You KNEW what the note said!,gs3_050.txt
メモの‥‥内容‥‥‥？ ああああああっ！,She knew... the contents of the note...? N-NOOOOOOOO!,gs3_050.txt
‥‥《目印に、白のマフラー》,"It says, ""Wear white scarf for identification.""",gs3_050.txt
だからこそ！　マフラーの色を 《白》と表現してしまったのです！,That's the reason why you said it was white!,gs3_050.txt
う‥‥く‥‥ッ！,Ugh... Unn... Urgh...!,gs3_050.txt
どうなんですか、証人！,"Well, Ms. Foster!?",gs3_050.txt
いやああああああああああああッ！,NOOOOOOOOO!,gs3_050.txt
静粛に！　静粛に！　静粛に！ 御剣くん！　どういうことですか！,Order! Order! Order! Mr. Edgeworth! I'm waiting for an explanation!,gs3_050.txt
このメモの内容が、外部に もれるなど、考えられないッ！,I'm quite sure this note wasn't leaked to the public!,gs3_050.txt
しかし‥‥この証人は、 メモの内容を知っていました！,And yet...! This witness knew exactly what the note said!,gs3_050.txt
その内容を知っていた人物は、 かぎられています。,"At the time of the murder, the number of people that knew were quite... limited.",gs3_050.txt
尾並田　美散と‥‥、メモを書いた 美柳　勇希本人‥‥,"Terry Fawles is one. The person who wrote the note, Valerie Hawthorne, is another.",gs3_050.txt
そして‥‥もうひとり。,And finally... One more person.,gs3_050.txt
も‥‥“もうひとり”？,"Did you say... ""One more person""?",gs3_050.txt
そう。‥‥本来ならば “あり得ない人物”‥‥,That's right... A person that no one would have suspected...,gs3_050.txt
アンタも気づいたようだな？ コネコちゃん‥‥,"Have you figured it out, Kitten?",gs3_050.txt
‥‥はい！,Yup!,gs3_050.txt
被害者のメモの内容を知っていた、 第３の人物。‥‥それはっ！,The third person that knew the contents of the note was...!,gs3_050.txt
‥‥ちょっと待つんだ、 コネコちゃん。,"...Hang on there, Kitten.",gs3_050.txt
な、なんですか！,"What is it, Mr. Armando?",gs3_050.txt
コーヒー牛乳、おごってやるぜ。 ‥‥とびっきり、甘いヤツだ。,Here. I made some special café con leche for you... I put in plenty of sugar.,gs3_050.txt
さめないうちに、飲んじゃいな。,Drink it up before it gets cold. Don't be shy.,gs3_050.txt
あの‥‥。 どういうことですか？,Umm... Why are you doing this?,gs3_050.txt
あったかいのを飲んで、 もう一度、考えなおすんだ。,Your brain needs stimulation. Drink some of this and then think it over again.,gs3_050.txt
そんなの、提出したら‥‥ おジイちゃんに怒られちゃうぜ。,Listen. Keep messing up like that and you're going to get the judge mad.,gs3_050.txt
コラァ！　弁護人！,Ms. Fey!,gs3_050.txt
おいしそうにコーヒー牛乳を 飲まないようにッ！,Don't just stand there casually drinking coffee!,gs3_050.txt
（ううう‥‥。 ケッキョク怒られた‥‥）,(Oops... I think it's too late...),gs3_050.txt
さ、裁判長！　本当に‥‥ もうひとり、いたんです！,B-But Your Honor...! Th-There is one more person!,gs3_050.txt
尾並田さんと被害者の他に、 メモの内容を知っていた人物が！,There is a person besides Mr. Fawles and the victim that knew what the note said.,gs3_050.txt
‥‥それは、この人物です。 美柳　ちなみさん。,And that person is... Dahlia Hawthorne!,gs3_050.txt
“美柳　ちなみ”‥‥？ 聞いたことありませんが。,Dahlia Hawthorne...? I've never heard that name before.,gs3_050.txt
被害者のメモを見てください。 ‥‥こう書かれています。,Look at the victim's note. This is what it says...,gs3_050.txt
《ちなみに相談。今度こそ伝える》 ‥‥彼女の名前です。,"""Talk to Dahlia. Tell her this time..."" There is her name, right there.",gs3_050.txt
い、いったい‥‥どなたですか！ 美柳　ちなみさん、というのは‥‥,Wh-What's this... So who is this person!? This... Dahlia Hawthorne...,gs3_050.txt
フッ‥‥,*sigh*...,gs3_050.txt
こともあろうに、 死者を引き出してくるとは、な。,Ms. Fey must be desperate if she's trying to bring the dead back to life.,gs3_050.txt
ししゃ‥‥？,The d-dead...?,gs3_050.txt
美柳　ちなみは‥‥ 被害者・美柳　勇希の妹にあたる。,Dahlia Hawthorne was the victim's deceased younger sister.,gs3_050.txt
今から５年前‥‥ある犯罪に 巻きこまれて、亡くなった。,She was killed in a crime 5 years ago.,gs3_050.txt
“ある犯罪”‥‥？　ま、まさか！,Killed in a crime...? Y-You don't mean...!?,gs3_050.txt
誘拐されて‥‥殺害された。 被告人・尾並田　美散によって！,Yes. She was kidnapped... And killed. By Terry Fawles!,gs3_050.txt
“殺害された”‥‥ 本当にそうなのでしょうか？,"You said she was ""killed""... But was she really?",gs3_050.txt
‥‥なんだと‥‥？,What are you implying...?,gs3_050.txt
たしかに《美柳　ちなみ》は、 死んだことになっています。,"Of course, people thought she had died 5 years ago...",gs3_050.txt
