Japanese,English,Note
ワザと曲げて、凶器であるように 見せかけたんだ。,He must have damaged the sword himself to back up his phony story.,gs3_014.txt
ううん‥‥さすが頭脳派だなあ、 アイガ探偵め‥‥。,"Yeah... I guess he really does have a brawny mind, huh?",gs3_014.txt
このデータによると、 怪人があらわれた時間は‥‥,"According to this data, the thief showed up at the basement warehouse at...",gs3_014.txt
夜中の１時‥‥なんだよね。,"Um, 1 o'clock in the morning, right?",gs3_014.txt
でも、そのデータは哀牙探偵が 用意したものだからなあ。,"Yeah, but remember, this data came from Atmey...",gs3_014.txt
好きに細工できたはずだよ。,"For all we know, he might have somehow tampered with it.",gs3_014.txt
でも、でも。こっちの写真にも 記録されてるよ、時間。,"But... But then, what about this photo? It's got the time on it, too!",gs3_014.txt
（‥‥この防犯カメラは、 高菱屋側が用意したものだ）,"(Yeah, and the security camera belonged to Lordly Tailor.)",gs3_014.txt
（哀牙探偵に、この時間表示を 細工することは、できない‥‥）,(Atmey couldn't have tampered with the photo's timestamp to show the wrong time...),gs3_014.txt
じゃあ、やっぱり ホンモノなんだよ、この記録は。,I guess that means this data is accurate after all.,gs3_014.txt
この写真に写っている 仮面マスク‥‥,So the Mask☆DeMasque in this photo...,gs3_014.txt
‥‥やっぱり、 あのアイガ探偵なのかな。,"...is Detective Atmey in disguise, huh?",gs3_014.txt
そうなるね。,It looks that way.,gs3_014.txt
（哀牙探偵は、倉庫に防犯カメラが あるのを知っていた‥‥）,(Atmey knew there was a security camera set up in the basement...),gs3_014.txt
（この写真を撮られるのも、 計画のうちだったのかな‥‥？）,(So I'm guessing this photo was probably a part of his elaborate plan...),gs3_014.txt
優作さん‥‥キョーハク されていたんだね‥‥。,"So Mr. DeLite was being blackmailed, huh?",gs3_014.txt
自分が、ムカシはたらいていた 会社の社長さんに。,By the CEO of the security company he used to work for.,gs3_014.txt
そうらしいね。 （調べてみる必要があるな‥‥）,"Yeah, it looks like it. (Sounds like we still need to do some more poking around...)",gs3_014.txt
なるほどくんも、ダメだよ。 ワルいコトしちゃ。,"You'd better watch yourself and not do anything naughty either, Nick.",gs3_014.txt
（真宵ちゃんに キョーハクされるからな‥‥）,(Was that a threat? Is she trying to blackmail ME now...?),gs3_014.txt
事件当夜、殺人のあったビルで このサイフが発見された‥‥,This was found in the building where the crime took place on the very night of the murder.,gs3_014.txt
ついでに、中に入っていた キーカードの使用時刻は‥‥,And according to the time record on the key card inside...,gs3_014.txt
ズバリ、殺人の起こった時間。 イヤな感じだねえ‥‥。,"Yeah, it was used right around the time of the murder... Doesn't sound very good, huh?",gs3_014.txt
それ、現場に落ちていたんだよね。,This was found on the floor of the basement warehouse.,gs3_014.txt
やっぱり‥‥哀牙探偵が 自分で置いたのかな。,So does that mean... Detective Atmey put it there himself?,gs3_014.txt
そうじゃないかな。,That's the only explanation I can think of.,gs3_014.txt
いかにも、現場で格闘があった ように見せかけるために、ね。,I guess he wanted to make sure it looked like he'd struggled with the thief that night.,gs3_014.txt
どう思う？　これ‥‥,What do you think about this?,gs3_014.txt
うーん‥‥事件に カンケイありそうだけど‥‥,Hmmm... It seems like it has something to do with this case...,gs3_014.txt
ちょっと、あたしには わからないな。,But I'm not really sure...,gs3_014.txt
同日　某時刻 留置所　面会室,October 13 Detention Center Visitor's Room,gs3_014.txt
だから、ぼくじゃありませーーーん,I already told you! It's not meeeeeeeee,gs3_014.txt
この、か細く耳をつきさす もの悲しげなヒメイは‥‥,"A sad, pitiful whine that tapers into silence...",gs3_014.txt
‥‥どうやら、優作くんは 取り調べ中らしいね。,Sounds like they're interrogating Mr. DeLite right now.,gs3_014.txt
ううう‥‥時間がないのに。,"Man, and we don't have enough time as it is.",gs3_014.txt
しかたないよ。警察も あわててるんじゃないかな。,"Yeah, well, I guess the police are going crazy just like we are.",gs3_014.txt
きのうまで怪人だと思っていたら、 今日は殺人事件の容疑者だからね。,"Yesterday they thought he was just a thief, but now they got a murder case on their hands.",gs3_014.txt
たしかに‥‥あそこの看守さんも、 ちょっとそわそわしてるね。,"I guess you're right... That guard over there looks a bit on edge, too.",gs3_014.txt
‥‥とにかく、あとでもう一度 来てみようか。,Come on. We'll just have to come back later.,gs3_014.txt
よし！　他をあたるよ、 なるほどくん！,"OK! Let's go check out some other place, Nick!",gs3_014.txt
面会のようすを監視する看守だ。,This guard monitors the visitor's room.,gs3_014.txt
どうやら今は、 することがないのだろう。,It looks like he doesn't have much to do right now.,gs3_014.txt
向かい側のカメラに向かって おもしろいカオをしている。,I can tell because he's looking at the camera and making funny faces.,gs3_014.txt
ごていねいに、カメラで 見張っているようだ。,"Smile, you're on candid camera.",gs3_014.txt
どうやら今は、 監視するものがないのだろう。,The camera doesn't seem to have a lot to tape right now.,gs3_014.txt
向かい側の看守を やさしく見守っている。,The only thing it's watching now is that guard over there.,gs3_014.txt
同日　某時刻 留置所　面会室,October 13 Detention Center Visitor's Room,gs3_014.txt
あ！　な、成歩堂さんッ！,Ah! M-Mr. Wright!,gs3_014.txt
優作さん‥‥。 取り調べ、終わったんですか？,Mr. DeLite... Did they finish their interrogation?,gs3_014.txt
はい！　ボクを‥‥ボクを、 見捨てないでくださーーーい！,"Yes, but...! P-Please don't leave me alone anymoooooore!",gs3_014.txt
‥‥優作くん。ぼくたちに、 ウソをついていましたね？,"...Mr. DeLite, you lied to us before, didn't you?",gs3_014.txt
あ。‥‥そ、それは‥‥,"W-Well... Err, you see...",gs3_014.txt
あの晩、高菱屋百貨店で 倉院のツボの盗難事件が発生した。,On the same night the Sacred Urn was stolen from Lordly Tailor Department Store...,gs3_014.txt
同時に、きみは脅迫状で、 ＫＢ警備に呼び出されていた。,...a blackmail letter you got summoned you to KB Security to hand over some money.,gs3_014.txt
そして、そこでは‥‥ 毒島社長が殺害されていた。,"And then, that's where the CEO, Kane Bullard, was murdered.",gs3_014.txt
でも‥‥天杉　優作は、 ひとりしかいない。,"But... there's only one Ron DeLite, am I right?",gs3_014.txt
‥‥あの晩、きみは 何をしていたのか‥‥？,So the only question is... Where were you that night?,gs3_014.txt
今度こそ、本当のコトを 聞かせてもらおうかな。,This time I want to hear the whole truth... Your life depends on it.,gs3_014.txt
は、はい‥‥。,O-OK...,gs3_014.txt
優作くん‥‥。最後に１つだけ、 カクニンしておくよ。,"Ron, before we go, there's one more thing I want to ask you.",gs3_014.txt
な、なんですか。 そんな、アタマをトガらせて‥‥,Y-Yes...? B-But please don't hurt me...,gs3_014.txt
ブスジマ社長を殺害したのは ‥‥本当に、きみじゃないんだね？,Mr. Kane Bullard... Do you swear that it wasn't you who killed him?,gs3_014.txt
ち‥‥ちがいます！　もう‥‥ ウソはつきません！,"Y-Yes, of course! I could never...! I-I'm not lying!",gs3_014.txt
ボク、死体を金庫に かくしただけなんです。,All I did was hide his body in the safe!,gs3_014.txt
それがバレるのがコワくて‥‥ きのう、自首したんです。,But then I was afraid they'd discover what I did. So I turned myself in yesterday!,gs3_014.txt
どうして、そんなコトを？,"Um, why?",gs3_014.txt
怪人として有罪になれば‥‥、 アリバイができますからね‥‥。,"Well, if the judge had ruled that I was guilty of robbery, then I'd have an alibi, right?",gs3_014.txt
ううん‥‥。 アタマいいんだ、優作さん。,"Hmm... I guess so. You're really clever, Mr. DeLite.",gs3_014.txt
（どうやら‥‥優作くんを 信用するしかないみたいだな）,(I guess I have no choice but to take Mr. DeLite at his word.),gs3_014.txt
‥‥真宵さまっ！,Mystic Maya!,gs3_014.txt
あ‥‥はみちゃん！,Hey...! Pearly!,gs3_014.txt
ただいま戻りました！,I'm back!,gs3_014.txt
春美ちゃん、今まで 何してたんだっけ‥‥？,Hey Pearls. So what have you been up to this whole time...?,gs3_014.txt
このツボです！　倉院の里で、 調べてもらっていたのですよ！,"The Sacred Urn, Mr. Nick! I took it back to Kurain Village to have it examined!",gs3_014.txt
で？　で？　どうだった？,And? And? What did you find out?,gs3_014.txt
はい！　ご心配なく。 まちがいなくホンモノだそうです！,Well there's no need to worry! They said it's the real urn!,gs3_014.txt
うわあ、よかったねえ！ いやホントに。,Whew! That's a relief! I was really worried!,gs3_014.txt
ただ‥‥ひとつだけ、問題が。,But there's one small problem.,gs3_014.txt
モンダイ‥‥？,Problem?,gs3_014.txt
この、おちゃめな ピンクの模様なのですが‥‥,"Um, these cute little pink splotches...",gs3_014.txt
どうやら、ペンキのようで‥‥ しかも、最近ついたものなのです！,They said that it's paint... And that they were put on the urn recently!,gs3_014.txt
（ツボに現れたピンクの模様、か。 ‥‥ま、どうでもいいけど）,Why are we talking about the pink splotches again? What's the big deal?,gs3_014.txt
どうでもよくないッ！ ちゃんと調べるんだよ！,What's the big deal!? We've gotta find out how they got there! That's the big deal!,gs3_014.txt
ちゃんと調べるのですよ、 なるほどくん！,"Yes, Mr. Nick! We've gotta find out how they got there!",gs3_014.txt
わ、わかったよ。 ツボのコトも、調べてみよう。,"O-OK, OK! We'll go find out how they got there!",gs3_014.txt
あの‥‥ボクのコトも、 忘れないでくださいね‥‥。,P-Please don't forget about me...,gs3_014.txt
《倉院のツボ》のデータを 法廷記録にファイルした。,Sacred Urn refiled into the Court Record.,gs3_014.txt
面会のようすを監視する看守だ。,This guard monitors the visitor's room.,gs3_014.txt
怪人から殺人犯にヘンシンした 被告人を前にして、,He looks pretty nervous...,gs3_014.txt
かなりキンチョーぎみに見える。,...standing near someone who went from thief to murderer overnight.,gs3_014.txt
ごていねいに、カメラで 見張っているようだ。,"Smile, you're on candid camera.",gs3_014.txt
優作くん。きみはまだ、 仮面マスクは自分だ、と‥‥？,"Mr. DeLite, do you still insist that you are Mask☆DeMasque...?",gs3_014.txt
だから、きのうから そう言ってるじゃないですか。,Isn't that what I've been saying since yesterday?,gs3_014.txt
‥‥アッサリ言われたね。,That was a quick response...,gs3_014.txt
ちょっとだけ、ハラが立つな。,"Tell me about it. To be honest, it's starting to get irritating.",gs3_014.txt
でも、でも、優作さん！,"B-But listen, Mr. DeLite!",gs3_014.txt
今日の裁判で、カイジンの 正体は暴かれたじゃないですか！,"At the trial today, we learned the true identity of the thief, didn't we!?",gs3_014.txt
あーっはっはっはっはっはっは！ はっはっはっはっはっはっ！,Hee hee hee ha ha ha Aha ha ha ha ha ha ha! Ho ho ho hee hee hee!,gs3_014.txt
‥‥さあさあみなさん、 ごらんくださあい‥‥！,"Take a good look, everyone!",gs3_014.txt
天才にふさわしき好敵手を求めて、 ついに自ら犯罪に手を染めた‥‥,"Unable to find a rival worthy of my genius, I was forced to create one by myself!",gs3_014.txt
あわれなピエロでござあい‥‥,Here I am! The tragic clown...,gs3_014.txt
たしかに‥‥あのツボを盗んだ のは、ボクじゃないですけど。,I guess it's true... I wasn't the one who stole that urn...,gs3_014.txt
そりゃ、そうですよね。 ＫＢ警備にいたんですから。,"Of course not. After all, you were at KB Security at the time.",gs3_014.txt
じゃあ‥‥この写真の怪人の 正体は、やっぱり‥‥,So then the person dressed up as Mask☆DeMasque in this photo...,gs3_014.txt
アイガ探偵‥‥ ってコトになるよね‥‥。,...It's gotta be Detective Atmey.,gs3_014.txt
あの晩‥‥きみは、高菱屋ではなく ＫＢ警備に行ったんだね？,"So that night, you didn't go to Lordly Tailor, you went to KB Security, right?",gs3_014.txt
はい。‥‥ボク、ヤクソクの時間 どおり、ＫＢ警備に行ったんです。,Yes... I went to KB Security at the time the blackmail note said I should.,gs3_014.txt
うんうん。‥‥それで？,Alright... What happened next?,gs3_014.txt
ムカシ社員だったから、 社長室の場所は知っていました。,"Well, I used to work there, so I knew where the CEO's office was.",gs3_014.txt
ノックしたんですけど‥‥ 返事がなくて。,I knocked... but there was no answer.,gs3_014.txt
だから、キーカードを 使って、ロックをはずしました。,So then I used the key card to unlock the door.,gs3_014.txt
（サイフを落としたのは たぶん、そのときだな‥‥）,(That's probably when he dropped his wallet...),gs3_014.txt
社長室に入ったら‥‥、 だれかが立っていたんです。,When I went into the CEO's office... someone was in there.,gs3_014.txt
“だれか”‥‥,"""Someone""...?",gs3_014.txt
そいつに‥‥いきなり、 アタマをガツン！　って。,Then suddenly they bashed me over the head! Bam!,gs3_014.txt
ブスジマ社長さんが 殴ったのかな‥‥？,Was it Kane Bullard that hit you...?,gs3_014.txt
わかりません。,I don't know.,gs3_014.txt
ボクがクラクラしている間に、 そいつ、逃げちゃったみたいで。,The person ran away while I was still stunned.,gs3_014.txt
気がついたら‥‥もう、 ビックリしました。,"When I came to my senses, the sight I saw left me speechless.",gs3_014.txt
目の前に、社長の死体が！ ボクも死ぬかと思いましたよ！,The dead body of the CEO was right there in front of me! I thought I'd die myself!,gs3_014.txt
‥‥とにかく、死体をなんとか しようと思いました。,"Anyway, I thought I should do something with the body...",gs3_014.txt
それで、あの金庫に‥‥？,So that's why you put it in the safe...?,gs3_014.txt
‥‥ええ。そうなんです。,"...Yes, that's right.",gs3_014.txt
ボク、警備チームのチーフだった から、開け方を知ってたんですよ。,"I used to be the chief of one of the security teams, so I knew how to open it.",gs3_014.txt
それで‥‥そのあとは？ どうしたんですか？,OK... And what did you do after that?,gs3_014.txt
そりゃもう、とりあえず 逃げましたよ！,"Well, I got out of there, for starters!",gs3_014.txt
あのビルの防犯カメラも、 ボクが設置しましたからね！,I was the one who set up the security cameras in that building...,gs3_014.txt
自分の姿が映らないように、 うまーいコト切り抜けました！,...so I knew how to avoid being spotted by them!,gs3_014.txt
‥‥なるほどくん。,Nick...,gs3_014.txt
どう考えてもハンニンぽいよ。 ‥‥優作さん。,"All of a sudden, Mr. DeLite kinda sounds like the murderer to me...",gs3_014.txt
（それを言っちゃあ‥‥）,(Please don't say that...),gs3_014.txt
キョーハクジョーって‥‥ コレが初めてじゃないんですか？,This blackmail letter... Is this the first one you got?,gs3_014.txt
モチロン、ちがいますよ！,"No, of course not!",gs3_014.txt
‥‥今回みたいに、どこかに 呼び出されたのは初めてですけど。,But this is the first one that ever called me out to a specific location.,gs3_014.txt
最初の脅迫状は‥‥ この事件の、すぐあとに‥‥？,"So, did you start receiving blackmail letters after this incident...?",gs3_014.txt
ええ。《エマノンの涙》事件から 数日たったころでしたね。,"Yes. Just a few days after the ""Tear of Emanon"" heist...",gs3_014.txt
ウチに脅迫状が届いたんです。 《おまえがやったんだろう》って。,"That first letter... It said, ""I know you did it"".",gs3_014.txt
いきなりバレちゃったんですか。,So someone found out about your true identity? Just like that?,gs3_014.txt
いやー、これでなかなか ムズカシイですよね、怪人も。,"Ah, it's not easy being a master thief, you know!",gs3_014.txt
《決定的な証拠もあるから、 カクゴしろ》なんて言われて。,"""I've got proof that it was you, so give up!"" it went on to say.",gs3_014.txt
それで、せっかくのエモノの 宝石も取りあげられちゃって‥‥,"So in the end, I had to give up the treasure I went through all that trouble to steal...",gs3_014.txt
そうなんですか‥‥‥‥,Is that right...,gs3_014.txt
ちょ、ちょっと！ “取りあげられた”というのは？,"Hey! Hang on a second! What do you mean you had to ""give it up""?",gs3_014.txt
あ、シンパイいりませんよ。 指定の貸金庫に宝石を預けたら、,"Oh, don't worry. After I put the jewel in the safe-deposit box the letter specified...",gs3_014.txt
あとで１００万円も 送ってきてくれましたからね。,"...someone sent me $10,000!",gs3_014.txt
（だれもシンパイなんか してないって‥‥）,"(No one said anything about me being worried, you know...)",gs3_014.txt
それからです。ボクのところに、 計画書が届くようになったのは。,"After that, I started getting the plans in the mail.",gs3_014.txt
け、けいかくしょ‥‥？,P-Plans...?,gs3_014.txt
あの。“計画書”というのは‥‥？,"What are these ""plans"" you're talking about?",gs3_014.txt
宝冠とか、絵とか、美術品‥‥ 狙うエモノと、盗み出す方法。,They were instructions on how to steal a crown or painting or some other rare treasure.,gs3_014.txt
警備の盲点や逃げ道、トレーニング 方法までキッチリ書かれていて。,"They showed security blind spots, escape routes and even suggested training methods.",gs3_014.txt
じゃ、じゃあ、まさか。 犯行の計画を立てたのは‥‥,So you mean that the one who planned the heists wasn't you...?,gs3_014.txt
ええ。２回目からは、 ボクじゃないですよ。,"No, it wasn't. I only planned the very first one.",gs3_014.txt
だれか親切なヒトが、イカした 大作戦を考えてくれるんですよ！,"After that, I received plans from some very kind person! Incredibly detailed plans!",gs3_014.txt
優作さん、キョーハク者に カンシャしてるよ‥‥,It sounds like Mr. DeLite is thankful to the person that was blackmailing him.,gs3_014.txt
（やはり‥‥怪人☆仮面マスクは、 この優作くんだったのか‥‥？）,(So Ron DeLite was Mask☆DeMasque after all...?),gs3_014.txt
（‥‥しかし‥‥）,(But...),gs3_014.txt
（他にいるんだ。犯罪の計画を 立てた人物が、もうひとり！）,(Someone else is behind the thefts. Someone who planned it all out in detail!),gs3_014.txt
計画どおりに盗み出したエモノは、 指定の貸金庫に預けるんです。,All I had to do was deposit the treasures I stole into the safe-deposit box.,gs3_014.txt
そうすると、おカネが 送られてくるんですよねー。,Then I just waited for the cash to come in the mail.,gs3_014.txt
（‥‥そんな、うれしそうな カオで言われても‥‥）,(Could you try not to look so gleeful about it...?),gs3_014.txt
じゃあ、《倉院のツボ》を 狙ったのも‥‥？,"So you went after the Sacred Urn because of one of those plans, too?",gs3_014.txt
そんなツボ‥‥じつは、 見たこともないんですよ。,"Well, see... truth is, I've never seen the urn.",gs3_014.txt
ボクは、計画書に書いてあるモノを 計画どおりに盗むだけですから。,All I did was follow the instructions and steal what I was told to steal.,gs3_014.txt
優作くん‥‥。今の証言、 まちがいないね？,Mr. DeLite... Is everything you've just told me the truth?,gs3_014.txt
ええ。‥‥でも、 まれかちゃんにはナイショですよ？,Yes... B-But please don't tell Dessie. OK?,gs3_014.txt
《天杉優作の証言書》を 法廷記録に挟んだ。,Ron's Testimony added to the Court Record.,gs3_014.txt
優作さん。ＫＢ警備、 やめさせられたんですよね？,"Mr. DeLite, is it true that one year ago...",gs3_014.txt
今から、１年ぐらい前に‥‥,...you were forced to quit KB Security?,gs3_014.txt
あ！　そ、それ！ ‥‥まれかちゃんには。,Ah! H-How did you...!?,gs3_014.txt
まれかちゃんには、 言わないでくださーーーい！,I-I'm begging you! Please don't tell Dessie! Pleeeease!,gs3_014.txt
い、いえ。 まだ言ってませんけど‥‥,D-Don't worry. We haven't told anyone yet...,gs3_014.txt
たた、助かった‥‥‥‥いや。,"Whew! Thank goodness... Err, no... I umm...",gs3_014.txt
でも、どうせアレかな。 かくしたって、いつかはバレるしな,But I suppose I'll have to tell her sometime... She'll find out eventually,gs3_014.txt
どうして話さないんですか？ まれかさんに。,Why have you been hiding it from her anyway?,gs3_014.txt
まれかちゃん、曲がったコトが 大キライなんですよ。,Dessie would despise me if she ever found out I was living a life of crime.,gs3_014.txt
犯罪者‥‥特に怪人なんて、 ユルしてくれるワケがないから‥‥,"A criminal, a thief... She'd never forgive me! My marriage would be over!",gs3_014.txt
じゃ、じゃあ‥‥なんで ワザワザ怪人なんかに？,"Knowing that, why did you become a thief in the first place?",gs3_014.txt
まれかちゃん、それはキモチよく おカネを使うんですよ。,Because Dessie spends money like it's water.,gs3_014.txt
それだけのおカネが もらえるシゴト‥‥,There's no job in the world that could bring in enough money...,gs3_014.txt
ボク、怪人しか 思いつかなかったんです。,"Except being a thief. At least, that's what I thought anyway.",gs3_014.txt
（まれかさんのためだったんだ ‥‥怪人☆仮面マスク‥‥）,"(So he became Mask☆DeMasque for Desirée, huh...?)",gs3_014.txt
いやー、スゴいですよね。 弁護士さん、なんて。,A great lawyer and so young! You really are an inspiration!,gs3_014.txt
さぞかし、かせいで らっしゃるんでしょうねえ。,"I bet you make lots and lots of money, don't you?",gs3_014.txt
怪人に言われると、ちょっと イヤミに聞こえるね。,"That doesn't sound right coming from a thief, if you know what I mean...",gs3_014.txt
スミマセン‥‥ ボク、なんてヒドいオトコなんだろ,I'm sorry... I suppose you could say I'm nothing but a terrible lowlife,gs3_014.txt
ど、どうかしましたか？,Wh-Why do you say that?,gs3_014.txt
‥‥あの、初めてなんです。 盗難事件の被害者とお会いするの。,...This is the first time I've ever had to actually face a victim of one of my crimes.,gs3_014.txt
（倉院のツボのコトか‥‥）,(I guess he's talking about the Sacred Urn...),gs3_014.txt
あ。でも、ツボを盗んだのは 優作さんじゃないんですよね？,"Yeah, but I thought that you weren't the one who stole my urn...",gs3_014.txt
た、たしかに、 ツボはそうなんですけど‥‥,"Th-That's true about the urn, I guess...",gs3_014.txt
やっぱり、怪人なんかやめて、 ロックンローラーになればよかった,Maybe I should give up this life of crime and try becoming a professional cowbell player,gs3_014.txt
このヒト、怪人☆仮面マスク担当の 刑事さんですね。,This is the detective that was in charge of the Mask☆DeMasque investigations.,gs3_014.txt
きのう自首したら、ナミダを流して よろこんでくれました。,He was so happy when I surrendered yesterday that he actually shed tears of joy.,gs3_014.txt
へええ。あの、イトノコさんが？,What? Gumshoe cried!? Really!? Was it a single manly tear or did he let loose and sob?,gs3_014.txt
ボクもついつい、 もらい泣きしちゃって。,"Sobbed. I started weeping myself, too. It was truly infectious!",gs3_014.txt
