Japanese,English,Note
‥‥それで、 名乗り出なかったのですか。,And that's why you hid your identity?,gs3_050.txt
ええ‥‥。 お姉さまにだけ、連絡をとって。,Yes... I only told my sister.,gs3_050.txt
被害者の勇希さん、ですな。,"Valerie Hawthorne, eh.",gs3_050.txt
わたしのことを知っていたのは、 お姉さまだけでした。,"Yes, she's the only one who knew about me.",gs3_050.txt
法律的には‥‥すでに５年前。 この証人は死んでいるのだ。,"Meanwhile, legally, this witness has been deceased for 5 years.",gs3_050.txt
わたし‥‥もう、あんな目に あいたくなくて‥‥,I... I didn't ever want something like that to happen to me again.,gs3_050.txt
それが、《無久井　里子》 というわけですね？,"And that new identity was ""Melissa Foster"", right?",gs3_050.txt
必要な書類は、お姉さまに 用意していただきました。,"Yes, my sister helped me get the official paperwork taken care of.",gs3_050.txt
（たしかに‥‥）,(That makes sense...),gs3_050.txt
（公務員の協力がなければ、 ムリな話ね‥‥）,"(Without an insider's help, doing all of the paperwork would've been impossible.)",gs3_050.txt
わたしには、お姉さましか たよれるヒトがいなかったんです。,She was the only person left in the world I could count on.,gs3_050.txt
そんなお姉さまを こ、殺すなんて‥‥ムリですわ！,And you... You think I k-k-killed her... There's no way I could!,gs3_050.txt
ぬふううううう‥‥！,Hmmmmm...!,gs3_050.txt
そこまで！,That's enough!,gs3_050.txt
本法廷は、これ以上の審議の 必要性を認めません。,This court sees no reason to further prolong the trial.,gs3_050.txt
さらに、被告に対する判決を 決める時間も、必要としません。,Nor is there any need for more time to decide the case against the defendant.,gs3_050.txt
これは、きわめて明白な事件です。 疑問の余地はない！,This case is extremely clear. I see no room for mis- interpretation of the facts.,gs3_050.txt
被告人、尾並田　美散に たった今、判決を言いわたします！,"This court finds the defendant, Terry Fawles...",gs3_050.txt
では、本日はこれにて閉廷！,That is all. This court is adjourned!,gs3_050.txt
