Japanese,English,Note
"コイツの番号なんですけど‥‥ 《５８４２１８９》です。 ""5842189.""",The number on this is...,gs1_048.txt
罪門さん！　さっきの記録‥‥ ＩＤの使用記録を見せてください！,Officer Marshall! Show us the ID number on that ID card record!,gs1_048.txt
この、４番目のナンバー‥‥ カンゼンに一致します！,"Look, the fourth number! It's a perfect match!",gs1_048.txt
使用された時刻は、５時１４分。 事件が起こった時間‥‥だ！,It was used at... 5:14. Right before the stabbing!,gs1_048.txt
しかし！　ＩＤカードは、この世に １枚しか存在しないはずだぜ！,"What's more, there's only one of them cards in the world!",gs1_048.txt
やっぱり‥‥事件があった時間、 多田敷さんは証拠保管室に‥‥,"So, when the incident occurred, Detective Goodman was in the evidence room!",gs1_048.txt
（でも、待てよ‥‥ 原灰巡査は、こう言っていた！）,"(But wait, what did Officer Meekins say?)",gs1_048.txt
保管室に入った本官は、ＩＤカード の提示を求めたであります！,"Sir, I entered the evidence room, and asked the man to display his ID card!",gs1_048.txt
それで‥‥ＩＤの提示を求められた 多田敷捜査官は？　どうしました？,So you asked Detective Goodman to show his ID card. What did he do?,gs1_048.txt
なんとッ！　いきなり、本官に ナイフを向けたであります！,That's the thing! Suddenly he pointed a knife at me!,gs1_048.txt
（そのとき、彼がＩＤカードを 持っていたのならば‥‥）,(If he had his ID card then...),gs1_048.txt
（原灰巡査に切りかかる必要 なんか、なかったハズだ‥‥）,(Why would he have pointed a knife at Officer Meekins?),gs1_048.txt
‥‥オーライ、カウボーイ。 アンタの勝ちさ。,"Alright, compadre, you win.",gs1_048.txt
この記録‥‥アンタに わたしたほうがよさそうだ。,I guess I can give you this ID card record.,gs1_048.txt
証拠品《ＩＤカード使用記録》の データを法廷記録にファイルした。,ID Card Record added to the Court Record.,gs1_048.txt
（このリスト‥‥）,(I've got an idea...),gs1_048.txt
（ＩＤを持っていそうな人物に 見せてみたほうがいいな）,(Maybe I should show this list to other people with IDs here...),gs1_048.txt
２月２３日　某時刻 証拠保管室／第３号庫,February 23 Evidence Room Sector Three,gs1_048.txt
（静かだな‥‥ 捜査は終わってるみたいだ）,(It's quiet... the investigation must be over here.),gs1_048.txt
証拠保管室‥‥かあ。 ホント、お墓みたいですね。,So this is the evidence room? It really is kind of like a graveyard.,gs1_048.txt
“お墓”というより‥‥ “死体置き場”だよ。このムード。,Graveyards are supposed to have grass and trees. This feels more like a morgue.,gs1_048.txt
ここ、こ。怖がらせようとしても む。ムダですからね。,"N-nice try, M-Mr. Wright. Y-you can't scare me!",gs1_048.txt
きゃああああああああああああッ！,Eeeeeeek!,gs1_048.txt
ほほほおおおおおおおおおおいッ！,Whoooooah!,gs1_048.txt
ご、ごめんなさい。 悪霊かと思ったんです。,"S-sorry, I thought you were a ghost!",gs1_048.txt
‥‥悪霊に、いきなり ビンタはどうかと思うッス。,"I wouldn't recommend going around smacking ghosts on the head, pal.",gs1_048.txt
とにかく‥‥ホントッスね？ さっきのハナシは！,"So, is it true what I heard?",gs1_048.txt
‥‥ボクさ。そんなね。 ケチなオトコじゃないワケ。,"Wrighto, please, do I look like a selfish man?",gs1_048.txt
ダレにたのまれても、 ５０００円までなら貸すし。,"Heck, if anyone asked me ""sir, can I borrow $50?"" I'd give them $50, no problem.",gs1_048.txt
‥‥ぜんぜんモンダイないよ。 好きに調べてくれていいから。,"So, go ahead! Investigate that room to your heart's desire! Knock yourself out!",gs1_048.txt
え、ええ‥‥ホントですよ。,"Yeah, it's true.",gs1_048.txt
巌徒局長殿が‥‥,"So, Chief of Police Gant...",gs1_048.txt
５０００円も貸してくれるッ！ この自分がたのんでもッ！,will loan anyone 50 bucks? Even me!?,gs1_048.txt
‥‥そっちですか。,"Oh, so that's what you were talking about...",gs1_048.txt
今日は自分、捜査班長を 任命されていたッス。,"Actually, I was put in charge of the investigation for today.",gs1_048.txt
１日だけですか。,Just for today?,gs1_048.txt
“１日班長さん”ですね。,Boss for a day...,gs1_048.txt
しかし、これからはッ！ アンタが１日班長ッス！,But guess what!? You got permission from the Chief... So now you're boss for a day!,gs1_048.txt
（うれしくないヒビキだな）,"(Gee, thanks.)",gs1_048.txt
とりあえず、これ。 持っておくといいッス。,"First of all, you'll want to have this.",gs1_048.txt
証拠品《証拠保管室の上面図》の データを法廷記録にファイルした。,Evidence Room Floor Plans added to the Court Record.,gs1_048.txt
‥‥おッ！ もう、こんな時間ッスか。,"Hey, pal, look at the time!!",gs1_048.txt
あれ。何か用事でもあるんですか？,Was there something you needed to be going to?,gs1_048.txt
そろそろ、御剣検事の査問会が 終わるッス。,It's just that Mr. Edgeworth's inquiry committee should be letting out soon.,gs1_048.txt
自分、今日の捜査の報告書を わたしてくるッス！,I'm going to go give them my report for the day.,gs1_048.txt
何かの助けになるかも‥‥,"It might help, you know...",gs1_048.txt
ほ、報告書、って‥‥ その、チラシですか？,R-report? You mean the note written on the back of that flyer?,gs1_048.txt
しかも、ウラに《異常なしッス》 しか、書いてありませんけど。,"The one that says nothing but ""No problems""!?",gs1_048.txt
御剣検事なら！　こんな報告書すら 役に立ててくれるハズッス！,"Hey, it's Mr. Edgeworth we're talking about! I'm sure he can use a report like this.",gs1_048.txt
自分、信じてるッス！,I believe in him!,gs1_048.txt
（アツ苦しい信頼を寄せられる 立場も、キノドクなもんだな）,(Who needs enemies when you've got friends like Detective Gumshoe...),gs1_048.txt
‥‥じゃっ！ ひとっ走り、行ってくるッス！,"I'm off, pal! Later!",gs1_048.txt
（御剣‥‥ぼくも、話を聞いて おいたほうがいいかな）,"(I should probably see what Edgeworth has to say, too.)",gs1_048.txt
さっき入ってきたドア、ですね。,That's the door we just came in through.,gs1_048.txt
出るときは、いらないみたいだ。 ‥‥ＩＤカード。,Looks like you don't need an ID card to get out.,gs1_048.txt
罪門さんが電源を切ったら どうなっちゃうんでしょうね。,I wonder what would happen if Officer Marshall cut the power while we were inside?,gs1_048.txt
（そのへん、ちゃんと考えてる のかな、あのヒト）,(Let's hope he remembers we're in here.),gs1_048.txt
うわ。おっきなガラクタが つみ上げられてますよ！,Wow! Look at this big pile of junk in the corner!,gs1_048.txt
これは‥‥クルマのドア、だね。,That looks like... a car door.,gs1_048.txt
ドアのフレームに 手錠がついてますよ。,There's a pair of handcuffs attached to the frame.,gs1_048.txt
‥‥タイホした怪盗に 逃げられたのかな。,Maybe the guy they caught was some sort of escape artist and he got away.,gs1_048.txt
こっちはアレですね。 現場検証用のヒト型。,"Hey, that's one of those human profiles for range testing.",gs1_048.txt
‥‥ヒタイを キレイに撃ち抜かれてるな。,He's been shot square in the forehead.,gs1_048.txt
成歩堂さんも、撃ち抜かれない ように、気をつけてくださいね。,Better him than us.,gs1_048.txt
‥‥何か、ハミ出してるね。,There's something sticking out of here.,gs1_048.txt
シャツ‥‥かな。 何かの証拠品でしょうか。,Looks like a shirt. I guess it must be evidence for some case.,gs1_048.txt
イトノコ刑事ですか、コレ。,I wonder if Detective Gumshoe put this here.,gs1_048.txt
ヒトを“だらしないヤツ”みたいに 言わないでほしいッス。,"There you go, pal, making me out to be some kinda slob!",gs1_048.txt
自分の保管庫は、そこじゃ ないッスから。‥‥とは言え。,I'm not responsible for the evidence here. That said...,gs1_048.txt
おそらく、これは‥‥最近。 開けられた保管庫ッスね。,I bet that evidence locker was opened recently.,gs1_048.txt
どうしてわかるんですか？,How do you know?,gs1_048.txt
こんなふうにしたら、 証拠品がイタむッスからね。,"If you leave things hanging out like that, the evidence gets dirty or ripped.",gs1_048.txt
見回りの巡査がチェックして、 担当の捜査官が注意されるッス。,The guard checks on that kind of stuff and notifies the detective responsible.,gs1_048.txt
‥‥まったく、 うるさくてかなわないッス！,How many times have I had him breathing down my neck about some silly evidence...,gs1_048.txt
‥‥イトノコ刑事さん、いつも 注意されてるみたいですね。,"Sounds like Detective Gumshoe leaves evidence hanging out a lot, too.",gs1_048.txt
きっと、コートの下では、シャツが ズボンからハミ出てるんだろうね。,"I bet he doesn't tuck in his shirt under that trench coat, either.",gs1_048.txt
‥‥カゲグチなら、聞こえない トコでやってほしいッス。,"If you're going to talk behind someone's back, don't do it right in front of them, pal!",gs1_048.txt
白い布がハミ出てるね。 ‥‥シャツかな。,A piece of white cloth is sticking out... looks like a shirt.,gs1_048.txt
ちゃんとしまっておかないと シワになっちゃいますよ！,You'd better tidy it up or it will get wrinkled!,gs1_048.txt
ぼくをニラまないで くれるかな。,"Hey, don't look at me! I didn't leave it hanging out like that!",gs1_048.txt
この中に、パンパンに詰まってる ワケですね。ユメと、証拠品が。,This place is stuffed with evidence... stuffed with dreams.,gs1_048.txt
ユメはどうかと思うけどね。,I'm not so sure about the dreams.,gs1_048.txt
えいっ！,Mmph!,gs1_048.txt
開かない。,It won't open.,gs1_048.txt
そりゃ、そうだろうなあ。,I guess I should have known.,gs1_048.txt
まあ。最新式のセキュリティで 守られているッスからねえ。,"Hey, pal, our security is high-tech around here!",gs1_048.txt
‥‥なんか、こまごまとした キカイが、ホコリをかぶってるね。,Some sort of bulky equipment is gathering dust here.,gs1_048.txt
かわいそうなほど ボロっちいツリザオがあります。,What a sorry looking fishing pole that is.,gs1_048.txt
あ、それ！　自分のッス。,Ah! That's my personal pole!,gs1_048.txt
‥‥あいかわらず、 使ったことないッス。,I never did get around to using it...,gs1_048.txt
あれ！　これ、どこかで 見たような‥‥,"Wait, I've seen that somewhere before...",gs1_048.txt
あ、それ！　金属探知機ッスよ！,"Right, pal. That's that metal detector!",gs1_048.txt
ホレ。ひょうたん湖の事件を 解決にみちびいた‥‥,"The one that led to the solving of that case out on Gourd Lake, remember?",gs1_048.txt
ああ！　なつかしいですね。,"Oh, right! Wow, that feels like it was ages ago.",gs1_048.txt
そして、これは‥‥ 見たコトないですね。,"And... hmm, I don't think I've seen this one before.",gs1_048.txt
あ、それ！　電波探知機ッス。,"Oh, that! That's a radiolocator!",gs1_048.txt
近い将来、なんらかの事件を 解決にみちびくかもしれないッス。,I'm sure it will come in handy in solving some case sooner or later.,gs1_048.txt
（このチャチなハコが‥‥？）,(That cheap-looking box?),gs1_048.txt
人間とキカイは、見た目じゃない！ ‥‥“マゴコロ”ッス！,You can't judge a person or a machine by their cover! You gotta look at their heart!,gs1_048.txt
うらぶれたガラクタたちが、 やつれ果て、打ちひしがれてます！,"A pile of junk lies battered, worn and forsaken!",gs1_048.txt
‥‥わざわざ、そこまで 言わなくてもいいんじゃないかな。,Aren't you being a little dramatic?,gs1_048.txt
ツリザオに、金属探知機。 これは‥‥知らないな。,Looks like a fishing pole... and a metal detector. Not sure what this one is.,gs1_048.txt
やるせなくホコリをかぶって、 ウツロな目でこっちを見てます！,"They cast a withering gaze in our direction that screams, ""dust me!""",gs1_048.txt
‥‥だから、わざわざ文学的に 表現しなくていいよ。,Can't junk just be plain old junk?,gs1_048.txt
ここだけ、開いてる‥‥ インジケータがついたままです！,"Look, this one's open! And there's a indicator tag stuck on it still!",gs1_048.txt
そこが、多田敷刑事の 証拠保管庫ッス。,That locker is coded with Detective Goodman's fingerprint.,gs1_048.txt
（被害者の‥‥保管庫！）,(Detective Goodman's locker!),gs1_048.txt
いいんですか？　開けっぱなしで。,Are you sure it's okay to leave it open like that?,gs1_048.txt
一度閉めちゃうと、 開けるのがタイヘンッスから。,"Well, it'd be hard to get it open again if we closed it.",gs1_048.txt
（中身は、カラ。‥‥さすがに どこかへ移されたようだな‥‥）,(It's empty... they must have taken the contents elsewhere.),gs1_048.txt
多田敷捜査官の保管庫ですね。 中身はカラッポです。,Detective Goodman's evidence locker. It's empty.,gs1_048.txt
保管庫を開けられるのは、 多田敷さん本人だけ‥‥,Only Detective Goodman himself can open this locker.,gs1_048.txt
つまり、このナイフを持ち出した のも、多田敷さん、ってコトかあ。,"So, the person who took out this knife had to have been Detective Goodman.",gs1_048.txt
（なぜ、それがマフラーに包まれて マフラーから出てきたんだ？）,"(And why was it wrapped in the ""scarf"" muffler stuck inside the ""car"" muffler?)",gs1_048.txt
こ‥‥これは‥‥血痕！,Wh-what's this...!? Blood!,gs1_048.txt
カスれてますけど、 アキラカに、手のアトですッ！,It's a little worn... but there's definitely a handprint here!,gs1_048.txt
ふき消そうとして 残ってしまったみたいだな‥‥,It looks like someone tried to wipe it off.,gs1_048.txt
成歩堂さん！　この部屋‥‥,Mr. Wright!,gs1_048.txt
他にも、血痕が 残っているかもしれません！,What if there are other bloodstains left in the room!?,gs1_048.txt
（‥‥あのクスリを使って、 よく調べたほうがいいな）,(We should use her testing fluid to check it out.),gs1_048.txt
こんなところに、手袋が ‥‥かたっぽだけ。,Someone left a glove here... but only one.,gs1_048.txt
イトノコ刑事ですか、コレ。,"Detective Gumshoe, maybe?",gs1_048.txt
ヒトを“うっかり屋”みたいに 言わないでほしいッス。,"There you go, pal, making me out to be some kind of absent- minded detective!",gs1_048.txt
ソイツも‥‥ “例の事件”の証拠品ッスね。,"That's evidence from ""the"" case, you know.",gs1_048.txt
《ＳＬ９号事件》ですか‥‥ （たしかに、タグがついてるな）,You mean SL-9? (It does have a tag on it...),gs1_048.txt
証拠品《ゴム手袋》のデータを 法廷記録にファイルした。,Rubber Glove added to the Court Record.,gs1_048.txt
きのう、初めて見ました。 この、黄色いテープ。,"That yellow crime scene tape! You know, yesterday was my first time seeing that!",gs1_048.txt
群衆をかきわけて、これを くぐるのがユメだったんですけど。,It was always my dream to push through the crowd and just step over the tape!,gs1_048.txt
２日連続で出くわすと、ちょっと ヘコんじゃいますね！,It's a little daunting to encounter it again so soon!,gs1_048.txt
（‥‥そうは見えないけど）,(I think maybe you're overreacting a little...),gs1_048.txt
‥‥ハデに割れたみたいですね。 何か、大きなものが。,"Wow, someone must have broken something big to make all these pieces.",gs1_048.txt
イトノコ刑事ですか、コレ。,"Detective Gumshoe, perhaps?",gs1_048.txt
ヒトを“いたずらっ子”みたいに 言わないでほしいッス。,"There you go, pal, making me out to be some kind of hooligan!",gs1_048.txt
どうやら‥‥“例の事件”の 証拠品みたいッスね。,"That's apparently from ""the"" case.",gs1_048.txt
例の事件‥‥？,"""The"" case?",gs1_048.txt
《ＳＬ９号事件》ッス。 カケラの１枚に、小さなシールが。,"The SL-9 Incident, pal. See the sticker on one of the pieces there?",gs1_048.txt
（《ＳＬ９号事件》の証拠品が また出てきたか‥‥）,(Another piece of SL-9 evidence...),gs1_048.txt
（‥‥やめておこう。 時間がもったいない‥‥）,(Let's not waste too much time with this now.),gs1_048.txt
あとで、ちゃんと 調べてみましょうね。,We can check it out later.,gs1_048.txt
このカケラを組み合わせると、 こんなツボになるワケだね。,"If you put these pieces together, it makes a jar.",gs1_048.txt
‥‥気になる点が、 ２つほどありますね。,There are two things that bother me.,gs1_048.txt
１つは‥‥ なぜ、カケラが足りないのか？,One: why are some of the pieces missing?,gs1_048.txt
そして、もう１つは‥‥ ちょっと不安定すぎます！,Two: doesn't it seem a little unstable!?,gs1_048.txt
そりゃ、割れますよ！,No wonder it broke!,gs1_048.txt
‥‥今度、ツボを作ることが あったら、気をつけるよ。,I'll make sure to remember that next time I make a jar.,gs1_048.txt
なんでこんなところに、 ペンキとノコギリが‥‥,What is a saw and paint doing here?,gs1_048.txt
‥‥ムカシから。,Since the dawn of time...,gs1_048.txt
ゲージュツはいつも、 《迫害》との戦いだったッス。,True art has always been a war against oppression.,gs1_048.txt
ゲージュツ？　そういえば‥‥ このペンキ、水色と黄色ですね。,True art...? I noticed that there's blue and yellow paint here.,gs1_048.txt
もしかして‥‥ここで 生まれたんですか？　タイホくん。,Perhaps we're witnessing the birthplace of the Blue Badger?,gs1_048.txt
まあ‥‥自分にとっては、 アトリエ？　みたいなモノッスね。,Well... You might say this is my studio...,gs1_048.txt
（いいのか‥‥？）,(Here? In the evidence room!?),gs1_048.txt
青いペンキと黄色いペンキが ありますね。,There's blue and yellow paint here.,gs1_048.txt
これだけあれば、成歩堂さんの 絵、描けますよ、あたし。,"This is all I'd need to paint a portrait of you, Mr. Wright!",gs1_048.txt
いちおう、ネクタイも してるんだけどな、ぼく。,"I am wearing a red necktie, you know...",gs1_048.txt
１日班長さん、なんですよね？ 刑事さん。,"So, Detective Gumshoe, you're boss for the day?",gs1_048.txt
そッスよ！　メーヨな任務ッス！,That's right! It's an honor!,gs1_048.txt
なんせ、警察局内で発生した サツジン事件ッスからねえ‥‥,"After all, the murder took place right here, in the Police Department!",gs1_048.txt
それにしては‥‥ ヒトリぽっちじゃないですか。,"But, if you're boss... why are you all alone!?",gs1_048.txt
他のヒトたちは‥‥？,Where are your underlings?,gs1_048.txt
きのうの捜査をもとに、明日の 法廷のジュンビをしているッス。,They're using our findings from yesterday's investigation to prepare for the trial.,gs1_048.txt
（‥‥つまり。今日もハズされて るのか。捜査班から‥‥）,"(In other words, Detective Gumshoe got kicked out of the investigation again...)",gs1_048.txt
でも自分、メゲないッス！,"I'm adamant, though!",gs1_048.txt
担当捜査官の座をモギとって、 この事件を眠らせてみせるッス！,I'm going to take control and put this case to rest!,gs1_048.txt
‥‥自分の証拠保管庫にッ！,"And in my own evidence locker, pal!",gs1_048.txt
イトノコさんの保管庫も あるんですか？　ここに。,"You have a locker in here, too, Detective Gumshoe?",gs1_048.txt
ハッハッ。そりゃそッス。 自分は‥‥刑事、ッスからねえ。,"Hah hah, of course! I am a detective, after all.",gs1_048.txt
自分にしか開けられない保管庫を、 バッチリもらってるッス。,"They gave me a locker that only I can open, pal!",gs1_048.txt
“自分にしか”開けられない‥‥？,"""Only you can open""...?",gs1_048.txt
自分は‥‥御剣検事を 信じているッス。何があっても。,"I'll always believe in Mr. Edgeworth, no matter what happens.",gs1_048.txt
そういえば‥‥今、査問会に 出頭しているそうですね。,"So... Mr. Edgeworth is with the inquiry committee now, right?",gs1_048.txt
今日の法廷の失態について、 セキニンを追求されてるハズッス。,They're trying to figure out who's responsible for the mess-up in court today.,gs1_048.txt
‥‥そう、ですか‥‥,I see...,gs1_048.txt
コイツは‥‥“ウンメイ” というヤツかもしれないッス。,"I guess this is what you call ""fate.""",gs1_048.txt
御剣検事は‥‥まだ。あの事件から 逃れるコトはできないッス。,Mr. Edgeworth just can't get away from that case...,gs1_048.txt
“あの事件”‥‥？,That case...?,gs1_048.txt
あれ。聞いてないッスか？ ‥‥《ＳＬ９号事件》ッスよ。,"Yeah, that case! The SL-9 Incident, of course!",gs1_048.txt
御剣検事にとっては‥‥ あれが“始まり”だったッス。,That was the beginning of the end for Mr. Edgeworth.,gs1_048.txt
（もう少し、詳しく 聞き出せないかな‥‥）,(Maybe we can get him to tell us more about the case...),gs1_048.txt
ここは、見た目以上に “ハイテク”ッスからねー。,This place is more high- tech than you might think.,gs1_048.txt
保管庫は、それぞれの捜査官しか 開けられないようになってるッス。,Every locker is fixed so that only one detective can open it.,gs1_048.txt
この、ＩＤカードを使うんですか？,Using this ID card?,gs1_048.txt
ＩＤカードは、なくすことが あるッスからねー。,"Well, that's the thing, pal. ID cards can be lost.",gs1_048.txt
自分、今年に入ってから もう３枚目ッス。,"Why, I'm on my third card since entering the force already.",gs1_048.txt
落としすぎです。,That sounds like a lot.,gs1_048.txt
ま。そんな自分でも、右手を 落とすことはできないッスから。,"Yes, but even I can't lose my own right hand!",gs1_048.txt
“みぎて”‥‥あ！ “指紋”‥‥ですか？,"""Right hand""...? Oh! You mean, your fingerprint?",gs1_048.txt
そッス！　保管庫は、指紋による ロックで守られているッス！,"Exactly, pal! The lock for each locker is coded with a fingerprint!",gs1_048.txt
自分が開けられるのは、 あの保管庫だけッス。,And that's the only locker we can open.,gs1_048.txt
でも‥‥そんなスゴいシカケが あるようには見えませんね。,"Funny, they look like normal lockers...",gs1_048.txt
さすが、最新型ッス。‥‥なんと！ 取っ手にヒミツがあるッス！,"These are the latest model! There's a trick to the handles, see?",gs1_048.txt
とって‥‥,The handles?,gs1_048.txt
ウラに、センサーがついてるッス。 登録されていない指紋だと‥‥,"On the other side of the handles is a sensor, and if the wrong person touches it...",gs1_048.txt
電気ショック！　ですね。,Bzzzap! You get a shock!,gs1_048.txt
そんなコトされたら自分、 毎日が黒こげッス。,"If that's what happened, my hand would be black and smoking every day!",gs1_048.txt
とにかく、パッと見た感じが あまりに自然なシカケなので‥‥,"In any case, the locks aren't that obvious.",gs1_048.txt
捜査官の中には、指紋のロックを 知らない連中もいるみたいッスね。,There's even some people in the force that don't know about the fingerprint locks!,gs1_048.txt
証拠品《証拠保管庫》のデータを 法廷記録にファイルした。,Evidence Locker added to the Court Record.,gs1_048.txt
‥‥かなり、 凶悪な事件だったらしいッス。,"Now that was a bloody, violent case.",gs1_048.txt
凶悪‥‥というと、 殺人事件ですか？,Violent... so it was a murder?,gs1_048.txt
連続殺人事件ッス。,A serial killing!,gs1_048.txt
（“連続”‥‥扱いたくないな、 そんなオソロシイ事件‥‥）,(A serial killing... Maybe I don't want to get involved in this after all.),gs1_048.txt
ハンニンはミスを犯して、 御剣検事が立件に成功したッス。,"But the killer made a mistake, and Mr. Edgeworth built his case around that to nab him.",gs1_048.txt
