Japanese,English,Note
な‥‥なんだ、ありゃあ‥‥。,Wh-what's that?,gs1_026.txt
ト‥‥トノサマン、だよね。,"Th-the Steel Samurai, Nick.",gs1_026.txt
よっ！　真宵ちゃん。,Yo! Maya!,gs1_026.txt
おい、矢張。 ‥‥なんだよアレ！,Larry! What the heck is this!?,gs1_026.txt
いやー、カズミだよ、カズミ。 オレのカノジョ。,"Oh, it was my girl Kiyance's idea...",gs1_026.txt
“これ置くとォ、インパクト？ あるしィ、売り上げが‥‥”って、,"She was all ""if you like, put this here, it would be, like, really cool!""",gs1_026.txt
ノボリといっしょに プレゼントしてくれたんだよ！,"Dude, she gave it to me along with the banner!",gs1_026.txt
すごーい！,Wow!,gs1_026.txt
カズミさんて、なんでも できるんですねー！,That's real impressive she could find those for you!,gs1_026.txt
カノジョ、カオが 広いからさ。,"Well, she knows a lot of people.",gs1_026.txt
あの番組、終わったらしくて。 タダでもらってきたんだとさ。,"And that show's finished now, so she got 'em for free.",gs1_026.txt
はあ‥‥。,Right...,gs1_026.txt
‥‥あのね、なるほどくん。,"Hey, Nick...",gs1_026.txt
？,Hmm?,gs1_026.txt
なんか、さっきから ミサイルのようすがヘンなの。,Missile's been acting strangely...,gs1_026.txt
“みさいる”？　‥‥ああ、あの たよりなさそうな小動物か。,"""Missile""? Oh, oh right.",gs1_026.txt
,That little... creature of yours.,gs1_026.txt
お。‥‥オレ、子犬って ダイスキなんだよな。,"Hey, I love lil' doggies!",gs1_026.txt
よしよし‥‥。,"Good boy, good boy.",gs1_026.txt
ぐるるるるるるるるるるるる‥‥,Grrraaaaaaarh!,gs1_026.txt
ど、どうしたの、ミサイル？,"Wh-what's wrong, Missile?",gs1_026.txt
わわわわわわわわわわわわわわわわ わわわわわわわわわわわわわわん！,Yip yip yip yip yip yip yip yip yip yip yip yip yip yip!,gs1_026.txt
きゃあああっ！,Eeeeek!,gs1_026.txt
ミサイル！　みさいるぅぅ！,Missile! Missssssssssile!,gs1_026.txt
わぐわぐわぐわぐわぐわぐわぐわ ぐわぐわぐわぐわぐわぐわぐわぐ,Munch munch munch munch munch munch munch munch!,gs1_026.txt
わぐわぐわぐわぐわぐわぐわぐわ ぐわぐわぐわぐわぐわぐわぐわぐ,Munch munch munch munch munch munch munch munch!,gs1_026.txt
うわわわっ！　やめろ！　やめろ！ オレのトノサマンジュウがああっ！,Wh-whoa! S-stop that thing! C-cannibal! It's eating my Samurai Dogs!,gs1_026.txt
‥‥‥‥‥‥‥‥‥！,,gs1_026.txt
‥‥‥‥。,,gs1_026.txt
‥‥オレの‥‥ トノサマンジュウが‥‥。,My Samurai Dogs... *sniff*,gs1_026.txt
スゴい‥‥。 ぜーんぶ食べちゃった‥‥。,Wow. He ate every single one.,gs1_026.txt
ゴメンな、矢張。,"I'm sorry, Larry...",gs1_026.txt
ゴメンですむかッ！,"""Sorry""!? ""Sorry"" don't pay my bills, Nick!",gs1_026.txt
ははは‥‥。 （ゴメンですますけどな‥‥）,Ah hah hah... (It's going to have to this time...),gs1_026.txt
おい、成歩堂！,"Yo, Nick!",gs1_026.txt
御剣はどうなったんだよ！,What happened with Edgeworth?,gs1_026.txt
今日の法廷は、なんとか 逃げ切ったけど‥‥、,"Well, we made it through the first day in court all right...",gs1_026.txt
まだ、なんとも言えないな‥‥。,"I don't know how good our prospects are from here on, though.",gs1_026.txt
‥‥ふうん。,Huh.,gs1_026.txt
ねえ、ねえ、知ってました？,"Hey, Larry, did you know Edgeworth's secret weakness?",gs1_026.txt
御剣検事って、地震が ニガテなんですよ！,He's terrified of earthquakes!,gs1_026.txt
コドモみたいですよねー。,He acts like a little boy!,gs1_026.txt
？,Huh?,gs1_026.txt
おかしいな‥‥。,That's weird.,gs1_026.txt
ムカシは、そんなこと なかったけどなあ。,I don't think he was ever like that in school.,gs1_026.txt
あれ‥‥そうなんですか？,No? Really?,gs1_026.txt
まあ‥‥アイツとのつきあい、 １年ぐらいだからな。,"Well, we were only in the same class for a year.",gs1_026.txt
すぐに、転校して いっちまったから‥‥。,He transferred schools pretty quickly...,gs1_026.txt
転校‥‥。,Transferred?,gs1_026.txt
（“ＤＬ６号事件”が 起こったからだ‥‥）,(Right... when the DL-6 Incident happened.),gs1_026.txt
（矢張も、あの事件のことは 知らないみたいだな‥‥）,"(Doesn't look like Larry knows about it, though.)",gs1_026.txt
おい、矢張。,"Hey, Larry.",gs1_026.txt
あの目ざわりなシロモノは、 いつから‥‥？,What was that big... thing up there before?,gs1_026.txt
ああ、あのデカいヤツか？,"Huh? Oh, the big guy?",gs1_026.txt
そうだな。もう１ヶ月ぐらいに なるかな‥‥。,"I've had that for about a month, yeah.",gs1_026.txt
子供たちには、けっこう ウケがいいんだぜ。,It's a big hit with the kids!,gs1_026.txt
じゃあ、なんで昨日は なかったんだ？,Why wasn't it there yesterday?,gs1_026.txt
え！　ええ？　いや、その。,Huh? Huh!? Oh... right.,gs1_026.txt
コ‥‥コンプレッサーが こわれちまってサ。,Th-the compressor was busted.,gs1_026.txt
こんぷれっさー？,Compressor?,gs1_026.txt
ホレ、屋台の横にあるだろ？ 小さなキカイが。,Yeah--it's that little unit by my hotdog stand.,gs1_026.txt
あれを使って 空気を入れるんだけどサ。,That what I use to put air in the Steel Samurai!,gs1_026.txt
ちょっと前にコワれちまって。 修理に出してたんだよ。,It broke a little while ago so I sent it in for repairs.,gs1_026.txt
なんだ。,Oh.,gs1_026.txt
ヤッパリさんが ふくらませたんじゃないんだ。,And here I thought you'd inflated it by yourself.,gs1_026.txt
‥‥あの。,Umm...,gs1_026.txt
トノサマンをくっつけたボンベが 飛んだのはわかったんですけど、,"So, the tank and the Steel Samurai you were trying to fill up flew away...",gs1_026.txt
‥‥それから、 どうなったんですか？,What happened next?,gs1_026.txt
アレが起こったのが、 ２０日ゴロでさ。,"Well, all that happened on the 20th or so.",gs1_026.txt
（２０日‥‥。 今から、約１週間前か‥‥）,(The 20th... a week ago.),gs1_026.txt
どうもボンベのヤツ、湖の方へ 飛んでいったみたいだから、,"Now, as far as I could see, the tank went flying out into the lake.",gs1_026.txt
それから毎晩、ボートで 必死に探したんだよ。,So I went out every night in a boat looking for it.,gs1_026.txt
なんたって、カズミがくれた 愛のトノサマンだからさァ。,"I mean, Kiyance gave me that Steel Samurai after all!",gs1_026.txt
で、いつ見つけたんですか？,And when did you find it?,gs1_026.txt
ああ。やっと、おとといの夜さ。,Just the night before last!,gs1_026.txt
スゲェとおくまで飛んでたよ。 探すのに４日もかかっちまった。,It flew way out there! Took me four whole days to find it.,gs1_026.txt
（おとといの夜‥‥って、 事件があった夜じゃないか！）,(The night before last... was the night of the murder!),gs1_026.txt
‥‥ゴメンな、成歩堂。,"Sorry for not telling you, Nick.",gs1_026.txt
事件の夜、じつはオレ、ここに いたんだよ。,"Actually, I was here on the night of the murder.",gs1_026.txt
でもな。オレ、１２時より前に 帰っちまったから‥‥。,"But, you see, I went home before midnight.",gs1_026.txt
湖で事件があったことは 知らないんですか‥‥。,So you didn't know about what happened?,gs1_026.txt
まあね。,No...,gs1_026.txt
うーん‥‥ザンネン。,That's too bad...,gs1_026.txt
でもさ。,It's not all bad.,gs1_026.txt
どうやら、ヤッカイなナゾが１つ、 カイケツしたみたいだな‥‥。,We've solved one mystery at least.,gs1_026.txt
ヤッカイなナゾ‥‥？,A mystery...?,gs1_026.txt
（報告しに行くか‥‥彼女に）,(Maybe we should go tell her...),gs1_026.txt
ヤッパリさん。 ホラ、ミサイル。,"Hey Larry! Look, it's Missile!",gs1_026.txt
カワイイでしょ。,Isn't he cute?,gs1_026.txt
そ、そのイヌを近づけるな！,K-keep that mutt away from me!,gs1_026.txt
親方に、なんて 言えばいいんだよ‥‥,What am I going to tell the big boss?,gs1_026.txt
今どき、マンジュウ屋で “親方”っていうのも、,"There's a ""big boss"" in charge of your hot dog stand?",gs1_026.txt
フゼイがあっていいねえ、 なるほどくん。,Nick! Maybe the stand is a front for a mafia money laundering scheme!!!,gs1_026.txt
真宵ちゃん。,Maya...,gs1_026.txt
ちょっとは“すみません”ぽい カオをした方がいいよ。,I think you should probably try to look a little sorry about what happened.,gs1_026.txt
はあい！,"Oh, right!",gs1_026.txt
‥‥とほほ。 オレのマンジュウよぉ‥‥。,Heh... My poor dogs...,gs1_026.txt
コイツのおかげで、 マンジュウも売れてるよ。,That's the guy that's selling my dogs faster than I can cook 'em!,gs1_026.txt
ヒョッシー、ホントに いるのかなあ。,Do you think Gourdy really exists?,gs1_026.txt
たぶん、何かの見間違いだと 思うけどサ。,"Nah, I think somebody probably saw something else that they just thought was Gourdy.",gs1_026.txt
その正体がわかるまで、 マンジュウを売りまくるぞ！,But I'll keep selling Samurai Dogs until the truth's out!,gs1_026.txt
‥‥この湖、魚は ほとんど釣れないぜ。,"You know, you can't catch many fish in this lake.",gs1_026.txt
ザコに用はないんだよ。,I'm not after small fry.,gs1_026.txt
あたしのエモノは、ズバリ “ヒョッシー”だからね！,I'm after the biggest fry of them all... Gourdy!,gs1_026.txt
ホンキで釣る つもりなのか‥‥？,You really going to try to fish out a monster?,gs1_026.txt
御剣さんを助けるためだよ！,"To save Edgeworth, yes!",gs1_026.txt
泣かせるなあ。 ‥‥いろんなイミで。,"Brings a tear to my eye, in more ways than one.",gs1_026.txt
なんだよ。 ‥‥ボンベ、か‥‥？,What? An air tank?,gs1_026.txt
それがどうかしたか？,What about it?,gs1_026.txt
矢張。 このボンベだけど‥‥、,Larry... I wanted to ask you about this tank...,gs1_026.txt
見おぼえがないか？ ‥‥このボンベ。,Have you seen this before?,gs1_026.txt
え。‥‥いや。 知らねェぞオレは。,Huh? Me? N-no. Never.,gs1_026.txt
‥‥このサムいのに、 ダイビングなんかしないって。,Who the heck would go diving in the middle of the winter!,gs1_026.txt
（‥‥なんか、目がオヨいでるぞ）,(There's something about the way his eye twitched when I showed him the tank...),gs1_026.txt
（もっと追求してみた方が よさそうだな‥‥）,(I think I'd better pursue this line of questioning a little further...),gs1_026.txt
このボンベ‥‥ お前のじゃないか？,Say... is this air tank yours?,gs1_026.txt
‥‥な、なんでだよ！,Wh-why would I have a thing like that?,gs1_026.txt
ホラ、ボンベの栓のところに、 万国旗がからまっているだろ。,Look--see how there's a string of flags around the tank valve?,gs1_026.txt
うしろのトノサマンの万国旗と 似ているからさ。,It's just like the string of flags around your Steel Samurai there.,gs1_026.txt
‥‥‥‥！,,gs1_026.txt
‥‥グ‥‥グーゼンだろ。,M-must be a coincidence!,gs1_026.txt
万国旗なんて、どこにでも あるからな‥‥,There're strings of flags everywhere these days!,gs1_026.txt
ホレ。小学校とか‥‥中学校とか。,L-like elementary schools! A-and used car dealerships!,gs1_026.txt
だいいち、ボンベなんて、 オレが何に使うって言うんだよ！,"L-look, why would I need a tank anyway!?",gs1_026.txt
お前、これを使って 湖にもぐったんじゃないか？,"You used this to go diving in the lake, didn't you?",gs1_026.txt
な、な、な、なんだって！,Wh-wh-what!?,gs1_026.txt
なんでオレがそんなこと しなくちゃならねェんだよ！,Why the heck would I go diving in the lake!?,gs1_026.txt
あッ！,Wait!,gs1_026.txt
まさかお前‥‥、,You... you're not...,gs1_026.txt
オレが何か、あの殺人事件と カンケイがあるとでも‥‥！,You're not saying I had something to do with that murder!?,gs1_026.txt
い、いや、 そういうワケじゃあ‥‥。,"N-no, not at all, just...",gs1_026.txt
‥‥そうは行かねぇぞ！ べ、弁護士を呼んでやる！,"Hey, you watch it buddy! I'm not saying anything until my lawyer gets here!",gs1_026.txt
なるほどくん。弁護士だって！,Larry... Nick is your lawyer.,gs1_026.txt
なんだ？　矢張。,"Well, Larry? She's right.",gs1_026.txt
フザけんなッ！,Bah!,gs1_026.txt
と、とにかく、そんなボンベ 知らねェや！,"A-anyway, I never seen that air tank! Okay?",gs1_026.txt
（‥‥ホントかぁ‥‥？）,"(Yeah, right...)",gs1_026.txt
（このタイド、ゼッタイ 何かありそうだぞ‥‥）,"(Larry is hiding something, I can tell...)",gs1_026.txt
お前、これを使って ふくらませたんじゃないのか？,"You used this to inflate that, didn't you?",gs1_026.txt
な‥‥何をだよ！,I-inflate what!?,gs1_026.txt
決まってるだろ？,What else?,gs1_026.txt
うしろでイバってる、 あのトノサマンだよ。,That big puffy Steel Samurai!,gs1_026.txt
‥‥‥‥！！,,gs1_026.txt
そ、そんなことを聞いて、 どうしようってんだよ。,N-now why would you go asking me a question like that.,gs1_026.txt
（どうやら、図星らしいな‥‥）,(Looks like I hit the nail on the head.),gs1_026.txt
ま‥‥まあ、な。,Right... right...,gs1_026.txt
実はさァ。,"Actually, umm...",gs1_026.txt
いつも使ってるコンプレッサーが コワれちまってよ。,"See, the compressor I always use was on the fritz.",gs1_026.txt
１回、ためしに使って みたんだけど‥‥,"So I tried using the tank to inflate it, just once.",gs1_026.txt
ダメ。うまくいかなかったよ。,"And, er, it didn't go so well.",gs1_026.txt
（やっぱりそうだったか‥‥）,(As I suspected!),gs1_026.txt
（まあ、ボンベのことは こんなところでじゅうぶんかな）,(I guess I've gotten to the bottom of that mystery!),gs1_026.txt
‥‥ふう。やれやれ。,Heh. Sorry!,gs1_026.txt
“うまくいかなかった”‥‥？,"It ""didn't go so well""?",gs1_026.txt
ま、まあな。,"Er, yeah.",gs1_026.txt
その話、もっとくわしく 聞かせてくれないか？,Do you think you could be a little more specific?,gs1_026.txt
な、なんでよ？,C-c'mon...,gs1_026.txt
じつはこの話、あんまり したくないんだよなァ‥‥。,"Look, it's embarrassing so I really don't want to talk about it...",gs1_026.txt
えー。聞きたい聞きたい！,Tell us! Tell us!,gs1_026.txt
‥‥わかったよ。,Fine.,gs1_026.txt
いやナ。さっきも言ったけど、 コンプレッサーがコワれたからさ、,"Whatever. It's like what I said, the compressor was busted.",gs1_026.txt
ボンベの空気でふくらまそうと してみたワケよ。,So I took the tank and tried to fill the Samurai up with that.,gs1_026.txt
ところが！,And then...,gs1_026.txt
パアァァン！,BLAAAAM!,gs1_026.txt
すげェ音がして 栓がハジけ飛んじまってさァ！,The valve busted open and made this incredible noise!,gs1_026.txt
ボンベのヤツ、ロケットみたいに “しゅぽーん！”って‥‥,And that tank there took off like a rocket.,gs1_026.txt
しわしわのトノサマンくっつけて、 飛んでいっちまったんだよ！,And it took my poor deflated Steel Samurai with it!,gs1_026.txt
ええーっ！,What!? Off into Gourd Lake?,gs1_026.txt
そりゃあすげェ音がして、 オレもビビっちまったよ！,"It sure scared me out of my gourd, that's for sure.",gs1_026.txt
そのボンベで、トノサマンを ふくらまそうとしてサ。,"See, I tried to use this tank to fill up the Samurai.",gs1_026.txt
トノサマンにボンベを くっつけた、まさにそのとき！,"I was attaching the tank, when it happened!",gs1_026.txt
パアァァン！,BLAAAAM!,gs1_026.txt
栓がハジけ飛んじまってさァ！,The valve just busted open and the whole thing took off!,gs1_026.txt
ボンベのヤツ、ロケットみたいに “しゅぽーん！”って‥‥,The tank shot up in the air like a rocket...,gs1_026.txt
しわしわのトノサマンくっつけて、 飛んでいっちまったんだよ！,And it took my poor deflated Steel Samurai with it!,gs1_026.txt
ありゃあ、スゲェ光景だったね。,"Man, what a sight that was.",gs1_026.txt
あたしも見たかった！,I wish I could have seen it!,gs1_026.txt
ぼくもだ。,Me too.,gs1_026.txt
悪いな、成歩堂。,"Sorry, Nick.",gs1_026.txt
コドクなマンジュウ売りにゃ、 なんのことかわかんねえよ。,I don't know much about that. I am a mere seller of hotdogs.,gs1_026.txt
１２月２６日　某時刻 貸しボート小屋前,December 26 Boat Rental Shop,gs1_026.txt
（今日もボート屋は 休みみたいだな‥‥）,"(Looks like the boat rental shop is closed today, too.)",gs1_026.txt
１２月２６日　某時刻 貸しボート小屋前,December 26 Boat Rental Shop,gs1_026.txt
ここって、いつも しずかだねえ。,"It's always so quiet, here.",gs1_026.txt
ボート屋さん、 やってないのかな。,I wonder if the boat shop is closed for good?,gs1_026.txt
湖で殺人があった わけだから、,"Well, with the murder on the lake and all...",gs1_026.txt
しばらく休むんじゃないかな。,They're probably just taking a vacation till it blows over.,gs1_026.txt
なるほど‥‥。,I get it.,gs1_026.txt
ピー　ピー　ピー,*beep* *beep* *beep*,gs1_026.txt
な！　なるほどくん！,N-Nick!,gs1_026.txt
反応してるよ！ き、金属探知機がッ！,It's beeping! The metal detector's found something!,gs1_026.txt
‥‥き、近所メイワクな 探知機だな‥‥。,Sure is loud enough about it.,gs1_026.txt
（どうやら、奥のシゲミに 反応しているみたいだ‥‥）,"(Whatever it is, it must be in those bushes...)",gs1_026.txt
真宵ちゃん。ちょっと見てきて。,"Go check it out, Maya.",gs1_026.txt
‥‥なんであたしが‥‥。,Why do I have to check it out?,gs1_026.txt
なるほどくん。,Nick.,gs1_026.txt
こんなものが。,Look!,gs1_026.txt
‥‥それって‥‥ ボンベ、だよね。,Huh...? An air tank?,gs1_026.txt
栓の部分がこわれてるみたいだ。,Huh. The valve looks broken.,gs1_026.txt
ヒョッシーじゃなかったね。,I thought it was Gourdy...,gs1_026.txt
いいかい真宵ちゃん。,"Maya, first of all...",gs1_026.txt
まず、ヒョッシーは シゲミにはいないんだ。,Why would Gourdy be in the bushes!?,gs1_026.txt
そして、ヒョッシーは、 金属探知機には反応しないよ。,"And second of all, why would a metal detector react to a sea monster!?",gs1_026.txt
ううう‥‥。,Oh.,gs1_026.txt
‥‥？,Huh?,gs1_026.txt
（‥‥このボンベ‥‥ 何かからみついてるな‥‥）,(There's something wrapped around this air tank...),gs1_026.txt
（‥‥万国旗？‥‥）,(It looks like... a string of flags...?),gs1_026.txt
いちおう、ひろっておこうか。 せっかくだし。,"Well, we might as well take it with us now that we've found it.",gs1_026.txt
（‥‥重いな）,(It's heavy...),gs1_026.txt
役に立つのかわからないが、 《ボンベ》をひろった。,Picked up air tank of dubious value.,gs1_026.txt
１２月２６日　某時刻 貸しボート小屋前,December 26 Boat Rental Shop,gs1_026.txt
ねえねえ、なるほどくん。,"Hey, Nick!",gs1_026.txt
ナツミさんが言ってたの、 あそこのボート屋さんだよね。,This is the boat shop that Lotta was talking about!,gs1_026.txt
‥‥そうだね。,You're right.,gs1_026.txt
でも、人のケハイなんか しないぞ‥‥。,Doesn't seem to be anyone around at all.,gs1_026.txt
ま。ま。 とにかく、行ってみようよ。,"Well, let's go check it out anyway!",gs1_026.txt
‥‥なんでサユリさん、 ＤＬ６号事件のことを‥‥。,Why would that bird Polly know about DL-6...?,gs1_026.txt
あのオジさんの正体を 考えなきゃいけないな。,We have to figure out who that old man is.,gs1_026.txt
あ。,Oh...,gs1_026.txt
どうした？,What?,gs1_026.txt
オジさん、カギかけちゃった。 ドアの向こうから。,"He locked the door, from the other side.",gs1_026.txt
（‥‥‥‥‥‥）,,gs1_026.txt
（‥‥あのオジさん、 ナニモノなんだろう‥‥？）,(Who could that old man be...?),gs1_026.txt
（もっと知る必要があるな‥‥ ＤＬ６号事件のこと）,(I think I need to do a little more research on this DL-6 Incident...),gs1_026.txt
（聞いてみるか。 イトノコ刑事にでも‥‥）,(Maybe I should ask Detective Gumshoe.),gs1_026.txt
１２月２６日　某時刻 ひょうたん森,December 26 Gourd Lake Woods,gs1_026.txt
あっ。イトノコ刑事。,"Hey, Detective Gumshoe!",gs1_026.txt
おお！,"Hey, pal!",gs1_026.txt
今日の法廷は、‥‥そのう‥‥。,"The trial today, it, er...",gs1_026.txt
どうしました？,Yes? What about the trial?,gs1_026.txt
イヤ。“おミゴトでした”と 言うほどアザヤカでもなく、,"Well, I was going to say ""good show,"" but it wasn't really all that...",gs1_026.txt
とはいえ、いちおう検事を 助けてくれているし‥‥,"Though you did save Edgeworth, I guess...",gs1_026.txt
なんとお礼をすればいいか、 コトバに詰まったッス。,I just wasn't sure how to thank you... you know?,gs1_026.txt
‥‥はあ。,Er... thanks.,gs1_026.txt
では、自分は一度、 署にもどるッス。,I'm going to head back to the station.,gs1_026.txt
真宵さんの調書をとって、 すぐに保釈の手続きをするッス。,I'll get the report on Maya and get her out of there as soon as I can.,gs1_026.txt
すみません。 ‥‥おねがいします。,Thank you.,gs1_026.txt
あ！　そうだ。,"Oh, wait!",gs1_026.txt
そのー‥‥保釈金って、 いくらぐらいなんですか？,"Umm... I was wondering, how much is bail going to be?",gs1_026.txt
シンパイいらねッス。,Don't worry about that.,gs1_026.txt
保釈金は全額、御剣検事が 支払うッス。,Mr. Edgeworth is posting the whole amount.,gs1_026.txt
え‥‥、御剣が‥‥？,What? Edgeworth...?,gs1_026.txt
言ったはずッス。,Didn't I tell you?,gs1_026.txt
検事は、彼女に カンシャしてるッス。,He's grateful to her for what she did.,gs1_026.txt
‥‥じゃ、あとで彼女を むかえに来るッス！,"Alright, pal. Well don't forget to go pick her up, okay?",gs1_026.txt
（御剣‥‥）,(Hmm...),gs1_026.txt
（今月の家賃も、全額 支払ってくれ‥‥）,"(Maybe I can get Edgeworth to pay this month's rent, too...)",gs1_026.txt
イトノコ刑事。,Detective Gumshoe?,gs1_026.txt
狩魔検事、 明日はどういう作戦で‥‥？,Any idea what strategy von Karma is planning for tomorrow?,gs1_026.txt
どうやら、もう１人の 目撃証人を立てるらしいッス。,It sounds like he's bringing in another witness!,gs1_026.txt
“もう１人の目撃証人”‥‥？,Another witness!?,gs1_026.txt
‥‥そういえば、今日の法廷で、,"Oh, right, he said something about that in the trial today...",gs1_026.txt
目撃者は、２人いたのだ。,There were two witnesses!,gs1_026.txt
‥‥とか言ってましたっけ。,I was wondering who that other witness was!,gs1_026.txt
で‥‥、どういう証人なんですか？,Er... who was it?,gs1_026.txt
す‥‥すまないッスが‥‥、,"S... sorry, pal.",gs1_026.txt
さすがにその情報は、 もらせないッス。,"As much as I'd like to, I'm not at liberty to divulge that information.",gs1_026.txt
（ううん‥‥）,(Right...),gs1_026.txt
そういえば、 御剣検事ですけど‥‥。,"Oh, right... I wanted to ask you something about Edgeworth.",gs1_026.txt
なんスか？,What's up?,gs1_026.txt
彼、地震がニガテなんですか？ 聞いたこと、なかったんですけど。,Is he afraid of earthquakes? I never heard anything about that before.,gs1_026.txt
‥‥‥‥。,,gs1_026.txt
御剣検事は、自分の話は ほとんどしないッス。,"Mr. Edgeworth doesn't talk about himself too much, see.",gs1_026.txt
でも、これだけは間違いないッス。,But there's one thing that's clear as day...,gs1_026.txt
あの人が、あんなに犯罪を ニクむようになったのも、,Him hating crime the way he does...,gs1_026.txt
検事になることを決めたのも、,And him becoming a lawyer...,gs1_026.txt
そして、地震を死ぬほど 怖がるようになったのも‥‥、,And him being scared of earthquakes...,gs1_026.txt
すべては、あの事件が キッカケになっているッス。,It all started with that incident.,gs1_026.txt
‥‥“ＤＬ６号事件”ですか？,The DL-6 Incident?,gs1_026.txt
そッス。,"Yep, that's the one.",gs1_026.txt
