Japanese,English,Note
１５年前‥‥。検事は、目の前で お父さんを‥‥。,Fifteen years ago... when he saw his father shot before his very eyes!,gs1_026.txt
‥‥あの人は今でも、 苦しんでいるッス。,"He still feels the pain now, you can see it in his eyes.",gs1_026.txt
ウチの綾里　真宵の ことなんですけど‥‥。,I wanted to talk to you about Maya Fey...,gs1_026.txt
あれ？　まだ釈放されて ないッス？,Huh? She's not out on bail yet?,gs1_026.txt
‥‥おかしいッスね。,That's strange.,gs1_026.txt
調書をとったら、すぐ 帰らせるように言ったッスが。,I told 'em to let her go as soon as they had their report written up.,gs1_026.txt
でも。,Man...,gs1_026.txt
‥‥今日は、彼女の おかげで助かったッス。,I don't know what would have happened in that courtroom today if it weren't for her.,gs1_026.txt
係官にハガイじめされて 引きずり出される彼女を見て、,Seeing her getting dragged out by the bailiff...,gs1_026.txt
自分は正直、ナミダが 止まらなかったッス。,"I'll be honest with you, pal. I shed a tear or two.",gs1_026.txt
御剣検事も、カンドーして クチビルをふるわせていたッス。,"Edgeworth, he was so moved I saw his lip trembling.",gs1_026.txt
ほ、ほんとですか！ （あの御剣が‥‥？）,Really!? (Cold-as-ice Edgeworth!?),gs1_026.txt
検事は、ホントにカンシャ してたッス。,"He was really grateful for what she did, you know.",gs1_026.txt
それをホコらしげに 見せるのは、まだ早いッス。,I think it's a little early for you to be proudly waving that thing around.,gs1_026.txt
ムザイ判決をもらったとき、 自分はアンタを認めるッス！,"You can be proud of yourself when you get Mr. Edgeworth declared innocent, pal!",gs1_026.txt
ジッサイ、あの女には やられたッス。,"That woman really took us for a ride, didn't she?",gs1_026.txt
まったく、人さわがせな‥‥。,Claiming she was a witness to a murder and all...,gs1_026.txt
でも、彼女の写真があったから、 御剣は助かったんですよ。,"Still, if it weren't for her photograph, Mr. Edgeworth wouldn't have made it today.",gs1_026.txt
あ、あれ。そうだったッスか。,"Oh, huh, really?",gs1_026.txt
（裁判、ちゃんと聞いてたのか この刑事‥‥）,"(Umm... you were at the trial, weren't you, Detective?)",gs1_026.txt
生倉　雪夫‥‥。,Robert Hammond...,gs1_026.txt
ＤＬ６号事件の弁護士ッス。,He was the defense attorney in the DL-6 Incident trial.,gs1_026.txt
たった１人の容疑者を、 ムザイにしたオトコッス。,He's the one who got the sole suspect off the hook.,gs1_026.txt
御剣検事は、コイツのことを どう思ってるッスかねえ‥‥。,"I wonder what Mr. Edgeworth thinks of him. Not much, I'd wager.",gs1_026.txt
こんなの、誰が見ても 御剣検事じゃないッスよね！,"I don't care who you are, no one can tell me that that's Mr. Edgeworth!",gs1_026.txt
だいいち、 ゼンゼン、似てないッス！,"I mean, come on, it doesn't look like him at all!",gs1_026.txt
でも御剣は、このボートに乗って いたことは、認めてるんですよ。,But Edgeworth has admitted he was on the boat.,gs1_026.txt
じゃあ、こっちの撃たれている 方が、御剣検事ッス！,"Then he's the one being shot, then!",gs1_026.txt
でも、彼はピンピンして 被告席に立っていますけどね。,He seemed fine in court today...,gs1_026.txt
,"Details, pal, details!",gs1_026.txt
アンタ、どっちの味方ッスか！,"Whose side are you on, anyway?",gs1_026.txt
（証拠から目をそらしたって、 しかたないってことなのに‥‥）,(All I'm saying is we have to respect the evidence...),gs1_026.txt
こんなの、誰が見ても 御剣検事じゃないッスよね！,"I don't care who you are, no one can tell me that that's Mr. Edgeworth!",gs1_026.txt
だいいち、 ゼンゼン、似てないッス！,"I mean, come on, it doesn't look like him at all!",gs1_026.txt
でも御剣は、このボートに乗って いたことは、認めてるんですよ。,But Edgeworth has admitted he was on the boat.,gs1_026.txt
じゃあ、こっちの撃たれている 方が、御剣検事ッス！,"Then he's the one being shot, then!",gs1_026.txt
でも、彼はピンピンして 被告席に立っていますけどね。,He seemed fine in court today...,gs1_026.txt
,"Details, pal, details!",gs1_026.txt
アンタ、どっちの味方ッスか！,"Whose side are you on, anyway?",gs1_026.txt
（証拠から目をそらしたって、 しかたないってことなのに‥‥）,(All I'm saying is we have to respect the evidence...),gs1_026.txt
間違いなく、凶器から発射 されているッス。,"Yep, it was fired from the murder weapon, without a doubt.",gs1_026.txt
１ｍの距離から撃たれたとなると、 ボートの上しか考えられない‥‥。,From a meter away... so it would have to have been from someone else on the boat.,gs1_026.txt
ううう‥‥。,Hmm...,gs1_026.txt
どう思います？　イトノコ刑事。,"What do you make of this, Detective Gumshoe?",gs1_026.txt
それを考えるのが、 アンタの仕事ッス！,"Hey, making something of things is your job!",gs1_026.txt
はあ。,Er... right.,gs1_026.txt
（‥‥って、それは刑事の シゴトだろう！）,(Since when do lawyers have to do detectives' work for them!?),gs1_026.txt
なんで御剣検事の指紋が ついてるッスかね‥‥。,"Maybe you should tell me why Mr. Edgeworth's prints were on the weapon, pal.",gs1_026.txt
そんなの、ぼくに わかるワケ、ないでしょう！,Huh? How should I know!?,gs1_026.txt
彼女は、２発、銃声を 聞いているッス。,"Now, she heard two gunshots, right?",gs1_026.txt
でも‥‥ 法廷記録によると、,But wait... Look at the Court Record!,gs1_026.txt
凶器のピストルは、 ３発撃たれているんですよ。,"According to this, the murder weapon was fired three times!",gs1_026.txt
な！　なんスと！,What!? How's that possible!?,gs1_026.txt
残りの１発は どこへ行ったんでしょうね？,Where was the third shot fired?,gs1_026.txt
さ、さあ‥‥。,I wonder...,gs1_026.txt
ためし撃ちでも したッスかねえ‥‥。,Maybe it was a practice shot or something?,gs1_026.txt
そんな、期待にみちた目で 見られてもコマるッス。,"Sorry to disappoint you, pal.",gs1_026.txt
なんにも思い浮かばねッス。,I'm drawing a blank.,gs1_026.txt
１２月２６日　某時刻 ひょうたん森,December 26 Gourd Lake Woods,gs1_026.txt
おっ！　アンタら。,Hey y'all!,gs1_026.txt
どうや。‥‥ヒョッシーのコト、 何かわかったんか？,Well? Y'all find anything out about Gourdy?,gs1_026.txt
‥‥ええと、 まだ見つからないんですよ。,"Umm... no, nothing.",gs1_026.txt
気合い入れなアカンで。 この辺、夜は冷え込むからなぁ。,"Well, keep moving! It gets cold out here at nighttime.",gs1_026.txt
そういえば‥‥サムいですね。,It is a little chilly...,gs1_026.txt
あ‥‥クシャミが‥‥。,I... I think I have to sneeze!,gs1_026.txt
ア、アカン！ クシャミはアカンでぇぇぇ！,Wh-whoa! No you don't! No sneezing!!!,gs1_026.txt
ハックショ！,Whaaa-cho!,gs1_026.txt
カシャ　カシャ　カシャ　カシャ！ カシャ　カシャ　カシャ　カシャ！,klik klik klik klik klik klik klik klik,gs1_026.txt
カシャ　カシャ　カシャ　カシャ！ カシャ　カシャ　カシャ　カシャ！,klik klik klik klik klik klik klik klik,gs1_026.txt
カシャ　カシャ　カシャ　カシャ！ カシャ　カシャ　カシャ　カシャ！,klik klik klik klik klik klik klik klik,gs1_026.txt
コラァ！　クシャミはアカン 言うたろぉが！,I told y'all NO SNEEZING!,gs1_026.txt
自動シャッターの“破裂音”の 設定を、少しユルめたんや。,"See, I set the camera to respond to things a little softer than a ""bang.""",gs1_026.txt
今、カメラはカルマ検事の 指パッチンにも反応するんや！,It'd trigger on one of von Karma's finger snaps now!,gs1_026.txt
ううう‥‥スミマセン。,Oh... I'm sorry.,gs1_026.txt
どぉぉしてくれるんや！ フィルム！,"Yeah, well, sorry's nice but what about my film!?",gs1_026.txt
なるほどくん。‥‥払っといて。,Nick... pay the lady.,gs1_026.txt
（‥‥とほほ）,(*sob*),gs1_026.txt
もし、ヒョッシーがいなかったら どうするんですか？,What are you going to do if Gourdy doesn't exist?,gs1_026.txt
スクープカメラマン、やめる。,I'll quit being an investigative photographer.,gs1_026.txt
ええっ！,What!?,gs1_026.txt
いやな。ウチ、実は今まで、 １枚しか撮ったことがないんや。,"After all, I only have one photo to my name so far...",gs1_026.txt
スクープ写真ですか？,Was it a good one?,gs1_026.txt
せや。‥‥ＵＦＯの写真 なんやけどな。,You bet... a yoofoh!,gs1_026.txt
ゆ‥‥ゆーほー。,A y-yoofoh...?,gs1_026.txt
だからな。‥‥今回、もし ヒョッシーが撮れんかったら‥‥、,"Anyway, if I can't get a career-making photo this time around...",gs1_026.txt
キッパリやめるんや。 そして、大学にもどるワ。,Then that's it! I'll quit and go back to school.,gs1_026.txt
え！　ナツミさん、ホントに 大学生なんですか？,Huh? So you really are a university student?,gs1_026.txt
まあな。‥‥休学中や。,"Yeah, well, I'm takin' a break for a bit.",gs1_026.txt
はああ‥‥。,Right...,gs1_026.txt
どうやニイちゃん。,"Well, Mister Lawyer?",gs1_026.txt
ウチは待ってんねんで。 アンタの情報をナ。,I've got the info y'all need!,gs1_026.txt
どうや？　ヒョッシー、 見つかりそうなん？,Y'all got the scoop on Gourdy for me yet?,gs1_026.txt
そんなにカンタンには 見つかりませんよ。,"It's not going to be that easy to find him, you know.",gs1_026.txt
早よォせんと、明日の 裁判に間にあわんで。,You'd better hurry or you won't have that info in time for the trial tomorrow!,gs1_026.txt
（まいったな‥‥）,(Uh oh...),gs1_026.txt
もう見つけましたよ、 ヒョッシーなら。,"Huh? Gourdy? Oh, we found him already.",gs1_026.txt
えっ！　あたしまだ 見てないよ！,What!? I haven't seen any monsters yet!,gs1_026.txt
や、やっぱりヒョッシーは いたんや！,Y-y'all for real!? Gourdy really exists!?,gs1_026.txt
アンタ！,Wait!,gs1_026.txt
み、見つけたっていう証拠は！ ‥‥写真でも撮ったんか！,I need proof! You get a photo!?,gs1_026.txt
証拠はもちろん、ありますよ。,Of course I have proof.,gs1_026.txt
‥‥ズルいや、なるほどくん。,"No fair, Nick!",gs1_026.txt
あたしがトイレに行ったときだ。,"It was when I went to the bathroom, wasn't it!?",gs1_026.txt
‥‥あのとき、ヒョッシーに コンタクトを‥‥。,That's when you made contact with Gourdy!,gs1_026.txt
ほれ！　ほれ！　ヒョッシーを 見つけた証拠を出しィな！,"Enough jabbering already, let's see your proof!",gs1_026.txt
‥‥‥‥。,,gs1_026.txt
アンタ、ウチをバカに しとるんか！,Y'all trying to make a fool outta me?,gs1_026.txt
そんなの、証拠でも なんでもあらへん！,That don't prove diddly-squat!,gs1_026.txt
うう。あやうくごまかされる ところだったよ‥‥。,"Hmph. We almost had her duped, too.",gs1_026.txt
（‥‥なんとかナットク させてしまいたいんだけど‥‥）,(We need to do something soon or I won't get that information off of her!),gs1_026.txt
ナツミさん。,Lotta...,gs1_026.txt
‥‥いないんですよ。 ヒョッシーなんて、ね。,There is no such thing as Gourdy.,gs1_026.txt
な、なんやて！,Wh-what!? How can y'all be so sure!,gs1_026.txt
ホ‥‥ホントなの！ なるほどくん！,"R-really, Nick!?",gs1_026.txt
ど‥‥どうしてや！ 証拠でも、あるんか！,Y'all got some proof Gourdy don't exist!?,gs1_026.txt
ヒョッシーがいないという 証拠は‥‥,The proof that Gourdy doesn't exist...,gs1_026.txt
‥‥まあ、証拠はないですけど、 弁護士としての“カン”が‥‥。,"I don't have it yet, but my lawyer instincts tell me the proof is out there.",gs1_026.txt
なんや！　証拠もないのに そんなこと言ったんか！,"Hah! Nice try, but y'all can't pull the wool over these eyes that easy!",gs1_026.txt
弁護士シッカクだよ！ なるほどくん！,"That won't work in court, either, Nick...",gs1_026.txt
（ホンキで怒られてしまった）,"(Great, now they're both mad at me.)",gs1_026.txt
もちろんあります。,Of course I have proof.,gs1_026.txt
弁護士は、証拠なしには ケツロンは出しませんから。,No lawyer worth his badge would make a claim without the proof to back it up.,gs1_026.txt
ヒョッシーがいないという 証拠は‥‥,Here's the proof that Gourdy doesn't exist...,gs1_026.txt
‥‥‥‥。,,gs1_026.txt
なんや！　弁護士は、デタラメな 証拠でケツロンを出すんかい！,Hah! All that fancy talk about lawyers and proof had me going for a second there!,gs1_026.txt
カオ洗って、出なおして来ィ！,Y'all better take a good hard look at that badge of yours and consider a career change!,gs1_026.txt
（この証拠でナットクさせるのは ムリか‥‥）,"(Great, the ""investigative photographer"" is giving me career advice...)",gs1_026.txt
矢張さんのボンベ‥‥？,Larry's air tank...?,gs1_026.txt
‥‥なんや、そのボンベは。,What're y'all doing with an air tank?,gs1_026.txt
これが、ヒョッシーです。,This... is Gourdy.,gs1_026.txt
‥‥はぁ？,Umm... scuze me?,gs1_026.txt
ど‥‥どういうこと、 なるほどくん？,"Wh-what exactly are you saying, Nick?",gs1_026.txt
この近くに、マンジュウの 屋台があるんですよ。,There's a stand near here... a hotdog stand.,gs1_026.txt
そこには、空気でふくらませた 大きな人形があるんです。,There's a giant inflatable samurai doll there.,gs1_026.txt
１週間前、ちょっとドジなヤツが ボンベでそれに空気を‥‥。,"About a week ago, an idiot, who happens to be a friend of mine, tried to fill it.",gs1_026.txt
ボンベの栓は破裂して、 湖の方へ飛んでいきました。,"He used this air tank, and when the valve blew, the tank flew into the lake.",gs1_026.txt
“パァァン！”という 破裂音とともにね。,"Apparently, it made a pretty loud ""bang"" when it flew...",gs1_026.txt
‥‥“破裂音”‥‥。,"A ""bang""...?",gs1_026.txt
ボンベは、しわしわの人形を つけたまま、湖に着水しました。,"The tank, along with the still deflated Samurai fell into the lake.",gs1_026.txt
この瞬間！,At the same time...,gs1_026.txt
偶然、湖のほとりで写真を 撮ったカップルがいたんです。,A couple was taking a photograph of the lake.,gs1_026.txt
それが、この写真です。,This photo!,gs1_026.txt
じゃあ‥‥,Wait...,gs1_026.txt
じゃあ、ヒョッシーの正体は‥‥,So... you're saying that Gourdy...,gs1_026.txt
しぼんだトノサマンだったの！？,Is really the Steel Samurai!?,gs1_026.txt
ウチのユメもしぼんだわ。,"Well, that's a fine way to ruin a gal's dreams.",gs1_026.txt
すみません‥‥ナツミさん。,"I'm sorry, Lotta.",gs1_026.txt
わかったわ‥‥。 アンタの勝ちや。,"Nah, it's okay, you win.",gs1_026.txt
ヤクソクどおり、情報を 聞かせてやるで‥‥。,"I'll give you your info, like I promised.",gs1_026.txt
ナツミさん、ちょっと カワイソウ‥‥。,Poor Lotta...,gs1_026.txt
ウチな、今日の裁判で、 つくづく思い知ったんや。,"I learned something in today's trial, that's for sure.",gs1_026.txt
ええかげんなキモチで 証言したらあかんねんな、って。,Testifyin' is serious business!,gs1_026.txt
だから、もうあの事件のことは しゃべらんことに決めたんや。,That's why I decided not to talk about that case any more.,gs1_026.txt
へええ。,Huh?,gs1_026.txt
いやいや。この事件について、何か 情報があるって言ってましたよね。,Whoa--didn't you say you had information about the case!?,gs1_026.txt
それを教えてくださいよ！,"Tell us that, at least!",gs1_026.txt
だぁかぁらぁ。,Like I said...,gs1_026.txt
‥‥それは、ヒョッシーの情報と 引きかえや。,I'll trade it for the dirt on Gourdy!,gs1_026.txt
じゃあ、ナツミさんの知っている “情報”を教えてください。,"So, tell us this ""information"" you have.",gs1_026.txt
‥‥しゃあないな。約束やし。,"A promise is a promise, I guess...",gs1_026.txt
警察で聞いた話やけど、 明日の検察の証人なァ、,I overheard the cops around here saying something about the witness tomorrow...,gs1_026.txt
この先にある貸しボート屋の 管理人らしいで。,They said he's the caretaker of the boat rental place up the path here.,gs1_026.txt
貸しボート屋‥‥？,Boat rental...?,gs1_026.txt
あそこ、ヒトがいたんですか？,"There's someone there? I mean, it looks so deserted.",gs1_026.txt
オッサンが１人で 住んでるんや。,"Just an old guy, living all by himself.",gs1_026.txt
調べてみたらええんちゃう？,Y'all should go check it out.,gs1_026.txt
ありがとう！　ナツミさん！,"Thanks, Lotta! We will!",gs1_026.txt
ホラ、行こうよなるほどくん！,"Let's get cracking, Nick!",gs1_026.txt
ちょっと待ちィ。,Hold on.,gs1_026.txt
まだ、何かあるんですか？,Something else?,gs1_026.txt
事件のあった晩やけどな。,Yeah... the night of the murder.,gs1_026.txt
ウチのカメラ、 ２回作動してたんや。,"My camera clicked twice, you know.",gs1_026.txt
‥‥！,,gs1_026.txt
じゃあ、この写真以外に、 もう１回、撮影を‥‥？,Wait... so you have another photo?,gs1_026.txt
まあな。,Well...,gs1_026.txt
ただ‥‥湖には なーんも写っとらん。,"Yeah, but there's nothing in it at all. Just the lake.",gs1_026.txt
なんの証拠にもならん思ォて、 今まで出さなかったんやけど、,"I figured it wouldn't be much use as evidence, so I kept it to myself.",gs1_026.txt
何がどういう証拠になるか わからんからな。,"Well, it might not be helpful at all, but...",gs1_026.txt
コレ、持って行きィ。,"Here, take it.",gs1_026.txt
《もう１枚の湖の写真》を 法廷記録に挟んだ。,Second Lake Photo added to the Court Record.,gs1_026.txt
ほな。,Bye now. Y'all take care.,gs1_026.txt
ウチ、荷物かたづけて 帰るさかい‥‥。,Time for me to pack up and leave.,gs1_026.txt
ナツミさん、カワイソウ‥‥。,Poor Lotta...,gs1_026.txt
矢張のせいだ。,It's all Larry's fault.,gs1_026.txt
アイツの伝説は、 いまだ健在だったな。,"The legend still lives on, I guess.",gs1_026.txt
“でんせつ”‥‥？,"The ""legend""...?",gs1_026.txt
矢張の関係者はみんな、 この言葉を思い知る運命なんだよ。,"Yeah, the legend of Larry, familiar to all who know him for any length of time...",gs1_026.txt
“事件のカゲに、ヤッパリ矢張” ‥‥ってね。,"""When something smells, it's usually the Butz.""",gs1_026.txt
‥‥‥‥。,Hmm.,gs1_026.txt
ちょっぴりメイワク、かも。,Someone should whip that Butz into shape.,gs1_026.txt
ウチ、なんとしてもヒョッシーを 撮らなアカンねん。,I gotta do what I gotta do to get me a picture of Gourdy!,gs1_026.txt
だから、自動シャッターのマイクの 感度、上げてあるんや。,That's why I raised the sensitivity of my mic.,gs1_026.txt
今度こそ、気ィつけてや。,"Just... watch yourself from now on, okay?",gs1_026.txt
ゴメンナサイ‥‥。,"Sorry, sorry!",gs1_026.txt
待っててくださいね、ナツミさん。 ‥‥これで、ヒョッシーを‥‥。,"Lotta, wait... For catching Gourdy...",gs1_026.txt
そのツリザオでか！,A fishing pole!? Are you out of your doggone mind!?,gs1_026.txt
そうです！,"Yes! I mean... yes, it's a fishing pole!",gs1_026.txt
‥‥‥‥。,Huh.,gs1_026.txt
そりゃあ思いつかんかった！ ‥‥キタイしとるで！,I never thought of that! Good luck!,gs1_026.txt
はい！,Thanks!,gs1_026.txt
（‥‥ウソだろ‥‥）,(I don't believe it...),gs1_026.txt
ナツミさん、ホラ。,"Hey, Lotta!",gs1_026.txt
お。カワイイなぁ。 ‥‥アンタの子かいな？,"Oh, cute! He yours?",gs1_026.txt
ケーサツ犬なんですよ！ ミサイルっていうの。,"He's a K-9 police dog! His name's ""Missile.""",gs1_026.txt
へええ。,Huh.,gs1_026.txt
でも、警察犬て、何かのニオイを 追いかけるモンやろ？,"K-9s are the ones they use to sniff for things, right?",gs1_026.txt
ヒョッシーって、どんな ニオイなんや？,I wonder what Gourdy smells like...,gs1_026.txt
ううん‥‥。,Hmm...,gs1_026.txt
そこまでは考えてなかったなぁ。,I hadn't thought about that.,gs1_026.txt
ナツミさん、ホラ。 金属探知機っていうんですよ！,"Hey, Lotta, look at this: It's a metal detector!",gs1_026.txt
知っとるわ。,I know what it is.,gs1_026.txt
なあ、アンタ。,Umm...,gs1_026.txt
ヒョッシーは、ピストル持った ハイジャック犯やないんや。,"I'm not sure that's going to pick up Gourdy, though.",gs1_026.txt
金属探知機じゃァ 引っかからんのとちゃうか？,Unless he's been eating people's watches or spare change or something.,gs1_026.txt
ううん‥‥。,Oh...,gs1_026.txt
そこまでは考えてなかったなぁ。,I hadn't thought about that.,gs1_026.txt
知らん。 ‥‥なーんも知らん。,"Yep, I'd have to say I know exactly squat about that.",gs1_026.txt
（あいかわらず、関心のない ものにはタンパクだな‥‥）,(It's painfully easy to know when something doesn't catch Lotta's interest...),gs1_026.txt
１２月２６日　某時刻 警察署内　刑事課,December 26 Police Department Criminal Affairs,gs1_026.txt
（イトノコさん‥‥ いないみたいだな）,(Detective Gumshoe's not here...),gs1_026.txt
イトノコなら、今日も 現場に行ってるよ。,Gumshoe's at the scene again today.,gs1_026.txt
え‥‥あ、そうなんですか。,"Huh? Oh, really?",gs1_026.txt
あいつもバカだよ。,He's a live wire that one.,gs1_026.txt
捜査方針に逆らって、 課長と大ゲンカしちゃって。,Got into a fight with the chief for not following protocol...,gs1_026.txt
（捜査方針‥‥）,(Not following protocol...?),gs1_026.txt
（やっぱり、御剣の容疑を 固めようという方向だろうな）,(I bet he wouldn't help them build the case against Edgeworth...),gs1_026.txt
１２月２６日　某時刻 警察署内　刑事課,December 26 Police Department Criminal Affairs,gs1_026.txt
おお。アンタッスか。,"Hey there, pal.",gs1_026.txt
どうしたッスか？ むずかしいカオをして。,What's up? You look out of sorts.,gs1_026.txt
‥‥まさか、また御剣検事に 不利なコトを‥‥！,Wait... you didn't go and do something that's going to hurt Mr. Edgeworth's case again!,gs1_026.txt
“また”はないでしょう！,"What do you mean, ""again""!?",gs1_026.txt
ま、とにかく、そこにすわるッス。,"Whatever, have a seat, pal.",gs1_026.txt
カネのこと以外なら、 相談にのるッス。,"I'm here for you if you need anything. Besides money, that is.",gs1_026.txt
捜査の方は、どうですか？,How is the investigation proceeding?,gs1_026.txt
どうもこうもないッス。,"It's not, really.",gs1_026.txt
これからまた、捜査会議が あるッスが‥‥、,We have another meeting coming up...,gs1_026.txt
御剣検事の動機をウラづける 捜査のハナシだけッス。,We're supposed to talk about Mr. Edgeworth's motive...,gs1_026.txt
動機‥‥ですか。,His motive?,gs1_026.txt
御剣検事のお父さんが 亡くなったＤＬ６号事件で、,"See, Mr. Edgeworth's father died in the DL-6 Incident...",gs1_026.txt
その容疑者を無罪にしたのが、 被害者の生倉弁護士ッス。,And the guy who got the lone suspect declared innocent was the victim in this case...,gs1_026.txt
だから御剣検事は、生倉弁護士に フクシュウした‥‥。,Robert Hammond.,gs1_026.txt
おそらく、そんなケツロンに なると思うッス。,They're saying that's why Mr. Edgeworth shot him.,gs1_026.txt
（‥‥御剣は、過去を語ろうと しない）,(And Edgeworth never talks about his past...),gs1_026.txt
（明日は、ムリヤリその話が 法廷で暴かれるわけか‥‥）,"(I bet they'll drag that out and hit him with it in court tomorrow, too...)",gs1_026.txt
‥‥御剣さん‥‥。,Poor Edgeworth...,gs1_026.txt
正直なところ、 これは‥‥イタイッス‥‥。,"I gotta admit, it doesn't look good, pal.",gs1_026.txt
あの‥‥イトノコ刑事さん。 “ヒョッシー”って知ってますか？,"Say, Detective Gumshoe. Do you know ""Gourdy""?",gs1_026.txt
