Japanese,English,Note
２月２３日　某時刻 証拠保管室前／警備室,February 23 Evidence Room Entrance Guard Station,gs1_048.txt
‥‥なんだ。この、きわめて シュミ性の強い空間は‥‥,What's with the decor in this place? It's very... eccentric.,gs1_048.txt
パンフレットによると、 《保管室前・警備室》ですけど。,"According to the pamphlet, this is the guard station for the evidence room.",gs1_048.txt
じゃあ、あのドアの向こうが 証拠保管室‥‥“殺人現場”か。,"So, beyond that door is the evidence room... the scene of the crime?",gs1_048.txt
そういうことになりますね。 ‥‥‥‥‥うううう‥‥‥‥‥,It sure seems that way... Oh. Ohhh...,gs1_048.txt
ど。どうしたの？,What's wrong?,gs1_048.txt
ヨコのサボテンくんの存在感に圧倒 されて、考えがまとまりません！,It's those cacti! They're so prickly... so imposing! It's hard to think straight.,gs1_048.txt
（やれやれ‥‥）,"(If you can't handle the cacti, stay out of the desert...)",gs1_048.txt
そもそも、警備室なのに、 どうして警備のヒトがいないんだ！,"What I want to know is, if this is a guard station, where is the guard?",gs1_048.txt
“警備のヒト”‥‥ だいたい、想像はつきますね。,I have a feeling I know who this guard is already...,gs1_048.txt
かなり、チクチクしますね。 ‥‥ホンモノかな、コレ。,"Yipes, that sure is prickly. It must be the real deal.",gs1_048.txt
このデカいのが１コあれば、 じゅうぶんだと思うけど。,I would think just one big one would be sufficient.,gs1_048.txt
この、サボテン。 ‥‥お姉ちゃん、みたいですね。,"This cactus... is a lot like my sister, actually.",gs1_048.txt
と、ともえさん‥‥？,M-Ms. Skye?,gs1_048.txt
冷たくてカタいカラをかぶって、 さらにトゲで身を守って‥‥,"Encased in a cold, rigid shell, with thorns pointing in every direction...",gs1_048.txt
お姉ちゃん、そっくり。,Just like her.,gs1_048.txt
悪いけど、どう見ても ともえさんには似てないよ。,"You know, I've been looking at this cactus a while now, and I don't see the resemblance.",gs1_048.txt
あたしも、フンイキで 言っちゃいました。,It's more an attitude thing than a physical similarity.,gs1_048.txt
証拠保管室の映像が 映し出されているみたいだ。,It looks like there's a video feed from the evidence room here.,gs1_048.txt
モニターの下に、 ランプが光ってますよ。,There's a light blinking below the monitor.,gs1_048.txt
《録画中》‥‥って 書いてあります！,"It says ""Recording""!",gs1_048.txt
このパソコンで、出入りするヒトを チェックしてたみたいですね！,I bet we could use this computer to check on who went in and out of here!,gs1_048.txt
警備員さんの服が つるしてあります！,There's a security guard uniform hanging here.,gs1_048.txt
“制服”じゃないコトは たしかだね。,"It looks more like a costume than a uniform, honestly.",gs1_048.txt
カワのジャンパーに、 カワのズボンに、カワの‥‥,"A leather jacket, leather pants, a leather...",gs1_048.txt
あれ。これ、なんでしたっけ！,What was that called again?,gs1_048.txt
パンチ‥‥ピンチ‥‥ペンチ‥‥ あ、ポンチ！,A punchy? A paunchy? A pinchy? I know! A poochy!,gs1_048.txt
ううん‥‥今ひとつ ピンと来ないなあ‥‥,"Hmm... Wait, maybe that wasn't it.",gs1_048.txt
（“ポンチョ”だけど、もう少し ダマっておこう‥‥）,"(It's a ""poncho,"" but I think I'll keep that information to myself for the time being.)",gs1_048.txt
こんなところに、 投げナワがありますよ。,"Look, on the floor, a lasso!",gs1_048.txt
‥‥なんか、“ワナ”っぽい ムードがただよってるなあ。,Hmm... looks like it's set up to trap something.,gs1_048.txt
ワナっぽい‥‥ねえ‥‥ あ！　できました！,"A trap, here? Wait, I know!",gs1_048.txt
《“ワナげ”な投げナワ》 ‥‥逆から読んでも同じです！,Maybe someone was trying to catch a wild bull in here... But the lasso missed!,gs1_048.txt
‥‥そりゃ、スゴイね。,You sure have an active imagination.,gs1_048.txt
このドアの向こうが 《証拠保管室》だね。,The evidence room is beyond that door.,gs1_048.txt
さあ、ハリきって行きましょう！,Let's just walk in!,gs1_048.txt
開かない。,It won't open.,gs1_048.txt
そりゃ、そうだろうね。,You thought it'd be open?,gs1_048.txt
（現場を調べるには、 だれかの協力が必要だな‥‥）,(I think we'd need someone's permission to go in there first...),gs1_048.txt
このドアの向こうが 《証拠保管室》だね。,The evidence room is beyond that door.,gs1_048.txt
ガント局長さんに ＩＤカードも借りてきたし。,And we have the ID card from Chief Gant!,gs1_048.txt
さあ、ハリきって行きましょう！,Let's just walk in!,gs1_048.txt
開かない。,It won't open.,gs1_048.txt
あ！　カード端末の 電源がオフになってるぞ。,"Ah hah! The card reader is turned off, see?",gs1_048.txt
もう！　警備のヒト、 ちゃんとシゴトしましょうよ！,What is that security guard thinking?,gs1_048.txt
わあ。西部のサルーンみたい！ この、スイングドア。,This swinging door makes the place look like some kind of saloon!,gs1_048.txt
でも‥‥クギで打ちつけてあるぞ。 入れないよ、これじゃ。,"But look, it's nailed shut. You can't get in that way.",gs1_048.txt
だってホラ。ここから入ったら、 サボテンが倒れてきて‥‥,Of course not! If you went in through here...,gs1_048.txt
チクッ、てなりますから。,The cactus would fall over. Ouch!,gs1_048.txt
‥‥“チクッ”じゃ すまないぞ、きっと。,"I'd say it'd be more of an ""Yeeeeaargh,"" myself.",gs1_048.txt
おやおや‥‥バンビーナが ごきげんナナメのようだよ。,"Howdy, pardners. Well, well, what's made my bambina's skies so gray?",gs1_048.txt
ざ、罪門さん！ （やっぱり、このヒトか‥‥）,"O-Officer Marshall! (Somehow, I knew...)",gs1_048.txt
なんだい？　その“やっぱり、 このヒトか‥‥”みたいな目は。,"What's that ""somehow I knew"" look for?",gs1_048.txt
‥‥お察しのとおり。 ここはオレのサルーンさ。,"As you may have surmised, this here's my saloon.",gs1_048.txt
あの‥‥あたしたち、 現場を調査したいんですけど。,Um... we're here to investigate the crime scene.,gs1_048.txt
ほお‥‥そのムネのカード。 新世界へのティケットかい。,Yeehaw! That card you got there on your chest.,gs1_048.txt
,That's better than a sheriff's badge in these parts.,gs1_048.txt
てぃけっと‥‥,Y-yeehaw?,gs1_048.txt
いいさ。サツジン現場で 開拓者気分を味わってくることさ。,"Well, what ya standin' there for? Get along, little dogies. The crime scene's a waiting!",gs1_048.txt
ピッ,*beep*,gs1_048.txt
（カードリーダーの 電源がもどったみたいだな）,(Looks like the card reader's on again.),gs1_048.txt
‥‥ついでに、お話を 聞かせていただけますか？,"While we're here, I was wondering if we could ask you some questions?",gs1_048.txt
悪いがカウボーイ。 キミたちの相手をする気はないさ。,"Sorry, cowboy, but I got no mind to tangle with you hombres.",gs1_048.txt
やっぱり‥‥忙しいんですか？,"You're... busy, then?",gs1_048.txt
そんなコトは言ってないだろう？,Did I say that?,gs1_048.txt
“相手をする気はない”‥‥ それだけのことさ。,I only said I didn't wish to speak with you.,gs1_048.txt
（やれやれ‥‥）,"(Actually, you said you had ""no mind to tangle with us hombres."")",gs1_048.txt
かなり、チクチクしますね。 ‥‥ホンモノかな、コレ。,This cactus sure is prickly. It must be real.,gs1_048.txt
ビリーに近づかないほうがいい。 ‥‥ケガ、するぜ。,Best keep your distance from Billy there. You're liable to get hurt.,gs1_048.txt
びりー‥‥ このサボテンのコトですか？,Billy... The cactus has a name?,gs1_048.txt
左ウデに、カウボーイハットを かぶってますね。ビリー。,"Billy, you're wearing your cowboy hat on your hand.",gs1_048.txt
ああ‥‥、そのカウスキンの ローハイドかい。,"Ah, my rawhide cow skin 10-gallon hat!",gs1_048.txt
買ったばかりだったんだけど。 ビリーが気に入ったみたいでね。,"I just picked that up, but Billy took a fancy to it.",gs1_048.txt
（‥‥トゲに引っかかって とれなくなったみたいだな）,(Looks like it got stuck on the thorns and he couldn't get it off.),gs1_048.txt
ずいぶんいっぱい モニターがありますね！,You sure have a lot of monitors in here!,gs1_048.txt
証拠保管室は、ゼンブで ８つ、あるからね。,There's eight cameras in the evidence room in all.,gs1_048.txt
１部屋に１つ、防犯カメラが 設置されているのさ。,One for each section.,gs1_048.txt
へえ‥‥。事件があった保管室の モニターは、どれですか？,Which monitor shows the section where the crime took place?,gs1_048.txt
そいつは‥‥“神のみぞ知る” ってヤツだな。,Why do cattle sit before the rains come? It's not for man to know.,gs1_048.txt
‥‥警備員シッカクですね、 罪門さん。,Unless you're the security guard responsible!,gs1_048.txt
カワのジャンパーに、 カワのズボンに、カワの‥‥,"A leather jacket, leather pants, and a leather...",gs1_048.txt
ズボンじゃないさ。チャップスに ‥‥そっちは、ポンチョだね。,"Those aren't pants, those are chaps. And that's a poncho up there.",gs1_048.txt
あ、それ！　ポンチョ！,Ah hah! A poncho!,gs1_048.txt
‥‥カッコいいけど、 名前はかわいらしいですね。,"It sure looks cool, but the name is a little silly.",gs1_048.txt
こんなところに、 投げナワがありますよ。,"Look, on the floor, it's a lasso.",gs1_048.txt
‥‥なんか、“ワナ”っぽい ムードがただよってるなあ。,Hmm... looks like it's set up to trap something.,gs1_048.txt
さっき、デカいウシを ひっとらえたぜ‥‥そのワナで。,I just roped me a steer with this here lasso.,gs1_048.txt
え！,What!?,gs1_048.txt
“もーッス！”“もーッス！” ‥‥しきりに、鳴いてたっけな。,"It was a' bellowing ""moo, pal! moo!""",gs1_048.txt
（イトノコ刑事か‥‥）,"(Detective Gumshoe, I presume...)",gs1_048.txt
このドアの向こうが 《証拠保管室》だね。,The evidence room is beyond that door.,gs1_048.txt
カードリーダーの電源は 入れておいたぜ。,I turned on the card reader.,gs1_048.txt
せいぜい、楽しんでくることさ、 カウボーイ！,"Go have yourself a ball, pardners!",gs1_048.txt
このＩＤカード、 あたしが借りたんですからね！,And I have the ID card! A real ID card!,gs1_048.txt
（‥‥早いトコ、現場を 調べたほうがいいかな‥‥）,(Let's get this investigation started already...),gs1_048.txt
わあ。西部のサルーンみたい！ この、スイングドア。,Look at this swinging door! Just a like a wild west saloon!,gs1_048.txt
おっと‥‥。 今日はもう、閉店だぜ。,"Ah... Sorry, pardner, but we're closed for the day.",gs1_048.txt
‥‥え。,Huh?,gs1_048.txt
早く帰ってくれねえかい、 アンタたち。,Y'all get along home now!,gs1_048.txt
お店のマスター気取りですね、 罪門さん。,I think Officer Marshall really wanted to be a wild west bartender.,gs1_048.txt
‥‥一度、このセリフが 言ってみたくてね。,I always wanted to say that.,gs1_048.txt
この先に、あたしたちの 新世界が広がっているワケですね！,"Beyond that door, a whole new world awaits us!",gs1_048.txt
‥‥殺人現場の証拠保管室、だね。,"Right, the evidence room where the murder took place...",gs1_048.txt
新世界へのティケットなら、 ここにありますし。,And our ticket to this new world is right here.,gs1_048.txt
‥‥局長さんから借りた お客さん用のＩＤ、だね。,The visitor's ID we borrowed from the Chief of Police I'm guessing...,gs1_048.txt
さあ。いざ！ このサルーンを出発しましょう！,Right! Let's leave this saloon behind us in the dust!,gs1_048.txt
（‥‥罪門巡査から、よくない 影響をモロに受けているな‥‥）,(She's definitely the impressionable type...),gs1_048.txt
‥‥あの。おハナシを うかがいたいんですけど‥‥,"Um, I was wondering if we could talk to you...",gs1_048.txt
悪いが、バンビーナ。,"Sorry, bambina.",gs1_048.txt
オレは今、タンブル・ウィードと ともに、荒野をかけめぐってるよ。,"But I'm off to roam the lands, like a tumbleweed on the wide prairie.",gs1_048.txt
ガンスリンガーが、マスケットに 弾丸をこめるよう、祈りながらね。,"Like a gunslinger loading his six-shooter, I say a little prayer.",gs1_048.txt
‥ぐぎゅるるぐぐ‥‥ぅぅ‥‥う‥,GRROOOOORRK,gs1_048.txt
‥‥で。ケッキョク、どういう コトですか？　成歩堂さん！,"What was that all about, Mr. Wright?",gs1_048.txt
ハラをすかせて、しゃべる気分じゃ ない。‥‥そういうコト、かな。,I think he was just too hungry to talk.,gs1_048.txt
それ‥‥、最後の“音”だけで キメつけてませんか？,You're just saying that because his stomach was growling!,gs1_048.txt
,You have no idea what he was talking about either!,gs1_048.txt
（‥‥とにかく、 なんとかしないとな‥‥）,"(Well, in any case, we need to get cracking on this investigation, pronto!)",gs1_048.txt
罪門さん。証拠保管室の 警備を担当してるんですよね？,"Officer Marshall, you're in charge of security for the evidence room, right?",gs1_048.txt
ダレにでもできる、ありがたい シゴトさ。‥‥よく知ってるね。,"You got good eyes, pardner. It's an easy job, and I'm grateful for it.",gs1_048.txt
留置所の、原灰巡査から 教えてもらいました。,"Actually, Officer Meekins at the detention center told us.",gs1_048.txt
ああ‥‥あの、 カワイソウなボウヤか。,"Ah, that poor little dogie?",gs1_048.txt
２回に１回は、自分の名前を “灰原”と書きまちがえる‥‥,"Poor guy, I keep getting his name wrong and calling him ""Meekly.""",gs1_048.txt
彼は‥‥こんなコトも 教えてくれました。,He told us something.,gs1_048.txt
事件があったとき、あなたは 警備室にいなかった‥‥と。,"He said that, when the stabbing occurred... you weren't at your station.",gs1_048.txt
こんなコト、言っちゃマズいが。,"Well, maybe I shouldn't be telling you this...",gs1_048.txt
今から、２年前。 捜査官からハズれてから‥‥,But since I got demoted from detective two years ago...,gs1_048.txt
見た目ほど、ヤル気マンマン ってワケじゃないんだよ。,"Well, it might not look it, but I lost my fire for the job, you know?",gs1_048.txt
あの‥‥何をしてたんですか？ 事件が起こった、５時１５分ごろ。,So... what were you doing around 5:15 when the murder took place?,gs1_048.txt
さあね‥‥。ジップ・コチーズ号で 街道をギャロップで流してたかな。,Well...,gs1_048.txt
,"I reckon I was galloping down the highway on the back of my steed, Zippy.",gs1_048.txt
‥‥名馬にまたがって 高速道路を走っていた、と。,"Note: he was riding down the highway on his horse named ""Zippy.""",gs1_048.txt
とりあえず、ここには ニンゲンは必要ないのさ。,"There's no need for people here, anyhow.",gs1_048.txt
最新のキカイたちが、キチンと 見張ってくれるらしいからね。,These newfangled machines do a bang-up job of keeping an eye on the place.,gs1_048.txt
最新のキカイ‥‥ “防犯システム”ですか。,You mean the security camera system?,gs1_048.txt
キカイ‥‥か。,I don't take to machines much.,gs1_048.txt
ステーキのヨコの、ゆでた ブロッコリーの次にニガテだよ。,"Kinda like that stewed broccoli they sneak in next to your steak, you know?",gs1_048.txt
おキョウさんから聞きました。,Ms. Starr told us something...,gs1_048.txt
罪門さん‥‥２年前まで 捜査官だったんだ、って。,She said that you were a detective until two years ago.,gs1_048.txt
“事件現場のブッシュワッカー” ‥‥荒野にうずめたユメのアトさ。,It was always my dream to be a rawhide wrangler on the scene of the crime...,gs1_048.txt
,That's all gone now... Like a drinking hole in a prairie fire.,gs1_048.txt
今も、調べてるんですよね。 ＳＬ９号事件‥‥おキョウさんと。,"You're still investigating the SL-9 Incident with Ms. Starr, aren't you?",gs1_048.txt
‥‥あれは、オレの事件だった。,That was my case...,gs1_048.txt
記録の上では《解決》している。 お得意のイカサマポーカーさ。,"It's all ""solved"" on the record books. But it smells like a bad game of poker.",gs1_048.txt
しかし。オレはナットクできない。 ‥‥それだけのコト、だよ。,I can't let it go...,gs1_048.txt
,That's all there is to it.,gs1_048.txt
あの。どんな事件だったんですか？ 《ＳＬ９号事件》って。,"What kind of case was it, anyway?",gs1_048.txt
名前だけ、よく聞くんですけど‥‥ ダレも教えてくれないんです。,"We've heard the name so many times, but no one tells us what actually happened.",gs1_048.txt
知らないほうがいいコトも あるよ、バンビーナ。,"There are some things you're better off not knowing, Bambina.",gs1_048.txt
それに‥‥あの事件は、２日前。 今度こそ、完全に死んじまった。,"Anyway, that case is officially dead as of two days ago.",gs1_048.txt
“２日前”‥‥ 事件があった日、ですか？,Two days ago... the day of our case!,gs1_048.txt
そう‥‥ 《証拠品の申し送り》さ。,That's right... The evidence transferals.,gs1_048.txt
（御剣も言ってたな ‥‥《申し送り》）,"(Edgeworth was talking about the transferals, too.)",gs1_048.txt
オレが知っているキカイは とりあえず、２つさ。,I know what maybe two of the machines in here do.,gs1_048.txt
と、“とりあえず”‥‥？,O-only two of them? There must be a dozen!,gs1_048.txt
言っただろ、バンビーナ。 オレにとってキカイは‥‥,"Like I said, bambina, Me and machines, well...",gs1_048.txt
ステーキのヨコの、ゆでた カリフラワーの次にニガテなのさ。,I like them about as much as I like stewed cauliflower with my steaks.,gs1_048.txt
まず。わかりやすいのは 《防犯カメラ》だろう。,The easiest ones to understand are these here security cameras.,gs1_048.txt
（ハラバイ巡査も言ってたな）,(Those are the ones that Officer Meekins mentioned.),gs1_048.txt
数時間ごとに、異常がなければ 消去されちまうらしいけどね。,"If nothing happens, the tapes are automatically erased every few hours.",gs1_048.txt
そのカメラに、映ってたんですか？ 原灰巡査と‥‥多田敷捜査官が。,"And Officer Meekins and Detective Goodman, are they on one of those tapes?",gs1_048.txt
‥‥たぶんね。,I reckon they might be.,gs1_048.txt
（セキニンシャが “たぶん”はないだろう‥‥）,"(You're the security guard and you ""reckon""!?)",gs1_048.txt
そして、もう１つ。,One more thing.,gs1_048.txt
証拠保管室に入るときには、 ＩＤカードが必要なんだよ。,When you go into the evidence room... You need an ID card.,gs1_048.txt
（たしかに‥‥ドアのワキに カードリーダーがあるな）,(Thus the card reader by the door.),gs1_048.txt
ＩＤカードを使うと、記録が残る。 ありがちだが‥‥わかりやすいさ。,The card reader leaves a record of every ID card passed through.,gs1_048.txt
（これが、ＩＤの使用記録‥‥）,(So this is the ID card record...),gs1_048.txt
あ‥‥‥あれ！ 見たことがあるナンバーが‥‥,Hey! I've seen that somewhere before!,gs1_048.txt
おっと‥‥！　これ以上は 見せられないな、バンビーナ。,"Sorry, Bambina. I can't show you more than that.",gs1_048.txt
え。,Huh?,gs1_048.txt
コイツが事件にカンケイするか‥‥ オレは聞かされてないからね。,"I haven't heard whether this is related to the case, yet.",gs1_048.txt
成歩堂さん！　今の記録。 見おぼえのあるナンバーが‥‥,Mr. Wright! I saw a number on that record just now! I've seen that number before!,gs1_048.txt
（使用記録と事件との“カンケイ” ‥‥つきつけてやるんだ！）,(Maybe there's some way I can prove that record is tied to the stabbing.),gs1_048.txt
すみませんけど‥‥そもそも、 《申し送り》って、なんですか？,"Sorry, but could you explain what this whole ""transferal"" thing is about?",gs1_048.txt
保管室には、解決した事件の 証拠品だけが眠っている。,We keep only evidence from solved cases in this room.,gs1_048.txt
それぞれの担当捜査官の管理で、 ２年間。ここに保管されるのさ。,They're kept here under the presiding detective's supervision for two years.,gs1_048.txt
万が一、解決がまちがっていた場合 ‥‥再捜査のためにね。,"So we can re-investigate them if it turns out there was a mistake, see?",gs1_048.txt
じゃあ、２年たった証拠品は どうなるんですか？,"So, what happens to the evidence after two years?",gs1_048.txt
警視庁の地下倉庫で、 永久に眠ることになる。,It goes to sleep forever in the underground vault at the Police Station.,gs1_048.txt
それが、《申し送り》ってヤツさ。 ‥‥年に一度、２月に行われる。,"That's what we call ""transferal."" We do it every February.",gs1_048.txt
そう、だったんですか‥‥,I see now...,gs1_048.txt
《申し送り》は‥‥そう。 事件の“葬式”とも言えるよ。,"""Transferal"" is like a funeral for old cases.",gs1_048.txt
解決から、２年が経過したとき。 その事件は完全に終わって、死ぬ。,Two years after a case is solved... it's closed forever. Dead.,gs1_048.txt
もう、追跡捜査をすることは できない。‥‥永久に。,Never to be reopened again. Never to be reinvestigated.,gs1_048.txt
（そして‥‥《ＳＬ９号事件》は ２日前、死んだワケか‥‥）,(And that happened to SL-9 two days ago...),gs1_048.txt
‥‥このニオイ。 テキサスを思い出すぜ。,That smell... Ah! Reminds me of Texas!,gs1_048.txt
罪門さん‥‥ テキサスのヒトだったんですか！,"So, Officer Marshall... You're from Texas?",gs1_048.txt
こないだテレビで見たさ。 ‥‥ベイビイからの差し入れかい？,"No, I just saw a special on television the other day. Is this from my baby?",gs1_048.txt
え、ええ。おキョウさんから‥‥,"Uh, yeah, Ms. Starr...",gs1_048.txt
こ‥‥コイツは‥‥ッ！,Wh-what's this!?,gs1_048.txt
ど、どうしました？,What? What's wrong?,gs1_048.txt
‥‥フィレ・ステーキ弁当‥‥！ そうか！　そういうコトかッ！,A filet steak lunch! I see... I see!,gs1_048.txt
‥‥どういうイミがあるのかな、 あのお弁当。,I don't see. I wonder what it means?,gs1_048.txt
罪門巡査に 《ステーキ弁当》をわたした。,Steak Lunch given to Officer Marshall.,gs1_048.txt
オーライ、バンビーナ。 アンタの勝ちだ。,"Alright, bambina. You win.",gs1_048.txt
なんでもぐもぐもぐもぐもぐもぐ。 聞いてごくごくごくごくごくごく。,Ask mmph mmph munch munch Anything mmph munch smack.,gs1_048.txt
（‥‥どうやら‥‥）,"(Finally, it seems like...)",gs1_048.txt
ハナシをしてくれる気に なったみたいですね！,He's willing to talk!,gs1_048.txt
‥‥ムカシ、テキサスの保安官は、 証拠品なんか信じなかった。,The sheriffs back in the wild west didn't place much faith in evidence.,gs1_048.txt
信じたのは‥‥自分の ウデっぷしだけ、だったのさ。,About the only thing they trusted was their shooting hand.,gs1_048.txt
あの。ここは“ムカシ”じゃないし “テキサス”でもないですけど‥‥,"Um... this is neither ""Wild"" nor ""West"" here...",gs1_048.txt
ハッ！　それとコレとは、 ハナシがちがうんじゃないかな？,Ah hah! But that and this are two different things entirely!,gs1_048.txt
ダメ。イミがわかりません。,I... guess so? Huh? I'm lost.,gs1_048.txt
（決定的にカンケイがある証拠品 以外、見せてもムダみたいだ）,(Looks like we need some evidence to get anywhere with this guy.),gs1_048.txt
これ、見てください！ 被害者のＩＤカードなんですけど。,See this? This is the victim's ID card.,gs1_048.txt
ああ。‥‥たしか、現場の 地下駐車場に落ちていたな。,"Ah, the one that was on the ground in the parking lot?",gs1_048.txt
