Japanese,English,Note
それが‥‥今から ２年前のコトだったんですね。,And this was two years ago?,gs1_048.txt
御剣検事は名を上げて‥‥ 同時に、黒い疑惑に包まれたッス。,That put Mr. Edgeworth right in the spotlight... and started the rumor-mill.,gs1_048.txt
（証拠品の“ねつ造”か‥‥）,Rumors... (About forged evidence?),gs1_048.txt
おとといの《申し送り》で、 完全にカタがつくはずだったッス。,"It was supposed to be all cleaned up with the ""transferal"" the other day.",gs1_048.txt
ケッキョク‥‥それが、最後の シゴトになっちまったッスね。,It was the last job he ever did...,gs1_048.txt
‥‥多田敷刑事の。,"Detective Goodman, that is.",gs1_048.txt
え‥‥ どういうコトですか？,Huh? What do you mean?,gs1_048.txt
《ＳＬ９号事件》の担当捜査官は、 被害者の多田敷　道夫だったッス。,"Detective Goodman was the detective in charge of the SL-9 Incident, see.",gs1_048.txt
じゃ、じゃあ‥‥あの、 飛び出しナイフは‥‥,"So, so... That switchblade knife...",gs1_048.txt
被害者自身が、証拠保管庫から 取りだしたもの、なのか‥‥？,The victim took the knife out of the evidence locker himself?,gs1_048.txt
刑事さん。ほら、これ。 弁護士がつけるバッジですよ。,Detective... here's my attorney's badge.,gs1_048.txt
‥‥アンタ、会うたびに 見せるッスね、それ。,"You show that to me every time we meet, pal.",gs1_048.txt
男はだまって警察手帳ッス！,Real men show their police badge. 'Nuff said!,gs1_048.txt
いいなあ。あたしも 早くほしいな、身分証明‥‥,I wish I had a badge... Even an ID card would be nice...,gs1_048.txt
事件の被害者・多田敷刑事の ＩＤカードッス。,"That's the victim, Detective Goodman's ID card.",gs1_048.txt
今日び、なんでもカードに暗証番号 ‥‥気が休まるヒマがないッス。,"These days, everything's cards and secret numbers. I can never relax!",gs1_048.txt
それは、イトノコ刑事が ぽろぽろ落とすからですよ。,That's only because you always lose your card.,gs1_048.txt
暗証番号もぽろぽろ忘れるッス。 ‥‥自分がコワくなるッス。,"I always forget my secret number, too. Scary, huh?",gs1_048.txt
ダレが見たって、自分は自分！ それでいいじゃないッスかッ！,My face should be ID enough! What's the world coming to!?,gs1_048.txt
（開きなおった‥‥）,"(Detective Gumshoe, rebel against the system.)",gs1_048.txt
御剣検事のクルマに、 御剣検事のナイフ‥‥,"Found in Mr. Edgeworth's car, stabbed with Mr. Edgeworth's knife, huh...",gs1_048.txt
どうして宝月主席検事殿は、 そんなコトをしたッスかねえ‥‥,What would drive Chief Prosecutor Skye to do such a thing?,gs1_048.txt
あ。あやや。も、モチロン！ ハンニンは、ベツのニンゲンッス！,"W-wait, I didn't mean... I mean, sure, of course someone else really did it!",gs1_048.txt
そのハンニンは、まるで‥‥,"Someone who must have, um...",gs1_048.txt
御剣検事に、ウラミでも あるみたいッスねえ‥‥,Someone who must have a grudge against Mr. Edgeworth!,gs1_048.txt
お、それ！,"Hey, that's it!",gs1_048.txt
御剣検事がもらった 《検事・オブ・ザ・イヤー》ッス！,"That's the ""King of Prosecutors"" award that Mr. Edgeworth got recently!",gs1_048.txt
授賞式、イトノコ刑事も 出席していたんですか？,"Were you at the awards ceremony, Detective Gumshoe?",gs1_048.txt
そりゃそッス！ 自分ももらったッスよ。努力賞。,"Of course, pal! I got an award for diligence, myself.",gs1_048.txt
はあ‥‥おめでとうございます。,Ah... congratulations.,gs1_048.txt
それにしても、 なんで《盾》なんですか？,"I was wondering, why is the award a shield?",gs1_048.txt
‥‥しかも、割れてるし。,And... why is it broken?,gs1_048.txt
それはモチロン、 ちゃーんと理由があるッス。,"Oh, there's a reason.",gs1_048.txt
ええと‥‥‥‥‥‥ また、今度教えてあげるッス。,Erm... I'll tell you what it is later.,gs1_048.txt
（忘れたらしいな、どうやら）,"(Apparently, he's forgotten.)",gs1_048.txt
この写真を、おキョウさんが‥‥,That's the photo that Ms. Starr took.,gs1_048.txt
何か、ココロ当たりありますか？,Anything you can tell us about it?,gs1_048.txt
スゴいヒトッス。おキョウさんは。 ‥‥この自分、１６才の冬‥‥,That Ms. Starr is quite the lady.,gs1_048.txt
,"Why, I remember it was winter... I was 16.",gs1_048.txt
あの事件をしゃべらされたのは、 あのヒトが最初で‥‥最後ッス。,She was the only one who ever got me to talk about what happened.,gs1_048.txt
１６才‥‥あたしと同い年だ。 何があったんだろ。,16... that's how old I am now! I wonder what happened?,gs1_048.txt
（‥‥イトノコ刑事も、 ムカシは高校生だったんだな）,"(I wonder if Detective Gumshoe wore a trench coat in high school, too.)",gs1_048.txt
あるイミ‥‥自分の代表作、ッス。 せいいっぱい、やってみたッス。,"This is my crowning achievement, my masterpiece, you might say.",gs1_048.txt
それなのに‥‥ゲージュツは やっぱり、リカイされにくいッス。,"But... art is always misunderstood, pal.",gs1_048.txt
げーじゅつ‥‥,Art...?,gs1_048.txt
授賞式当日も、彼はホコらしげに おどっていたッスが‥‥,He was dancing proudly on the day of the awards ceremony...,gs1_048.txt
式典が終わって、関係者の 出入りが多くなって‥‥,But there were a lot of people coming and going after the ceremony...,gs1_048.txt
一時的に、どこかに 持っていかれちゃったッス。,So they took the Blue Badger away for a while!,gs1_048.txt
あれ。そうなんですか。,Really? Why?,gs1_048.txt
‥‥“みっともない”から。 連中、そんなコト言ってたッス。,"Oh, they said it was ""shameful"" or something like that.",gs1_048.txt
“みっともない”ッスと！ 自分が、いっしょうけんめい‥‥,"""Shameful""! I toiled night and day...",gs1_048.txt
（まあ‥‥ あるイミ、しかたないよな）,(I sympathize with Detective Gumshoe... but I can see why they moved it.),gs1_048.txt
指紋が一致しないかぎり、 開けることはできないッス。,You can't open the lockers if your fingerprint doesn't match.,gs1_048.txt
開けることができたら‥‥ ５０円！　払うッス。,If you can open it... they'll give you 50 cents!,gs1_048.txt
‥‥警察にも、ゼッタイの 自信はないもよう、と。,Note: the Police Department lacks faith in its lock system.,gs1_048.txt
現に、事件が起こったとき、 保管庫を開けた多田敷刑事が‥‥,"After all, Detective Goodman was stabbed here after opening his locker...",gs1_048.txt
同じ時間に、検事局で 死体になったワケッスからねえ。,But at the same time he was found dead over at the Prosecutor's Office!,gs1_048.txt
これ‥‥見ていただけますか。,Could you take a look at this?,gs1_048.txt
事件当日、この現場に入った ヒトのＩＤなんですけど。,This is the ID card record of the people who came in here on the day of the stabbing.,gs1_048.txt
ああ。ウワサは聞いてるッス。,"Ah, I heard the rumors.",gs1_048.txt
事件の時間に保管室に入ったのは、 やっぱり多田敷刑事だった‥‥,"So, it was Goodman who came in here at the time of the murder...",gs1_048.txt
ああああああああああああああッ！,Whoooooooooah!!!,gs1_048.txt
ど、どうしたんですか‥‥？,Wh-what is it?,gs1_048.txt
こ、こ、こ、こ、こ、こ、こ、こ。 この、２番目の番号‥‥,Th-th-th-th-th-th! That second number...,gs1_048.txt
ま、まさか‥‥ イトノコ刑事のＩＤ、ですか‥‥？,"It's not your ID number is it, Detective Gumshoe?",gs1_048.txt
‥‥みつるぎけんじ‥‥,Mr. Edgeworth!,gs1_048.txt
え‥‥,What...?,gs1_048.txt
この、２番目の番号は‥‥ 御剣検事のものッスゥゥゥッ！,The second number on this list... belongs to Mr. Edgeworth!,gs1_048.txt
え‥‥‥えええええええええッ！,What... Whaaaaaaaaat!?,gs1_048.txt
証拠品《ＩＤカード使用記録》に データを追加した。,ID Card Record updated in the Court Record.,gs1_048.txt
（御剣が‥‥なぜ、保管室に？）,(Why would Edgeworth have come to the evidence room!?),gs1_048.txt
多田敷刑事のメモと、 この飛び出しナイフ‥‥,Detective Goodman's note... and that switchblade knife.,gs1_048.txt
きっと、イチバン驚いたのは 御剣検事だったッス。,I bet Edgeworth was the most surprised of anyone.,gs1_048.txt
《ＳＬ９号事件》‥‥ですか。,Because of the SL-9 connection?,gs1_048.txt
‥‥２年前。御剣検事が 初めて扱った、大きな事件ッス。,"That was Mr. Edgeworth's first big case you know, two years ago.",gs1_048.txt
検事の実力を、世間に見せつけた 最初の事件だったッスよ。,That was the first time the world knew Edgeworth was a man to be feared!,gs1_048.txt
でも‥‥その証拠品が、 なぜ、今になって‥‥？,"But, why would evidence from that case turn up now?",gs1_048.txt
やっぱり‥‥まだ。,"I guess it's not over, pal.",gs1_048.txt
あの事件は、カタがついてない。 そういうコトッスかねえ‥‥,Maybe there are some loose ends left on that case...,gs1_048.txt
イッピキの刑事として、 これだけは断言しておくッス！,"Allow me to say one thing, speaking as a detective.",gs1_048.txt
ココロ当たりのないモノには、 断固！　チンモクを守るッス！,"If I see a piece of evidence I know nothing about, I say nothing! Nothing!",gs1_048.txt
か、かまいませんよ、それで。,That's... fine.,gs1_048.txt
‥‥ホッ。,"You bet it's fine, pal!",gs1_048.txt
‥‥このカケラ‥‥もともとは、 どんなカタチだったのかな。,I wonder what shape these pieces were in before whatever it was broke?,gs1_048.txt
ちょっと、試してみましょうか。 ジッサイに作ってみて。,You want to try to put it back together?,gs1_048.txt
‥‥ハッ！ シロートには、ムリッス。,"Hah! Good luck, pal. That's no job for amateurs.",gs1_048.txt
なんせ、この自分が３時間かけても 歯が立たなかったッスからね！,"Why, I spent a good three hours on that before I had to give up!",gs1_048.txt
こんなこともあると思って、 ノリを持ち歩いてますからね！,That's why I always carry around a tube of glue!,gs1_048.txt
（どうやら、これが“底”だ。 ‥‥組み立ててみよう！）,"(Well, this piece looks like the bottom. Let's try putting the rest in place!)",gs1_048.txt
‥‥ダメだ！　どう考えても、 カケラが合わないよ！,It's no use. These pieces just don't add up to anything!,gs1_048.txt
もしかしたら、カケラが 足りないのかもしれませんね。,Maybe some of the pieces are missing?,gs1_048.txt
とにかく、できるところまで やってみましょうよ！,Let's just try to put as many of the pieces in place as we can!,gs1_048.txt
（‥‥また、あとで がんばってみようかな）,(Hmm... maybe I'll give it another shot later.),gs1_048.txt
あ、あれ‥‥‥,H-huh?,gs1_048.txt
いちおう、できたみたいだけど‥‥ 足りないみたいですね。カケラ。,"Well, I think we did it. But some of the pieces are missing.",gs1_048.txt
自分も、そこまでなら２分ッス。 モンダイは、そこからッスねえ‥‥,That only took me two minutes to do! The problem is finishing it!,gs1_048.txt
‥‥カケラ、 盗まれたんでしょうか？,Were some pieces stolen?,gs1_048.txt
それとも‥‥ 最初から、足りなかったのかな。,I bet they were missing to begin with.,gs1_048.txt
それにしても‥‥,Still...,gs1_048.txt
見ていて不安になるほど 不安定なツボ、ッスねえ。,It doesn't look like the most stable kind of jar.,gs1_048.txt
割れてトーゼン！　みたいな ふてぶてしさを感じます。,I kind of understand how it got broken.,gs1_048.txt
証拠品《不安定なツボ》のデータを 法廷記録にファイルした。,Unstable Jar added to the Court Record.,gs1_048.txt
‥‥‥！ こ。こんなところに、反応が！,Hey! A reaction!,gs1_048.txt
犯人がフツウに逃げたとしたら‥‥ こんなところ、さわるハズがない。,"If the criminal was running away normally, you wouldn't think they'd touch here...",gs1_048.txt
（何か、重要な手がかりになる ‥‥そう考えるべきだ！）,(This could be a big clue!),gs1_048.txt
あ、アンタ‥‥ すげェクスリ、持ってるッス！,"Hey, pal... Wow! That's some stuff you got there!",gs1_048.txt
あ、これですか？,"Oh, this?",gs1_048.txt
《ルミノール試薬》って いうんですよ！,It's called Luminol Testing Fluid!,gs1_048.txt
どこでッ！　いったい、 どこで売ってるッスかッ！,Where do they sell that?? Where!?,gs1_048.txt
え。,Huh?,gs1_048.txt
自分も買うッス！,"I want to buy some, too!",gs1_048.txt
局長に５０００円借りて、 買ってくるッス！,I'll go borrow $50 from the Chief and buy some now!,gs1_048.txt
どこで売ってるの？　これ。,"So, where do they sell it?",gs1_048.txt
‥‥さあ。あたし、いつも 通信販売で買ってますから。,"Well, I always order mine through magazine offers...",gs1_048.txt
（とりあえず、上面図に 書きこんでおこう‥‥！）,"(Let's mark this spot on the floor plans, shall we?)",gs1_048.txt
あ‥‥、やっぱり！ これって右手のアト、ですね！,Ah hah! Look!,gs1_048.txt
,It's a handprint! Someone's right hand touched here!,gs1_048.txt
なんッスとほほおおおおおおおッ！,Whaaaaaaaaaat!?,gs1_048.txt
ど、どうしたんですか？,What?,gs1_048.txt
コレ‥‥この、保管庫。 よりによって、自分のッス！,This... this locker! This is mine!,gs1_048.txt
え。刑事さんの‥‥？,"This is your evidence locker, Detective Gumshoe?",gs1_048.txt
あ、アンタ！　自分が‥‥ 自分がタイホされたときは！,"Hey, pal!When they... When they arrest me I want you to do me a favor, okay?",gs1_048.txt
ちゃんと証言してほしいッス！ “ニクめないヤツだった”‥‥と！,"I want you to testify for me, pal! Tell 'em I was the kind of guy everyone liked!",gs1_048.txt
（‥‥これは、重要な手がかりだ！ 上面図に書きこんでおこう‥‥）,(This is a major clue! Let's mark the position on our floor plans.),gs1_048.txt
ケーサツは信用できないッス！ ヨロシク証言、たのんだッスよ！,"You can't trust those police! You'll testify for me, right?",gs1_048.txt
刑事さんが言わないでください！,"But, you're a police officer, too, Detective Gumshoe!",gs1_048.txt
かなり出血があったみたいだ。 （こんなの、初めて見るぞ‥‥）,Someone lost a lot of blood here. (I've never seen anything like this!),gs1_048.txt
どう思いますか？　イトノコ刑事。 ぼく、シロートですから‥‥,"What's your opinion, Detective Gumshoe? I'm kind of an amateur in this field...",gs1_048.txt
うーム‥‥‥‥ 青白い血‥‥ッスか。,Well... The blood does look a little bluish.,gs1_048.txt
多田敷刑事は、もしかしたら‥‥ 宇宙人、だったッスかねえ。,"Maybe, just maybe... Detective Goodman was an alien!?",gs1_048.txt
でも、やっぱり‥‥この保管庫で 事件は起こったんですね。,"Whatever the case may be, it does look like the murder happened here.",gs1_048.txt
いちおう、上面図に 書きこんでおこうか。,Let's mark it on the floor plans.,gs1_048.txt
自分のスイリは ほったらかしッスかッ！,"So that's it, huh? You're just going to ignore my deductions!?",gs1_048.txt
２月２３日　某時刻 証拠保管室／第３号庫,February 23 Evidence Room Sector Three,gs1_048.txt
（さっきの調査で‥‥気になる “手のアト”があった）,(Our investigation turned up a suspicious handprint.),gs1_048.txt
この、刑事さんの保管庫に 付着した、血痕‥‥ですね。,"Here, in this blood on the detective's evidence locker.",gs1_048.txt
アイツから借りた、新兵器 ‥‥試してみよう！,Let's use the secret weapon we just borrowed!,gs1_048.txt
さあ、始めましょう！ まず‥‥指を選んでください。,Right. Let's get started! First... choose a finger.,gs1_048.txt
ユビ‥‥？,A finger...?,gs1_048.txt
５本それぞれ、指紋のつき方は ちがうハズですからね。,Each finger leaves behind a slightly different imprint.,gs1_048.txt
指紋がキレイに残っていそうな 指を選びましょうよ！,So let's choose the finger that will have left behind the clearest print!,gs1_048.txt
‥‥パッと見た感じ、 ちがいがわからないよ。,I really can't tell the difference at a glance...,gs1_048.txt
ぐずぐずモンクを言わないで、 さっさと１本、選ぶ選ぶ！,Quit procrastinating and choose a finger!,gs1_048.txt
よーし。じゃ、いよいよ 指紋の検出に移りますよ！,Okay. Now it's time to check for prints!,gs1_048.txt
ちょっと、あたしが やって見せてあげますね。,Let me show you how it's done.,gs1_048.txt
（なんか、イキイキしてきたぞ ‥‥あかねちゃん）,(Ema's starting to get that sparkle in her eyes...),gs1_048.txt
まず、アルミの粉を よーく、ふりかけます。,"First, we sprinkle the aluminum powder around.",gs1_048.txt
え！　ど、どうやって？,Huh? How do you do that?,gs1_048.txt
スクリーンに、トンって さわれば‥‥ホラ！,Just touch the screen... See?,gs1_048.txt
おお。‥‥ソレっぽいね、なんか。,Ah... it looks like that did the trick.,gs1_048.txt
アルミ粉は、指紋にカンゼンに 吸着するんです。,The aluminum powder adheres completely to the print.,gs1_048.txt
いい具合に、アルミ粉を トントンって、ふりかけたら‥‥,Once the powder is well spread...,gs1_048.txt
よぶんなコナを 吹きとばしちゃってください。,just blow away the excess.,gs1_048.txt
え！　ど、どうやって？,Huh? How do I do that?,gs1_048.txt
ジッサイに、 息を吹きかけるんですよ。,You just blow. With your breath.,gs1_048.txt
ふーっ、て。‥‥ホラね！,Imagine you're blowing out the candles on a birthday cake. See?,gs1_048.txt
おお。‥‥楽しそうだね！ （なんか、抵抗があるケド‥‥）,Wow... that looks like fun! (It might take some getting used to though...),gs1_048.txt
大丈夫。　ハナに入ったり しませんから。,It's fine! It won't go up your nose or anything.,gs1_048.txt
ほどよくコナをふりかける。 よけいなコナを吹きとばす。,"You just pour the powder on thick, and blow away the extra!",gs1_048.txt
‥‥指紋検出のキホンです！,"Those are the basics of fingerprinting, Mr. Wright!",gs1_048.txt
（やってみるしかないな、 コレばっかりは‥‥）,(I guess I'd better give it a try...),gs1_048.txt
（‥‥他の指紋を試してみたいな）,(I think I'd like to try one of the other fingerprints.),gs1_048.txt
じゃあ、ベツの“指”に 変えてみましょうか！,"Okay, let's move on to a different finger!",gs1_048.txt
あ！　やりました！ 検出できたみたいですね！,Aha! You did it! You found one!,gs1_048.txt
でも‥‥‥コレ。 どう見ても“指紋”じゃないよ。,But... this looks nothing like a fingerprint.,gs1_048.txt
う、うーん‥‥ たしかにそうですね。,"Hmm... Now that you mention it, I guess it doesn't...",gs1_048.txt
どういうことかな。,What does it mean?,gs1_048.txt
どうやら‥‥‥ハズレだった、 というコトじゃないでしょうか。,It think it means... we're out of luck.,gs1_048.txt
ハズレ‥‥？,Out of luck...?,gs1_048.txt
この“手のアト”のヌシは、 手袋をしていた、ってコトですね。,The person who left this handprint must have worn gloves.,gs1_048.txt
ここまでやらせといて、 そりゃないだろう！,Don't tell me we've been wasting our time here!,gs1_048.txt
まま。こんなもんですよ、 カガク捜査なんて。,"Hey, calm down. That's just the way it goes sometimes with scientific investigations.",gs1_048.txt
でも‥‥そうですね。,But... it does seem a shame.,gs1_048.txt
せっかくだから、 他の指紋を探してみましょうか。,"While we're at it, why don't we look for other prints?",gs1_048.txt
他の‥‥？,Other prints...?,gs1_048.txt
保管庫のトビラを、もう一度 よーく見ると‥‥,Looking at the locker door again closely...,gs1_048.txt
“血のアト”以外の部分にも、 ユビの跡が残ってますよね？,it seems like there are fingerprints outside the bloody handprint as well.,gs1_048.txt
いちばんハッキリ残っている 指紋を検出してみましょう！,Let's see if we can find a clear print!,gs1_048.txt
（“血のアト”以外の、 ユビの跡、ねえ‥‥）,(Hmm... fingerprints outside the blood...),gs1_048.txt
きゃあ！　ウットリするほどに ミゴトな指紋ですね！,Yay! A print so clear it's dazzling!,gs1_048.txt
う、うっとり‥‥？,D-dazzling...?,gs1_048.txt
それじゃ、セッカク検出した 指紋ですからね。,"Anyway, this print took a lot of effort to find.",gs1_048.txt
さっそく、 《照合》してみましょう！,Let's match it up right away!,gs1_048.txt
まだ、あるんだ。 ‥‥いろいろ、タイヘンだなあ。,So we're not done yet? This is quite a process...,gs1_048.txt
まあ、セッカク 指紋を検出しても‥‥,"Well, there's no point in finding a fingerprint...",gs1_048.txt
持ち主がわからなくちゃ、 イミがないですからねー。,"and not knowing who the owner is, right?",gs1_048.txt
（そりゃ、そうか‥‥）,(I guess she's right...),gs1_048.txt
御剣検事さんからもらった、 関係者の指紋データを見て‥‥,Look at the fingerprint data we got from Mr. Edgeworth...,gs1_048.txt
指紋のヌシだと思われるヒトを、 ズバリ！　指摘してください！,and point out the person you think left these prints!,gs1_048.txt
え‥‥！　そんなの、 わかるワケないじゃないか。,Huh? How am I supposed to know who it was?,gs1_048.txt
そんなコトないと思いますよ。,I could make a pretty good guess.,gs1_048.txt
“血のアト”と合わない以上、 この指紋は事件と無関係です。,The bloody handprint and the fingerprints are in different places right?,gs1_048.txt
‥‥と、なれば。,That means that the prints probably don't have anything to do with our case.,gs1_048.txt
この保管庫に、イチバン指紋が 残りそうな人物は‥‥？,"So, whose fingerprints would we most likely find on this evidence locker?",gs1_048.txt
（‥‥考えてみよう。 この指紋の持ち主は‥‥）,(Let me think... who could have left these prints...?),gs1_048.txt
‥‥一致しませんでしたね。,Hmm... no match.,gs1_048.txt
だって‥‥こんなの、 わかるハズがないよ。,C'mon! How am I supposed to guess whose they are?,gs1_048.txt
そうでしょうか‥‥,Isn't it obvious?,gs1_048.txt
血痕と位置が合わない以上、 指紋は、事件と無関係ですよね？,The bloody handprint and the fingerprints are in different places right?,gs1_048.txt
だとすれば‥‥,That means that the prints probably don't have anything to do with our case.,gs1_048.txt
この指紋は、保管庫のヌシのモノで ある可能性が高いハズです。,They most likely belong to the owner of this evidence locker.,gs1_048.txt
ど、どうしましたか？,S-something wrong?,gs1_048.txt
そこまでわかってるのなら、 やってくれればいいのに。,"I was just thinking, if you're so sure who it is, why don't you match the fingerprints?",gs1_048.txt
成歩堂さんッ！,Mr. Wright!,gs1_048.txt
あたしは、これから先のコトを 思って、わざわざ‥‥,"I was doing this for your benefit, so you'd learn!",gs1_048.txt
わわ、わかりました！,"F-fine, fine!",gs1_048.txt
やっぱり！,Ah hah!,gs1_048.txt
この指紋、イトノコ刑事さんの ものだったんですね！,So these prints belonged to Detective Gumshoe!,gs1_048.txt
どうしました？　成歩堂さん。,"Something wrong, Mr. Wright?",gs1_048.txt
“だからなんだよ”みたいな カオして。,"You gave me this ""so what?"" look.",gs1_048.txt
まあ‥‥“だからなんだよ”って 思ってるからね、ジッサイ。,"I guess that's probably because I was thinking ""so what?""",gs1_048.txt
まあ。今回はカラぶりでしたけど、 次があるじゃないですか！,"Okay, so we came up with nothing this time, but there's always next time!",gs1_048.txt
成歩堂さんのトモダチでしょ？ “カラぶり”と“ドシャぶり”は。,"Sometimes you hit, sometimes you miss!",gs1_048.txt
気にしない気にしない！,"You gotta roll with the punches, Mr. Wright!",gs1_048.txt
