Japanese,English,Note
うーん‥‥ 自分で書くかあ。,So that's why the sauce is so salty...,gs1_070.txt
な、なんだ‥‥？ （リストのウラに、ラクガキが！）,I wonder what this is? (It looks like someone drew some kind of sketch here!),gs1_070.txt
なんですか！　ナニか ありましたか？　成歩堂さん！,What is it? Did you find something?,gs1_070.txt
（なんとも判断しにくい絵だけど ‥‥今は、ヒミツにしておこう）,(I can't make it out. I'd better keep quiet about it for now.),gs1_070.txt
い、いや。なんでもないよ。,"Huh? Oh. No, it's nothing.",gs1_070.txt
成歩堂さん、目が泳いでます‥‥,"Why are your eyes moving about like that, Mr. Wright?",gs1_070.txt
（この絵のコト‥‥ 覚えておいたほうがいいな！）,(I'd better not forget about this picture!),gs1_070.txt
証拠品リストのウラに、 マジックで描かれた絵。,A picture is drawn on the back of the evidence list in magic marker.,gs1_070.txt
‥‥なんか、とてつもなく イヤな予感がする‥‥,I've got a very bad feeling about this...,gs1_070.txt
うわ。こんなところに 反応しましたよ！,Wow! We got a reaction!,gs1_070.txt
キレイに血がついてるね。 サボテンのトゲのまわりに。,Hm. There's clearly blood around the thorns here.,gs1_070.txt
この部屋、ちらかってるから。 何かにつまづいて‥‥,This room's pretty messy. Someone must have tripped over something...,gs1_070.txt
ぐさっと、ヒタイでも 突き刺さったんじゃないかな。,and planted their head right in these thorns.,gs1_070.txt
あるイミ、サツジンより イタい事件ですよね。,I think that might be more painful than being murdered.,gs1_070.txt
きゃあ！ こんなに、たくさん‥‥,Whoa! This area must have been covered in blood!,gs1_070.txt
やっぱり、あの事件の‥‥？,Is this from that incident?,gs1_070.txt
罪門　直斗検事さんが 殺害されたときのもの、ですよね。,It must be. When Prosecutor Neil Marshall was murdered.,gs1_070.txt
２年もたっているから、 かなり反応がウスくなっています。,"Two years have passed, so the reaction's kind of dull.",gs1_070.txt
（この場所で事件が起こった、 というワケか‥‥？）,(So a murder really did take place here.),gs1_070.txt
こ。こんなところに ぽたぽたと、血がっ！,What? It looks like some blood has dripped down here!,gs1_070.txt
この、量‥‥ 鼻血、かもしれないね。,"Judging by the amount, my guess is it's from a nosebleed.",gs1_070.txt
はなぢ‥‥,"A nosebleed, hm?",gs1_070.txt
もしかしたら、御剣検事さん。,"Maybe in his wrath,",gs1_070.txt
デキのワルい部下の ほっぺをビンタした、とか。,Mr. Edgeworth slapped someone for their incompetence.,gs1_070.txt
（デキのワルい部下‥‥ 思い当たる人物が１人、いるな）,(Why does Detective Gumshoe's face come to mind...?),gs1_070.txt
‥‥‥！ こ。こんなところに、反応が！,Why am I getting a reaction here?,gs1_070.txt
犯人がフツウに逃げたとしたら‥‥ こんなところ、さわるハズがない！,There's no reason for the murderer to touch this spot if he fled out the door.,gs1_070.txt
（何か、重要な手がかりになる ‥‥そう考えるべきだ！）,(This just might be something significant!),gs1_070.txt
あ、アンタ‥‥ すげェクスリ、持ってるッス！,Hey...,gs1_070.txt
,"That's some pretty amazing stuff you got there, pal!",gs1_070.txt
あ、これですか？,"What, this?",gs1_070.txt
《ルミノール試薬》って いうんですよ！,"It's called ""Luminol Testing Fluid""!",gs1_070.txt
どこでッ！　いったい、 どこで売ってるッスかッ！,Where'd you get your hands on that!?,gs1_070.txt
え。,Huh?,gs1_070.txt
自分も買うッス！,I'd like to get some too!,gs1_070.txt
局長に５０００円借りて、 買ってくるッス！,I'll just borrow 50 bucks from the Chief!,gs1_070.txt
どこで売ってるの？　これ。,"Where do you get this, Ema?",gs1_070.txt
‥‥さあ。あたし、いつも 通信販売で買ってますから。,I always buy it by mail order.,gs1_070.txt
（とりあえず、上面図に 書きこんでおこう‥‥！）,"(Well, I'd better jot this down on the floor plans.)",gs1_070.txt
あ‥‥、やっぱり！ これって右手のアト、ですね！,I knew it! This is someone's right handprint!,gs1_070.txt
なんッスとほほおおおおおおおッ！,WHAAAAAAT!!?,gs1_070.txt
ど、どうしたんですか？,"What's the matter, Detective?",gs1_070.txt
コレ‥‥この、保管庫。 よりによって、自分のッス！,Th-this locker... It's mine!,gs1_070.txt
え。刑事さんの‥‥？,It's yours?,gs1_070.txt
あ、アンタ！　自分が‥‥ 自分がタイホされたときは！,Please!,gs1_070.txt
,You have to help me... When they come to take me away...,gs1_070.txt
ちゃんと証言してほしいッス！ “ニクめないヤツだった”‥‥と！,Promise you'll testify that I wouldn't harm a fly!,gs1_070.txt
,"You'll do that for me, won't you, pals!?",gs1_070.txt
（‥‥これは、重要な手がかりだ！ 上面図に書きこんでおこう‥‥）,(This is an important clue! I'll jot it down on the floor plans...),gs1_070.txt
ケーサツは信用できないッス！ ヨロシク証言、たのんだッスよ！,"I'm counting on you guys! Believe me, you can't trust the police!",gs1_070.txt
刑事さんが言わないでください！,What? But you're a detective!,gs1_070.txt
かなり出血があったみたいだ。 （こんなの、初めて見るぞ‥‥）,There must have been a massive amount of blood here. (I've never seen so much before...),gs1_070.txt
どう思いますか？　イトノコ刑事。 ぼく、シロートですから‥‥,"I'm not a professional. What's your opinion, Detective?",gs1_070.txt
うーム‥‥‥‥ 青白い血‥‥ッスか。,Hmm... Pale blue blood...,gs1_070.txt
多田敷刑事は、もしかしたら‥‥ 宇宙人、だったッスかッ！,Maybe Detective Goodman...,gs1_070.txt
,was actually an alien?,gs1_070.txt
とにかく、やっぱり‥‥事件は この保管室で起こったんですね。,This proves that something really happened in front of this locker.,gs1_070.txt
いちおう、上面図に 書きこんでおこうか。,I'll make a note of it on the floor plans.,gs1_070.txt
自分のスイリは ほったらかしッスかッ！,"Hey! If you didn't want my opinion, you shouldn't have asked!",gs1_070.txt
この、血‥‥やっぱり、 ともえさんが‥‥,This blood must be from when Lana...,gs1_070.txt
お‥‥お姉ちゃんは ハンニンじゃありません！,No! My sister isn't the murderer!,gs1_070.txt
でも‥‥きみに電話を かけてきたんだよね？,"But she did call you, didn't she?",gs1_070.txt
事件が起こった時間に。,At the time of the crime?,gs1_070.txt
うううう‥‥,,gs1_070.txt
ジッサイ、右手に 包帯を巻いていたわけだし。,And her right hand is bandaged.,gs1_070.txt
もう！　成歩堂さん、 どっちのミカタなんですかっ！,Hey! Just whose side are you on!?,gs1_070.txt
そ、そういう モンダイじゃないよ‥‥,"This has nothing to do with ""taking sides.""",gs1_070.txt
（ともえさんの手‥‥ 血でよごれていたことになる）,(So... This means that Lana's hand had blood on it.),gs1_070.txt
（やっかいだな‥‥）,(This just keeps getting worse...),gs1_070.txt
（‥‥他の指紋を試してみたいな）,(I think I'd like to try one of the other fingerprints.),gs1_070.txt
じゃあ、ベツの“指”に 変えてみましょうか！,"Okay, let's move on to a different finger!",gs1_070.txt
うーん‥‥ いちおう、検出してみたけど。,Hmm... I gave it my best shot.,gs1_070.txt
これじゃ、さすがに 照合のデータになりませんね。,"That kind of result won't be any good for matching prints, will it?",gs1_070.txt
でも。この指紋、これ以上キレイに 検出するのは、ムリみたいだよ？,But it doesn't look like we'll get a clearer result from this print.,gs1_070.txt
じゃあ。気分をかえて、 他のユビを調べてみましょうか！,"Ok, let's try a different finger, then!",gs1_070.txt
