Japanese,English,Note
‥‥なんか、カドの立つ なぐさめかただなあ。,Thanks for the sympathy.,gs1_048.txt
（でも‥‥たしかに。 この部屋には、もう１つ‥‥）,(Wait... If I remember correctly...),gs1_048.txt
（“手のアト”があった。 ‥‥調べてみよう！）,(there was one other handprint in this room. Let's check it out!),gs1_048.txt
たしか‥‥ここに、 ルミノール反応があったよね。,"This is where we got a luminol fluid reaction, right?",gs1_048.txt
あ、そうだ！ “手のアト”がありました！,Right! There was a handprint here!,gs1_048.txt
じゃあ、じゃあ、 コレ、使ってみますか？,Okay! Want to try using this?,gs1_048.txt
（目つきが変わってる。 キケンだな‥‥）,(There go her eyes sparkling again...),gs1_048.txt
‥‥いや。ここはあえて やめておこうか。,"Actually, let's not check.",gs1_048.txt
えー！　なんでですか！,What!? Why not!?,gs1_048.txt
あんまりジラすと、このコナ、 アタマからブチまけますからね！,Try my patience any longer and I'll dump this powder over your head!,gs1_048.txt
（‥‥早めにとったほうが いいかもしれないな‥‥）,(Hmm... maybe I better check for those prints after all.),gs1_048.txt
‥‥よし。指紋を検出してみよう！,"Okay, let's check for prints!",gs1_048.txt
そう来なくっちゃ！,That's the spirit!,gs1_048.txt
あ！　でも、今回は、 １つ注意しなくちゃ！,Oh! But I have to warn you about something first.,gs1_048.txt
え‥‥？,What?,gs1_048.txt
ここの血のアト、ふきとられて いたわけですよね？,"The area with the blood was wiped away, right?",gs1_048.txt
‥‥ああ。クスリの反応で 見つけたワケだからね。,We only ended up finding it using chemical means.,gs1_048.txt
つまり‥‥その部分の指紋も、 ふき取られているワケです。,Any prints in that area will have been wiped away too.,gs1_048.txt
あ‥‥そうか。,Oh... right.,gs1_048.txt
じゃあ‥‥“指紋はない”って コトじゃないか。,So... that means no prints.,gs1_048.txt
そのカクリツは、カガク的に考えて 高いと言わざるを得ませんか？,Would you say the probability of your hypothesis is high?,gs1_048.txt
ぼ、ぼくに聞くなよ！,D-don't ask me!,gs1_048.txt
とにかく。“ふき取られていない” 指紋を探しましょう！,Anyway... We must try to find prints that weren't wiped away.,gs1_048.txt
（“手のアト”以外に残された 指紋、か‥‥）,(Prints other than the ones left by the bloody hand...),gs1_048.txt
こ‥‥この指紋‥‥,"Hey, these fingerprints, they...",gs1_048.txt
だ、ダレですか！ あたしの知ってるヒトですか！,Whose are they? Whose!? Is it someone I know?,gs1_048.txt
ざ‥‥‥‥‥罪門　恭介‥‥！,It's Officer Marshall!!!,gs1_048.txt
え。ざ、罪門さん‥‥？,Huh? O-Officer Jake Marshall!?,gs1_048.txt
証拠品《罪門の指紋》のデータを 法廷記録にファイルした。,Marshall's Fingerprints added to the Court Record.,gs1_048.txt
そ、そんな！　グーゼンです！ 事件とはカンケイありません！,Th-that's got to be a coincidence! He's not involved in the crime!,gs1_048.txt
‥‥あかねちゃん。,Ema.,gs1_048.txt
これは‥‥イトノコ刑事の指紋とは 決定的に、違うポイントがあるよ。,This are decidedly different from Detective Gumshoe's prints.,gs1_048.txt
‥‥！,,gs1_048.txt
ルミノール反応‥‥血のアトと、 指紋の位置が、一致している。,The luminol reaction. The blood and the fingerprints are in the same place.,gs1_048.txt
あ‥‥ああッ‥‥！,Oh... Oh!!!,gs1_048.txt
（ふきとられた、血のアト‥‥ そこに、罪門　恭介の指紋が！）,"(So, we have Jake Marshall's fingerprints... on a wiped bloodstain!)",gs1_048.txt
罪門さんが、どうして‥‥,But why would Officer Marshall...,gs1_048.txt
どうやら‥‥長かった調査にも、 やっと、コタエが出たみたいだ。,It looks like our investigation is finally turning up some results!,gs1_048.txt
‥‥！,,gs1_048.txt
こういうのを‥‥“決定的な証拠” っていうんじゃないのかな。,"I guess this is what you'd call ""decisive evidence""!",gs1_048.txt
そ、そんな！ 罪門さんが‥‥どうして‥‥‥,I... I don't believe it!,gs1_048.txt
つづく,To be continued.,gs1_048.txt
