Japanese,English,Note
へえ‥‥バッジのウラって、 こうなってるんですね！,So this is what the back of the badge looks like!,gs1_070.txt
あたし、安全ピンだと 思ってました！,And I always thought it had a safety pin!,gs1_070.txt
バッジには、ナンバーが 刻まれているからね。,Each badge has a number carved into it.,gs1_070.txt
他の弁護士がつけることは できないんだ。,"That way, you can tell which attorney it belongs to.",gs1_070.txt
じゃあ、《ニセ弁護士あらわる！》 ‥‥なんてコト、ないんですね。,You mean you couldn't lend your badge to anyone?,gs1_070.txt
すぐにバレるんじゃないかな。 ニセモノなんて。,"No, I'd be found out right away.",gs1_070.txt
なーんだ。 つまんないなあ‥‥,Well that's no fun!,gs1_070.txt
バッジのウラには、 ナンバーが刻まれている。,A number is engraved on the back of the badge.,gs1_070.txt
‥‥どうせなら、名前を 刻んでくれればいいのに‥‥,I wish they'd put my name on it instead...,gs1_070.txt
名前と、ＩＤナンバーが 書きこまれているね。,A name and ID number are written here.,gs1_070.txt
"《捜査官：多田敷　道夫 ＩＤ　：５８４２１８９》 ID# 5842189""","""Detective Bruce Goodman,",gs1_070.txt
でも。どうして《ＩＤ》って 番号ばっかりなんでしょうね。,I wonder why they only use numbers for IDs.,gs1_070.txt
‥‥どういうこと？,What else would they use?,gs1_070.txt
あたし。『ひらがな』だって、 人類の偉大な発明だと思うんです。,"Letters, silly! They're the reason we have a written language in the first place!",gs1_070.txt
はあ。,True...,gs1_070.txt
《捜査官：多田敷　道夫 ＩＤ　：ぬむろふへもこ》,"""Detective: Bruce Goodman, ID: YABADAB""",gs1_070.txt
‥‥とか。どう思います？,See? Wouldn't that be better?,gs1_070.txt
《ぬむろふへもこ》‥‥ なんか、おぼえやすいね。,"""YABADAB""? Well, it does have a certain ring to it...",gs1_070.txt
ですよね！　ですよね！ ‥‥ふふん。,Exactly my point! Tee-hee!,gs1_070.txt
（ゴキゲンになった）,(It doesn't take much to amuse her.),gs1_070.txt
名前と、ＩＤナンバーが 書きこまれている。,His name and ID number is written on it.,gs1_070.txt
"《捜査官：多田敷　道夫 ＩＤ　：５８４２１８９》 ID# 5842189""","""Detective Bruce Goodman,",gs1_070.txt
‥‥被害者のヒトの血、 ですよね。,"This must be the victim's blood, right?",gs1_070.txt
リンゴをむいてて、指を 切ったワケじゃなさそうだね。,"Either that, or Edgeworth cut himself peeling an apple.",gs1_070.txt
それにしても、御剣のヤツ。 ブッソウなナイフを持ってるなあ。,What's Edgeworth doing with a knife like this anyway?,gs1_070.txt
週末は、ヤマにこもって 『サバイバル』してるのかも！,Hey! Maybe he spends his weekends roughing it in the wild!,gs1_070.txt
たき火のそばに座って、 リンゴむいたりしてね。,Edgeworth? In the wild? I think my fruit-peeling theory is more likely.,gs1_070.txt
もう！　御剣検事さんといえば、 もっとワイルドなイメージですっ！,Are you kidding? I always pictured him as an outdoorsman!,gs1_070.txt
（そうかなあ‥‥）,(Now there's a scary thought...),gs1_070.txt
被害者・多田敷　道夫の血液が 付着している。,The victim Bruce Goodman's blood still remains on the blade.,gs1_070.txt
‥‥このナイフのニギリ‥‥ 服の色と合わせているのかな。,I wonder if Edgeworth got this knife because the handle matches his clothes...?,gs1_070.txt
こんなところに、金属の プレートがハマってますよ！,"Hey, check it out! There's a metal plate here!",gs1_070.txt
どうやら、歴代の受賞者の 名前が刻まれているみたいだ。,Hm. It looks like the names of all the previous recipients are engraved on it.,gs1_070.txt
‥‥なんか、やたら同じヒトの 名前が並んでますね。,Wow. One guy's listed a bunch of times!,gs1_070.txt
なんて読むんでしょうね、コレ。 えーと。《かり‥‥ま》かな？,"""von Karma""... I guess he must be a foreigner?",gs1_070.txt
まあ‥‥ そんなトコじゃないかな。,"Uh, yeah. That's probably it.",gs1_070.txt
わあ！　すごいんですねー。 かりま検事さん。,"Well wherever he's from, he must have been an amazing prosecutor!",gs1_070.txt
一度、会ってみたいです！ かりま検事さんに。,"I'd like to meet this Mr. ""von Karma"" sometime!",gs1_070.txt
（‥‥連呼されると、ちょっと おもしろいな。かりま検事）,"(When she says it, his name does have kind of a ring to it...)",gs1_070.txt
《検事・オブ・ザ・イヤー》 歴代の受賞者が刻まれている。,"""King of Prosecutors."" The names of past recipients are etched on the plate.",gs1_070.txt
ならんでいる“狩魔　豪”の名前 ‥‥なんか、ヒニクに見える。,Manfred von Karma's name appears here too... How ironic.,gs1_070.txt
うわ。ジミなストラップですねー。,"Man, what a boring strap!",gs1_070.txt
いいんじゃないかな。 好きずきだし。,"What's wrong with it? Everyone has different tastes, you know.",gs1_070.txt
ちなみに。あたしのストラップ、 《小江戸剣士・ヒメサマン》です！,"Here, check out mine. It's a Pink Princess strap!",gs1_070.txt
なかなか手に入らないんですよ！ いいでしょ。,"These are hard to come by, you know.",gs1_070.txt
（やれやれ。あいかわらず、 はやってるみたいだな‥‥）,(I see he's as popular as ever with the kids...),gs1_070.txt
ちなみに、ぼくの携帯電話には ストラップがついていない。,"Come to think of it, I don't have a strap on my mobile phone at all.",gs1_070.txt
‥‥よけいなものをつけるのが メンドくさいんだよな。,I hate having useless things dangling off it.,gs1_070.txt
（‥‥もう、 押す必要はないだろう）,(There's no need to push this again.),gs1_070.txt
どうしたんですか？ ムズカシイ顔、して。,What's wrong? You look like I do during finals!,gs1_070.txt
‥‥いや。 なんでもないよ。,Never mind. It's nothing.,gs1_070.txt
リダイヤルボタン。最後に 通話したナンバーを呼び出す。,The redial button. It dials the number of the last person called.,gs1_070.txt
‥‥あかねちゃんだ。 いったい、何を話したのか‥‥？,The last call was to Ema. I wonder what they spoke about...?,gs1_070.txt
‥‥あれ。なんか、文字を 消したアトがありますよ。,"Hey, look here! It looks like something's been erased.",gs1_070.txt
へえ。イトノコ刑事あての 手紙かなんか、だったのかな。,Maybe it was a letter or something to Detective Gumshoe.,gs1_070.txt
ええと‥‥ 《賞与：２４００円在中》,"Let's see... ""Annual bonus: $20.""",gs1_070.txt
あの。コレ‥‥ ゼロが何個か足りませんよね。,Um... I think a couple zeros are missing.,gs1_070.txt
こんなモンじゃないのかな。 （あの刑事さんの場合‥‥）,"No, that sounds about right. (At least in that detective's case...)",gs1_070.txt
‥‥オトナになるのが イヤになってきました。,Maybe I should rethink my career as an investigator.,gs1_070.txt
この、血‥‥ お姉ちゃんのもの、なんですね。,"This blood... It's my sister's, right?",gs1_070.txt
そうみたいだね。,It appears so.,gs1_070.txt
（留置所で見た、ともえさんの 右手の包帯‥‥）,(Lana's right hand was bandaged when I saw her in jail.),gs1_070.txt
（あのとき、キズを 負ったんだろうな‥‥）,(She must have cut herself at the time of the crime...),gs1_070.txt
お姉ちゃん‥‥,Poor Sis...,gs1_070.txt
白いエナメル地に、 細かく血が飛んでいる。,Blood is splattered over the white enamel surface.,gs1_070.txt
‥‥ともえさんのものだ。 右手の包帯が、そうなんだろう。,"It must be Lana's blood, from the cut on her right hand she now has bandaged.",gs1_070.txt
きゃあっ！こんなトコロにも、 ぺったり血がついてますッ！,AAAH! There's blood here too!,gs1_070.txt
クツの底、か‥‥ 被害者自身の血、だろうね。,On the sole of the shoe? It's got to be the victim's.,gs1_070.txt
どうやら‥‥血だまりの中を 歩いたみたい、だね。,He must have stepped in a puddle of his own blood.,gs1_070.txt
ううう‥‥ナマナマしいんですね。 サツジン事件って。,All this blood... It's horrible!,gs1_070.txt
（足のウラに、血のアトが あるということは‥‥）,(Hmm...),gs1_070.txt
（当然、血だまりの上を 歩いたことになる、よな‥‥）,(This blood might be an important clue...),gs1_070.txt
こちらの血痕は、被害者自身‥‥ 多田敷　道夫のものだ。,"These blood traces are from Bruce Goodman, the victim.",gs1_070.txt
刺されたあと、逃げようと したのだろうか。,He must have tried to run after he was stabbed.,gs1_070.txt
これ‥‥ 血のアト、ですよね？,"This is a bloodstain, isn't it?",gs1_070.txt
飛び出しナイフから 付着したんだろうね。,Yeah. It was probably left behind from the switchblade.,gs1_070.txt
このマフラー‥‥まちがいなく、 ともえさんのモノ、なの？,Are you absolutely sure this is your sister's muffler?,gs1_070.txt
は、はい‥‥,Yes...,gs1_070.txt
（やはり‥‥このナイフを かくしたのは、彼女のようだ）,(So she really did hide the knife.),gs1_070.txt
（いったい、なぜ‥‥？）,(But why...?),gs1_070.txt
きゃあああ！　びび、 ビックリさせないでくださいっ！,EEEEEEE!!! Don't scare me like that!,gs1_070.txt
ビックリしたの、こっちだよ！,Scare YOU? I'm the one who was scared!,gs1_070.txt
‥‥この、ナイフの刃‥‥ 先が欠けてますね。,Hey... The tip of this knife is missing!,gs1_070.txt
（それに、この赤黒いシミ。 “血”かな、やっぱり‥‥）,(There's also a dark red stain here. It looks like blood...),gs1_070.txt
とにかく‥‥このナイフは カガク的に、重要な証拠品です！,,gs1_070.txt
（たしかに‥‥他にも手がかりが あるかもしれない）,,gs1_070.txt
（このナイフ‥‥もっと よく調べたほうがいいな！）,,gs1_070.txt
ナイフに、小さなタグが ついてますね。,There's a small tag on the knife.,gs1_070.txt
"《ＳＬ－９》‥‥ そう書かれているみたいだ。 ""SL-9 2.""","It says,",gs1_070.txt
どういうイミかなあ‥‥,What's that supposed to mean?,gs1_070.txt
（似たヒビキのコトバなら 聞いたことがあるんだけど‥‥）,I'm not sure... (But it reminds me of a similar code...),gs1_070.txt
（ＤＬ６号‥‥“事件”）,"(""DL-6."" Maybe it's a case number?)",gs1_070.txt
でも‥‥なんだか。,That's weird.,gs1_070.txt
？　どうしたの？,What?,gs1_070.txt
なんか‥‥どこかで見たような 気がするんですよねー。,"I don't remember where,",gs1_070.txt
,but I think I've seen something like this before.,gs1_070.txt
この、タグの文字と‥‥ “よく似た”文字を‥‥最近。,Something similar to what's written on this tag. It wasn't that long ago either...,gs1_070.txt
（法廷記録‥‥もう一度、 カクニンしてみたほうがいいな）,(Maybe I should check the Court Record again.),gs1_070.txt
小さなタグには、 《ＳＬ－９》と書かれている。,"""SL-9"" is written on a small tag attached to the knife.",gs1_070.txt
２年前の、あの事件の凶器で、 多くの被害者の血を吸ったナイフ。,It was the weapon used in that incident two years ago; and has known many victims.,gs1_070.txt
（油性ペンで名前が書いてある）,(Someone used a marker to write their name on this.),gs1_070.txt
《１－３ ほうづき　あかね》,"""Ema Skye""",gs1_070.txt
もしかして‥‥学校にも 持っていってるの？　これ。,Don't tell me you bring this with you everywhere you go.,gs1_070.txt
そりゃもう。いつ、何が 起こるか、わかりませんからね！,"Well, you never know where something might go down!",gs1_070.txt
（いつ、何が起こると 思ってるんだろう‥‥）,(Just what kind of a world do you think we live in...?),gs1_070.txt
油性ペンで名前が書いてある。 《１－３》‥‥か。,Ema Skye is written on the side in permanent marker.,gs1_070.txt
この《１》が《小学１年》だったら イヤだなあ‥‥,She seems awfully possessive about a can of luminol.,gs1_070.txt
《ＡＩ１６号》‥‥ そう書かれているみたいだ。,"The tag says, ""AI-16.""",gs1_070.txt
それで‥‥なんなんですか、 このドライバー。,What's that got to do with anything?,gs1_070.txt
それは、その。 関係ないんじゃないかな。,"Nothing, apparently.",gs1_070.txt
御剣も、そう言ってたし。,"At least, that's what Edgeworth said.",gs1_070.txt
でも、“関係ない”って言われる ほど、気になりますよねー。,Hm. That makes it seem all the more suspicious.,gs1_070.txt
きっと、トンでもなく重要な イミがあるんですよ。コレ。,Who knows? This might turn out to be the clue that breaks the case!,gs1_070.txt
これ以上、ヘンな事件を かかえこみたくないなあ‥‥,Wouldn't that be nice...,gs1_070.txt
《ＡＩ１６号》‥‥ そう書かれているみたいだ。,"""AI-16"" is written on the tag.",gs1_070.txt
今回の事件とは、関係ない 証拠品ということだ。,That means it has nothing to do with the current case.,gs1_070.txt
この部分‥‥かすかに、 赤黒いシミがありますけど。,"Hey, look here! It's hard to make out, but there's a dark red stain here.",gs1_070.txt
やっぱり‥‥ “血”みたいだね。,Hmm... Looks like blood.,gs1_070.txt
多田敷さんが刺されたときに ついたんでしょうか？,Do you think Detective Goodman's blood somehow got on it when he was stabbed?,gs1_070.txt
どうも‥‥ そうじゃないみたいだね。,Not likely.,gs1_070.txt
ずいぶん、古いものに見えるよ。 ほとんど、消えかかってるし。,"This blood looks like it's been here for months, maybe longer.",gs1_070.txt
（このツボは、《ＳＬ９号事件》と いう事件の証拠品だった‥‥）,(This jar was evidence in the SL-9 Incident...),gs1_070.txt
（血は、そのときに ついたのかもしれないな）,(That might be when the blood got on it.),gs1_070.txt
赤黒い“血痕”‥‥ ずいぶん、古いものみたいだ。,There's a trace of old blood on this jar.,gs1_070.txt
このツボは、《ＳＬ９号事件》と いう事件の証拠品だった‥‥,This was evidence in the SL-9 Incident...,gs1_070.txt
血は、そのときに ついたのかもしれないな。,The blood must be from back then.,gs1_070.txt
あ、あれ！ ここ、底がありませんよ！,Huh? This thing doesn't have a bottom!,gs1_070.txt
ホントだ。これじゃあ‥‥,That's weird.,gs1_070.txt
どっちが下か、わかりませんね。,"I wonder which side is ""up""?",gs1_070.txt
いやいや。それより、 そもそも底がなかったら‥‥,Better yet...,gs1_070.txt
コレ、何に使うんだろう？,What's the purpose of a bottomless jar?,gs1_070.txt
うーん。 底の知れないツボですねえ‥‥,"At least it doesn't collect dust inside, right?",gs1_070.txt
ポッカリ穴が空いている。 底なしのツボだ。,"The jar has no bottom, so the hole goes right through.",gs1_070.txt
‥‥ホントにツボなのかな。 あるいは、天体望遠鏡、とか‥‥,"I wonder if it's really a jar, or some kind of weird telescope...?",gs1_070.txt
この部分‥‥かすかに、 赤黒いシミがありますけど。,"Hey, look here! It's hard to make out, but there's a dark red stain here.",gs1_070.txt
やっぱり‥‥ “血”みたいだね。,Hmm... Looks like blood.,gs1_070.txt
でも。なんかヘンですね。 この、巌徒局長のカケラ‥‥,"This piece the Chief has is different, though.",gs1_070.txt
他の血は、みんな 消えかけた“点”なのに‥‥,"The blood stains on the other pieces are just spots,",gs1_070.txt
この１枚だけ、“線”に なってますよ！,but this one's a line!,gs1_070.txt
（どういうことだろう‥‥）,(That is odd...),gs1_070.txt
この赤黒いシミは‥‥ ２年前の血痕だろう。,The dark red stains must be blood traces from the incident two years ago.,gs1_070.txt
巌徒局長の部屋から見つかった カケラだけ、“線”が残っている。,Only the fragment found in Chief Gant's office still has lines remaining on it.,gs1_070.txt
ビデオテープにラベルが 貼ってありますね。,This tape has a label on it.,gs1_070.txt
どれどれ。記録した時間なんかが 書かれているんじゃないかな。,Let me see. Maybe it lists the time it was recorded.,gs1_070.txt
《永久保存版！ 湯ケムリ紀行・旅まみれ》,"""Hackoholics Anonymous: Twelve Steps to Recovery""",gs1_070.txt
新しいテープが なかったんですね、きっと。,They must have recorded over an old tape.,gs1_070.txt
そ。それにしても、 警察が提出した証拠だぞ！,"Yeah, but this evidence is from the police department!",gs1_070.txt
《永久保存版》がつく番組って、 ロクなモノがないですからねー。,Why would they have a tape like that anyway?,gs1_070.txt
‥‥なんか、急に 旅に出たくなってきたよ。,Let's just hope they got it off a criminal.,gs1_070.txt
《永久保存版！ 湯ケムリ紀行・旅まみれ》,"""Hackoholics Anonymous: Twelve Steps to Recovery""",gs1_070.txt
この事件が解決したら、 温泉でも行ってみようか。,I wonder what the 12 steps are...?,gs1_070.txt
タグには《ＳＬ９号－１１番》と 書かれているね。,"The tag says, ""SL-9 11.""",gs1_070.txt
これも、例の事件の 証拠品らしいなあ。,I guess this is another piece of evidence from that case.,gs1_070.txt
あたし、ムカシからキライ なんですよ。“タグ”ってコトバ。,"You know, I never did care for the word, ""tag."" It's confusing.",gs1_070.txt
へえ‥‥。なんで？,Huh? What's so confusing about that?,gs1_070.txt
だって。見た目が まぎらわしいじゃないですか。,"Do you know how many other words sound like it? ""Bag,"" ""Gag,"" ""Nag,"" ""Lag,"" ""Xag""...",gs1_070.txt
まぎらわしい‥‥？,"""Xag""...? Is that a word?",gs1_070.txt
“タグ”か“クダ”か“ゲタ”か “タダ”か、はたまた“多い”か。,Do you challenge me...?,gs1_070.txt
“多い”はないよ、あかねちゃん。,"What, are we playing a word game now?",gs1_070.txt
タグには《ＳＬ９号－１１番》と 書かれている。,"""SL-9 11"" is written on the tag.",gs1_070.txt
これも、例の事件の 証拠品らしいな。,It seems this is more evidence from that incident.,gs1_070.txt
《ミツルギ　レイジ １７：１２》‥‥,"""Miles Edgeworth - 17:12""...",gs1_070.txt
日付は、事件当日だ。,This is dated the day of the crime.,gs1_070.txt
入庫してから、３分後に 事件が起きたわけですね。,The murder took place three minutes after Edgeworth parked his car.,gs1_070.txt
どこかで２、３回、 信号に引っかかっていたら‥‥,If only he was held up at a couple extra red lights...,gs1_070.txt
事件に巻きこまれなくて すんだかもしれないのに。,he wouldn't have been caught up in this whole affair.,gs1_070.txt
そういう考えかたもあるね。,Perhaps...,gs1_070.txt
成歩堂さんも、信号は キチンと守りましょうね！,It just goes to show you never know what'll happen when you run a yellow light!,gs1_070.txt
《ミツルギ　レイジ １７：１２》‥‥,"""Miles Edgeworth - 17:12""...",gs1_070.txt
日付は、事件当日だ。,It's dated the day of the murder.,gs1_070.txt
これ‥‥手のアト、ですよね。,"This is a handprint, right?",gs1_070.txt
カワの布地に、アブラのシミ みたいに付着している。,Yeah. Someone left behind an oil stain on the fabric.,gs1_070.txt
アブラっぽい手をした ヒトだったのかな。,"Whoever it was, they must have had a really oily hand.",gs1_070.txt
成歩堂さん。カガク的に 考えてみましょう！,"Mr. Wright, think about it scientifically!",gs1_070.txt
ど。どういうコト？,Huh?,gs1_070.txt
つまり。こういうコトです。,A more likely explanation is...,gs1_070.txt
ツルツルにワックスをかけた ばかりのろうかで、転んで‥‥,"the person slipped and fell on a freshly waxed floor,",gs1_070.txt
手が、ワックスで べたべたになった、とか。,getting wax all over their hand.,gs1_070.txt
なるほど‥‥ 意外に、イイ線かもしれないね。,"Well, that would account for this amount of oil I guess.",gs1_070.txt
（どこが“カガク的”か わからないけど）,"(I don't see what's so ""scientific"" about it though.)",gs1_070.txt
あたしの学校、こないだ ワックスをかけたばっかりだし。,"It happens, you know. I always slip on the floors at school after they're waxed.",gs1_070.txt
カワの布地に、ハッキリ 手のアトが残っている。,A clear handprint can be seen on the leather cloth.,gs1_070.txt
指紋のヌシは、あかねちゃんだ。 ‥‥彼女にはヒミツにしておこう。,The print belongs to Ema... I think I'll keep this information to myself.,gs1_070.txt
《周知の事情により、辞職を決意 した。よろしくおねがいしたい》,"""Due to recent events I hereby announce my resignation as public prosecutor.""",gs1_070.txt
（ほ。本当に、辞表だぞ‥‥）,(He really wrote a resignation letter...),gs1_070.txt
さすが、御剣検事さん。 ちょっぴり、エラそうですね。,"Wow! Even when resigning, Mr. Edgeworth is cool and concise!",gs1_070.txt
でも‥‥御剣検事さんは、 ワルくないのに‥‥,"Still, it wasn't his fault...",gs1_070.txt
ダレかに、セキニンをとらせる。 それが、オトナの世界なんだよ。,Someone has to be held responsible. That's how it is in the grown-up world.,gs1_070.txt
えー！　でも、辞めちゃったら “セキニン”も何もないですよ？,"Yeah, but that responsibility means nothing if he just quits!",gs1_070.txt
ま。まあ、たしかに‥‥,"Well, not everyone sees it that way.",gs1_070.txt
セキニンを取るのなら‥‥ タダで５年はたらく、とか！,To truly take responsibility you should have to work the rest of your life for no pay.,gs1_070.txt
（オトナの世界はキビシイな‥‥）,"(Sometimes the ""grown-up"" world can be tough...)",gs1_070.txt
刑事さん‥‥あんまり、 よくないですね。写真うつり。,"Detective Gumshoe isn't very photogenic, is he?",gs1_070.txt
そんなコト言っちゃ ワルいと思うよ。本人に。,"Whatever you do, just don't say that to his face.",gs1_070.txt
だって、ホラ。 目が半分、閉じちゃってますよ！,"Look, his eyes are half shut!",gs1_070.txt
そのかわり、クチが半分 開いちゃってるね。,Yeah... and his mouth is half open.,gs1_070.txt
うわ。シャツのボタン、 １個ずつズレてますよ！,Hey! Each of his shirt buttons is off a notch!,gs1_070.txt
このネクタイ、細いほうが 前に来てるぞ。,And he's got the narrow end of his tie in front.,gs1_070.txt
“写真うつり”とは ちょっとちがうみたいだね。,"I think this goes beyond being a ""photogenic"" issue.",gs1_070.txt
キンチョーのあまり、 エガオがひきつっている。,He's wearing a really nervous smile in this picture.,gs1_070.txt
めずらしく、ヒゲがつるつるに そり上げられている。,At least for once he's got a clean-shaven face.,gs1_070.txt
うわ、おいしそう！,"Wow, my mouth is watering!",gs1_070.txt
今にも、ニクの焼ける音が ジューッ、て聞こえそうです！,I can almost hear the sound of steak frying on the grill!,gs1_070.txt
ジッサイは、冷えて コチコチだけどね。,No doubt it's all cold and tough by now.,gs1_070.txt
きっと、大丈夫です！,"No, I'm sure it's delicious!",gs1_070.txt
おキョウさんが、まごころで ヤキを入れてますから。,Ms. Starr poured her heart into making this!,gs1_070.txt
‥‥その表現、なんかコワいよ。,So long as she didn't put any other organs in there...,gs1_070.txt
えーと。原材料は‥‥と。 『にく』だって。,"Let's see... ""Ingredients: Meat""",gs1_070.txt
も。モチロン、牛肉ですよね。 ハッキリ書いてありませんけど。,"She must mean ""beef."" She probably just wrote it generically.",gs1_070.txt
そ。そりゃそうだよ！ ハッキリ書いてないけどね。,Uh... yeah. Let's hope so.,gs1_070.txt
カガク者としては、やはり。 食品添加物をチェックしないと。,"Of course, as a scientist I have to check what additives she used.",gs1_070.txt
マニアックだなあ。,Go to town.,gs1_070.txt
『まごころ』 ‥‥だそうです。,"Huh? It says here... ""Hours of sweat and labor.""",gs1_070.txt
