Japanese,English,Note
（真宵ちゃんはこれからの一生を 殺人者として生きることに‥‥）,"(After the trial, Maya's life would be destroyed, and she'd be labeled a murderer...)",gs2_006.txt
（そんなこと、 できるわけがない！）,(I can't let that happen!),gs2_006.txt
‥‥裁判長！,Your Honor!,gs2_006.txt
決断しましたか、弁護人。,"Have you reached a conclusion, Mr. Wright?",gs2_006.txt
弁護側の主張は変わりません。 《完全無罪》以外に、あり得ない！,The defense will not change its plea.,gs2_006.txt
,We will accept nothing short of complete acquittal!,gs2_006.txt
‥‥‥‥今。,...You.,gs2_006.txt
この瞬間、勝負は決した。 ‥‥刑事。,"You have sealed your fate, Mr. Phoenix Wright. Detective!",gs2_006.txt
は‥‥はッ！,"Y-Yes, sir!",gs2_006.txt
最後の証言を。 ‥‥トドメを刺すの。,Present the final portion of your testimony -- the final strike.,gs2_006.txt
うう‥‥りょ、了解ッス‥‥。,Um... Y-Yes... sir...,gs2_006.txt
あ、ちょ、ちょっと。 進行役は、この私が‥‥,"N-Now, see here! Proceedings are run by...",gs2_006.txt
ひいっ！,Eek!,gs2_006.txt
‥‥やっぱり、いいです。 最後の証言をしてください。,"Oh, yes, of course. Go ahead Detective and give your testimony...",gs2_006.txt
綾里　真宵の有罪を立証する、 もう１つの証拠について！,I think the court would like to hear about the other piece of incriminating evidence!,gs2_006.txt
～真宵の犯行を立証する証拠～,-- Incriminating Evidence --,gs2_006.txt
ザンネンながら、さらに強力な 証拠があるッス。,"Sorry, pal but there's an even more incriminating piece of evidence.",gs2_006.txt
被告が現場で着ていた 装束を見てほしいッス。,This is the costume the defendant was wearing at the time of the crime.,gs2_006.txt
見てのとおり、血痕が 付着しているッス。,"As you can see, it's covered in blood.",gs2_006.txt
被告は、明らかに無抵抗の 被害者を殺害したッス。,"The defendant attacked and killed a person who, without a doubt, was not fighting back.",gs2_006.txt
これ‥‥ですか。,So this is the costume...,gs2_006.txt
たしかに、返り血が ついていますね。,There certainly is evidence of a back spray of blood on this.,gs2_006.txt
綾里　真宵が 犯行に関わっている証拠ッス。,"This piece directly links Maya Fey to the crime, sir.",gs2_006.txt
‥‥わかりました。 受理しましょう。,I see... The court accepts this into evidence.,gs2_006.txt
証拠品《真宵の装束》のデータを 法廷記録にファイルした。,Maya's Costume added to the Court Record.,gs2_006.txt
いかがですか、弁護人。,"Alright, Mr. Wright.",gs2_006.txt
（指紋のついた２つの凶器に、 血まみれの装束‥‥）,(Maya's fingerprints on both murder weapons and blood splatters on her clothes...),gs2_006.txt
（これ以上サイアクの状況が あり得るか‥‥？）,(Could this situation get any worse??),gs2_006.txt
‥‥フッ。 コトバもないみたいね。,Hah. What's wrong? You seem to be at a loss.,gs2_006.txt
検察側の証言は、 これが最後のはずよ。,I think this is the last piece of testimony the prosecution should have to offer.,gs2_006.txt
せいぜい、あがくことね。 ‥‥成歩堂　龍一！,"Feel free to sulk off with your tail between your legs, Mr. Phoenix Wright!",gs2_006.txt
（たのむから、フルネームで 呼ぶの、やめてくれえ‥‥）,(Please stop calling me by my full name. It's disturbing.),gs2_006.txt
～真宵の犯行を立証する証拠～,-- Incriminating Evidence --,gs2_006.txt
ザンネンながら、さらに強力な 証拠があるッス。,"Sorry, pal but there's an even more incriminating piece of evidence.",gs2_006.txt
被告が現場で着ていた 装束を見てほしいッス。,This is the costume the defendant was wearing at the time of the crime.,gs2_006.txt
見てのとおり、血痕が 付着しているッス。,"As you can see, it's covered in blood.",gs2_006.txt
被告は、明らかに無抵抗の 被害者を殺害したッス。,"The defendant attacked and killed a person who, without a doubt, was not fighting back.",gs2_006.txt
（狩魔め‥‥これで一気に 勝負を決める気か）,(That Von Karma! She thinks she can decide the verdict with this testimony alone!),gs2_006.txt
（なんとしても‥‥決定的な ムジュンを見つけなければ！）,(I have to somehow find a critical contradiction and then I'll have her!),gs2_006.txt
だから、さっさとそれを 証言してください！,Why didn't you say so in your testimony earlier!?,gs2_006.txt
ううう‥‥今日の弁護人は なんかコワいッス。,"Uh... You're kinda scary today, you know, pal?",gs2_006.txt
ま、まあまあ弁護人。 そうコーフンしないで‥‥。,"Come now, Mr. Wright... There is no need for that kind of attitude in my court...",gs2_006.txt
わわ、わかりました。 そんなにニラまないように。,"A-Alright. Just, please stop glaring at me like that...",gs2_006.txt
真宵ちゃんの‥‥装束？,Maya's... costume?,gs2_006.txt
そッス。ワレワレが かけつけたときに着ていたッス。,Yeah. She was wearing this when we arrested her.,gs2_006.txt
（真宵ちゃん‥‥今日も 同じカッコウをしていたな）,(Maya... She's wearing her channeling costume today too...),gs2_006.txt
（あれ以外、着ちゃいけない キマリでもあるのかな‥‥？）,(Is she not allowed to wear anything else...?),gs2_006.txt
その、装束についている血は‥‥？,This blood on the costume...,gs2_006.txt
化学分析の結果、被害者のもので あると断定されているッス。,Lab results show that it is the victim's blood.,gs2_006.txt
ふむう‥‥被告の装束に、 被害者の血がねえ‥‥。,Hmm... So there is blood from the victim on the defendant's clothes.,gs2_006.txt
（うう‥‥これも かなり不利だぞ‥‥）,(Definitely not good... Urk.),gs2_006.txt
あの‥‥他に何か、手がかりに なるようなものは？,"Hmm, where there any other clues you could gleam from this piece of evidence?",gs2_006.txt
そッスね‥‥。,"Um, well...",gs2_006.txt
‥‥変わったことがあるなら、 とっくに証言している。,"If you must change the topic, then the good detective here must testify again.",gs2_006.txt
時間のムダ。 ‥‥次、行きなさい。,But too bad. Not enough time. Time to move on.,gs2_006.txt
狩魔検事はカンペキ主義 ですからねえ‥‥。,"Ah, yes, Ms. von Karma is perfectly correct...",gs2_006.txt
（‥‥くそ。裁判長も 検事の味方か‥‥）,(Grr... Now even the Judge is on her side!),gs2_006.txt
（ヘタに食いさがるのも キケンだけど‥‥どうする！）,(But if I bite off more than I can chew here... What should I do!?),gs2_006.txt
（‥‥狩魔検事‥‥、今まで ほとんど口を挟まなかった）,(Why is Ms. von Karma suddenly putting up resistance?),gs2_006.txt
（ここで突然の“異議あり”。 何かあるのかもしれない‥‥）,(There must be a reason as to why she suddenly threw out an objection like that...),gs2_006.txt
（この装束‥‥何か 手がかりはないのか！）,(There must be a clue somewhere on this costume!),gs2_006.txt
（‥‥よく見るんだ‥‥！）,(I just have to look harder!),gs2_006.txt
成歩堂くん。,Mr. Wright.,gs2_006.txt
その装束を穴のあくほど 見つめても、しかたありません。,Ms. von Karma's logic is perfect. There is no way for you to poke a hole in it.,gs2_006.txt
（くそっ！　時間切れか。 この装束には‥‥）,"(Argh! Looks like my time is up. So, about the costume...)",gs2_006.txt
（深追いして何も出なかったら 致命的だ‥‥）,"(If I pursue this and I turn up nothing, it could be disastrous...)",gs2_006.txt
‥‥そうですね。 特にモンダイはありません。,"You're right, Your Honor. There is absolutely nothing more to this.",gs2_006.txt
‥‥わかりました。 では、証人。証言をつづけなさい。,"Good. Well, Detective, please continue with your testimony.",gs2_006.txt
‥‥裁判長。,Your Honor.,gs2_006.txt
この証拠品には、 大きな問題があります！,"Actually, there is something very wrong with this piece of evidence.",gs2_006.txt
な、なんですって！,Wh-What!?,gs2_006.txt
ど、どういうことッス！,"What are you talking about, pal!?",gs2_006.txt
い、いったい、何が 問題だと言うのですか！,Wh-Where is this problem you are talking about!?,gs2_006.txt
（‥‥どうやら、目の前に つきつけてやる必要があるな）,(I've come this far... There's no turning back now!),gs2_006.txt
この装束がはらんでいる “問題点”とは！,The problem I have with this piece of evidence is here!,gs2_006.txt
問題点はもちろん、 この血痕ですよ！,The problem is obviously the blood splatter here!,gs2_006.txt
で、でも‥‥その血痕は 被害者のものと断定されています。,B-But... We've determined that the blood splatter is from the victim.,gs2_006.txt
どこがモンダイなのですか？,Where is the problem in that?,gs2_006.txt
どこッス？,"Yeah, where, pal?",gs2_006.txt
‥‥どこでしょう。,Yeah... I wonder about that too...,gs2_006.txt
今の発言はちょっと カチンと来ました！,"That last antic of yours just pushed me over the top, Mr. Wright.",gs2_006.txt
もう、尋問はこれで 打ち切って‥‥,I am declaring that this cross-examination period is over...,gs2_006.txt
まま、待ってください！ （今度こそ、はずせないぞ‥‥）,"P-Please wait, Your Honor! (Ack! I'd better not mess up again...)",gs2_006.txt
問題点‥‥それは、 このへんです！,There is a problem... somewhere around... here!,gs2_006.txt
ど、どういうことですか？ ‥‥狩魔検事？,"Wh-What does he mean, Ms. von Karma?",gs2_006.txt
‥‥問題点はそこじゃない。 弁護人の頭脳、ということかしら。,There's nothing wrong with it. The only thing wrong here is the defense's head.,gs2_006.txt
さすが狩魔検事のムスメさんです。 ‥‥うまいことを言う。,Well said. You certainly do take after your father!,gs2_006.txt
（バカにしやがって‥‥ もう一度だ！）,"(I've just been made to look like a fool again... Alright... Focus, Phoenix!)",gs2_006.txt
‥‥この装束の たもとを見てください。,I ask the court to please take a look at the sleeve of this costume.,gs2_006.txt
たもと‥‥？,The sleeve?,gs2_006.txt
‥‥‥‥！ 小さな穴があいています。,There is a tiny hole here...,gs2_006.txt
‥‥あ‥‥穴ッスか‥‥？ 報告書には書いてなかったッス。,...A... A hole...? But that wasn't in the report.,gs2_006.txt
待ってください！,Hold on!,gs2_006.txt
‥‥この穴のまわり‥‥かすかに、 火薬のニオイがします！,What's this around the hole? I-It smells faintly of gunpowder!,gs2_006.txt
か‥‥火薬‥‥ 聞いてないッスゥゥ！,G-Gunpowder!? No one ever told me!,gs2_006.txt
火薬のニオイがする“穴”‥‥,A hole that smells of gunpowder...,gs2_006.txt
（‥‥どうやら、見つけたぞ！ ヤツらの“穴”を‥‥！）,"(It looks like I've found the ""hole"" I was looking for!)",gs2_006.txt
当然それは、弾丸によるもの‥‥ “弾痕”と考えるべきです！,"Your Honor, the only logical conclusion you can make is that it must be a bullet hole!",gs2_006.txt
静粛に！　静粛に！　静粛に！ ‥‥これは、重大なコトです！,Order! Order! Order!! This is a very grave matter.,gs2_006.txt
どうやら、法廷記録に 情報をくわえたほうがいいですね。,It's best we correct the Court Record first before anything else.,gs2_006.txt
証拠品《真宵の装束》のデータを 書きなおした。,Maya's Costume updated in the Court Record.,gs2_006.txt
すす、すまねッス！ ワレワレの見落としッス！,"Sorry about that. I guess we messed up, sir.",gs2_006.txt
‥‥！,,gs2_006.txt
（か‥‥狩魔のヤツ‥‥ 笑っている‥‥？）,(I-Is she actually... smiling!?),gs2_006.txt
（もしかして‥‥ 知っていたのか！）,(What else is she hiding!?),gs2_006.txt
‥‥ムネをはりなさい、刑事。,"Pull yourself together, Detective.",gs2_006.txt
そんなささいな“穴”。 ‥‥証拠の持つ力は変わらない。,"That tiny ""hole"" doesn't change a thing. The strength of the evidence still holds.",gs2_006.txt
証言をつづけて。 今のは“ムジュン”ではないわ。,"Continue with your testimony. That, just now, was a fluke. Nothing more.",gs2_006.txt
ば、バカな！ こんな大きな見落としを‥‥！,H-How can you say something like that!? This is a huge oversight!,gs2_006.txt
‥‥たしかに、これは 警察のミスです。,"While I agree it is a mistake on the part of the police,",gs2_006.txt
しかし、狩魔検事の言うように、 この証拠の発言力は変わりません。,what Prosecutor von Karma has said is true. The evidence still stands.,gs2_006.txt
もっと決定的な“ムジュン” でもないかぎりは‥‥。,"If you do not find a more definitive problem with the evidence, then...",gs2_006.txt
そ‥‥そんな‥‥！,No way!!,gs2_006.txt
‥‥証人。 証言をつづけてください。,"Detective Gumshoe, please continue with your testimony.",gs2_006.txt
は‥‥はあ‥‥。,"Y-Yes, sir.",gs2_006.txt
血痕は被害者のものだった。 ‥‥それはわかりました。,"Alright, I'll give you that the blood splatter is from the victim, but...",gs2_006.txt
でも、たもとにあいた 穴は、なんなんですか！,what is this hole in the sleeve?,gs2_006.txt
うう‥‥すまねッス。ワレワレの 目がフシ穴だったということで‥‥,"Um... Sorry, pal. We must've thought it was a tear in the seam...",gs2_006.txt
そんなオチをつけてすむ モンダイじゃありません！,Missing the hole is not what I'm asking you about. I'm talking about the hole itself!,gs2_006.txt
火薬のニオイがする‥‥,The smell of gunpowder clearly gives away that...,gs2_006.txt
アキラカに弾痕です！,it is a bullet hole!,gs2_006.txt
‥‥どうでもいいでしょ、 そんなこと。,As if little things like that matter.,gs2_006.txt
え。,But they do.,gs2_006.txt
装束には、“弾痕”といっしょに “血痕”も残っている。,"That there is a ""bullet hole"" in the sleeve and blood all over the costume...",gs2_006.txt
‥‥被告が被害者を殺害したという 事実は、変えられないってコト。,it doesn't change the fact that the defendant killed the victim.,gs2_006.txt
（‥‥くそ‥‥） (...Grr...),,gs2_006.txt
（やっぱり、証言のムジュン点を 探すしかないみたいだな‥‥）,(I know there's something more to this costume.),gs2_006.txt
さあ、刑事。 さっさとすませちゃって。,"Come now, Detective. You're wasting precious time.",gs2_006.txt
‥‥了解ッス。,"...Yes, sir.",gs2_006.txt
“無抵抗だった”‥‥ どうしてそれがわかるんですか！,"He wasn't ""fighting back""? How do you know if he was or wasn't!?",gs2_006.txt
被害者に、抵抗した跡が 見られないからッス。,"We could find no evidence that the victim put up any sort of struggle, pal.",gs2_006.txt
ふむう‥‥。,Hmm...,gs2_006.txt
被害者と争っていたのか、 犯人が一方的に殺害したのか‥‥,"So did the murderer have a fight with the victim, or not?",gs2_006.txt
これは、まったく意味あいが ちがってきますからねえ。,"Depending on this, the circumstances around this murder change drastically.",gs2_006.txt
（ううう‥‥ またまた大ピンチか‥‥）,(Ugh... We're in real trouble now...),gs2_006.txt
（“被害者が無抵抗じゃなかった” という証拠でもあればなあ‥‥）,(If only I had something to prove that the victim did fight back...),gs2_006.txt
イトノコギリ刑事！,Detective Dick Gumshoe!,gs2_006.txt
な‥‥なんスか？,Y-Yes?,gs2_006.txt
フルネームで呼ばれると、 なんかちょっとブキミッス‥‥。,"Heh, having you call me by my full name is kind of a weird feeling...",gs2_006.txt
“無抵抗な被害者を殺害した” ‥‥そう証言しましたね？,"You said that my client killed ""a person who, without a doubt, was not fighting back.""",gs2_006.txt
そッス。,"Yeah, I did.",gs2_006.txt
じゃあ、警察が見落とした この弾痕は、どうなるんですか！,"Then what, may I ask, is the bullet hole you police overlooked supposed to mean!?",gs2_006.txt
え‥‥ ど、どういうコトッスか？,"Eh, um... What does it mean?",gs2_006.txt
いいですか。,I'll tell you what it means.,gs2_006.txt
弾痕があるということは、 被害者は発砲したわけです。,It means that the victim had fired off a shot.,gs2_006.txt
これのどこが “無抵抗の被害者”なんですかッ！,"Is this what it means to ""not fight back""?",gs2_006.txt
や‥‥やられたッスゥゥ！,A-Ah! You're right!,gs2_006.txt
たしかに、そのとおりです！,It would seem that way!,gs2_006.txt
被告に向かって発砲したとなると、 状況は変わってきますね‥‥。,"If the victim tried to shoot the defendant, then... It would change everything...",gs2_006.txt
（やったぞ！ これで、風向きが‥‥）,(Alright! The wind seems to be shifting...),gs2_006.txt
‥‥ふう‥‥。,Hah.,gs2_006.txt
（なんだ？　あの“ごくろうさま” と言わんばかりのタメイキは？）,"(What is with that ""are you finished yet"" laugh?)",gs2_006.txt
ごくろうさま。 ‥‥成歩堂　龍一。,"Are you finished yet, Mr. Phoenix Wright?",gs2_006.txt
ど‥‥どういうことですか？ 狩魔検事。,Ms. von Karma?,gs2_006.txt
どうやら‥‥綾里　真宵は、 被害者に撃たれたみたいね。,It seems... that Maya Fey was shot at by the victim.,gs2_006.txt
‥‥それなら、《正当防衛》が 成立するかもしれない。,"However, that is only grounds enough to support a ""justified self-defense"" plea.",gs2_006.txt
そのとおりです。,That is correct.,gs2_006.txt
でも‥‥おぼえてるでしょ？ そこの弁護士は、ハッキリ言った。,"But I'm sure you remember, Your Honor, what the defense clearly said.",gs2_006.txt
‥‥《正当防衛》ではなく、 《完全無罪》を主張する、って。,"They rejected ""justified self- defense"" and pleaded ""not guilty.""",gs2_006.txt
あっ！,Ack!,gs2_006.txt
そういえば‥‥,Now that you...,gs2_006.txt
そうでした！,"Why, that's right!",gs2_006.txt
つまり！,Which means!,gs2_006.txt
弁護側はまだ、 何も証明していない！,The defense has yet to prove anything at all!,gs2_006.txt
そんなあアァッ！,Nooooo!!,gs2_006.txt
た‥‥たしかに、 そのとおりです‥‥。,"W-Well... Yes, that's true...",gs2_006.txt
‥‥それに。,Furthermore...,gs2_006.txt
装束に弾痕が あったからといって、,just the fact that there is a bullet hole in the costume...,gs2_006.txt
それで《正当防衛》が 証明されるわけじゃない。,"is not enough to substantiate even a plea of ""justified self-defense"".",gs2_006.txt
え。そうなんですか‥‥？,Huh? How so?,gs2_006.txt
はぎゃッ！,Aaah!,gs2_006.txt
‥‥ボケッとしてないで、,Don't just stand there.,gs2_006.txt
さっさと事件当日に 起こったことを再現なさい。,Hurry up and tell the court what transpired that day.,gs2_006.txt
‥‥新しく発見された データもおりこんで。,"...With the new information we acquired added in, of course.",gs2_006.txt
え‥‥？ じ、自分が‥‥ッスか。,Huh? You mean... By myself...?,gs2_006.txt
自分はその、アタマを 使うのがあの‥‥,You want me to put together the scenario all by myself?,gs2_006.txt
うはっ！,Aah!,gs2_006.txt
やら、やらせていただくッス！,"Y-Yes, sir! Right away, sir!",gs2_006.txt
～推測される事件の再現～,-- What Transpired --,gs2_006.txt
被告は霊媒中、被害者のスキを見て ナイフでムネを刺したッス。,"During the channeling, the defendant saw her chance to stab the victim in the chest.",gs2_006.txt
被害者は当然、最後の力を ふりしぼって、抵抗したッス。,"Of course, the victim used the last of his strength to fight back, sir.",gs2_006.txt
２人はもみ合って、被害者は ピストルを取り出したッス。,"While the two were fighting, the victim took out his gun.",gs2_006.txt
被害者は発砲したッスが、 距離が近すぎて、はずしたッス。,"The victim took a shot, but because they were too close, he missed.",gs2_006.txt
そのスキに被告はピストルを 奪って、トドメを‥‥。,"The defendant then picked up on the opening, took the victim's gun and ended it...",gs2_006.txt
ふむう‥‥ スジはとおっていますね。,Hmm... This scenario you have put together does make sense...,gs2_006.txt
ホッ‥‥。,"Yes, sir.",gs2_006.txt
弁護人、どうですか？,"Well, Mr. Wright?",gs2_006.txt
（たしかに、スジはとおっている ように聞こえる‥‥）,"(Just by listening, it does make sense...)",gs2_006.txt
（でも、ゼッタイに 認めるワケにはいかない！）,"(However, I won't give up that easily!)",gs2_006.txt
そそ、そんなにニラまないように。,P-Please refrain from glaring at me like that...,gs2_006.txt
‥‥では、尋問をおねがいします。,"Now then, your cross- examination, please.",gs2_006.txt
～推測される事件の再現～,-- What Transpired --,gs2_006.txt
被告は霊媒中、被害者のスキを見て ナイフでムネを刺したッス。,"During the channeling, the defendant saw her chance to stab the victim in the chest.",gs2_006.txt
被害者は当然、最後の力を ふりしぼって、抵抗したッス。,"Of course, the victim used the last of his strength to fight back, sir.",gs2_006.txt
２人はもみ合って、被害者は ピストルを取り出したッス。,"While the two were fighting, the victim took out his gun.",gs2_006.txt
被害者は発砲したッスが、 距離が近すぎて、はずしたッス。,"The victim took a shot, but because they were too close, he missed.",gs2_006.txt
そのスキに被告はピストルを 奪って、トドメを‥‥。,The defendant then picked up on the opening and took the victim's gun and ended it...,gs2_006.txt
（‥‥ニクらしいほど もっともらしく聞こえる）,"(His testimony certainly makes us look very bad,)",gs2_006.txt
（でも、どこかにムジュンを 見つけないと‥‥）,(but there's gotta be a contradiction in there somewhere...),gs2_006.txt
（それも、決定的なヤツを！）,(And uncovering it is going to uncover the truth! I can feel it!),gs2_006.txt
霧崎医師と被告人は、 体格にかなり差があります。,There is quite a difference in height between Dr. Grey and the defendant.,gs2_006.txt
被告人の体力では、 被害者を刺すのはムリです！,"Add in body strength, and it seems unlikely the defendant could have stabbed the victim!",gs2_006.txt
そ‥‥そういえば そッスねえ‥‥。,"Now that you mention it... Yeah, I guess...",gs2_006.txt
‥‥トボける気かしら？ 成歩堂　龍一！,You think you can get away with such flimsy reasoning? Mr. Phoenix Wright!,gs2_006.txt
綾里　真宵は霊媒中だった。 ‥‥そうでしょ？,"Maya Fey was in the middle of channeling, was she not?",gs2_006.txt
‥‥‥‥？,,gs2_006.txt
倉院流霊媒道では、 術者は交霊中、体格も変化する。,"When channeling with the Kurain Channeling Technique, the medium physically changes.",gs2_006.txt
看護師の体格ならば、霧崎医師と 争えたはずよ。,"With the nurse's build, the defendant could have easily been a match for the doctor.",gs2_006.txt
（こいつ‥‥そんなことまで 調べてるのか‥‥！）,(I don't believe it... She even studied up on the Kurain Channeling Technique!),gs2_006.txt
‥‥言ったはずよ。 私は、カンペキなの。,Like I said before... I am perfect.,gs2_006.txt
あのお‥‥今の話、 私にはその、イミが‥‥,Um... Uh... About what you were talking about... I didn't quite get it...,gs2_006.txt
な、なんでもないです。 証言をつづけてください。,"Um, n-never mind. Let's continue with the testimony...",gs2_006.txt
ナイフで刺されただけでは 死ななかったわけですね。,"So he was stabbed, but the stab wound didn't kill him.",gs2_006.txt
ただ、出血量から考えて、 かなりダメージがあったッス。,"But if you think about the blood loss, it was pretty bad.",gs2_006.txt
どれぐらいのダメージですか？,How bad would you say it was?,gs2_006.txt
そうそう。じつはこないだ、 献血に行ってきたッス。,"Actually, I went to give blood the other day.",gs2_006.txt
終わったら、ちょっと くらくらっとしたッス。,"And afterward, I felt a little lightheaded and dizzy.",gs2_006.txt
