Japanese,English,Note
まあ、おおむねそのとおりと 考えても、特に問題はないですね。,"Well, that's the gist of it. I guess you could put it that way and leave it at that.",gs2_002.txt
どうですか？　弁護人。 これで問題ありませんね？,"Do you have any further questions, Mr. Wright?",gs2_002.txt
‥‥そうですね。 問題ないでしょう。,"Hmm... No, I think I'm done here, Your Honor.",gs2_002.txt
ちょっとちょっと！ ‥‥どうしちゃったの今日は！,"Wait, wait, wait! What is with you today, Nick!?",gs2_002.txt
ちゃんと法廷記録、見てよー！,Take a good look at the Court Record!!,gs2_002.txt
え‥‥？,Huh?,gs2_002.txt
‥‥‥‥。 あ、‥‥あああっ！,What are you talking...? Ah... Aaaaaaaah!,gs2_002.txt
どうしましたか？ やっぱり、問題があると？,"What is it, Mr. Wright? By your screaming, I assume you have a question after all?",gs2_002.txt
裁判長！ まったく、お話になりません。,Your Honor! The witness' testimony does not make sense!,gs2_002.txt
モロヘイヤさんが、公衆電話を 探していたはずがない！,I don't believe that there was ever a need for the witness to search for a phone!,gs2_002.txt
な‥‥なんだって！,H-How dare you!,gs2_002.txt
そこまでキメつけるからには 当然、証拠があるんでしょうな！,"You can't just make outrageous claims like that! You do have some sort of proof, don't you?",gs2_002.txt
え！　‥‥も、もちろんです。 （だいじょうぶだよな、証拠‥‥）,"Well, yeah... O-Of course! (This evidence should be good enough, I think...)",gs2_002.txt
ふむう‥‥。 では、示してもらいましょう。,"Alright. Let's have this proof, then.",gs2_002.txt
証人が、公衆電話を探していた はずがないという証拠を！,Please present proof that the witness had no need to search for a public phone booth!,gs2_002.txt
カンタンなことですよ。 ‥‥証拠は、これです。,It's very simple! This is the evidence that backs up my claim!,gs2_002.txt
‥‥あいかわらず、自信たっぷりに 意味不明なモノを持ち出しますね。,"And yet again you have presented this court with an obscure, meaningless item.",gs2_002.txt
え？　意味不明ですか？ ‥‥この証拠品。,Huh? This evidence? It's meaningless?,gs2_002.txt
わかんないよ！,I don't get it at all!,gs2_002.txt
そもそも、どうしてあのヒトが 公衆電話を探すハズがないの？,Why do you think he wouldn't need to look for a phone in the first place!?,gs2_002.txt
え。‥‥どうして、って‥‥。,"Well, that's... because...",gs2_002.txt
なんか、証拠品を見ていて 思ったんだよ。,I was looking at the evidence and it just hit me.,gs2_002.txt
“公衆電話なら 探すまでもないぞ”って。,"I thought, ""Hey, he really didn't have to look for a phone.""",gs2_002.txt
じゃあ、じゃあ、その証拠品を 提示しようよ！,Then why don't you hurry up and present that piece of evidence!?,gs2_002.txt
（あれは‥‥ どの証拠品だったっけ‥‥）,"(Hmm, now what was that piece of evidence again...?)",gs2_002.txt
考えるまでもありません。 ‥‥これを見てください。,"It's quite simple, actually. Please take a look at this.",gs2_002.txt
事件の現場写真、ですか？,At the crime scene photo?,gs2_002.txt
それがどうかしたかね？,Is there a problem with it?,gs2_002.txt
“どうかしたかね” じゃありませんよ。,"Oh, there's nothing wrong with the picture.",gs2_002.txt
これを見てもわからないなんて、 それこそどうかしている！,"But if you don't understand my logic after looking at it, something is wrong with you!",gs2_002.txt
うおおおッ！,Noooo!,gs2_002.txt
で‥‥電話ボックス‥‥！,It's... It's... A phone booth!,gs2_002.txt
そのとおり！,That is correct!,gs2_002.txt
証人は、３歩あるくだけで 電話ボックスにたどりつけた！,All the defendant had to do was walk three steps!,gs2_002.txt
証人！　‥‥なぜ、 そうしなかったのですか！,Mr. Wellington! Why did you not use the phone that was right in front of you!?,gs2_002.txt
ぐはああぁッ！,Ooooooougn!,gs2_002.txt
静粛に！　静粛に！,Order! Order!,gs2_002.txt
つ、通報がおくれたから なんだと言うのですか！,Wh-What does reporting the crime a little late prove for you!?,gs2_002.txt
証人は、その１５分間の ことを説明できないでいる！,The witness can't explain what he was doing for those 15 minutes!,gs2_002.txt
これはかなり、アヤシイ！,That is reason enough to throw suspicion on his testimony!,gs2_002.txt
ふむう‥‥たしかに。 どうなんですか、証人！,"Yes, this is very true. What do you have to say for yourself, witness!?",gs2_002.txt
ね。ね。やっぱり、その携帯電話、 アイツのなんじゃないかな。,"Then I bet this phone really is his, Nick!",gs2_002.txt
それを取りもどすために 殺したんだよ！　町尾巡査。,He must've killed Dustin to get his phone back!,gs2_002.txt
でも、マコちゃんは、アイツに それを返すはずだったんだぞ。,But Maggey said that she was going to return it to him.,gs2_002.txt
殺す必要なんて、ないよ。,So there was no reason for him to kill for it.,gs2_002.txt
それに、マコちゃんが拾った電話、 そもそもまだ、ここにあるし。,"And on top of that, we still have the phone she found anyway.",gs2_002.txt
うーん‥‥。 でも、携帯電話じゃないとしたら、,"Hmm... But if he wasn't looking for his cell phone,",gs2_002.txt
何を探してたのかな？ モロヘイヤさん。,was he looking for something else...?,gs2_002.txt
（何かを探していた、か‥‥）,(Was he...?),gs2_002.txt
弁護人。,Mr. Wright.,gs2_002.txt
‥‥はい。,"Yes, Your Honor?",gs2_002.txt
あなたには、何か考えが あるのではないですか？,Do you have any thoughts you would like to share with the court?,gs2_002.txt
空白の１５分のあいだ、 この証人が何をしていたか‥‥？,Can you offer an explanation as to what the witness was doing during those 15 minutes?,gs2_002.txt
今の段階ではまだ、なんとも 言えないですね‥‥。,I'm afraid it's too early to say anything for sure at this time.,gs2_002.txt
そうですか‥‥。 亜内検事。,I see... Mr. Payne?,gs2_002.txt
他に証言してもらうことは ありますか？,Will we be hearing further testimony from the prosecution?,gs2_002.txt
いいえ。以上です。,"No, Your Honor. That is all.",gs2_002.txt
え！,Oh crud...,gs2_002.txt
この証人は、犯行現場で “被告を見た”と証言しています。,This witness has said that he saw the defendant commit the crime at the crime scene.,gs2_002.txt
たしかにそのとき、証人は メガネをかけていませんでした。,"While it is true that the witness was not wearing his glasses at the time,",gs2_002.txt
しかし、犯人との距離は近かった。 それを目撃することは可能でした。,"the court feels that since he was near the culprit, positive identification is possible.",gs2_002.txt
ということは‥‥？,Which means...?,gs2_002.txt
被告人・須々木　マコの犯行は、 じゅうぶん立証されたと考えます。,"The guilt of the defendant, Maggey Byrde, has been sufficiently substantiated.",gs2_002.txt
えええええええっ！,WHAAAAAAAT!?,gs2_002.txt
なるほどくん！ なんとかしないと‥‥！,Nick! You have to do something before it's too late!!,gs2_002.txt
それでは、これで尋問を終了‥‥,I hereby close the cross-exa--,gs2_002.txt
わ、わかりました！,W-Wait!,gs2_002.txt
モロヘイヤさんが、空白の １５分間に何をしていたか？,"As to the actions of Mr. Wellington during the 15 minute gap,",gs2_002.txt
‥‥弁護側の考えを 述べたいと思います！,the defense would like to propose an explanation!,gs2_002.txt
さきほど弁護人は、それはムリだと 認めたばかりですぞ！,I thought the defense had just finished proving that this couldn't be explained!,gs2_002.txt
１つだけ、可能性があります！,"No, there is one possibility!",gs2_002.txt
わかりました。 弁護人の考えを聞きましょう。,Alright. Let's hear your explanation.,gs2_002.txt
‥‥ただし。その考えに説得力が なかった場合‥‥,"However, be forewarned that if your explanation is not persuasive,",gs2_002.txt
ペナルティを与えます。 ‥‥よく考えてください。,"you will be penalized. Think carefully before you present, Mr. Wright.",gs2_002.txt
は、はい！,"Yes, Your Honor!",gs2_002.txt
（しまった‥‥。“１つだけ” なんて言わなきゃよかった‥‥）,(Urk. I probably shouldn't have said there was only one possibility...),gs2_002.txt
以下の疑問の答えを示す 証拠品を提示してください。,Please present to the court the one piece of evidence that will answer the following:,gs2_002.txt
“証人はなぜ、警察にすぐ 通報しなかったか‥‥？”,"""Why didn't the witness call the police right away?""",gs2_002.txt
その証拠は、あるいは コレではないでしょうか！,Perhaps this is the evidence you need to be convinced!,gs2_002.txt
“あるいは”、ですね？,Perhaps?,gs2_002.txt
そ、そうですよ。 単なる一例ですから、今のは。,Aha ha ha. That was just an idea I thought I'd throw out.,gs2_002.txt
別の“あるいは”を 見せてください。,"I suggest that ""perhaps"" you should find a better piece of evidence.",gs2_002.txt
は、はい！　では‥‥,"Yes, of course, Your Honor! Well then...",gs2_002.txt
その前に！ ペナルティを与えます。,"But before you do, you will be penalized.",gs2_002.txt
（いたたた‥‥）,(Ouch.),gs2_002.txt
‥‥１つだけ、考えがあります。,There is only one possible explanation.,gs2_002.txt
モロヘイヤさん！,Mr. Wellington!,gs2_002.txt
な、なんだ！ オドかさないでくれたまえ‥‥。,Wh-What!? Don't do that! You almost made me have a heart attack!,gs2_002.txt
これは、あなたのメガネですね？,"These are your glasses, aren't they?",gs2_002.txt
あっ！　ど、どこでそれを‥‥ ハッ‥‥‥！,Ah! Where... Where did you find--!? Ghaaaa!,gs2_002.txt
‥‥聞きましたかみなさん。 彼は今、認めましたね。,I believe the court all heard what you just confessed to:,gs2_002.txt
このメガネが、 自分のものであることを！,That these glasses are in fact yours!,gs2_002.txt
モロヘイヤさん、 教えてあげましょう。,"I'll tell you where they were found, Mr. Wellington.",gs2_002.txt
こいつは、被害者の死体の下から 発見されたんですよ。,These glasses were found under the victim's body.,gs2_002.txt
ななな、なんだってェェェ！ 死体の下ァァァ！,U-Under the v-victim's body!?,gs2_002.txt
静粛に！　静粛に！,Order! Order!,gs2_002.txt
まま、ま、ま、待ってくれ！,"N-Now, w-wait a second! Hold on!",gs2_002.txt
ボ、ボクは、 何も認めたワケじゃないぞ！,I-I didn't confess or confirm a-any-anything!,gs2_002.txt
裁判長！ 答えはハッキリしています！,Your Honor! I think the answer is quite clear here!,gs2_002.txt
町尾巡査は、つき落とされたとき、 犯人のメガネをつかみとった！,"As he fell, Dustin Prince grabbed the culprit's glasses.",gs2_002.txt
メガネをなくした犯人は、 必死でそれを探した！,"The culprit knew that he had to find his glasses, and searched frantically for them.",gs2_002.txt
しかし、死体の下には 気がつかなかった！,What he didn't realize was that they were under the victim's body!,gs2_002.txt
‥‥だから、通報が１５分、 おくれたのです！,And that is why it took him 15 minutes to make that call!,gs2_002.txt
べ‥‥弁護人！ つ、つまりあなたは‥‥,M-Mr. Wright! Are you...?,gs2_002.txt
告発するつもりですか！ この証人を‥‥真犯人だと！,Are you indicting the witness as the real murderer!?,gs2_002.txt
‥‥もちろん、そのつもりです！,Of course! That is precisely what I am doing!,gs2_002.txt
う‥‥‥‥ うおおおおおおおおおおおおッ！！,Oooo...OOOOWAAAAAAAAAA AAAAAAAAAAAAAAAAAAAAAA AAAAAAAAAAAAAAAAAAAAH!,gs2_002.txt
（まちがいない！）,(I know I'm right!),gs2_002.txt
（真犯人は、アイツだ！）,(He is the real murderer!),gs2_002.txt
なるほどくん！ ゼンブ、わかっちゃったの？,"Did you figure it out, Nick!?",gs2_002.txt
‥‥なんとなく、ね。,More or less.,gs2_002.txt
やっぱり、事件のカギは この携帯電話だったんだよ。,Turns out this cell phone was the key to this case after all.,gs2_002.txt
‥‥とにかく、 アイツを沈めるチャンスだ！,"Anyway, now is our chance to deep-six this guy.",gs2_002.txt
イッキに追いつめるぞ！,I'll sink him in one shot!,gs2_002.txt
う‥‥うん！,Yeah!,gs2_002.txt
なんだかあたし、コーフンして きちゃったよ‥‥！,"This is so exciting, watching you work again!",gs2_002.txt
（‥‥どうやらぼくは 自分をとりもどしつつあった）,"(Somehow, my old self is coming back to me.)",gs2_002.txt
（ノルかソルかの勝負。 その、身を切るような一瞬！）,(It's time to sink or swim; everything rests on the edge of a knife!),gs2_002.txt
（それはたしかに、ぼくがいつも 求めていたものだった‥‥）,(This is the moment I've been waiting for...),gs2_002.txt
静粛に！　静粛に！,Order! Order!,gs2_002.txt
裁判長！ べ‥‥弁護人に法廷ブジョク罪を！,Your Honor! The defense... The defense is making a mockery of this court!,gs2_002.txt
なんのコンキョもなく 証人を犯人呼ばわりして‥‥,"Without any solid ground to stand on, he accuses the witness of being the murderer!",gs2_002.txt
そそ、そ、そうだ！,Y-Y-Yeah! That-That's right!,gs2_002.txt
ボ、ボクが犯人なワケ、 ないじゃないかッ！,I... I'm no criminal!,gs2_002.txt
この‥‥この、三流の ヘボ弁護士が‥‥,"Th-This third-rate, fraud of a lawyer...",gs2_002.txt
‥‥モロヘイヤさん。 じゃあ、逆に聞きましょう。,"In that case, why don't we look at it from a different perspective.",gs2_002.txt
どうしてあなたが 犯人じゃないと言えるんですか！,Let's hear your explanation as to why you are NOT the murderer!,gs2_002.txt
な‥‥！　そんな、 カンタンなコトだろ！,"Why, that's... That's easy... Um... Uh...",gs2_002.txt
たとえば、アレがある！ ‥‥被害者が書き残した名前！,For example... There's um... The name the victim wrote! What about that...?,gs2_002.txt
ああ。‥‥あの《鈴木》という 文字のことですか？,"Oh, you mean the name ""Maggie""?",gs2_002.txt
い、いくらキミでも、 それぐらいは読めるだろう？,"Y-Yeah! Even an idiot like you can read that, right?",gs2_002.txt
しかしこれは、被害者が 書いたものではない！,But we already know this was not written by the victim himself.,gs2_002.txt
被告人の名前は《須々木》だし、 被害者は左ききでした。,"After all, the defendant's name is ""Maggey"" and the victim was left-handed.",gs2_002.txt
つまりこれは、被告人に 罪を着せるために、,"So basically, you are saying that in order to make the defendant look guilty,",gs2_002.txt
真犯人が被害者の右手を使って 書き残した、ということですね？,the real criminal used the victim's right hand to write her name on the ground?,gs2_002.txt
で、でも！　でもでも！,"B-But... But, but!!",gs2_002.txt
真犯人は、被告の 知り合いってコトだろう？,Wouldn't that mean that the real criminal was someone the defendant knew?,gs2_002.txt
彼女の名前が“スズキ”だって 知っていたわけだからな！,"Otherwise, how else would that person know her name was ""Maggie"", er ""Maggey""!?",gs2_002.txt
たしかに、そのとおりです。,That is a good point.,gs2_002.txt
この証人は、須々木　マコさんを 知らないはずですね。,The witness didn't even know of Ms. Byrde before this trial.,gs2_002.txt
（どうなんだ‥‥！）,"(Ah, I forgot!)",gs2_002.txt
（アイツに、被告人の名前を 知るチャンスはなかったのか？）,"(Hmm, was there any way this creep could've known Maggey's name beforehand?)",gs2_002.txt
（ダメだ！ どう考えたって‥‥）,"(No matter how I look at it, it's no good!)",gs2_002.txt
（アイツがマコちゃんのことを 知っていたはずがない！）,(There is no way he could have known Maggey or her name!),gs2_002.txt
ダ、ダメだよなるほどくん！ アイツに逃げられちゃう！,Nick! You can't let this slimebag get away!,gs2_002.txt
もっと、考えないと！,Think harder!,gs2_002.txt
そ、それはそうだけど‥‥ （とにかく、整理してみるか）,"Y-You're right... (OK, let's go over this from the beginning one more time.)",gs2_002.txt
（ようするに、証人にチャンスが あったことを証明すればいい）,(It would be best if I could prove that the witness had a chance to learn...),gs2_002.txt
（彼女の名前が“スズキ”だと 知るチャンスが‥‥）,"(that the defendant's name was ""Maggey"".)",gs2_002.txt
では、弁護人。 提示していただきましょうか。,"Now, will the defense please present its case?",gs2_002.txt
この証人が、どうやって 被告の名前を知ることができたか？,How could the witness have known the defendant's name?,gs2_002.txt
その証拠は、これです！,This is how!,gs2_002.txt
弁護人が何もわかっていない という証拠ですかな？,Am I supposed to take this as evidence that the defense doesn't know what's going on?,gs2_002.txt
あ、あれ？　‥‥ははは。,Huh?... Oh... Ah ha ha ha.,gs2_002.txt
もう、笑ってすまされるような トシではないですぞ！,Aren't you a little old to be laughing like a 5-year old? Take some responsibility!,gs2_002.txt
（あんたにトシのコトを 言われたくないぞ‥‥）,"(As if I need a lecture about responsibility from you, of all people...)",gs2_002.txt
弁護人にペナルティを与えます。,The defense will receive a penalty.,gs2_002.txt
もう一度、考えなおしてください。,Please think carefully before presenting your case again.,gs2_002.txt
はい‥‥。,"Yes, Your Honor...",gs2_002.txt
‥‥モロヘイヤさん。,Mr. Wellington.,gs2_002.txt
事件があったとき、携帯電話を 落としていたそうですね？,"You didn't have your cell phone with you on the day of the murder, correct?",gs2_002.txt
そ、それがどうかしたかい！,So what if I didn't?,gs2_002.txt
それに気づいたあなたは、 どうしましたか？,"When you realized you had lost it, what did you do?",gs2_002.txt
‥‥ど、どうした、って‥‥？,What did I do?,gs2_002.txt
落とした携帯電話の番号に、 かけてみませんでしたか？,Didn't you try to find it by calling it?,gs2_002.txt
‥‥！　ど、どうしてそれを‥‥,Why you...! How did you...!?,gs2_002.txt
裁判長！　今の質問は、事件に なんら関係が‥‥,Your Honor! These questions have nothing to do with...,gs2_002.txt
却下。,Overruled.,gs2_002.txt
成歩堂くん。どういうことですか？,"Mr. Wright, where are you going with this line of questioning?",gs2_002.txt
この証人の携帯電話が、 事件に関係あるのですか？,Do you think there is some relation between this witness' cell phone and the murder?,gs2_002.txt
‥‥あります。,"I do, Your Honor.",gs2_002.txt
須々木　マコは事件当日、公園で 携帯電話を拾っています。,"On the day of the murder, Maggey Byrde picked up a lost phone in the park.",gs2_002.txt
‥‥そして！,And!,gs2_002.txt
落とし主からの電話を一度、 受けているのです！,She also received a phone call from the owner of the phone!,gs2_002.txt
‥‥ピッ‥‥,...*beep*...,gs2_002.txt
『あ、あの、もしもし。 スズキと申しますが‥‥』,"""Um, hello?""",gs2_002.txt
『あ。すみません。その携帯電話を 落とした者なんですけど‥‥』,"""Oh, thank you! I've been searching for my phone.""",gs2_002.txt
『よかった！　じゃァさっそく お会いして、お返ししますッ！』,"""Is this yours? Oh, I'm glad you called! We can meet up and I can give this back!""",gs2_002.txt
『すぐ、そちらにうかがいます。 もう一度、お名前を‥‥』,"""I'll be right there, um... I'm sorry, I didn't catch your name...""",gs2_002.txt
『はッ！　スズキ　マコッス！』,"""You can call me Maggey!""",gs2_002.txt
あなたは、その時に知ったのです。 彼女の名前が“スズキ”だと！,"That was when you learned that her name was ""Maggey""!",gs2_002.txt
う‥‥ぐぐ‥‥,"Uh, um, nnngh...",gs2_002.txt
しかし、あなたは１つ カンちがいをした。,But you made one fatal mistake.,gs2_002.txt
カンちがい‥‥？,Fatal mistake?,gs2_002.txt
被告の名前は《須々木》です。 書き残された名前は《鈴木》‥‥,"My client's name is ""Maggey"" but the name that was written on the ground was ""Maggie"".",gs2_002.txt
このまちがいは、耳で聞いたとき にしか、起こらない！,This is a mistake that could only occur if all you knew was how her name sounded!,gs2_002.txt
ひいイィッ！,EEEEEEEEEK!,gs2_002.txt
静粛に！　静粛に！,Order! Order!,gs2_002.txt
お、おま‥‥お待ちください！,"B-But, Your Honor!",gs2_002.txt
この証人には、動機がありません！,The witness has no motive!,gs2_002.txt
ほほお。‥‥と、言いますと？,And your point is?,gs2_002.txt
カンタンなことです。 人を殺すには、何か理由がある。,"It's very simple, Your Honor. A person usually would not kill someone without a reason.",gs2_002.txt
モロヘイヤくんには、 その理由がありません！,Mr. Wellington had no reason to kill anyone!,gs2_002.txt
そ‥‥そうともっ！ ドーキがないよボクには！,That is absolutely correct! I don't have a motive!,gs2_002.txt
‥‥ふむう‥‥。弁護人。,Hmm... Mr. Wright.,gs2_002.txt
はい。,Your Honor?,gs2_002.txt
証明できますかな？ この証人の“動機”を‥‥。,Can you explain what motive this witness could have had?,gs2_002.txt
カンタンなコトです。,"It's very simple, Your Honor.",gs2_002.txt
‥‥‥‥！,,gs2_002.txt
だだ、だいじょうぶなの？ なるほどくん‥‥。,"Are you sure, Nick!?",gs2_002.txt
だって、“できません”て言ったら 終わっちゃうだろ？　裁判。,"If I said I can't offer an explanation, then the trial's over, right?",gs2_002.txt
そ、そりゃそうだけど‥‥。,"Yeah, but...",gs2_002.txt
では、提示してもらいましょう。 この証人の“動機”を示す証拠を！,"Now then, please present to this court proof that the witness had a motive!",gs2_002.txt
犯人は、これが理由で 被害者を殺したのではないか！,The murderer killed the victim because of this!,gs2_002.txt
弁護人は、苦しまぎれに デタラメな証拠を提出しておる！,The defense is obviously haphazardly throwing out evidence in desperation!,gs2_002.txt
そのようですね‥‥。,It certainly seems that way.,gs2_002.txt
ここまできて、 ハッタリは通用しませんぞ！,Don't let all your hard work up to this point go to waste on a random guess.,gs2_002.txt
‥‥しまった‥‥。,What was I thinking...?,gs2_002.txt
モロヘイヤの動機はコイツです！,Mr. Wellington's motive is right here!,gs2_002.txt
携帯電話‥‥。,The cell phone?,gs2_002.txt
須々木　マコが拾った電話には、 ある電話番号が登録されていた！,In the memory of the phone the defendant found was a list of certain phone numbers!,gs2_002.txt
モロヘイヤの動機はコイツです！,Mr. Wellington's motive is right here!,gs2_002.txt
な‥‥なんですか、 それは‥‥リスト？,What is this? ...A list?,gs2_002.txt
須々木　マコが拾った携帯電話に 登録されていた電話番号です。,These phone numbers were pulled from the memory of the phone the defendant found.,gs2_002.txt
これらの名前は、あるグループの メンバーだとわかりました！,"And we have determined that the people on this list are members of a ""certain group"".",gs2_002.txt
し‥‥調べたのか？ そ、その番号を‥‥。,You... You looked up all those numbers...?,gs2_002.txt
‥‥もちろん。,Of course.,gs2_002.txt
これは、その電話に登録されていた 番号のリストです。,This list of phone numbers was stored in the cell phone's memory.,gs2_002.txt
電話番号とその名前はすべて、ある 詐欺グループのメンバーのものだ！,The names and numbers belong to people who are members of a certain con artists' group.,gs2_002.txt
ななな、なんですってぇ！ さ‥‥詐欺ぐるーぷ‥‥？,Wh-Wh-Wh-Wh-What!? C-C-Con artists!?,gs2_002.txt
