Japanese,English,Note
‥‥あれの１０倍ぐらい、 くらくらしたんじゃないかと‥‥,...I guess the damage was maybe... about 10 times the dizziness...?,gs2_006.txt
きゃん！,Ack!,gs2_006.txt
あ‥‥あいすまねッス！,S-Sorry!,gs2_006.txt
そのピストルは、 いったいどこから‥‥？,Where in the world did that pistol come from?,gs2_006.txt
どうやら被害者の霧崎医師は、 あの日のために用意していたッス。,"It looks like the victim, Dr. Grey had specifically bought it for that day.",gs2_006.txt
ピストルを、ですか‥‥？,But a handgun...?,gs2_006.txt
ヤミルートから手に入れたッス。 事件の２日前に。,He got it off the black market about 2 days before the murder.,gs2_006.txt
（霧崎先生、どうして ピストルなんか‥‥）,(Why did Dr. Grey bring a gun...?),gs2_006.txt
（用心のため、 だったのかな‥‥？）,(Was he taking precautions against something...?),gs2_006.txt
じゃあ、この装束の弾痕は、 そのときに‥‥？,"So, you're saying that the bullet hole in this costume was made then?",gs2_006.txt
そう考えるのが自然ッス。,"Sorry, pal, but that's what I'd think.",gs2_006.txt
２人はもみ合っていて、 そのとき発砲されたッス。,The two of them were already fighting when a shot was fired.,gs2_006.txt
（‥‥真宵ちゃん、当たらなくて よかったな‥‥）,(Maya... I'm really glad you weren't hurt...),gs2_006.txt
真宵ちゃんは、ピストルなんて 撃ったことはない！,Maya has never fired a gun before in her life!,gs2_006.txt
安全装置は、被害者が すでにハズしていたッス。,The victim had already taken off the safety.,gs2_006.txt
引き金さえ引けば、アンタですら 発砲できたッス。,"With the safety off, even an amateur like you can fire it by pulling the trigger.",gs2_006.txt
（そうなのか‥‥ ぼくですら‥‥）,(Even me...? I wonder...?),gs2_006.txt
おわかりかしら？,Now do you understand?,gs2_006.txt
狩魔のロジックは カンペキなの。,A Von Karma's logic is perfect.,gs2_006.txt
‥‥装束にあいた、小さな穴。,Missing the tiny hole on this costume...,gs2_006.txt
これを見落としたのは 致命的でしたね。,will be the prosecution's undoing.,gs2_006.txt
ど‥‥どういうコトッスか？,Eh? What do you mean?,gs2_006.txt
この小さな穴が、あなたの証言に あいた大きな穴を証明している！,This little hole has actually created a huge hole in your testimony!,gs2_006.txt
は‥‥早く説明を！ 成歩堂くん！,"E-Explain yourself, Mr. Wright!",gs2_006.txt
２人はもみ合っていて、被害者が 至近距離から発砲した。,You said the two of them were fighting when the victim fired his gun at point blank.,gs2_006.txt
それならばなぜ！ 装束の弾痕にコゲあとがないのか？,"If that were true, then where is the gunpowder burn on this costume!?",gs2_006.txt
こ‥‥コゲあと‥‥ッスか‥‥？,G-Gunpowder... burn?,gs2_006.txt
さっき、あなたは こう証言したはずです！,This is what you testified earlier:,gs2_006.txt
“至近距離から撃たれた弾痕には、 コゲあとができる”と！,"""When something is shot from point blank, a burn area is left around the bullet hole.""",gs2_006.txt
うおおッ！,OH!,gs2_006.txt
この装束の弾痕には、 コゲあとなんか、ない！,But there is not a single trace of gunpowder burn on this costume!!,gs2_006.txt
‥‥たしかに、そのとおりです。,That is a very good point.,gs2_006.txt
となると‥‥どういうことに？,And... what exactly does this mean?,gs2_006.txt
発砲されたとき、２人はかなり はなれていたことになります。,"It means that when the shot was fired, they were standing apart from each other.",gs2_006.txt
ふむう‥‥,Hmm...,gs2_006.txt
ガッカリね、成歩堂　龍一‥‥。,"I'm disappointed, Mr. Phoenix Wright.",gs2_006.txt
そんなことで、私のロジックに 穴があくと思って？,You think you can punch a hole in my logic with that?,gs2_006.txt
そのていどのコト、 なんとでも説明がつくでしょ！,"With wishy-washy thinking like that, anyone can explain anything away!",gs2_006.txt
それなら、なんとでも 説明してもらいましょう。,Then I implore you to disprove my line of thinking.,gs2_006.txt
たとえば、そうね‥‥。,Let's see...,gs2_006.txt
もみ合っているときに、 被害者が被告人を突きとばした。,"In the middle of their fight, the victim pushed the defendant away.",gs2_006.txt
そして、距離があいたときに、 撃った！　‥‥どう？,"And it was then, when they were separated, that he fired! How was that?",gs2_006.txt
‥‥お話になりませんね。,As if that was even possible.,gs2_006.txt
証言では、被害者は刺されたとき、 かなりダメージを受けていた。,"According to testimony, the wound from the stabbing was very severe.",gs2_006.txt
被告人を遠くまで突きとばす チカラなど、残っていない！,The victim would not have had the strength to push the defendant very far after that!,gs2_006.txt
‥‥‥‥！,,gs2_006.txt
じゃ、じゃあ‥‥そうね。,W-Well... Then...,gs2_006.txt
‥‥そう！ 被告のほうから、はなれた！,That's right! The defendant must have pushed the victim away!,gs2_006.txt
ナイフで刺したあと、彼女は 一度、霧崎医師とキョリをとった。,"After stabbing him, she must have put some space between the doctor and herself.",gs2_006.txt
そして、ナイフをかまえなおして、 ふたたび、おそいかかったのよ。,"And then while she was preparing to strike again, the doctor took his shot.",gs2_006.txt
そのとき、被害者は発砲した。 ‥‥これなら問題ないでしょう！,There. That should satisfy even you.,gs2_006.txt
‥‥ふむう‥‥それなら スジがとおるようです。,Hmm... That does make an awful lot of sense.,gs2_006.txt
いかがですか？　成歩堂くん。,"What do you think, Mr. Wright?",gs2_006.txt
（ここは‥‥マチガイは ゆるされないぞ！）,(I must be careful. I can't afford to make a mistake here!),gs2_006.txt
（ジックリ急いで考えるんだ！）,(Concentrate and think!),gs2_006.txt
（‥‥どう考えても‥‥今度こそ “穴”はないみたいだ‥‥）,"(Ack, it's no good. I can't find a ""hole"" in her logic at all this time...)",gs2_006.txt
どうやら‥‥ スジはとおるようです。,"I admit it. Somehow, your reasoning makes logical sense.",gs2_006.txt
成歩堂　龍一！ ‥‥そのコトバが聞きたかったの。,"That's it. That's exactly what I wanted to hear from you, Mr. Phoenix Wright!",gs2_006.txt
１１時。お茶の時間は すぎてしまったようね‥‥。,Drat. It's 11:00 AM. I've already missed my morning tea.,gs2_006.txt
‥‥でも。,...However.,gs2_006.txt
とにかく、今度こそ ケツロンが出たみたいね。,At least we were able to arrive at a conclusion.,gs2_006.txt
ふむう‥‥そのようですな。,Hmm... It does look that way.,gs2_006.txt
（‥‥だ、ダメだ！　このままじゃ すべてが終わってしまう！）,"(...Oh boy... If I don't do something soon, it'll be curtains for Maya...)",gs2_006.txt
それでは、これで‥‥,"Well then, I think we can...",gs2_006.txt
裁判長‥‥お待ちください！,Your Honor! Please... Wait!,gs2_006.txt
‥‥なんですか？　弁護人？ 発言は慎重におねがいします！,Who was that? Mr. Wright? Please refrain from making unnecessary outbursts!,gs2_006.txt
（ムリヤリでも、狩魔の説明に ムジュンを見つけるんだ！）,"(I don't care how, but I must find something to go on in Von Karma's explanation!)",gs2_006.txt
狩魔検事の説明には、 致命的なムジュンがあります！,"There is a fatal flaw in her argument, Your Honor!",gs2_006.txt
致命的な‥‥,Fatal...?,gs2_006.txt
ムジュン‥‥！ やはっ！,Flaw...!? Yeow!,gs2_006.txt
おもしろい‥‥。 じゃ、見せてもらおうじゃない！,"Very interesting. I would love to see where this ""flaw"" is!",gs2_006.txt
私の説明に ムジュンする証拠品を！,Show me something that contradicts my explanation!,gs2_006.txt
（‥‥さっきの狩魔の説明には、 どこかにムジュンがあるはず！）,(There has to be a snag in her explanation somewhere!),gs2_006.txt
（“被告は、トドメを刺す前に 被害者とキョリをとった”）,"(""She put some distance between them before rushing to make the final blow."")",gs2_006.txt
（“そしてもう一度、おそい かかったところを撃たれた”）,"(""And when she was about to strike, the doctor took his shot."")",gs2_006.txt
（‥‥この説明にムジュンする 証拠品は、ズバリ！）,(There must be a piece of evidence that contradicts this line of thinking!),gs2_006.txt
これを見てください！,Take a look at this!,gs2_006.txt
それがどうしたッス？,"Why are you showing this to me, pal?",gs2_006.txt
あきらかに、狩魔検事の 説明のムジュンを‥‥,Prosecutor von Karma's explanation and this piece of evidence...,gs2_006.txt
説明していないッス！,...Do not contradict!,gs2_006.txt
‥‥え。,...Huh?,gs2_006.txt
やれやれ。考えなおしたほうが いいッスな。,"Haha, looks like you need to use your brain a little more, pal.",gs2_006.txt
（イトノコ刑事にあしらわれると、 ヒドくクツジョクを感じるな）,"(Ugh... Being lectured by Gumshoe, of all people, is so embarrassing...)",gs2_006.txt
ホラ！　早くやりなおすッス！,Come on! Hurry up and get that thinking cap on!,gs2_006.txt
その証拠は‥‥これです。,This is the piece of evidence that destroys your logic.,gs2_006.txt
なんですか‥‥ビョウブ？,What is that? A folding screen?,gs2_006.txt
重要なのは、ビョウブに あいている“穴”です。,"I would like to point the court's attention to the ""hole"" in this folding screen.",gs2_006.txt
‥‥あああッ！,Aaah!,gs2_006.txt
‥‥どうやら、 わかったようですね。,It looks like you already know what I'm talking about.,gs2_006.txt
え？　え？　何がッス？,Who? Where? What?,gs2_006.txt
せせ、セツメイを！,"Mr. Wright! Your explanation, please!",gs2_006.txt
（‥‥このヒトたち、 ホントにわからないのか‥‥？）,(Are these two really that clueless...?),gs2_006.txt
弾丸は、被告のたもとをつらぬいた あと、ビョウブに当たった。,"The bullet went through the defendant's sleeve first, then the folding screen.",gs2_006.txt
床から２０ｃｍほどのところに。 ‥‥ということは！,It passed through at a height of approximately 8 inches off the ground... Which means!,gs2_006.txt
発砲されたとき、真宵ちゃん‥‥ いや被告は‥‥,"When the shot was fired, Maya... I mean, the defendant,",gs2_006.txt
おそいかかるどころか、 しゃがみこんでいたことになる！,"was not getting ready to strike, but was actually squatting low to the ground!",gs2_006.txt
静粛に！　静粛に！,Order! Order!,gs2_006.txt
‥‥た、たしかに そういうことになります！,Th-This changes everything!,gs2_006.txt
現場の上面図を見てください。,Please look at this diagram of the crime scene.,gs2_006.txt
銃を撃ったとき、霧崎医師は このあたりにいました。,"The victim, Dr. Grey was here when he fired the shot.",gs2_006.txt
そして、弾丸はビョウブに 当たりました。,And the bullet hit this folding screen.,gs2_006.txt
‥‥ビョウブのこの位置です。 高さは、床から２０ｃｍ。,"It hit at this location, about 8 inches off the ground.",gs2_006.txt
その瞬間‥‥、被告は このあたりにいたはずです。,"At this time, the defendant was in this area.",gs2_006.txt
このあたりです！,Here!,gs2_006.txt
ビョウブのウラ‥‥ですか？,Behind the folding screen...?,gs2_006.txt
ぎゃあ！,Ack!,gs2_006.txt
被害者と犯人は、もみあって いたんでしょ！,"The victim and his attacker were fighting, were they not?",gs2_006.txt
なんでそんなところに いるのよ！,Then what would the attacker be doing all the way back there!?,gs2_006.txt
え‥‥。,Um...,gs2_006.txt
だいいち、ビョウブのウラに いたんじゃあ、,"Besides which, if the attacker was behind the folding screen,",gs2_006.txt
被害者が、それをねらって 撃てたはずがない！,then how could the victim even know where to shoot? It's obviously impossible!,gs2_006.txt
そりゃそうですね。,"Yeah, I guess so...",gs2_006.txt
コラ！　弁護人！,Mr. Wright!,gs2_006.txt
（さすがにマズかったな‥‥）,"(Boy, did I just screw up royally...)",gs2_006.txt
（とにかく、事件が起こったときの 真宵ちゃんの位置が重要だ！）,"(What's done is done. For now, I should focus on where Maya was at the time of the crime.)",gs2_006.txt
ここらへんです！,Somewhere around here!,gs2_006.txt
‥‥‥‥‥‥‥？,,gs2_006.txt
（マズい！　裁判長、シリが カユそうなカオをしてる‥‥）,(Uh oh. The judge's face is scrunched like he just smelled some serious bad breath...),gs2_006.txt
え、えーと‥‥ あるいはですね。,"Uhh... Um... That is, I mean...",gs2_006.txt
ちょっと待ってください！ ‥‥おシリがカユいもので。,Wait! I just realized I forgot to brush this morning... Excuse me while I freshen up.,gs2_006.txt
は、はあ。,"Uh, sure...",gs2_006.txt
その間にもう一度、 あなたも考えなおしなさい！,"In the meantime, I want you to think things through again, Mr. Wright!",gs2_006.txt
（やっぱり、 ちがってたみたいだな‥‥）,"(Ah, of course... Whoops...)",gs2_006.txt
（とにかく、事件が起こったときの 真宵ちゃんの位置が重要だ！）,"(What's done is done. For now, I should focus on where Maya was at the time of the crime.)",gs2_006.txt
もちろんここ。 ビョウブの近くです！,"She was standing here, near the folding screen!",gs2_006.txt
ちょ、ちょっと待ちなさい！,W-Wait a second!,gs2_006.txt
被害者がコシを低くしていたのは、 弾痕の高さから推測できる。,We know the defendant was close to the ground based on the height of the bullet hole.,gs2_006.txt
‥‥でも、被害者とのキョリは どうなの！,But... How can you gauge the distance from that!?,gs2_006.txt
もっと、被害者と近い位置に いたかもしれないじゃない！,Isn't it possible that the defendant was standing much closer to the victim?,gs2_006.txt
‥‥それはあり得ません。,That's impossible.,gs2_006.txt
‥‥なぜ！,B-But why!?,gs2_006.txt
理由は、きみが一番よく 知ってるはずだ、狩魔検事。,"You, of all people, should know the answer to that question, Ms. von Karma.",gs2_006.txt
近いキョリから撃たれた 弾痕には、コゲあとができる。,"If she were shot from somewhere closer, there would be gunpowder burns present.",gs2_006.txt
‥‥しかし！,However!,gs2_006.txt
‥‥この装束の弾痕に、 そんなものは見あたらない！,There is nothing of the sort around the bullet hole of this costume!,gs2_006.txt
ああああッ！,Aaaaaah!,gs2_006.txt
く‥‥この‥‥ 成歩堂　龍一が‥‥ッ！,"C-Curse you, Mr. Phoenix Wright! You...!",gs2_006.txt
‥‥ふむう‥‥,Hmm...,gs2_006.txt
“被害者が発砲した瞬間 被告は、はなれた場所にいた”,I believe it has now been proven that,gs2_006.txt
それは立証されたようです。,the defendant was standing a ways from the victim when she was shot at.,gs2_006.txt
しかし、被告の状況は 変わらないと思いますが‥‥？,But do you think this has changed the defendant's situation...?,gs2_006.txt
（そう言われると、 変わらない気もするな‥‥）,"(Hmm, even with that explanation, it feels like nothing has changed...)",gs2_006.txt
（しかし、ここでそれを 認めるわけにはいかない！）,(But I can't give up just yet!),gs2_006.txt
冗談じゃありません！ 状況は、まったく変わります！,"Honestly, Your Honor! This changes everything!",gs2_006.txt
いいですか！　被害者は刺されて 死にかけていた！,The prosecution has claimed that the defendant was aiming to kill by stabbing.,gs2_006.txt
もし殺害するつもりならば、 ナイフでトドメを刺せばいい。,"If that were true, delivering the final strike with the knife would be ideal.",gs2_006.txt
しかし！　ジッサイは どうだったでしょう‥‥？,However! Where and what was the defendant doing at the time...?,gs2_006.txt
‥‥被告はビョウブのそばで‥‥ しゃがんでいたッス‥‥。,...Squatting all the way by the folding screen...?,gs2_006.txt
そのとおり‥‥。,Exactly.,gs2_006.txt
もし綾里　真宵が犯人ならば、,"If Maya Fey was the real murderer,",gs2_006.txt
なぜトドメを刺さず、ビョウブの そばでしゃがみこんでいたのか？,why would she be by the folding screen instead of preparing to strike?,gs2_006.txt
‥‥‥うむむ‥‥‥,Nnngh...,gs2_006.txt
たしかに‥‥不可解ですねえ。,"Upon further consideration, it does make very little sense.",gs2_006.txt
きっと、何か事情があったッス。,"Yeah, I figured there had to be a reason.",gs2_006.txt
その“事情”を立証するのが あなたの仕事です！,Figuring things out and proving the logic behind everything is YOUR job!,gs2_006.txt
むぐぐ‥‥！,Oof...,gs2_006.txt
（よし！　これで判決は カンゼンに‥‥）,"(Alright! With this, the rest of the trial should be in the b--)",gs2_006.txt
（判決はカンゼンに‥‥ わからなくなったな）,(...blast radius of disaster.),gs2_006.txt
さすがね‥‥成歩堂　龍一。,"You are such a smart man, Mr. Phoenix Wright.",gs2_006.txt
何もないゼロの状況から、 ここまで持ちなおすとは。,To think that you've been able to take a completely hopeless case to this point...,gs2_006.txt
パパを手こずらせただけの ことはある。楽しいわ‥‥。,"Now I know why papa had a tough time with you. Mmm, you amuse me...",gs2_006.txt
（出た‥‥オヤジゆずりの イヤミなウス笑い‥‥）,"(Uuugh. Of all the things to inherit, why did it have to be that smarmy smile!?)",gs2_006.txt
‥‥刑事‥‥。,Detective.,gs2_006.txt
よくも、私のカンペキな ロジックをキズつけてくれたわね。,How dare you damage my perfect logic!?,gs2_006.txt
え、え！　‥‥自分のせいッスか？,H-Huh!?... How is it all my fault??,gs2_006.txt
とりあえず、その中途ハンパな ヒゲをそっておきなさい。,"You can start repairing your standing by first removing that three-strand ""goatee"".",gs2_006.txt
おしおきは、そのあと。,"Oh, and rest assured your punishment will come later.",gs2_006.txt
‥‥お、おしおき‥‥,...P-Punishment...,gs2_006.txt
じゃ、裁判長。 この刑事のカオも見あきたし、,"Well then, Your Honor, I think I've had all I can take of this Detective's face.",gs2_006.txt
‥‥そろそろ 次の証人を呼ばせてもらうわ。,I think it's time to call in the next witness.,gs2_006.txt
（次の証人‥‥？ そうか、ナツミさんだな！）,(Next witness...? That's gotta be Lotta!),gs2_006.txt
‥‥わかりました。,Very well.,gs2_006.txt
ここで、５分間の休憩を とりましょう。,The court will take a 5 minute recess.,gs2_006.txt
次の証人の話を聞くのは、 それからにします。,"After we reconvene, we will hear from the next witness.",gs2_006.txt
つづく,To be continued.,gs2_006.txt
そこまで！,That's enough!,gs2_006.txt
本法廷は、これ以上の審議の 必要性を認めません。,This court sees no reason to further prolong the trial.,gs2_006.txt
さらに、被告に対する判決を 決める時間も、必要としません。,Nor is there any need for more time to decide the case against the defendant.,gs2_006.txt
これは、きわめて明白な事件です。 疑問の余地はない！,This case is extremely clear. I see no room for mis- interpretation of the facts.,gs2_006.txt
被告人、綾里　真宵に この場で、判決を言いわたします！,"This court finds the defendant, Maya Fey...",gs2_006.txt
被告人はこれより身柄を 司直に預けるものとし、,"The accused will surrender to the court immediately,",gs2_006.txt
１ヶ月以内に、高等裁判所において 通常裁判を受けることとします。,to be held pending trial at a higher court within a month from today's date.,gs2_006.txt
では、本日はこれにて閉廷！,That is all. This court is adjourned!,gs2_006.txt
