Japanese,English,Note
６月２１日　午前　９時４８分 地方裁判所　被告人第３控え室,"June 21, 9:48 AM District Court Defendant Lobby No. 3",gs2_006.txt
ええええっ！,Whaaaaaaaat!?,gs2_006.txt
かるまけんじ‥‥って、 あの‥‥？,Prosecutor von Karma!? You mean...?,gs2_006.txt
いや、それが‥‥ どうも、その２代目らしいよ。,"No, I heard it's his successor this time...",gs2_006.txt
にだいめ‥‥。,Successor...?,gs2_006.txt
ヒドいヤツだったよね。 狩魔検事。,Manfred von Karma. He was a really sinister man.,gs2_006.txt
自分が勝つためなら、 どんなヒキョウな手だって‥‥,He pulled all sorts of nasty tricks; all so he could win.,gs2_006.txt
（“カンペキ”という コトバに異常にこだわる男‥‥）,"(He was a man obsessed with the word ""perfection""...)",gs2_006.txt
（記録上は、４０年間 ‥‥完全に無敗）,(He had a perfect record... for forty long years.),gs2_006.txt
（有罪判決のウラで、いったい どんな汚い手が使われたことか）,(Who knows what sorts of dirty tricks he used to get each of those guilty verdicts?),gs2_006.txt
（‥‥２代目、か。いったい、 どんなヤツなんだろう）,"(And now, his successor... I wonder what kind of person they will turn out to be...)",gs2_006.txt
もうダメだあ‥‥。,It's no good...,gs2_006.txt
‥‥真宵さまっ！,Mystic Maya!!,gs2_006.txt
はみちゃん！,Pearly!,gs2_006.txt
よく来てくれたねー。 ありがとう。,You showed up! Thanks for coming all this way!,gs2_006.txt
だってわたくし、 もうシンパイで‥‥。,I was really worried about you...,gs2_006.txt
あれ？　おばさまは‥‥ いっしょじゃないの？,"Hey, where's your mother? Didn't you two come together?",gs2_006.txt
おかあさまは、 修験者たちを見ています。,Mother is watching over the trainees.,gs2_006.txt
２日つづけて修行を お休みすることはできない、って。,She said they have training for two days straight with no breaks.,gs2_006.txt
え！　じゃ、じゃあ‥‥ ひとりで？,Huh!? Then... Then... You came all by yourself?,gs2_006.txt
はい！　お屋敷を抜け出して、 地図を見ながら。,Yup! I snuck out of the manor and followed a map.,gs2_006.txt
もしかして、歩いてきたの？,Don't tell me you walked all the way here...,gs2_006.txt
まさか。 ‥‥もちろん、走ってきました！,Of course not! ...I ran!,gs2_006.txt
そ、それはそれは‥‥。 （電車で２時間かかるんだぞ‥‥）,That's... I can't... Oh my... (If it takes two hours by train... Oh man...),gs2_006.txt
はみちゃん。 あの‥‥電車は？,Pearly... What about the train?,gs2_006.txt
はい？ “でんしゃ”‥‥ですか？,"Huh? What's a... ""tray-in""?",gs2_006.txt
（‥‥ダメだこりゃ）,(I give up...),gs2_006.txt
‥‥そろそろ、お時間ですね。,"...It's time, isn't it?",gs2_006.txt
うう‥‥コワいなぁ、カルマ検事。 何するかわかんないもん。,Um... I'm really scared... What if Von Karma tries to do something to me?,gs2_006.txt
あたしやっぱり、 御剣検事がよかったよ。,At least I know Mr. Edgeworth would be nicer to me than Von Karma!,gs2_006.txt
みつるぎけんじさん‥‥って、 どなたですか？,Mr. Eh-ji-werth? Who is that?,gs2_006.txt
んーとね。なるほどくんの ライバル。‥‥でも、親友なの。,"Um, he's Nick's rival... Well, he's also a friend.",gs2_006.txt
いやー、今でもハッキリ おぼえてるよ！,I still remember him as if I had just seen him only yesterday.,gs2_006.txt
最後のサイゴまで、それは それはタイヘンな裁判ばっかり。,Every trial was a scorching fierce battle until the very end.,gs2_006.txt
‥‥とまあ、こんなカンジでさ。 宿命のライバルだよねー‥‥,It was always back and forth with them. But when you're rivals for life...,gs2_006.txt
真宵ちゃん！ ‥‥その名前は口にしないで。,Maya! Please don't mention that name ever again...,gs2_006.txt
‥‥ど‥‥ どうしたの？　なるほどくん‥‥,"Huh...? But why, Nick?",gs2_006.txt
ご‥‥ごめん。‥‥真宵ちゃんは 知らなかったかもしれないね。,"I'm... I'm sorry, Maya. I forgot you don't know...",gs2_006.txt
アイツは‥‥もう、 いないんだよ。どこにも。,He... He's... He's gone... And he's not coming back...,gs2_006.txt
えええええッ！,Whaaaat!?,gs2_006.txt
ちょちょ、ちょっと待ってよ！ そ、それってどういう‥‥,W-W-Wait... Wait a second!! What's that supposed to mean!?,gs2_006.txt
開廷時間です！ 法廷へ入ってください！,Court will commence shortly. Please proceed into the courtroom.,gs2_006.txt
行こう。今は そんな話をしてるときじゃない。,Let's go. Now's not the time to talk about that anyway.,gs2_006.txt
な‥‥、なるほどくん‥‥？,N...Nick...?,gs2_006.txt
同日　午前１０時 地方裁判所　第２法廷,"June 21, 10:00 AM District Court Courtroom No. 2",gs2_006.txt
これより、綾里　真宵の 法廷を開廷します。,Court is now in session for the trial of Maya Fey.,gs2_006.txt
検察側・弁護側とも、 準備のほうはよろしいですかな？,Are the prosecution and the defense prepared?,gs2_006.txt
（なんだ、この女の子は‥‥）,(What is with this girl...?),gs2_006.txt
コラッ！　準備は できてるのですか！　成歩堂くん！,*Ahem!* Mr. Wright!! Are you finally prepared!?,gs2_006.txt
え！,Huh?,gs2_006.txt
‥‥あ、す、スミマセン‥‥。 （なんでぼくばっかり怒るんだよ）,"A-Ah, yes, Your Honor. (Why does he always seem mad at me!?)",gs2_006.txt
成歩堂　龍一‥‥。,Mr. Phoenix Wright.,gs2_006.txt
‥‥‥‥！,,gs2_006.txt
私が女なので、おどろいている。 ‥‥そんなところね。,"You must be a little shocked because I am a woman, correct?",gs2_006.txt
（‥‥ってことは、やっぱり この子が、狩魔検事の‥‥）,"(...Hold on. So this kid is the ""famed"" Prosecutor von Karma...?)",gs2_006.txt
私の名は狩魔　冥（かるまめい）。 ‥‥天才検事よ。,"I am Franziska von Karma, the Prodigy.",gs2_006.txt
はあ‥‥。,I... see...,gs2_006.txt
私がアメリカの検事局を捨てて この国へ来た理由は、ただ１つ。,I gave up a promising career in Germany and came to this country for one sole reason.,gs2_006.txt
‥‥復讐よ。,Revenge.,gs2_006.txt
‥‥復讐‥‥？ （父親、狩魔　豪のことか‥‥）,"Revenge...? (Is this about her father, Manfred von Karma...?)",gs2_006.txt
あの‥‥個人的なことならば、 のちほどゆっくりと‥‥,"Um... If it's something of a personal nature, I'm sure you can...",gs2_006.txt
あうッ！,Oww!,gs2_006.txt
‥‥発言中よ。,I'm talking.,gs2_006.txt
ジャマすると、 このムチがモノを言うわ。,"If you interrupt again, my whip will do the speaking for me.",gs2_006.txt
（ムチじゃなくて クチでモノを言ってくれぇ‥‥）,(Please speak with your mouth like a normal person... I beg of you...),gs2_006.txt
いてッ！,Yeow!!,gs2_006.txt
‥‥私はかならず、あなたを倒す！,Make no mistake; I will defeat you!,gs2_006.txt
カクゴすることね‥‥ 成歩堂　龍一ッ！,"Prepare to go down, Mr. Phoenix Wright!",gs2_006.txt
では、狩魔検事。 ‥‥冒頭弁論をおねがいします。,"Prosecutor von Karma, your opening statement, please...",gs2_006.txt
‥‥狩魔の血を引く者は、 １つの宿命を負っている。,Those of Von Karma blood have only one fate.,gs2_006.txt
それはすなわち、 “カンペキな立証”‥‥,"And that is ""perfection"".",gs2_006.txt
被告人・綾里　真宵に 罪を逃れる道はないと宣言するわ！,"The defendant, Maya Fey, will find no escape from her guilt on my watch.",gs2_006.txt
わわ、わかりました。 ‥‥ところで、弁護人。,V-Very well... What is the defense's position?,gs2_006.txt
はい。,Your Honor.,gs2_006.txt
弁護側の主張ですが、《完全無罪》 ということでいいのですか？,"Does the defense wish to enter a plea of ""not guilty""?",gs2_006.txt
‥‥ええ。,...Yes.,gs2_006.txt
‥‥バカほどバカゆえに バカなユメを見るもの‥‥。,Foolish fool who foolishly dreams of foolish dreams...,gs2_006.txt
今から１０分以内。弁護人は、 意見を変えざるをえなくなる。,Ten minutes. I give the defense ten minutes before it changes its plea.,gs2_006.txt
そう。《正当防衛》という 逃げ道にね。,"That's right. I'll have you running for the ""justified self-defense"" plea in no time.",gs2_006.txt
（《正当防衛》‥‥）,"(""Justified self-defense""...)",gs2_006.txt
（命が危険にさらされたとき、 自衛のため相手を死なせること）,(A plea usually reserved for when a person unintentionally kills in defense of himself.),gs2_006.txt
（たしかに、そのほうが 証明しやすいけど‥‥）,"(We could very easily make a solid case that it was self-defense, but...)",gs2_006.txt
弁護側は、あくまでも 《完全無罪》を主張します！,"The defense stands by the plea of ""not guilty"", Your Honor!",gs2_006.txt
（《正当防衛》は、“殺した”と 認めてしまうわけだからな）,"(Because to plead ""justified self-defense"" is to say you did kill someone.)",gs2_006.txt
‥‥おろかな。,How foolish.,gs2_006.txt
じゃあ、最初の証人を呼ぶわ。 ‥‥成歩堂　龍一！,"If that's how you want to play it, Mr. Phoenix Wright,",gs2_006.txt
,then I shall now call the first witness.,gs2_006.txt
（‥‥オヤジとちがって イキがいいなあ‥‥）,"(She's just as scary as her father. Like father, like daughter I suppose.)",gs2_006.txt
証人。名前と職業は？,"Witness, your name and occupation?",gs2_006.txt
はッ！　名前は糸鋸　圭介。 所轄署の刑事ッス。,"Yes, sir! My name is Dick Gumshoe. I'm a detective at the local precinct.",gs2_006.txt
うはっ！,Aah!!,gs2_006.txt
‥‥そんなコトは どうでもよろしい。,Get to the point already.,gs2_006.txt
さっさと事件の説明をなさい。,Explain to the court the details of this murder.,gs2_006.txt
りょ、リョーカイッス！　では、 現場の上面図を見てもらうッス。,"Y-Yes, sir! Um, if everyone would please look at this map.",gs2_006.txt
《対面の間》には窓がなく、 扉にはカギがかかっていたッス。,The Channeling Chamber has no windows and the door was locked shut.,gs2_006.txt
事件が起こったとき、部屋の中には 被害者と被告しかいなかったッス。,"At the time of the murder, only the victim and the defendant were in the room.",gs2_006.txt
２人はそこで、 何をしていたんですか？,What were they doing in there?,gs2_006.txt
はッ。‥‥その。 ちょっと、霊媒をッスね‥‥。,"Um... They... Well, they were channeling... a spirit... Sir.",gs2_006.txt
れれ‥‥れいばい‥‥？,Ch-Channeling a spirit??,gs2_006.txt
（裁判長、ウサンくさそうな カオしてるな‥‥）,(The look of disbelief on the judge's face is...),gs2_006.txt
‥‥えへん。 とにかく、霊媒が始まって数分後、,"*ahem* Anyway, a few minutes after the channeling started,",gs2_006.txt
部屋の中から銃声がしたッス。,"gunshots were heard coming from inside the room, sir.",gs2_006.txt
ドアをぶっコワして、 数名の証人が部屋に踏みこむと‥‥,"A few of the witnesses broke the door down, and rushed into the room.",gs2_006.txt
被害者はすでに 亡くなっていた、と。,"Ah, and that's when they found that the victim was already dead, correct?",gs2_006.txt
‥‥これ以上ないぐらい 明白な事件ですな。,"Hmm, I believe this is one of the most open and shut cases I have ever presided over.",gs2_006.txt
証拠品《上面図》を 法廷記録にファイルした。,Floor Plans added to the Court Record.,gs2_006.txt
それで‥‥被害者は どうやって殺害されたのですか？,"So, how was the victim killed?",gs2_006.txt
それが‥‥ 少々こみいってるッス。,I was about to get to that...,gs2_006.txt
さっさとそれを証言なさい。,"Stop wasting my time, then.",gs2_006.txt
～被害者の死因について～,-- Cause of Death --,gs2_006.txt
直接の死因は、コメカミに 撃ちこまれたピストルの弾丸ッス。,"The direct cause of death was a pistol shot to the forehead, sir.",gs2_006.txt
弾丸は、かなり至近距離から 撃たれているッス。,The shot was fired from point-blank range.,gs2_006.txt
ただ、被害者は撃たれる前に、 ムネを刺されているッス。,"But before the victim was shot, sir, he was stabbed in the chest.",gs2_006.txt
傷は、かなりヒドかったッスが、 即死にはいたらなかったッス。,"The wound was very severe, but not enough to cause instantaneous death.",gs2_006.txt
犯人は、トドメを刺すために ピストルを使ったッス。,The murderer used the pistol to finish the victim off after the stabbing.,gs2_006.txt
ふむう‥‥。,Hmm...,gs2_006.txt
ピストルで撃たれる前に、 刺されているんですか‥‥。,So the victim was stabbed before being shot...,gs2_006.txt
これが被害者の解剖記録ッス。,"This is the victim's autopsy report, sir.",gs2_006.txt
証拠品《解剖記録》のデータを 法廷記録にファイルした。,Autopsy Report added to the Court Record.,gs2_006.txt
受理します。 ‥‥では、弁護人。尋問を。,"The court accepts it into evidence. Mr. Wright, you may question the witness.",gs2_006.txt
～被害者の死因について～,-- Cause of Death --,gs2_006.txt
直接の死因は、コメカミに 撃ちこまれたピストルの弾丸ッス。,"The direct cause of death was a pistol shot to the forehead, sir.",gs2_006.txt
弾丸は、かなり至近距離から 撃たれているッス。,The shot was fired from point-blank range.,gs2_006.txt
ただ、被害者は撃たれる前に、 ムネを刺されているッス。,"But before the victim was shot, sir, he was stabbed in the chest.",gs2_006.txt
傷は、かなりヒドかったッスが、 即死にはいたらなかったッス。,"The wound was very severe, but not enough to cause instantaneous death.",gs2_006.txt
犯人は、トドメを刺すために ピストルを使ったッス。,The murderer used the pistol to finish the victim off after the stabbing.,gs2_006.txt
（‥‥とにかく、今のところ、 証言にアヤシイところはない）,(Nothing sounds out of place so far...),gs2_006.txt
（今は、凶器に関する 情報を集めよう‥‥）,"(I should try to learn more about the murder weapons, for now...)",gs2_006.txt
凶器のピストルは、 だれのものだったんですか？,"The murder weapon, Detective Gumshoe. Whose pistol was it?",gs2_006.txt
被害者、霧崎医師の ものだったッス。,It was the victim's.,gs2_006.txt
被害者‥‥？ なぜ、そんなものを‥‥,"The victim? Now, why would he have...",gs2_006.txt
“なぜピストルを持っていたか” ‥‥そんなコトどうでもよろしい。,"""Why would he have a pistol?"" Who cares?",gs2_006.txt
それより、そのピストルに 付着していた指紋。,The point that you are missing is whose fingerprints are on that pistol.,gs2_006.txt
そちらに注目してくれるかしら。 というか、注目しなさい。,"If you're not already paying attention to that, then I suggest you start.",gs2_006.txt
指紋‥‥ですか。 もしかして‥‥？,Fingerprints? There were fingerprints?,gs2_006.txt
ピストルのグリップには 被害者の指紋といっしょに、,"Along with the victim's,",gs2_006.txt
綾里　真宵の指紋が 残されていたッス。,"the defendant, Maya Fey's were also on the grip, sir.",gs2_006.txt
ふむう‥‥。,Hmm.,gs2_006.txt
凶器のピストルに、 被告の指紋ですか‥‥。,So the defendant's fingerprints were left on the murder weapon...,gs2_006.txt
（‥‥しまった‥‥ ワナだったか！）,(Hmm... I walked right into her hands there.),gs2_006.txt
至近距離‥‥って、 どのくらいですか？,"Point blank, huh? So about how far away was it?",gs2_006.txt
３０～５０ｃｍぐらいッスね。,It was anywhere between 12 to 20 inches away.,gs2_006.txt
どうして、そんなことが わかるんですか？,And how do you know he was shot at point blank?,gs2_006.txt
ふう、やれやれ ‥‥成歩堂　龍一。,"Tsk, tsk, tsk. Mr. Phoenix Wright.",gs2_006.txt
バカな国のバカのバカさかげん には、ウンザリするわね‥‥。,I grow tired of the foolish foolery of the foolish fools of this foolish country...,gs2_006.txt
な、なんだと‥‥！,E-Excuse me!?,gs2_006.txt
‥‥コゲあと。,Gunpowder burn.,gs2_006.txt
コゲあと‥‥？,...Gunpowder burn?,gs2_006.txt
至近距離で弾丸を撃ちこまれると、 弾痕のまわりに、コゲあとがつく。,"When something is shot from point blank, a burn area is left around the bullet hole.",gs2_006.txt
弾丸は、火薬の爆発で アツくなるッスから。,"Gunpowder exploding is what makes a bullet fire, and that gets real hot, pal.",gs2_006.txt
被害者のコメカミは、 ハッキリコゲていたッス！,And there were definitely some gunpowder burns left on the victim's forehead!,gs2_006.txt
（はあ‥‥。はじめて 聞いたな‥‥）,"(Wow... Never knew that... Live and learn, I guess...)",gs2_006.txt
刺された‥‥。 その凶器は、どんなものですか？,Stabbed... And what was he stabbed with?,gs2_006.txt
この果物ナイフッス。,A fruit knife.,gs2_006.txt
ふむう‥‥。そのナイフは どなたの‥‥？,I see. And whose knife was it?,gs2_006.txt
どうやら、綾里家のもの らしいッス。,"It looks like it belongs to the Feys, sir.",gs2_006.txt
モチロン、綾里　真宵の 指紋がべっとりッス。,"And of course, Maya Fey's fingerprints are all over it.",gs2_006.txt
ふむう‥‥べっとり。,"Hmm... All over it, huh?",gs2_006.txt
（うう‥‥不利だな‥‥）,(Urk. This does not look good...),gs2_006.txt
‥‥ふっふっふっ‥‥ どうしたの？　成歩堂　龍一‥‥。,"Ha ha ha. What will you do now, Mr. Phoenix Wright?",gs2_006.txt
どれぐらいの 傷だったんですか？,How severe was the wound?,gs2_006.txt
あと１センチ右ならば、 シンゾウをぐさりッス。,"If it had been half an inch more to the right, it would've hit the victim's heart.",gs2_006.txt
とても反撃なんてムリッス。 きっと、立ってられなかったッス。,"After a stab like that, it's impossible to fight back, let alone stand.",gs2_006.txt
（カンゼンに、殺意をもって 刺しているな‥‥）,(This testimony makes Maya look like she had stabbed him with the intent to kill...),gs2_006.txt
ピストルより、刺された方が先‥‥ まちがいありませんか？,"Are you sure he was stabbed first, then shot?",gs2_006.txt
まちがいないッス。,Yup. Sure as sure can be.,gs2_006.txt
傷を調べれば、それぐらいは すぐにわかるッス。,"One look at the wounds and you'd come to the same conclusion too, pal.",gs2_006.txt
バカはバカのバカげた意見を ありがたく聞くものみたいね‥‥。,A fool is a fool who will only listen to the foolish opinions of other foolish fools...,gs2_006.txt
‥‥そもそも、コメカミを 至近距離で撃たれれば即死。,A pistol shot to the forehead at point blank is certainly enough to kill instantly.,gs2_006.txt
ナイフとピストル。 どちらが先か、考えるまでもない。,"Does it matter, then, which was first?",gs2_006.txt
というか、もう少し考えなさい。 ‥‥成歩堂　龍一！,"Think a little more before you open that big mouth of yours, Mr. Phoenix Wright!",gs2_006.txt
（‥‥ムカつくなあ‥‥）,(Grr... What a pain...),gs2_006.txt
そこまで！,That's enough!,gs2_006.txt
殺害された方法については、 これでハッキリしました。,We have clearly established how the victim was murdered.,gs2_006.txt
２つの凶器を、証拠として 提出するッス。,I brought the two murder weapons with me today.,gs2_006.txt
‥‥わかりました。 受理しましょう。,Very well. The court accepts them into evidence.,gs2_006.txt
証拠品《ピストル》のデータを 法廷記録にファイルした。,Pistol added to the Court Record.,gs2_006.txt
証拠品《ナイフ》のデータを 法廷記録にファイルした。,Knife added to the Court Record.,gs2_006.txt
死亡推定時刻は、６月１９日の 午後３時１５分。,The date and time of death was June 19th at 3:15 PM.,gs2_006.txt
証人たちが２発の銃声を聞いた 時刻にまちがいないわ。,Eyewitnesses claim to have heard two gunshots at this time.,gs2_006.txt
そして、２つの凶器に 被告人の指紋、ですか。,"And the two murder weapons, both with the defendant's fingerprints on them...?",gs2_006.txt
ふむう‥‥。 まさに、カンペキですな。,Hmm... This does seem like an open and shut case.,gs2_006.txt
‥‥トーゼン。,Naturally!,gs2_006.txt
（まずい‥‥）,(This is going from bad to worse...),gs2_006.txt
（事件がシンプルなだけに、 つけいるスキがまったくない！）,(As if the summary just now wasn't oversimplifying things to the extreme...),gs2_006.txt
裁判長。エンリョなく そのハンマーをたたいていいわ。,Your Honor. Feel free to slam that little gavel of yours.,gs2_006.txt
‥‥もう、 ギロンの余地はないものね。,"After all, there is no room left for doubt, is there?",gs2_006.txt
たしかにそうですね。 ‥‥弁護人。,That is quite true... Mr. Wright.,gs2_006.txt
は、はい。,Y-Yes?,gs2_006.txt
これでもまだ、あなたは 《完全無罪》を主張するのですか？,"Even in the face of all this, do you still wish to plead ""not guilty""?",gs2_006.txt
正直なところ、それでは 勝ち目がないと思いますがね。,"It's the opinion of this court that if you do not adjust your plea, you stand to lose.",gs2_006.txt
予言は当たったようね。 ‥‥成歩堂　龍一。,"See, just as I promised, Mr. Phoenix Wright.",gs2_006.txt
１０分以内に、あなたは 意見を変えざるをえなくなる‥‥。,You would change your plea in less than ten minutes...,gs2_006.txt
どうしますか？　弁護人。,"What will you do, Mr. Wright?",gs2_006.txt
《正当防衛》に主張を変えるなら、 今ならば聞き入れましょう。,"Will you change to ""justified self-defense""? Because now would be the time to do so.",gs2_006.txt
これが、最後のチャンスです。,This is your final chance.,gs2_006.txt
（‥‥この決断は大きい‥‥ よく考えるんだ！）,(This is a huge decision! I'd better think this through all the way!),gs2_006.txt
（‥‥有罪になってしまったら、 すべてはおしまいだ）,"(If Maya is convicted, then it's all over.)",gs2_006.txt
（ここは、とにかく真宵ちゃんを 守らなくちゃ‥‥）,"(I really should play it safe, and try to soften the blow...)",gs2_006.txt
わかりました。,Your Honor.,gs2_006.txt
‥‥弁護側の主張を、 《正当防衛》に‥‥,"The defense would like to change its plea to ""justified self-defense""...",gs2_006.txt
‥‥フッ‥‥,Hah.,gs2_006.txt
わかりました。 弁護人の主張を受理しましょう。,Understood. Let the record show that the defense has entered a new plea.,gs2_006.txt
（‥‥しかたないんだ‥‥）,(...There's nothing else I could do...),gs2_006.txt
（‥‥千尋さん‥‥？）,(Mia...?),gs2_006.txt
‥あなたは、カギをにぎっている‥,...You already hold the key...,gs2_006.txt
‥あなたが信じなければ勝てない‥,"...If you don't believe, you cannot win...",gs2_006.txt
（‥‥‥！）,,gs2_006.txt
（《正当防衛》を主張すれば、人を 死なせたと認めたことになる！）,"(If we plead ""justified self- defense"", we would basically be confessing to murder!)",gs2_006.txt
（真宵ちゃんは、これからの一生を 殺人者として生きることに‥‥）,"(After the trial, Maya's life would be destroyed, and she'll be labeled a murderer...)",gs2_006.txt
（そんなこと‥‥させられるか！）,(Can I really... Can I really let that happen!?),gs2_006.txt
‥‥裁判長！,Your Honor!,gs2_006.txt
な、なんですか？,Y-Yes?,gs2_006.txt
やはり‥‥主張を 曲げることはできません。,The defense... The defense retracts its previous statement.,gs2_006.txt
弁護側は《完全無罪》を なんとしても証明してみせます！,"And instead, will prove beyond the shadow of a doubt that the defendant is not guilty!",gs2_006.txt
（‥‥《正当防衛》を 主張するということは‥‥）,"(If we plead ""justified self- defense""...)",gs2_006.txt
（つまり“殺害”を事実として 認めてしまうことになる！）,(we would basically be confessing to a murder!),gs2_006.txt
