Japanese,English,Note
一流のニンゲンは、 時計のために生きたりはしない。,"A real first-class person doesn't live by, nor is he chained by, time.",gs2_002.txt
腕時計？　ハッ！　愚劣だね！,And to wear a watch? Hah! What a ridiculous notion!,gs2_002.txt
もっと自由に生きるコトを おすすめするよ！,People should live freely without constraints. That's how life should be!,gs2_002.txt
（‥‥ヘタなツッコミを 入れたばっかりに‥‥）,"(And yet again, another flood of meaningless words...)",gs2_002.txt
（壮大に時間をムダに しちまったな‥‥）,(Talk about a first-class waste of time...),gs2_002.txt
‥‥まあ、とにかく‥‥。,In any case...,gs2_002.txt
どうして警官だとわかりました？,And how did you know he was a police officer?,gs2_002.txt
オヤオヤ。このボクの推理力を 知らないのかい。,You obviously have no idea how powerful my deductive reasoning skills are.,gs2_002.txt
ひとめ見れば、職業ぐらいピタリ！ ‥‥当ててしまうよ。,"With one glance, I could tell just what kind of occupation he held.",gs2_002.txt
あのヘアスタイルに、手のカタチ。 典型的な警察官タイプだった。,"That shoddy, do-it-yourself hairstyle practically screamed ""I'm a police officer"".",gs2_002.txt
ネクタイのゆがみ具合もポイント。 それに安物のクツ。,"It was also the way he tied his tie and those cheap, low- quality shoes. Ugh.",gs2_002.txt
ついでに、警官の制服を 着ていたからね。,"Oh, and I suppose it was also because he was wearing an officer's uniform.",gs2_002.txt
（‥‥それを先に言えよ！）,(Shouldn't that statement have come first!?),gs2_002.txt
へえ。すごいなあ。,"Wow, that's pretty impressive.",gs2_002.txt
ね。ね。あたしのコトも わかっちゃうのかな？,"Hey, Nick! Do you think he's figured out what I do?",gs2_002.txt
（‥‥その前に ぼくが聞きたいぞ‥‥）,(Even I haven't figured that out yet...),gs2_002.txt
その女性のことが、ハッキリ 見えたんですか？,Are you sure you got a good look at her face?,gs2_002.txt
ニンゲンには、“目”というものが ついてるからねえ。,"Animals have this thing called an ""eye"", Mr. Wright. They use this ""eye"" to see things.",gs2_002.txt
‥‥それも、２つ。,"In the case of humans, we have two of them. Yes, even you!",gs2_002.txt
だから、ハッキリ見えたかって 聞いてるんです！,I don't care if I have them or not! Did you or did you not get a clear look at her face!?,gs2_002.txt
‥‥それはこれから 証言します。,That's what the witness was just about to get to.,gs2_002.txt
大声を出さないで いただきたいね。,I would like to request that Mr. Wright not use such a loud voice during questioning.,gs2_002.txt
大声を出さないように。,"Sustained. Mr. Wright, please refrain from raising your voice in this court.",gs2_002.txt
（大声を出させないでくれえ）,(Then please don't make me have to raise my voice.),gs2_002.txt
そろそろいいかな？ つづけても。,"Are you finished? I'd like to continue, if that's alright with you.",gs2_002.txt
まちがいありませんか！,So you're SURE you are not mistaken?,gs2_002.txt
キミのまちがいだらけの人生と ボクを、いっしょにしないでくれ。,"Please. Don't confuse your pitiful, train-wreck of a life with mine.",gs2_002.txt
ボクはね。いわゆるブランド品だ。 ニンゲンとして、ね。,"I'm what you call a famous brand-name product, while you are only a cheap imitation.",gs2_002.txt
まちがいなんて、あり得ないよ。,There is no way someone as magnificent as myself could have made a mistake.,gs2_002.txt
あり得ないそうです。,"Of course, of course.",gs2_002.txt
（とほほ‥‥）,(Oh ho ho ho. Of course.),gs2_002.txt
他に何か、気づいたことは ありませんでしたかな？,"Did you notice anything else of interest, witness?",gs2_002.txt
‥‥バナナ？,The banana...?,gs2_002.txt
しかも１本じゃない。 フサごとまるまるだったね。,"Well, it was actually more than just one. More like a bunch of bananas.",gs2_002.txt
なんで、そんなものが‥‥？,Now what would a bunch of bananas be doing there...?,gs2_002.txt
‥‥ふう、ヤレヤレ。 知るわけないだろ、ボクが。,And why would I know such a thing? I'm only telling you what I saw.,gs2_002.txt
ヘンだね。,That's really strange.,gs2_002.txt
バナナのコトなんて、 マコちゃんヒトコトも‥‥。,Maggey never mentioned anything about a bunch of bananas.,gs2_002.txt
なるほどくん！ きっと、ウソだよバナナなんて！,"That's it, Nick! He's gotta be lying about the bananas!",gs2_002.txt
（‥‥ううん。 そうは言っても‥‥）,"(Hmm... He could be, but...)",gs2_002.txt
（“現場でバナナを見た” なんてウソ、意味がないぞ‥‥）,(there's no reason for him to lie about there being bananas at the crime scene.),gs2_002.txt
‥‥もし、 ウソじゃなかったとしたら？,And what if it's not a lie?,gs2_002.txt
カンちがい‥‥かな。 何かと見まちがえた、とか。,"Well, maybe he thought he was seeing one thing, and it was something else...?",gs2_002.txt
（‥‥カンちがい。それって やっぱり、ムジュンだよな‥‥）,"(If he mistook something else for a bunch of bananas, then that would be an inaccuracy.)",gs2_002.txt
（とにかく‥‥）,"(Think Phoenix, think!)",gs2_002.txt
‥‥モロヘイヤさん。,Mr. Wellington.,gs2_002.txt
じつは、ここにあるんですよ。 ‥‥そのときのバナナが。,I believe I have the bananas you saw... right here!,gs2_002.txt
なんだ。キミもバナナのコト、 知ってたんじゃないか。,"Ah, so you knew about the bananas, too. Why didn't you say so earlier?",gs2_002.txt
そんなことでボクを引っかけた なんて、思わないでほしいね。,But don't think you can use this as a way to pull more information out of me.,gs2_002.txt
（引っかかってるんだよな‥‥ 思いっきり！）,(And that's where you'd be wrong.),gs2_002.txt
な‥‥成歩堂くん‥‥ そ、それは‥‥,M-Mr. Wright. What is the meaning of this?,gs2_002.txt
グローブじゃないですか！,Isn't that the baseball glove?,gs2_002.txt
え‥‥！　な、なんだって？ グローブ‥‥？,Huh!? Wh-Wh-What!? A baseball glove??,gs2_002.txt
なんなら、食べてみますか？,Doesn't it look delicious? Care for a bite?,gs2_002.txt
そ‥‥そんな‥‥。,Th-That's...,gs2_002.txt
そんなバナ‥‥バカなああぁァッ！,That's not... It's a... Noooooooo!,gs2_002.txt
裁判長！　これで、 １つハッキリしたことがあります！,Your Honor! I think this proves one very important fact!,gs2_002.txt
つまり、この証人は‥‥,This witness...,gs2_002.txt
モロヘイヤさんは、 大のバナナ好きなのです！,Mr. Wellington loves large bananas!,gs2_002.txt
な‥‥なるほどくん。,"Uh, Nick...",gs2_002.txt
こおりついちゃったじゃない！ ‥‥空気が！,I hope you've noticed the icy glares we're getting from everyone in here!,gs2_002.txt
そ‥‥それがいったい、 どうだと言うんですか？,Wh-What in the world do you mean?,gs2_002.txt
ちなみに、ボクはバナナより イチゴの方が好きだけど。,I'll have you know I like strawberries much better than bananas.,gs2_002.txt
ううう‥‥,Whoops...,gs2_002.txt
もう一度。 考えなおしてください。,"Think it over one more time and try again, Mr. Wright.",gs2_002.txt
モロヘイヤさんは、 野球をやったことがないのです！,Mr. Wellington has never played baseball!,gs2_002.txt
だから、グローブというものを 知らなかった！,That would explain why he didn't even know what a glove is!,gs2_002.txt
な‥‥なるほどくん。,"Uh, Nick...",gs2_002.txt
こおりついちゃったじゃない！ ‥‥空気が！,I hope you've noticed the icy glares we're getting from everyone in here!,gs2_002.txt
そ‥‥それがいったい、 どうだと言うんですか？,Wh-What in the world do you mean?,gs2_002.txt
中学時代、ボクはピッチャーで ４番だったけどね。,"When I was in junior high, I was a star pitcher... Well, 4th in line, actually, but...",gs2_002.txt
ううう‥‥,Whoops...,gs2_002.txt
もう一度。 考えなおしてください。,"Think it over one more time and try again, Mr. Wright.",gs2_002.txt
‥‥ところで、モロヘイヤさん。 視力はいくつですか？,"By the way, just how bad are your eyes?",gs2_002.txt
な‥‥。なな、ななな、 ななななんだい急に！,Huh? How... What... You... Why are you asking me about this all of a sudden!?,gs2_002.txt
バナナとグローブを見まちがえた ぐらいで、視力が低いとは‥‥,"Your Honor, it is very simple to mistake a glove for a bunch of bananas...",gs2_002.txt
ふつう、まちがえません。 異議は却下します。,"No, I don't think so. Objection overruled.",gs2_002.txt
ヤ‥‥ヤレヤレ。 あなたがたは、アレだ。,"Y-Y-You... You're one of those people. Yes, you know what I mean.",gs2_002.txt
地動説を唱えたガリレオを 認めなかった連中といっしょだ。,You're like those people who refused to accept Galileo for his Copernican Theory!,gs2_002.txt
くだらんジョーシキにしばられて 新しい可能性に気づきもしない！,"You're too used to your world view to realize that there are other, new possibilities!",gs2_002.txt
たしかに、結果的にアレは グローブだったのかもしれない。,"Sure, in the end, we find out that it is in fact, a glove, not bananas. However...",gs2_002.txt
しかし、ハナからそれを 疑ってかかるなんて‥‥,"when viewed from afar, I do think there is room enough for doubt, don't you...?",gs2_002.txt
だから、いくつなんですか視力は！,And that is why I asked you how bad your eyesight is!,gs2_002.txt
両方とも０．１だよ！　ワルいか！,"They're both 20/200. I suppose you're going to tell me that's terrible, right!?",gs2_002.txt
今日はどうしてメガネを‥‥？,Why are you not wearing your glasses today then?,gs2_002.txt
‥‥さ、最近ちょっと。 その、なくしてしまって‥‥。,"Ummm... That's because I lost them recently, you see...",gs2_002.txt
も、モチロン作りなおそうと 思ってますよ！,"Of course, I was planning on getting a new pair made right away!",gs2_002.txt
でも、なかなかボクの おメガネにかなうメガネが‥‥,"But you know, my glasses are no ordinary glasses, so to replace them--",gs2_002.txt
事件を目撃したときは？ メガネをかけていましたか？,How about when you witnessed the crime? Were you wearing your glasses then?,gs2_002.txt
‥‥‥‥ッ！,,gs2_002.txt
どうなんですか！,"How about it, witness!?",gs2_002.txt
‥‥あ、あなたがたはアレだ。,"Y-You are an unrelenting, evil man.",gs2_002.txt
あのジャンヌダルクを処刑した 連中といっしょだ。,You're like those people who rejected Joan of Arc and put her to death!,gs2_002.txt
勇気を持って、正しいおこないを した者をつかまえて、,"She was brave and courageous, only to be caught by horrible, unrighteous people.",gs2_002.txt
なんにも悪くないのに 火あぶりに‥‥,"And while she didn't do anything wrong, she was still gruesomely burned at the--",gs2_002.txt
‥‥つまり 証人はメガネをかけていなかった！,Which boils down to you were not wearing your glasses at that time!,gs2_002.txt
それならば！,Therefore!,gs2_002.txt
目撃したという“女”が 被告だったのかどうか‥‥、,"The identity of the ""woman"" at the scene of the crime and that of the defendant",gs2_002.txt
この証人に断言できるはずがない！,can not be proven to be the same by this witness!,gs2_002.txt
‥‥‥‥ッ！,,gs2_002.txt
‥‥しかし、 現場の段差は、たった３ｍです！,But the height difference was only 9 feet!,gs2_002.txt
上の遊歩道にいる被告のカオが 見えても、おかしくはない！,It was very possible for him to see the face of the culprit standing on the upper path!,gs2_002.txt
ふむう‥‥証人。,Hmm... Witness.,gs2_002.txt
証言は正確におねがいします。 人の命がかかっているのですよ。,"Please be more accurate in your testimony. Remember, a person's life is at stake.",gs2_002.txt
‥‥‥わ、わかりましたよ！,"Y-Yes, Your Honor!",gs2_002.txt
では、証言をつづけてください。,"Now then, please continue with your testimony.",gs2_002.txt
では、事件を目撃してからのことを 証言してもらいましょう。,"Please tell the court what happened next, in the moments after you witnessed the crime.",gs2_002.txt
～事件を目撃してからのこと～,-- What Happened Next --,gs2_002.txt
遊歩道の女は、ボクに気づくと サッと逃げていきましたね。,The girl on the upper path ran away as soon as she realized I was there.,gs2_002.txt
そのあと、ボクはすぐに警察に 通報しました。,"After that, I immediately called the police station to report the crime.",gs2_002.txt
警察に電話が入ったのは、 ６時４５分だったみたいですね。,It must've been 6:45 PM when I made the call.,gs2_002.txt
きっとヒマだったのでしょう。 １０分もしないで駆けつけてきた。,They must have a lot of free time on their hands since they showed up within 10 minutes.,gs2_002.txt
‥‥ふむう。,Hmm...,gs2_002.txt
遊歩道の人物は、あなたを見て 逃げだしたワケですね。,So the person who was on the upper path saw you and then ran away.,gs2_002.txt
そのとおり。,"Yes, that is correct.",gs2_002.txt
ボクほどアタマがよくなくても、 さすがにリカイできるでしょう。,"Which is why, even someone without a superior brain like mine can understand that...",gs2_002.txt
‥‥この女こそが犯人だ、とね！,that girl is the murderer!,gs2_002.txt
では、弁護人。 尋問をおねがいします。,"You may question the witness now, Mr. Wright.",gs2_002.txt
～事件を目撃してからのこと～,-- What Happened Next --,gs2_002.txt
遊歩道の女は、ボクに気づくと サッと逃げていきましたね。,The girl on the upper path ran away as soon as she realized I was there.,gs2_002.txt
そのあと、ボクはすぐに警察に 通報しました。,"After that, I immediately called the police station to report the crime.",gs2_002.txt
警察に電話が入ったのは、 ６時４５分だったみたいですね。,It must've been 6:45 PM when I made the call.,gs2_002.txt
きっとヒマだったのでしょう。 １０分もしないで駆けつけてきた。,They must have a lot of free time on their hands since they showed up within 10 minutes.,gs2_002.txt
（今の証言‥‥。おかしいところ、 あるかなあ‥‥）,(I can't find anything out of the ordinary in his testimony...),gs2_002.txt
もう一度、見てみようよ。 ‥‥法廷記録。,Why don't you take one more look at the Court Record?,gs2_002.txt
そうだね。,"Yeah, I guess I should.",gs2_002.txt
すぐに逃げていったんですか？,"She ran away, just like that?",gs2_002.txt
そう。まさに“たつ鳥、 あとをにごさず”‥‥みたいな。,"Yes, she did. She saw me and flew the nest like the guilty bird she is.",gs2_002.txt
‥‥おっと！　三流大学出身の キミには、ムズかしい表現かな。,"Oh, I'm sorry. Was that pun too hard for someone who only got a third-rate education?",gs2_002.txt
（たしかに‥‥ぼくには リカイできない表現だな）,"(Actually, that did take me a few seconds to get...)",gs2_002.txt
ところで、すぐに逃げたのに それが被告とわかったんですか？,"Anyway, if she ran away the instant she saw you, how could you tell it was my client?",gs2_002.txt
‥‥えっ‥‥,Eek!,gs2_002.txt
証人は、すでにその質問に 答えています！,The witness has already answered that question.,gs2_002.txt
“その女は被告だった”と！,He has stated that the defendant is the culprit!,gs2_002.txt
ふむう‥‥。 弁護人の質問を却下します。,"This is true. Mr. Wright, I'm striking your question from the record.",gs2_002.txt
（どうも引っかかるな‥‥）,"(Hmm, how can I get more information out of him?)",gs2_002.txt
“すぐ”‥‥というのは？,Immediately? As in?,gs2_002.txt
だから“すぐ”だよ。 １分もたたなかったと思うね！,"As in immediately! I mean, sure, a minute might have elapsed before I did, but...",gs2_002.txt
それが市民のギム、ってヤツさ。 ‥‥三流大学で習わなかったかい？,"That's the duty of every good citizen, or did they not teach that at your pitiful school?",gs2_002.txt
（そんなの、 大学で教わることかよ！）,(You think people learn about how to call the police in COLLEGE!?),gs2_002.txt
ね、ね、なるほどくん。 法廷記録、ちょっと見てみて。,"Hey, Nick. I think you should take a look at the Court Record for a sec.",gs2_002.txt
（‥‥‥‥？）,,gs2_002.txt
どうしてその時間を‥‥？,How do you know what time it was...?,gs2_002.txt
あの刑事が教えてくれたんだよ。,That detective told me. You know which one I mean.,gs2_002.txt
ホラ。あの、いかにも三流中学出身 っぽいコートを着た‥‥,The one with the jacket that makes him look like a dropout from a no-name high school.,gs2_002.txt
自分はちゃんと二流‥‥ イヤ一流大学を出てるッス！,"Hey, pal! I graduated from a pretty good, I mean, top-ranked college!",gs2_002.txt
（‥‥やれやれ‥‥）,(I don't believe this.),gs2_002.txt
とにかく、時間はまちがいないと 思うよ。,It doesn't matter. I don't believe I was mistaken on what time I called.,gs2_002.txt
ちがってるとしたら、あの刑事が 時計の読み方を知らなかったのさ。,"And if I am wrong, then that detective obviously doesn't know how to tell time.",gs2_002.txt
なんスとお‥‥！　自分は‥‥ 自分は二流、イヤ一流の‥‥,What!? Why you!!! You're just some lousy kid who...,gs2_002.txt
なるほど。‥‥それで、 通報を受けた警察は‥‥？,"I think the court can see your point. Anyway, how did the police respond?",gs2_002.txt
ということは、７時にはもう 警察が到着していた‥‥？ 7:00 PM?,So you're saying that there were police on the scene by,gs2_002.txt
もっと早かったと思うよ。,"They got there before that, I think.",gs2_002.txt
あのあたりは、あまりヒトが 通らないんだけどね。,There usually aren't many people in that area at that time of day.,gs2_002.txt
アッという間にヤジウマで イッパイさ。,"But suddenly, before I knew it, there were people crawling all over gawking.",gs2_002.txt
‥‥この国のモラルの低さには 絶望するよ‥‥。,It certainly says something about the morals of the people in this country.,gs2_002.txt
‥‥これを見てください。,"Mr. Wellington, would you please take a look at this?",gs2_002.txt
被害者の解剖記録‥‥ですか？,You mean the victim's autopsy report?,gs2_002.txt
記録によると、事件があったのは、 ６時２８分です。,"According to this, the murder occurred at 6:28 PM.",gs2_002.txt
それがどうかしたかい？,So what of it?,gs2_002.txt
あなたは、その瞬間を目撃した。 それからすぐに警察に通報した。,You said that you called the police immediately after the murder took place.,gs2_002.txt
しかし、警察に電話が入ったのは ６時４５分です。,"However, by the time you had called the police, it was already 6:45 PM.",gs2_002.txt
事件発生から１５分も たっているじゃないですか！,There is clearly a 15 minute gap here! Do you deny it!?,gs2_002.txt
‥‥‥‥ッ！,Aaaack!,gs2_002.txt
この空白の１５分間‥‥。 あなたは何をしていたのか！,I think this court would like to hear what you were doing during this 15 minute gap!,gs2_002.txt
ぐぅぅぅぅッ！,Grrrrrr!,gs2_002.txt
証人は、死体を見て 動転していたのです！,The witness was in shock at the time after witnessing a terrible murder!,gs2_002.txt
ちょっぴり、放心していた のではないでしょうか‥‥。,It's only to be expected that he would be a little dazed...,gs2_002.txt
１５分を“ちょっぴり”とは 言わない！,"Fifteen minutes is hardly what I would call ""a little dazed""!",gs2_002.txt
ぎゃうッ！,Aaaaah!,gs2_002.txt
証人！,Mr. Wellington.,gs2_002.txt
うッ‥‥！,Y-Yes?,gs2_002.txt
‥‥警察に通報するまで、 あなたは何をしていたのですか！,Explain yourself. What were you doing during those 15 minutes?,gs2_002.txt
答えてください！,Answer the question!,gs2_002.txt
‥‥でんわ‥‥,... I... Uhh... Telephone... Err... I mean...,gs2_002.txt
なんですって？,Spit it out!,gs2_002.txt
‥‥公衆電話を探していたんだよ！,I... I was searching for a phone booth!,gs2_002.txt
公衆電話‥‥,A phone booth?,gs2_002.txt
あの。証人は 携帯電話はお持ちでは‥‥？,"You mean, you don't have a cell phone?",gs2_002.txt
‥‥‥‥ッ！,,gs2_002.txt
そ、その、重箱のスミをつつく ような、キタナイやりかた‥‥,You and your questions! As if you're trying to open all the layers of a Matryoshka doll.,gs2_002.txt
イカガなものかと思いますがね！,You must think you're really something special!,gs2_002.txt
‥‥証人ッ！,Witness!,gs2_002.txt
落としちゃったんだよ！ 携帯電話を！,I-I lost my cell phone! There! Are you happy!?,gs2_002.txt
落とした‥‥？,You lost it...?,gs2_002.txt
‥‥まったく、メガネはなくすは、 携帯電話は落とすは‥‥。,"Unbelievable! You lose your glasses, and your cell phone!",gs2_002.txt
よくモノをなくすヒトですね。,You must be very scatterbrained when it comes to your belongings.,gs2_002.txt
なんだ！　一流のニンゲンは 落とし物なんかしないってか！,What!? Are you saying that first-rate people are never allowed to lose things!?,gs2_002.txt
いいか。天才と呼ばれる連中は、 みんなどこかがオカシイんだよ。,Haven't you ever heard that all geniuses have a strange quirk or two?,gs2_002.txt
逆に言えば、オカシイところが あるボクは天才なんだ。,"So by that rationale, since I have my own quirk, it would mean that I am a genius!",gs2_002.txt
まあ、キミたち凡人には とうていリカイが‥‥,"I don't think simple, plain people like you can underst--",gs2_002.txt
‥‥そこまでッ！,Enough!,gs2_002.txt
（やれやれ‥‥）,"(Oh man, oh man...)",gs2_002.txt
（‥‥って、待てよ。 携帯電話を‥‥落とした‥‥？）,(Wait! Hold on a second. He lost... his cell phone?),gs2_002.txt
なるほどくん！ その携帯電話って、もしかして！,Nick! That cell phone! Could it be...?,gs2_002.txt
この、マコちゃんが拾ったヤツ だってのか？　まさか‥‥！,You mean this phone Maggey found? There's no way...!,gs2_002.txt
（とんでもないことになってきた！ ‥‥どうする？）,"(Boy, I didn't see this coming. What should I do now...?)",gs2_002.txt
（‥‥まさかな。この電話が あいつのものだなんて）,(It's probably just a coincidence.),gs2_002.txt
（そんなグーゼン、あるわけ‥‥）,"(I mean, what are the chances that this phone is that snob's anyway?)",gs2_002.txt
ダ、ダメだよなるほどくん！,Nick!? What do you think you're doing!?,gs2_002.txt
これはちゃんと たしかめておかなきゃ！,You really should check out this lead!,gs2_002.txt
どうしましたか？　弁護人。,"Is there a problem, Mr. Wright?",gs2_002.txt
は、はい！ （もう一度、考えなおすか‥‥）,"N-No, Your Honor. (I should give this some more thought...)",gs2_002.txt
モロヘイヤさん！,Mr. Wellington!,gs2_002.txt
なくした携帯電話は、 今どこに‥‥？,Where is your cell phone right now?,gs2_002.txt
ヤレヤレ‥‥。 何をあわてているんだか。,"Heh, what are you getting all excited about? You seem to be a little confused.",gs2_002.txt
ちゃんと見つけたよ。 ホラ、これだ。,"I found my phone, I'll have you know. See. Here is it.",gs2_002.txt
あ‥‥、そうなんですか。,Oh... I see...,gs2_002.txt
なんだ、ちゃんと持ってるよ。,"Hmm, looks like he's got his phone.",gs2_002.txt
‥‥あたしてっきり、それ、 あの人のモノだと思ったのに。,And I thought that just maybe this was his.,gs2_002.txt
うーん‥‥。,Hmm...,gs2_002.txt
わかりました。,"Well then, I think we've cleared this issue up.",gs2_002.txt
事件が起こったとき、証人は 携帯電話を落としていた。,"At the time of the murder, the witness did not have his cell phone because he had lost it.",gs2_002.txt
だから公衆電話を探していて、 通報がおくれた、と。,"Therefore, the delay in his call was caused by his search for a phone booth.",gs2_002.txt
